{
  "model": "gemini_llm",
  "prompt": "prompt_B",
  "id": 3108,
  "question": "Where is the Monument to the Executed located within Kraków?",
  "context": "phone : nan\ncemetery : nan\nemergency : nan\nopening_hours : nan\nwebsite : nan\npets_allowed : nan\ngeometry : POINT (19.9276006 50.060019)\nhistoric : memorial\nwiki_summary_en : The monument of Marshal Józef Piłsudski, located at the intersection of Piłsudski, Wenecja, and Garncarska streets in Kraków, is the work of Czesław Dźwigaj. The monument was unveiled on November 10, 2008.\npostal_code : nan\ntoilets : nan\nnatural : no information\ndescription : nan\nvisiting_time : nan\nleisure : no information\ntourism : no information\npublic_transport : nan\nbrand : nan\nalt_name : nan\namenity : no information\nreservation : nan\nattraction : nan\nhighchair : nan\nparking : nan\nswimming_pool : nan\ncontact_phone : nan\ncommunity_centre : nan\naddr_street : nan\ncontact_twitter : nan\nsocial_facility : nan\ncontact_facebook : nan\nzoo : nan\nemail : nan\nwheelchair : nan\ncuisine : nan\ncontact_website : nan\ninternet_access : nan\nopening_hours_reception : nan\nguest_house : nan\naddr_city : nan\ncontact_instagram : nan\nimage : nan\nlocation : nan\noutdoor_seating : nan\nmuseum : nan\ntakeaway : nan\nsmoking : nan\nname : Pomnik Marszałka Józefa Piłsudskiego i Legionistów;Józef Piłsudski;маршал Юзэф Пілсудскі;Czesław Dźwigaj\nid : 2406\n\nphone : nan\ncemetery : nan\nemergency : nan\nopening_hours : nan\nwebsite : nan\npets_allowed : nan\ngeometry : POINT (19.9613554 50.0290041)\nhistoric : monument\nwiki_summary_en : The Monument to the Victims of Fascism in Krakow, the monument to the Victims of the Concentration Camp in Plaszow – a monument located on the outskirts of the former German Nazi concentration camp Plaszow in Krakow, commemorating the people murdered by the Nazis in this camp. It was established in 1964 according to the design of architect Witold Cęckiewicz. The sculpture made of Pińczów limestone on a reinforced concrete structure was created by Ryszard Szczypiński.\npostal_code : nan\ntoilets : nan\nnatural : no information\ndescription : nan\nvisiting_time : nan\nleisure : no information\ntourism : no information\npublic_transport : nan\nbrand : nan\nalt_name : nan\namenity : no information\nreservation : nan\nattraction : nan\nhighchair : nan\nparking : nan\nswimming_pool : nan\ncontact_phone : nan\ncommunity_centre : nan\naddr_street : nan\ncontact_twitter : nan\nsocial_facility : nan\ncontact_facebook : nan\nzoo : nan\nemail : nan\nwheelchair : nan\ncuisine : nan\ncontact_website : nan\ninternet_access : nan\nopening_hours_reception : nan\nguest_house : nan\naddr_city : nan\ncontact_instagram : nan\nimage : nan\nlocation : nan\noutdoor_seating : nan\nmuseum : nan\ntakeaway : nan\nsmoking : nan\nname : Pomnik Ofiar Faszyzmu;Памятник жертвам фашизма\nid : 2433\n\nphone : nan\ncemetery : nan\nemergency : nan\nopening_hours : nan\nwebsite : nan\npets_allowed : nan\ngeometry : POINT (19.9661461 50.0326418)\nhistoric : memorial\nwiki_summary_en : The Monument of Martyrdom – Executed on September 10, 1939 – is a monument located in Krakow in its right-bank part relative to the Vistula River – Podgórze, at Abrahama Street. Krakow was occupied by the Wehrmacht on September 6, 1939, and just four days later, on September 10, 1939, the Germans carried out the first mass execution of Poles at this site. Thirteen residents of Krakow were executed at the wall of the new Jewish cemetery in Podgórze. Eleven men, known by name, and two unknown individuals were killed. The monument, unveiled in 1984, is a granite stone block with a black marble plaque on which the inscription appears.\npostal_code : nan\ntoilets : nan\nnatural : no information\ndescription : nan\nvisiting_time : nan\nleisure : no information\ntourism : no information\npublic_transport : nan\nbrand : nan\nalt_name : nan\namenity : no information\nreservation : nan\nattraction : nan\nhighchair : nan\nparking : nan\nswimming_pool : nan\ncontact_phone : nan\ncommunity_centre : nan\naddr_street : nan\ncontact_twitter : nan\nsocial_facility : nan\ncontact_facebook : nan\nzoo : nan\nemail : nan\nwheelchair : nan\ncuisine : nan\ncontact_website : nan\ninternet_access : nan\nopening_hours_reception : nan\nguest_house : nan\naddr_city : nan\ncontact_instagram : nan\nimage : nan\nlocation : nan\noutdoor_seating : nan\nmuseum : nan\ntakeaway : nan\nsmoking : nan\nname : Pomnik rozstrzelanych 10 września 1939 roku\nid : 2513\n\nphone : nan\ncemetery : nan\nemergency : nan\nopening_hours : nan\nwebsite : nan\npets_allowed : nan\ngeometry : POINT (19.9719279 50.0362614)\nhistoric : memorial\nwiki_summary_en : The Monument to the Martyrdom of Those Hanged on June 26, 1942, in Kraków – a monument in the form of an obelisk located on Wodna Street next to the Kraków Płaszów railway station in District XIII Podgórze. \nThe German occupiers hanged seven Poles in retaliation for a sabotage action that involved derailing a military train at the local station. \nIn Tadeusz Wroński's book titled \"Chronicle of Occupied Kraków\" on page 213, there is a photograph depicting the execution by hanging. \nThe inscription on the plaque:\npostal_code : nan\ntoilets : nan\nnatural : no information\ndescription : nan\nvisiting_time : nan\nleisure : no information\ntourism : no information\npublic_transport : nan\nbrand : nan\nalt_name : nan\namenity : no information\nreservation : nan\nattraction : nan\nhighchair : nan\nparking : nan\nswimming_pool : nan\ncontact_phone : nan\ncommunity_centre : nan\naddr_street : nan\ncontact_twitter : nan\nsocial_facility : nan\ncontact_facebook : nan\nzoo : nan\nemail : nan\nwheelchair : nan\ncuisine : nan\ncontact_website : nan\ninternet_access : nan\nopening_hours_reception : nan\nguest_house : nan\naddr_city : nan\ncontact_instagram : nan\nimage : nan\nlocation : nan\noutdoor_seating : nan\nmuseum : nan\ntakeaway : nan\nsmoking : nan\nname : Pomnik Martyrologii Powieszonych 26 czerwca 1942 roku w Krakowie\nid : 2900\n\nphone : nan\ncemetery : nan\nemergency : nan\nopening_hours : nan\nwebsite : nan\npets_allowed : nan\ngeometry : POINT (20.0477564 50.0859829)\nhistoric : memorial\nwiki_summary_en : The Monument to the Executed in Krzesławice (Monument of Martyrdom) is a monument located in the northern part of Krakow, in District XVII Wzgórza Krzesławickie, in the Krzesławice housing estate at Wańkowicza Street.\npostal_code : nan\ntoilets : nan\nnatural : no information\ndescription : nan\nvisiting_time : nan\nleisure : no information\ntourism : no information\npublic_transport : nan\nbrand : nan\nalt_name : nan\namenity : no information\nreservation : nan\nattraction : nan\nhighchair : nan\nparking : nan\nswimming_pool : nan\ncontact_phone : nan\ncommunity_centre : nan\naddr_street : nan\ncontact_twitter : nan\nsocial_facility : nan\ncontact_facebook : nan\nzoo : nan\nemail : nan\nwheelchair : nan\ncuisine : nan\ncontact_website : nan\ninternet_access : nan\nopening_hours_reception : nan\nguest_house : nan\naddr_city : nan\ncontact_instagram : nan\nimage : nan\nlocation : nan\noutdoor_seating : nan\nmuseum : nan\ntakeaway : nan\nsmoking : nan\nname : no information\nid : 3108\n\nphone : nan\ncemetery : nan\nemergency : nan\nopening_hours : nan\nwebsite : nan\npets_allowed : nan\ngeometry : POINT (19.8287079 50.0190523)\nhistoric : no information\nwiki_summary_en : Źródło Świętojańskie – a permanent karst spring located in Kraków, east of Tyńca. Since 1997, it has been the only nature monument in Kraków that is a spring. The spring is situated at the foot of the northern slope of the hill Duża Biedzinka – the name of the hill comes from a legend in which a wandering saint traveling to Kraków complained (in old speech, he \"biedził\") that he could not find anywhere to drink water; then, a spring gushed forth at his feet – in the triangle between the western bypass of Kraków (along the A4 highway) and the streets Bolesław Śmiałego and Nad Czerną. It is located within the Bielańsko-Tyniecki Landscape Park. The stream flowing from the spring enters a fenced private area after a few meters, and after about 400 meters, it falls into an oxbow lake of the Vistula River.\npostal_code : nan\ntoilets : nan\nnatural : spring\ndescription : podzboczowe, spływowe, szczelinowe, krasowe\nvisiting_time : nan\nleisure : no information\ntourism : no information\npublic_transport : nan\nbrand : nan\nalt_name : nan\namenity : no information\nreservation : nan\nattraction : nan\nhighchair : nan\nparking : nan\nswimming_pool : nan\ncontact_phone : nan\ncommunity_centre : nan\naddr_street : nan\ncontact_twitter : nan\nsocial_facility : nan\ncontact_facebook : nan\nzoo : nan\nemail : nan\nwheelchair : nan\ncuisine : nan\ncontact_website : nan\ninternet_access : nan\nopening_hours_reception : nan\nguest_house : nan\naddr_city : nan\ncontact_instagram : nan\nimage : nan\nlocation : nan\noutdoor_seating : nan\nmuseum : nan\ntakeaway : nan\nsmoking : nan\nname : Źródło Świętojańskie\nid : 11399\n\nphone : nan\ncemetery : nan\nemergency : nan\nopening_hours : nan\nwebsite : nan\npets_allowed : nan\ngeometry : POLYGON ((19.9270449 50.0600478, 19.9270339 50.060046, 19.9270359 50.0600406, 19.9269735 50.060031, 19.9269714 50.0600364, 19.9269606 50.0600347, 19.9269627 50.0600293, 19.9269542 50.0600279, 19.9269569 50.0600211, 19.9269652 50.0600224, 19.9269757 50.0599961, 19.9269368 50.0599899, 19.9269348 50.0599952, 19.9269268 50.059994, 19.9269287 50.0599887, 19.9268994 50.0599841, 19.9268921 50.0600107, 19.9269056 50.0600126, 19.9269031 50.0600196, 19.9268951 50.0600185, 19.9268881 50.0600399, 19.9268963 50.0600409, 19.9268939 50.0600481, 19.9268854 50.060047, 19.9268835 50.0600523, 19.9268721 50.0600509, 19.9268739 50.0600454, 19.926815 50.0600372, 19.9268118 50.060047, 19.9268007 50.0600456, 19.9268033 50.0600373, 19.9267605 50.060031, 19.9267577 50.060039, 19.9267462 50.0600373, 19.9267494 50.0600292, 19.9267072 50.0600229, 19.9267041 50.060031, 19.926693 50.0600291, 19.9266963 50.0600212, 19.9266537 50.0600149, 19.9266508 50.0600227, 19.9266397 50.060021, 19.9266431 50.0600131, 19.9265997 50.0600068, 19.9265967 50.0600147, 19.9265857 50.0600129, 19.9265889 50.0600049, 19.9265461 50.0599985, 19.926543 50.0600062, 19.9265322 50.0600046, 19.9265354 50.0599968, 19.9264931 50.0599904, 19.9264903 50.0599984, 19.9264791 50.0599968, 19.9264822 50.0599887, 19.9264385 50.0599825, 19.926436 50.0599901, 19.9264249 50.0599885, 19.9264276 50.0599806, 19.9264158 50.0599787, 19.9264186 50.0599715, 19.9264303 50.0599733, 19.9264513 50.0599163, 19.9264411 50.0599146, 19.9264421 50.0599122, 19.9264041 50.0599061, 19.9264131 50.0598815, 19.926462 50.059889, 19.9264664 50.0598769, 19.9264174 50.0598695, 19.926434 50.0598234, 19.9264834 50.0598308, 19.9264878 50.0598186, 19.9264385 50.0598113, 19.9264474 50.0597866, 19.9264772 50.0597912, 19.9264846 50.0597738, 19.9264879 50.0597726, 19.9264972 50.059774, 19.9265028 50.0597748, 19.9265038 50.0597725, 19.9265152 50.0597742, 19.9265133 50.0597795, 19.9265562 50.0597858, 19.9265582 50.0597804, 19.9265691 50.0597821, 19.9265673 50.0597873, 19.9266107 50.059794, 19.9266126 50.0597887, 19.926623 50.0597903, 19.926621 50.0597956, 19.9266637 50.059802, 19.9266654 50.0597975, 19.9266747 50.0597991, 19.9266728 50.0598043, 19.9267182 50.0598112, 19.9267204 50.0598056, 19.9267297 50.0598072, 19.9267281 50.0598117, 19.9267712 50.0598184, 19.9267732 50.0598131, 19.9267836 50.0598147, 19.9267815 50.05982, 19.9268247 50.0598268, 19.9268268 50.0598213, 19.9268373 50.059823, 19.9268354 50.0598282, 19.9268779 50.059835, 19.9268838 50.059818, 19.9268776 50.0598121, 19.926887 50.059808, 19.9268941 50.0598147, 19.9269374 50.0598213, 19.9269394 50.0598162, 19.9269507 50.059818, 19.9269488 50.0598231, 19.9269878 50.0598292, 19.9269898 50.0598238, 19.9270007 50.0598255, 19.9269987 50.0598306, 19.9270369 50.0598366, 19.9270389 50.0598312, 19.9270499 50.0598329, 19.927048 50.0598381, 19.9271096 50.0598476, 19.9271116 50.0598424, 19.9271225 50.059844, 19.9271205 50.0598495, 19.9271819 50.0598588, 19.9271838 50.0598534, 19.9271966 50.0598554, 19.9271947 50.0598607, 19.9272029 50.0598619, 19.9272019 50.0598647, 19.9271998 50.0598702, 19.9271916 50.0598689, 19.9271824 50.0598936, 19.9271906 50.0598949, 19.927188 50.059902, 19.9271775 50.0599005, 19.9271653 50.0599333, 19.9271756 50.0599348, 19.927173 50.0599418, 19.9271627 50.0599401, 19.9271505 50.0599727, 19.9271608 50.0599744, 19.9271581 50.0599815, 19.9271478 50.0599798, 19.9271358 50.0600123, 19.9271461 50.060014, 19.9271434 50.060021, 19.9271352 50.0600197, 19.9271254 50.0600461, 19.9271334 50.0600474, 19.9271303 50.0600556, 19.9271221 50.0600543, 19.9271211 50.0600569, 19.9271231 50.0600605, 19.9271192 50.0600616, 19.9271162 50.0600589, 19.9271062 50.0600574, 19.9271081 50.0600523, 19.927047 50.0600424, 19.9270449 50.0600478))\nhistoric : no information\nwiki_summary_en : The building of the \"Sokół\" Gymnastic Society – a historic sports hall located in Kraków in the Old Town district at J. Piłsudski Street 27, in the Piasek area. The \"Sokół\" Gymnastic Society was established on February 23, 1885, at the initiative of students associated with the so-called Academic Reading Room of Jagiellonian University. Its goal was to spiritually and physically revive society by cultivating national traditions, patriotic education, and engaging in sports activities, mainly of a paramilitary nature. The \"Sokół\" Society was formed within the framework of the \"Reading Room.\" It promoted tourism, gymnastics, and various sports: rowing, shooting, fencing, archery, swimming, athletics, and more. In 1889, the city municipality provided the Society with land on what was then Wolska Street, right by the river Rudawa that flowed there at the time. In the same year, a building was constructed, the falconry. It housed the largest gymnasium in Galicia, equipped with the most modern sports facilities. The edifice was designed by Karol Knaus. The official opening of the building took place on November 18, 1889. In 1894, the falconry was expanded. An eastern part designed by Teodor Talowski was added, giving the building neo-Gothic features. In 1921, the Kraków District of the Polish Gymnastic Society \"Sokół\" was based in the building. On July 31, 1947, representatives of the Security Office sealed the \"Sokół\" building, revoking its permit for operation. From 1957, the building was administered by TKKF. \"Sokół\" regained its building in September 1990 and started a major renovation of the building that had been devastated by the previous user, the Cracovia Sports Club. From 2017 to 2020, the first comprehensive renovation and conservation work since the building's inception took place. Almost the entire cost was financed by the National Fund for the Revaluation of Kraków Monuments granted by the Social Committee for the Renewal of Kraków Monuments. On May 15, 1984, the building was entered into the register of monuments. It is also included in the municipal register of monuments.\npostal_code : nan\ntoilets : nan\nnatural : no information\ndescription : nan\nvisiting_time : nan\nleisure : sports_centre\ntourism : no information\npublic_transport : nan\nbrand : nan\nalt_name : nan\namenity : no information\nreservation : nan\nattraction : nan\nhighchair : nan\nparking : nan\nswimming_pool : nan\ncontact_phone : nan\ncommunity_centre : nan\naddr_street : Marszałka Józefa Piłsudskiego\ncontact_twitter : nan\nsocial_facility : nan\ncontact_facebook : nan\nzoo : nan\nemail : nan\nwheelchair : no\ncuisine : nan\ncontact_website : nan\ninternet_access : nan\nopening_hours_reception : nan\nguest_house : nan\naddr_city : Kraków\ncontact_instagram : nan\nimage : nan\nlocation : nan\noutdoor_seating : nan\nmuseum : nan\ntakeaway : nan\nsmoking : nan\nname : Hala Sokoła\nid : 11492\n\n",
  "answer": "The Monument to the Executed is located at **Abrahama Street** in the Podgórze district of Kraków. It commemorates the first mass execution of Poles by the Germans on September 10, 1939, at the wall of the new Jewish cemetery.",
  "labels": {
    "faithfulness": "FAITHFUL",
    "groundedness": "GROUNDED",
    "relevance": "RELEVANT",
    "completeness": "COMPLETE",
    "coherence": "COHERENT",
    "conciseness": "CONCISE"
  },
  "quality_score": 6
}