{
  "model": "gemini_llm",
  "prompt": "prompt_C",
  "id": 3566,
  "question": "What are some notable features or artworks inside the Franciscan Church?",
  "context": "phone : nan\ncemetery : nan\nemergency : nan\nopening_hours : nan\nwebsite : nan\npets_allowed : nan\ngeometry : POLYGON ((19.9308706 50.0589273, 19.93087 50.0589287, 19.9308682 50.0589284, 19.9308666 50.0589323, 19.9308558 50.0589305, 19.9308574 50.0589267, 19.9308551 50.0589263, 19.9308557 50.058925, 19.9308496 50.0589239, 19.9308501 50.0589226, 19.9308417 50.0589211, 19.9308407 50.0589235, 19.9308162 50.0589195, 19.9307903 50.0589146, 19.9307913 50.0589122, 19.9307832 50.0589107, 19.9307825 50.0589123, 19.9307763 50.0589112, 19.9307757 50.0589125, 19.9307738 50.0589122, 19.930772 50.0589164, 19.9307614 50.0589145, 19.9307631 50.0589105, 19.9307612 50.0589101, 19.9307617 50.0589089, 19.9307104 50.0588999, 19.9307097 50.0589012, 19.9307081 50.058901, 19.9307063 50.058905, 19.9306957 50.0589031, 19.9306974 50.0588991, 19.9306954 50.0588987, 19.9306973 50.0588941, 19.930687 50.0588922, 19.9306902 50.0588845, 19.9306999 50.0588862, 19.930711 50.0588599, 19.9307007 50.0588581, 19.9307044 50.0588497, 19.930714 50.0588514, 19.9307251 50.0588254, 19.9307149 50.0588237, 19.9307186 50.0588152, 19.9307283 50.0588169, 19.9307392 50.058791, 19.9307291 50.0587892, 19.9307325 50.0587809, 19.9307423 50.0587827, 19.9307536 50.0587556, 19.9306402 50.0587364, 19.9306698 50.0586639, 19.930785 50.0586835, 19.9308017 50.0586426, 19.9308454 50.05865, 19.9308851 50.058553, 19.9311062 50.0585841, 19.931056 50.0587067, 19.9310312 50.0587026, 19.9310223 50.0587246, 19.931137 50.0587441, 19.9311077 50.0588151, 19.9311126 50.0588159, 19.931112 50.0588174, 19.9310729 50.0588107, 19.9310613 50.0588391, 19.9310743 50.0588413, 19.9310298 50.0589497, 19.9310224 50.0589484, 19.9310215 50.0589505, 19.9310167 50.0589497, 19.9310004 50.0589469, 19.9310013 50.0589448, 19.9309757 50.0589404, 19.9309748 50.0589425, 19.9309605 50.05894, 19.9309615 50.0589377, 19.9309492 50.0589356, 19.9309486 50.0589371, 19.9309383 50.0589353, 19.9309364 50.0589396, 19.9309346 50.0589393, 19.9309327 50.0589436, 19.9309222 50.0589417, 19.9309238 50.0589378, 19.9309215 50.0589374, 19.9309219 50.0589362, 19.9308706 50.0589273))\nhistoric : church\nwiki_summary_en : The Church of the Immaculate Heart of the Blessed Virgin Mary – a historic Roman Catholic parish church and convent of the Felician Sisters located in Krakow, in the Old Town district at Smoleńsk 6, in Nowy Świat.  \nIt was built between 1882 and 1884 according to the design of Feliks Księżarski. It was intended for the Felician Sisters who were displaced from the Russian Partition following the January Uprising. Next door, in a cottage in the garden, there was a Student Kitchen run by the nuns named after Sister Salomea.  \nThe church was built in the Neo-Romanesque style, is pseudobasilical, and has galleries. Its tower is adorned with a golden crown, resembling that of St. Mary's Church. Inside the church, there is the tomb of Blessed Mother Angela, the founder of the Felician congregation.  \nIn 1931, in exchange for the estate in Tyńiec, the Felicians ceded part of the garden at the corner of Straszewskiego and Zwierzyniecka streets – on this site, the Catholic House with the \"Świt\" cinema was built at that time, and it is currently home to the philharmonic.\npostal_code : nan\ntoilets : nan\nnatural : no information\ndescription : nan\nvisiting_time : nan\nleisure : no information\ntourism : no information\npublic_transport : nan\nbrand : nan\nalt_name : nan\namenity : place_of_worship\nreservation : nan\nattraction : nan\nhighchair : nan\nparking : nan\nswimming_pool : nan\ncontact_phone : nan\ncommunity_centre : nan\naddr_street : Smoleńsk\ncontact_twitter : nan\nsocial_facility : nan\ncontact_facebook : nan\nzoo : nan\nemail : nan\nwheelchair : nan\ncuisine : nan\ncontact_website : nan\ninternet_access : nan\nopening_hours_reception : nan\nguest_house : nan\naddr_city : Kraków\ncontact_instagram : nan\nimage : http://commons.wikimedia.org/wiki/File:Ko%C5%9Bci%C3%B3%C5%82_Niepokalanego_Serca_Naj%C5%9Bwi%C4%99tszej_Maryi_Panny_w_Krakowie_%28ul._Smole%C5%84sk%29_-_front.jpg\nlocation : nan\noutdoor_seating : nan\nmuseum : nan\ntakeaway : nan\nsmoking : nan\nname : Kościół pw. Niepokalanego Serca Najświętszej Marii Panny;Szűz Mária Szeplőtelen Szíve templom\nid : 3454\n\nphone : nan\ncemetery : nan\nemergency : nan\nopening_hours : nan\nwebsite : nan\npets_allowed : nan\ngeometry : POLYGON ((19.9360229 50.0650008, 19.9361075 50.0648936, 19.9360812 50.064885, 19.9361097 50.0648488, 19.9362229 50.0647054, 19.9362489 50.0647142, 19.9362791 50.0646758, 19.9362792 50.0646759, 19.9364055 50.0647195, 19.9363751 50.064758, 19.9364 50.0647665, 19.9363301 50.0648569, 19.9364068 50.0648823, 19.9364072 50.0648823, 19.9364478 50.0648934, 19.9364416 50.064902, 19.936462 50.0649132, 19.9364703 50.0649261, 19.93647 50.0649401, 19.936461 50.0649528, 19.936445 50.0649622, 19.9364265 50.0649665, 19.936415 50.0649665, 19.9364049 50.0649654, 19.9363952 50.064963, 19.9363894 50.064972, 19.9362848 50.064941, 19.9361965 50.0650565, 19.9360229 50.0650008))\nhistoric : church\nwiki_summary_en : The Church of  St. Casimir the Prince (Polish: Kościół św. Kazimierza Królewicza) known colloquially as the  Franciscan Observants Church (Polish: Kościół reformatów) is a historic Roman Catholic conventual church of the Franciscan Observants located at 4 Reformacka Street, in the Old Town of Kraków, Poland.\npostal_code : nan\ntoilets : nan\nnatural : no information\ndescription : nan\nvisiting_time : nan\nleisure : no information\ntourism : no information\npublic_transport : nan\nbrand : nan\nalt_name : nan\namenity : place_of_worship\nreservation : nan\nattraction : nan\nhighchair : nan\nparking : nan\nswimming_pool : nan\ncontact_phone : nan\ncommunity_centre : nan\naddr_street : Reformacka\ncontact_twitter : nan\nsocial_facility : nan\ncontact_facebook : nan\nzoo : nan\nemail : nan\nwheelchair : nan\ncuisine : nan\ncontact_website : nan\ninternet_access : nan\nopening_hours_reception : nan\nguest_house : nan\naddr_city : Kraków\ncontact_instagram : nan\nimage : nan\nlocation : nan\noutdoor_seating : nan\nmuseum : nan\ntakeaway : nan\nsmoking : nan\nname : Kościół pw. Świętego Kazimierza Królewicza;Kościół Reformatów;Szent Kázmér herceg templom\nid : 3466\n\nphone : nan\ncemetery : nan\nemergency : nan\nopening_hours : nan\nwebsite : nan\npets_allowed : nan\ngeometry : POLYGON ((19.9275262 50.0605272, 19.9275366 50.0604942, 19.9275125 50.0604903, 19.9275261 50.0604577, 19.9275031 50.0604537, 19.9275172 50.0604225, 19.9275407 50.0604269, 19.9275547 50.0603937, 19.9275734 50.0603969, 19.9275935 50.0603658, 19.9277809 50.0604318, 19.9278005 50.0604541, 19.9278586 50.0604643, 19.9278624 50.0604551, 19.9278662 50.0604558, 19.92787 50.0604453, 19.9280045 50.0604683, 19.9279927 50.0604965, 19.9280105 50.0604997, 19.9279896 50.0605493, 19.9279104 50.0605354, 19.9279085 50.0605397, 19.9279163 50.0605483, 19.9279066 50.060552, 19.9278956 50.0605409, 19.9278417 50.0605314, 19.9278373 50.0605408, 19.9278266 50.0605388, 19.9278307 50.0605298, 19.9277728 50.0605192, 19.9277393 50.0605315, 19.9275262 50.0605272))\nhistoric : church\nwiki_summary_en : The Church of the Most Sacred Heart of Jesus – a historic Roman Catholic parish church and conventual church of the Sisters of the Sacred Heart located in Krakow, in the Old Town district at 24 Garncarska Street, in Nowy Świat.  \nIt was built at the end of the 19th century in an eclectic style with a predominance of Neo-Romanesque elements according to the plans of Władysław Kaczmarski, on land donated to the nuns by Duchess Wanda Jabłonowska, and funded by Zofia Wołodkowicz. It was consecrated in 1900.  \nOn the front facade of the church and monastery, there are sculptures by Jan Tombiński. In the convent house by the church, there is a museum dedicated to Bishop Józef Sebastian Pelczar, the founder of the congregation of the Sisters of the Sacred Heart. In the church, in a side chapel, there is an altar with a portrait and relics of Bishop Pelczar, and another altar where the mortal remains of the founder of the congregation, Klara Ludwika Szczęsna, were laid to rest in 1995, having been transferred from Rakowicki Cemetery. A small altar of John Paul II with relics was placed at the altar of St. Joseph in 2011. The main altar was made in 1899 by Kazimierz Wakulski, while the author of the side altars was Wit Wisz.\npostal_code : nan\ntoilets : nan\nnatural : no information\ndescription : nan\nvisiting_time : nan\nleisure : no information\ntourism : no information\npublic_transport : nan\nbrand : nan\nalt_name : nan\namenity : place_of_worship\nreservation : nan\nattraction : nan\nhighchair : nan\nparking : nan\nswimming_pool : nan\ncontact_phone : nan\ncommunity_centre : nan\naddr_street : Garncarska\ncontact_twitter : nan\nsocial_facility : nan\ncontact_facebook : nan\nzoo : nan\nemail : nan\nwheelchair : nan\ncuisine : nan\ncontact_website : nan\ninternet_access : nan\nopening_hours_reception : nan\nguest_house : nan\naddr_city : Kraków\ncontact_instagram : nan\nimage : http://commons.wikimedia.org/wiki/File:Ko%C5%9Bci%C3%B3%C5%82_Naj%C5%9Bwi%C4%99tszego_Serca_Pana_Jezusa,_Krak%C3%B3w.JPG\nlocation : nan\noutdoor_seating : nan\nmuseum : nan\ntakeaway : nan\nsmoking : nan\nname : Kościół pw. Najświętszego Serca Pana Jezusa;Jézus Szent Szíve templom\nid : 3470\n\nphone : nan\ncemetery : nan\nemergency : nan\nopening_hours : nan\nwebsite : nan\npets_allowed : nan\ngeometry : POLYGON ((19.9384844 50.0559648, 19.9384812 50.0559763, 19.9384864 50.0559954, 19.9384559 50.0559998, 19.9384545 50.0559954, 19.9384495 50.0559963, 19.9384092 50.0558695, 19.9384081 50.055866, 19.9384112 50.0558656, 19.9384074 50.0558514, 19.9384032 50.0558354, 19.9384309 50.0558322, 19.9384358 50.0558476, 19.9384404 50.0558618, 19.9386281 50.0558382, 19.9386455 50.055836, 19.9388005 50.0558139, 19.9388014 50.0558162, 19.9388214 50.0558787, 19.9388338 50.055918, 19.9388153 50.0559205, 19.9384844 50.0559648))\nhistoric : church\nwiki_summary_en : St. Martin's Church – a historic Lutheran church located in Krakow, in the I Stare Miasto district at Grodzka Street 56, in the Old Town. It is the seat of the Krakow Evangelical-Augsburg parish and the Evangelical-Reformed diaspora. Additionally, services of the Old Catholic Mariavite Church are held there. The faithful of the Evangelical-Reformed Church (Calvinists) do not recognize the placement of sculptures and images in places of worship; however, as it is an ecumenical church, they made a concession regarding the placement of a painting of Jesus calming the storm and two figures in the chancel.\npostal_code : nan\ntoilets : nan\nnatural : no information\ndescription : nan\nvisiting_time : nan\nleisure : no information\ntourism : no information\npublic_transport : nan\nbrand : nan\nalt_name : nan\namenity : place_of_worship\nreservation : nan\nattraction : nan\nhighchair : nan\nparking : nan\nswimming_pool : nan\ncontact_phone : nan\ncommunity_centre : nan\naddr_street : Grodzka\ncontact_twitter : nan\nsocial_facility : nan\ncontact_facebook : nan\nzoo : nan\nemail : nan\nwheelchair : nan\ncuisine : nan\ncontact_website : nan\ninternet_access : nan\nopening_hours_reception : nan\nguest_house : nan\naddr_city : Kraków\ncontact_instagram : nan\nimage : http://commons.wikimedia.org/wiki/File:Church_of_St._Martin_in_Krak%C3%B3w.JPG\nlocation : nan\noutdoor_seating : nan\nmuseum : nan\ntakeaway : nan\nsmoking : nan\nname : Kościół Świętego Marcina;Kirche Heiliger Marcin;Szent Márton templom;Касцёл Святога Марціна\nid : 3518\n\nphone : nan\ncemetery : nan\nemergency : nan\nopening_hours : nan\nwebsite : http://bazylika.deon.pl/\npets_allowed : nan\ngeometry : POLYGON ((19.9488191 50.0622836, 19.9488175 50.0622791, 19.9488172 50.0622754, 19.9488191 50.0622698, 19.9488068 50.0622649, 19.9488422 50.0622279, 19.9487953 50.0622094, 19.9487868 50.062218, 19.948774 50.062213, 19.9487645 50.0622117, 19.9487546 50.0622109, 19.9487446 50.062208, 19.9487364 50.0622032, 19.9487314 50.0621976, 19.9487264 50.0621939, 19.9487124 50.0621883, 19.9487046 50.0621887, 19.9486828 50.0621938, 19.9486596 50.0621934, 19.9486382 50.0621876, 19.9486213 50.0621772, 19.9486113 50.0621635, 19.9486094 50.0621484, 19.9486059 50.0621464, 19.9485916 50.0621406, 19.9485858 50.0621394, 19.9485746 50.0621392, 19.9485633 50.0621363, 19.9485541 50.0621308, 19.9485484 50.0621239, 19.9485316 50.0621167, 19.9485397 50.0621082, 19.9484923 50.0620892, 19.9484896 50.0620921, 19.9484751 50.0620862, 19.9484827 50.0620779, 19.9483959 50.0620439, 19.9483876 50.0620522, 19.9483732 50.0620463, 19.9483813 50.0620378, 19.9483682 50.0620328, 19.948376 50.0620243, 19.9483891 50.0620294, 19.9484161 50.0620007, 19.9484028 50.0619956, 19.9484117 50.0619861, 19.948425 50.0619912, 19.948454 50.0619583, 19.9484902 50.0619222, 19.9484773 50.0619169, 19.9484861 50.0619078, 19.948492 50.0619102, 19.9485528 50.0618464, 19.9485745 50.0618548, 19.9485807 50.0618483, 19.9485924 50.061853, 19.9485902 50.0618551, 19.9485884 50.0618581, 19.948588 50.0618619, 19.9485888 50.0618642, 19.9485907 50.0618667, 19.9485899 50.0618695, 19.9485908 50.0618716, 19.9485917 50.0618731, 19.9485933 50.061874, 19.9485931 50.061876, 19.9485948 50.0618781, 19.9485926 50.0618804, 19.9486077 50.0618867, 19.9486263 50.0618944, 19.9486285 50.0618921, 19.9486319 50.0618921, 19.9486335 50.0618916, 19.9486348 50.0618909, 19.9486366 50.0618913, 19.9486394 50.0618913, 19.9486426 50.0618905, 19.9486458 50.0618888, 19.9486503 50.0618888, 19.9486538 50.0618883, 19.9486587 50.0618862, 19.9486618 50.0618837, 19.9486642 50.0618814, 19.9486757 50.0618863, 19.9486496 50.0619138, 19.9487049 50.0619358, 19.9487129 50.0619275, 19.9487264 50.0619346, 19.9487338 50.0619339, 19.9487441 50.0619346, 19.9487534 50.0619369, 19.9487611 50.0619409, 19.9487668 50.0619462, 19.9487698 50.0619513, 19.9487889 50.0619588, 19.9488115 50.0619522, 19.9488364 50.0619516, 19.9488597 50.0619572, 19.9488778 50.061968, 19.948888 50.0619825, 19.9488888 50.0619985, 19.9489081 50.062006, 19.9489179 50.0620053, 19.9489254 50.0620059, 19.9489341 50.0620081, 19.9489471 50.062016, 19.948951 50.0620214, 19.9489521 50.0620238, 19.9489676 50.0620285, 19.9489592 50.0620371, 19.9490063 50.0620557, 19.9490329 50.0620277, 19.9490376 50.0620293, 19.949055 50.0620353, 19.9490513 50.0620386, 19.9490517 50.0620439, 19.9490663 50.0620498, 19.9490817 50.0620556, 19.9490881 50.062053, 19.9490912 50.0620497, 19.9491075 50.0620563, 19.9491119 50.0620581, 19.9491008 50.0620698, 19.9491111 50.0620745, 19.9491062 50.0620791, 19.9491874 50.0621119, 19.9491917 50.0621073, 19.9492025 50.0621115, 19.9491983 50.0621162, 19.9492752 50.0621474, 19.9492795 50.0621427, 19.9492848 50.0621447, 19.9492907 50.062147, 19.9492865 50.0621519, 19.9492935 50.0621547, 19.9492873 50.0621613, 19.9492799 50.0621585, 19.9492357 50.0622046, 19.9492429 50.0622075, 19.9492362 50.0622145, 19.949229 50.0622116, 19.9492012 50.0622411, 19.9491524 50.0622924, 19.9491085 50.0623384, 19.9491157 50.0623414, 19.9491085 50.0623485, 19.9491011 50.0623455, 19.9490967 50.0623501, 19.9490859 50.0623457, 19.9490904 50.0623412, 19.949013 50.0623103, 19.9490085 50.0623149, 19.9489955 50.0623096, 19.9489749 50.0623311, 19.9488734 50.0622919, 19.9488575 50.0622969, 19.9488419 50.0622971, 19.9488286 50.0622925, 19.9488191 50.0622836))\nhistoric : church\nwiki_summary_en : Basilica of the Sacred Heart of Jesus (Polish: Bazylika Najświętszego Serca Pana Jezusa w Krakowie) is a Roman Catholic church of the Jesuits in Kraków.\npostal_code : nan\ntoilets : nan\nnatural : no information\ndescription : nan\nvisiting_time : nan\nleisure : no information\ntourism : no information\npublic_transport : nan\nbrand : nan\nalt_name : Bazylika pw. Najświętszego Serca Pana Jezusa\namenity : place_of_worship\nreservation : nan\nattraction : nan\nhighchair : nan\nparking : nan\nswimming_pool : nan\ncontact_phone : nan\ncommunity_centre : nan\naddr_street : Mikołaja Kopernika\ncontact_twitter : nan\nsocial_facility : nan\ncontact_facebook : nan\nzoo : nan\nemail : nan\nwheelchair : nan\ncuisine : nan\ncontact_website : nan\ninternet_access : nan\nopening_hours_reception : nan\nguest_house : nan\naddr_city : Kraków\ncontact_instagram : nan\nimage : http://commons.wikimedia.org/wiki/File:Ko%C5%9Bci%C3%B3%C5%82_Serca_Jezusowego_w_Krakowie_przy_ul._Kopernika.jpg\nlocation : nan\noutdoor_seating : nan\nmuseum : nan\ntakeaway : nan\nsmoking : nan\nname : Kościół pw. Najświętszego Serca Pana Jezusa;Bazylika pw. Najświętszego Serca Pana Jezusa;Jézus Szent Szíve templom\nid : 3541\n\nphone : nan\ncemetery : nan\nemergency : nan\nopening_hours : nan\nwebsite : https://www.franciszkanska.pl/\npets_allowed : nan\ngeometry : POLYGON ((19.9360453 50.0593627, 19.9360469 50.0593477, 19.9359662 50.0593431, 19.935963 50.0593572, 19.9359395 50.0593554, 19.9359408 50.0593405, 19.93587 50.0593358, 19.9358672 50.05935, 19.9358438 50.0593481, 19.9358462 50.0593342, 19.9357696 50.0593289, 19.9357671 50.0593435, 19.9357433 50.0593415, 19.9357461 50.0593267, 19.935667 50.0593204, 19.9356644 50.0593359, 19.9355814 50.059326, 19.9355849 50.0593183, 19.9355829 50.059318, 19.935584 50.0592994, 19.9355858 50.0592995, 19.9355969 50.0592277, 19.935595 50.0592274, 19.9356048 50.059174, 19.9356079 50.0591741, 19.9356112 50.0591704, 19.9356179 50.0591699, 19.9356219 50.0591701, 19.9356236 50.0591596, 19.9356254 50.0591481, 19.9356217 50.0591479, 19.9356152 50.0591462, 19.9356133 50.0591425, 19.93561 50.0591421, 19.9356162 50.0590991, 19.9356177 50.0590892, 19.9362173 50.0591319, 19.9362286 50.0590723, 19.9364226 50.0590902, 19.9364291 50.0590596, 19.9364809 50.0590643, 19.9364705 50.059098, 19.9364995 50.0591222, 19.936494 50.0591529, 19.9365123 50.0591544, 19.9365104 50.0591711, 19.9365411 50.0591734, 19.9365552 50.0591568, 19.9365702 50.0591624, 19.9365559 50.0591791, 19.9365838 50.0592002, 19.9366139 50.059195, 19.9366183 50.0592055, 19.9365891 50.0592115, 19.9365846 50.0592389, 19.9366105 50.059249, 19.9366019 50.059259, 19.9365762 50.0592492, 19.936541 50.0592653, 19.9365471 50.0592841, 19.93653 50.0592862, 19.9365248 50.059269, 19.9364932 50.0592667, 19.9364901 50.0592857, 19.9364735 50.0592845, 19.9364788 50.0592658, 19.9364397 50.0592637, 19.9364567 50.0592812, 19.9364544 50.0592923, 19.9364496 50.0593165, 19.9364083 50.0593405, 19.9363033 50.0593336, 19.9362996 50.0593621, 19.9363038 50.0593622, 19.9363026 50.0593695, 19.9362916 50.0593689, 19.9362916 50.0593661, 19.9362474 50.0593633, 19.936183 50.0593593, 19.9361771 50.0593589, 19.9361763 50.0593655, 19.9360694 50.0593605, 19.9360684 50.059364, 19.9360453 50.0593627))\nhistoric : church\nwiki_summary_en : The Church of St. Francis of Assisi (Polish: Kościół św. Franciszka z Asyżu) and Friary of the Conventual Friars Minor located in the Old Town district of Kraków, Poland, are a Roman Catholic religious complex on the west side of All Saints Square at Franciszkańska 2, across the street from the Bishop's Palace in Krakow – which served as the residence of Pope John Paul II during his stays in the city. The Church dates back to the 13th century. The saint Maximilian Kolbe was a friar there in 1919, and led his first service at this church upon Poland's return to sovereignty.\npostal_code : nan\ntoilets : nan\nnatural : no information\ndescription : Ojców Franciszkanów\nvisiting_time : nan\nleisure : no information\ntourism : no information\npublic_transport : nan\nbrand : nan\nalt_name : Kościół pw. Świętego Franciszka z Asyżu\namenity : place_of_worship\nreservation : nan\nattraction : nan\nhighchair : nan\nparking : nan\nswimming_pool : nan\ncontact_phone : nan\ncommunity_centre : nan\naddr_street : Plac Wszystkich Świętych\ncontact_twitter : nan\nsocial_facility : nan\ncontact_facebook : nan\nzoo : nan\nemail : nan\nwheelchair : nan\ncuisine : nan\ncontact_website : nan\ninternet_access : nan\nopening_hours_reception : nan\nguest_house : nan\naddr_city : Kraków\ncontact_instagram : nan\nimage : http://commons.wikimedia.org/wiki/File:Krak%C3%B3w_-_Church_of_St._Francis_01.JPG\nlocation : nan\noutdoor_seating : nan\nmuseum : nan\ntakeaway : nan\nsmoking : nan\nname : Bazylika Świętego Franciszka z Asyżu;Franciscan Church;Kościół pw. Świętego Franciszka z Asyżu;Kościół pw. Świętego Franciszka z Asyżu w Krakowie;Basílica de los Franciscanos;Kościół Franciszkanów;Franziskanerkirche;Костёл Святого Франциска Ассизского;Assisi Szent Ferenc templom;Sanktuarium Matki Bożej Bolesnej\nid : 3566\n\nphone : nan\ncemetery : nan\nemergency : nan\nopening_hours : nan\nwebsite : nan\npets_allowed : nan\ngeometry : POLYGON ((19.9528695 50.0637715, 19.9528455 50.0638127, 19.9527797 50.0637964, 19.952706 50.0637782, 19.9527304 50.0637373, 19.9526658 50.0637214, 19.9526669 50.0637196, 19.9526656 50.0637193, 19.9527546 50.063566, 19.9527604 50.0635675, 19.9527661 50.063569, 19.9527654 50.0635701, 19.952771 50.0635715, 19.9527704 50.0635724, 19.9528006 50.0635798, 19.9528011 50.0635791, 19.9528048 50.0635799, 19.9528056 50.0635787, 19.9528141 50.0635808, 19.9528153 50.0635787, 19.9528211 50.06358, 19.9528228 50.0635775, 19.9528453 50.0635832, 19.9528439 50.0635857, 19.9528497 50.0635871, 19.9528463 50.0635935, 19.9529317 50.0636145, 19.9529356 50.0636083, 19.9529416 50.0636097, 19.9529431 50.0636073, 19.9529658 50.0636129, 19.9529643 50.0636154, 19.9529703 50.0636169, 19.9529688 50.0636193, 19.952977 50.0636212, 19.9529763 50.0636225, 19.95298 50.0636233, 19.9529797 50.0636241, 19.9530099 50.0636315, 19.9530105 50.0636308, 19.953016 50.0636322, 19.9530168 50.063631, 19.9530226 50.0636324, 19.9530283 50.0636338, 19.9530271 50.0636362, 19.9529388 50.0637882, 19.9528695 50.0637715))\nhistoric : church\nwiki_summary_en : St. Teresa of Jesus and St. John of the Cross Church – a historic Roman Catholic parish church and convent of the Discalced Carmelites located in Kraków, in the Grzegórzki district at 44 Mikołaj Kopernik Street, in Wesoła. It was built between 1720 and 1730 with the funding of Chancellor Jan Szembek, and the consecration of the new temple was performed in 1730 by the Warmian bishop Krzysztof Jan Szembek, the founder’s brother. In the second half of the 18th century, the Carmelites moved here from the convent house near St. Martin's Church. The church is built in the Baroque style, in the shape of a Greek cross. The modest façade adorned with pilasters features a portal. In front of the church stands a marble column from 1668. In the main altar, there is a painting of St. Teresa of Avila gifted by the founder. The church is associated with the story of the nun Barbara Ubryk, who, after strange behaviors, laughter in church, confessions lasting many hours, and fits of exalted piety, was bricked up in a cell, where she was imprisoned under inhumane conditions for 21 years (from 1848 to 1869). News of this caused a scandal and riots against the clergy.\npostal_code : nan\ntoilets : nan\nnatural : no information\ndescription : nan\nvisiting_time : nan\nleisure : no information\ntourism : no information\npublic_transport : nan\nbrand : nan\nalt_name : nan\namenity : place_of_worship\nreservation : nan\nattraction : nan\nhighchair : nan\nparking : nan\nswimming_pool : nan\ncontact_phone : nan\ncommunity_centre : nan\naddr_street : nan\ncontact_twitter : nan\nsocial_facility : nan\ncontact_facebook : nan\nzoo : nan\nemail : nan\nwheelchair : nan\ncuisine : nan\ncontact_website : nan\ninternet_access : nan\nopening_hours_reception : nan\nguest_house : nan\naddr_city : nan\ncontact_instagram : nan\nimage : https://commons.wikimedia.org/wiki/File:Church_of_Saint_Teresa,_Krak%C3%B3w.JPG\nlocation : nan\noutdoor_seating : nan\nmuseum : nan\ntakeaway : nan\nsmoking : nan\nname : Kościół pw. Świętej Teresy od Jezusa i Świętego Jana od Krzyża;Jézusról nevezett Szent Terész és Keresztes Szent János templom\nid : 3678\n\nphone : nan\ncemetery : nan\nemergency : nan\nopening_hours : nan\nwebsite : nan\npets_allowed : nan\ngeometry : POLYGON ((19.9413179 50.0679172, 19.941651 50.0678102, 19.9409749 50.0667991, 19.9405863 50.0669002, 19.9404079 50.0669595, 19.9413179 50.0679172))\nhistoric : no information\nwiki_summary_en : Rynek Kleparski – a city square in Kraków located directly north of the Old Town, between Basztowa and St. Philip Streets; the western fragment of the former marketplace of Kleparz, now a market square (commonly referred to as Stary Kleparz). \n\nIt was probably established during the location of the town of Kleparz in 1366. At that time, it encompassed a much larger area than it does now, approaching the size of Kraków's Main Market Square (it also included today's pl. Jana Matejki and the built-up areas between Rynek Kleparski, pl. Matejki, and the Planty). On the square, at the site of today's primary school, there stood a brick Kleparz town hall (demolished in 1803) and numerous buildings associated with the market functions of the square (the square was divided into several parts, including an eastern section where a horse market operated and a western section that hosted a grain market). The so-called \"Royal Road\" began from the square, running from the St. Florian's Church (then at the corner of Rynek Kleparski), through the Barbican and St. Florian's Gate towards Wawel.\n\nAfter Kleparz was annexed to Kraków, it was decided to partially build up the square, which lost its status as the main city square – this plan was implemented in the second half of the 19th century and the first half of the 20th century, during which numerous residential houses and public buildings were constructed. In 1880, the western part of the former square officially received the name \"Rynek Kleparski\" and retained the character of a popular market square. Currently, the square features a marketplace managed by the Merchant Company \"Stary Kleparz,\" and its area is occupied by typical market architecture (stalls, etc.).\n\nRynek Kleparski is surrounded mainly by residential buildings with commercial functions. Notable structures include:\n\nthe Neo-Gothic St. Vincent's Church along with the missionaries' monastery (on St. Philip Street),\nthe \"Phoenix\" building (at the corner with Basztowa Street, built in 1931-1932).\nLudwik Waryński lived at Rynek Kleparski 8. \nSince 2017, a Living Bagel Museum has operated at 4 Ignacy Paderewski Street (in a tenement by Rynek Kleparski).\npostal_code : nan\ntoilets : nan\nnatural : no information\ndescription : nan\nvisiting_time : nan\nleisure : no information\ntourism : no information\npublic_transport : nan\nbrand : nan\nalt_name : nan\namenity : marketplace\nreservation : nan\nattraction : nan\nhighchair : nan\nparking : nan\nswimming_pool : nan\ncontact_phone : nan\ncommunity_centre : nan\naddr_street : nan\ncontact_twitter : nan\nsocial_facility : nan\ncontact_facebook : nan\nzoo : nan\nemail : nan\nwheelchair : nan\ncuisine : nan\ncontact_website : nan\ninternet_access : nan\nopening_hours_reception : nan\nguest_house : nan\naddr_city : nan\ncontact_instagram : nan\nimage : nan\nlocation : nan\noutdoor_seating : nan\nmuseum : nan\ntakeaway : nan\nsmoking : nan\nname : Rynek Kleparski;Клепарський Ринок\nid : 9516\n\n",
  "answer": "The tomb of Blessed Mother Angela, the founder of the Felician congregation, is located inside the church.",
  "labels": {
    "faithfulness": "FAITHFUL",
    "groundedness": "GROUNDED",
    "relevance": "RELEVANT",
    "completeness": "PARTLY_COMPLETE",
    "coherence": "COHERENT",
    "conciseness": "CONCISE"
  },
  "quality_score": 5
}