{
  "model": "gemini_llm",
  "prompt": "prompt_C",
  "id": 10940,
  "question": "What are the operating hours for the reception services at Oddział Szybkiej Diagnostyki?",
  "context": "phone : +48 12 422 05 21\ncemetery : nan\nemergency : nan\nopening_hours : Mo-Sa 11:30-18:00; Su 14:00-18:00\nwebsite : https://mariacki.com\npets_allowed : nan\ngeometry : POLYGON ((19.9389202 50.0616958, 19.9389203 50.061699, 19.9389308 50.0616987, 19.9389329 50.0617701, 19.9390219 50.061769, 19.9390222 50.0617899, 19.939069 50.0617897, 19.9390689 50.0617933, 19.9390767 50.061793, 19.9390802 50.0618409, 19.939344 50.0618351, 19.939351 50.0618316, 19.9393529 50.0618287, 19.9393987 50.0618276, 19.9394004 50.0618305, 19.9394044 50.0618316, 19.9394074 50.0618335, 19.9395723 50.0618301, 19.9395709 50.0618076, 19.9396872 50.0618003, 19.9398112 50.0617858, 19.9398073 50.0617685, 19.9399081 50.0617606, 19.9399015 50.0617225, 19.9399401 50.0617198, 19.93994 50.0617183, 19.9399602 50.061717, 19.9399606 50.0617186, 19.9399692 50.061718, 19.9399702 50.0617194, 19.9399813 50.0617187, 19.9399899 50.0617279, 19.9399952 50.0617288, 19.9400217 50.0617113, 19.9400209 50.0617098, 19.9400369 50.0616991, 19.9400395 50.0616999, 19.9400659 50.0616821, 19.9400651 50.0616789, 19.9400511 50.0616717, 19.940056 50.061665, 19.9400547 50.0616639, 19.9400564 50.0616076, 19.940059 50.0616066, 19.9400525 50.0615991, 19.940068 50.0615934, 19.9400674 50.0615901, 19.9399952 50.0615393, 19.9399396 50.0615406, 19.9399397 50.0615398, 19.9399158 50.0615402, 19.9399161 50.0615412, 19.939878 50.0615421, 19.9398787 50.0615519, 19.9398721 50.0615521, 19.9398723 50.0615544, 19.9397785 50.0615573, 19.9397782 50.0615557, 19.9397579 50.0615566, 19.9397579 50.0615578, 19.9397104 50.0615598, 19.9397104 50.0615587, 19.9396443 50.0615601, 19.9396455 50.0615812, 19.9396154 50.0615819, 19.9396132 50.0615889, 19.9396 50.0615893, 19.9395861 50.0615896, 19.9395829 50.0615827, 19.9395486 50.0615837, 19.9395448 50.0615299, 19.9395668 50.0615144, 19.939553 50.0614859, 19.939531 50.0614753, 19.9395071 50.0614763, 19.9393837 50.0614812, 19.9393762 50.0614839, 19.9393761 50.0614869, 19.9393269 50.0614876, 19.9393264 50.0614846, 19.9393189 50.0614835, 19.939314 50.0614832, 19.9393132 50.0614736, 19.9392723 50.0614752, 19.9392747 50.0614847, 19.9390605 50.0614909, 19.9390002 50.0614946, 19.9390017 50.0615307, 19.9390053 50.0615305, 19.9390062 50.0615472, 19.9389247 50.0615485, 19.9389213 50.0616186, 19.9389157 50.0616188, 19.9389159 50.0616254, 19.9388923 50.0616254, 19.9388892 50.0616186, 19.938877 50.0616213, 19.9388797 50.0616277, 19.9388474 50.0616408, 19.9388378 50.0616376, 19.9388319 50.0616448, 19.9388419 50.0616479, 19.938842 50.0616615, 19.9388421 50.0616746, 19.938833 50.0616782, 19.9388394 50.0616852, 19.9388485 50.0616816, 19.9388831 50.061693, 19.93888 50.0616998, 19.9388918 50.0617023, 19.9388965 50.061696, 19.9389202 50.0616958))\nhistoric : church\nwiki_summary_en : The Church of the Assumption of the Blessed Virgin Mary (Polish: Kościół Wniebowzięcia Najświętszej Marii Panny), known colloquially as the St. Mary's Church (Polish: Kościół Mariacki), is a historic Roman Catholic parish church located at Mariacki Square at the north-eastern corner of the Main Market Square in the Old Town of Kraków, Poland.\nIt is a Brick Gothic church. Built in the 14th century, its foundations date back to the early 13th century and serve as one of the best examples of Polish Gothic architecture. Standing 80 m (262 ft) tall, it is particularly famous for its wooden altarpiece carved by Veit Stoss (Wit Stwosz). Some of its monumental polychrome murals were designed by Poland's leading history painter, Jan Matejko (1838–1893). In 1978, it became a UNESCO World Heritage Site alongside the Historic Centre of Kraków.\nOn every hour, 24 hours a day, 365 days a year, a trumpet signal—called the Hejnał mariacki—is played from the top of the taller of Saint Mary's two towers. The plaintive tune breaks off in mid-stream, to commemorate a famous 13th-century trumpeter who was shot in the throat while sounding the alarm before a Mongol attack on the city. The noon-time hejnał is heard across Poland and abroad broadcast live by Polish Radio Jedynka.\nSaint Mary's Basilica also served as an architectural model for many of the churches that were built by the Polish diaspora abroad, particularly those like Saint Michael's and Saint John Cantius in Chicago, designed in the Polish Cathedral style.\nThe church is familiar to many English-speaking readers from the 1928 book The Trumpeter of Krakow by Eric P. Kelly.\npostal_code : nan\ntoilets : nan\nnatural : no information\ndescription : nan\nvisiting_time : nan\nleisure : no information\ntourism : attraction\npublic_transport : nan\nbrand : nan\nalt_name : Kościół pw. Wniebowzięcia Najświętszej Maryi Panny\namenity : place_of_worship\nreservation : nan\nattraction : nan\nhighchair : nan\nparking : nan\nswimming_pool : nan\ncontact_phone : nan\ncommunity_centre : nan\naddr_street : Plac Mariacki\ncontact_twitter : nan\nsocial_facility : nan\ncontact_facebook : nan\nzoo : nan\nemail : biuro@mariacki.com\nwheelchair : yes\ncuisine : nan\ncontact_website : nan\ninternet_access : nan\nopening_hours_reception : nan\nguest_house : nan\naddr_city : Kraków\ncontact_instagram : nan\nimage : nan\nlocation : nan\noutdoor_seating : nan\nmuseum : nan\ntakeaway : nan\nsmoking : nan\nname : Bazylika Wniebowzięcia Najświętszej Maryi Panny;St. Mary's Basilica;Kościół pw. Wniebowzięcia Najświętszej Maryi Panny;Iglesia de Santa María;Bazylika Mariacka;Церква Успіння Пресвятої Богородиці;Marienbasilika;Мариацкий костёл;Mária Mennybevétele templom;Касцёл Унебаўзняцця Найсвяцейшай Панны Марыі;Basilica di Santa Maria;Kościół Mariacki;Basilique Sainte-Marie;Krokuvos Šv. Marijos bazilika;聖母聖殿;성모 승천 대성당;Krakówi Maria kirik;Sanktuarium Matki Bożej Częstochowskiej\nid : 3443\n\nphone : nan\ncemetery : nan\nemergency : nan\nopening_hours : Mo-Fr 08:00-16:00\nwebsite : https://dworek.eu/\npets_allowed : nan\ngeometry : POLYGON ((19.9406886 50.0928475, 19.9407847 50.0929495, 19.9410392 50.0928509, 19.9411519 50.0928072, 19.9411251 50.0927787, 19.9411201 50.0927734, 19.9410568 50.0927062, 19.9409401 50.0927514, 19.9409062 50.0927154, 19.9408476 50.0927381, 19.9407875 50.0927614, 19.9408204 50.0927964, 19.9406886 50.0928475))\nhistoric : no information\nwiki_summary_en : The Cultural Center “Dworek Białoprądnicki” - a cultural center located in a historic manor house in Kraków on Biały Prądnik, surrounded by the Tadeusz Kościuszko Park.\npostal_code : nan\ntoilets : nan\nnatural : no information\ndescription : nan\nvisiting_time : nan\nleisure : no information\ntourism : attraction\npublic_transport : nan\nbrand : nan\nalt_name : nan\namenity : no information\nreservation : nan\nattraction : nan\nhighchair : nan\nparking : nan\nswimming_pool : nan\ncontact_phone : nan\ncommunity_centre : nan\naddr_street : Papiernicza\ncontact_twitter : nan\nsocial_facility : nan\ncontact_facebook : nan\nzoo : nan\nemail : nan\nwheelchair : nan\ncuisine : nan\ncontact_website : nan\ninternet_access : nan\nopening_hours_reception : nan\nguest_house : nan\naddr_city : Kraków\ncontact_instagram : nan\nimage : nan\nlocation : nan\noutdoor_seating : nan\nmuseum : nan\ntakeaway : nan\nsmoking : nan\nname : Dworek Białoprądnicki\nid : 3456\n\nphone : nan\ncemetery : nan\nemergency : nan\nopening_hours : nan\nwebsite : nan\npets_allowed : nan\ngeometry : POLYGON ((19.9528695 50.0637715, 19.9528455 50.0638127, 19.9527797 50.0637964, 19.952706 50.0637782, 19.9527304 50.0637373, 19.9526658 50.0637214, 19.9526669 50.0637196, 19.9526656 50.0637193, 19.9527546 50.063566, 19.9527604 50.0635675, 19.9527661 50.063569, 19.9527654 50.0635701, 19.952771 50.0635715, 19.9527704 50.0635724, 19.9528006 50.0635798, 19.9528011 50.0635791, 19.9528048 50.0635799, 19.9528056 50.0635787, 19.9528141 50.0635808, 19.9528153 50.0635787, 19.9528211 50.06358, 19.9528228 50.0635775, 19.9528453 50.0635832, 19.9528439 50.0635857, 19.9528497 50.0635871, 19.9528463 50.0635935, 19.9529317 50.0636145, 19.9529356 50.0636083, 19.9529416 50.0636097, 19.9529431 50.0636073, 19.9529658 50.0636129, 19.9529643 50.0636154, 19.9529703 50.0636169, 19.9529688 50.0636193, 19.952977 50.0636212, 19.9529763 50.0636225, 19.95298 50.0636233, 19.9529797 50.0636241, 19.9530099 50.0636315, 19.9530105 50.0636308, 19.953016 50.0636322, 19.9530168 50.063631, 19.9530226 50.0636324, 19.9530283 50.0636338, 19.9530271 50.0636362, 19.9529388 50.0637882, 19.9528695 50.0637715))\nhistoric : church\nwiki_summary_en : St. Teresa of Jesus and St. John of the Cross Church – a historic Roman Catholic parish church and convent of the Discalced Carmelites located in Kraków, in the Grzegórzki district at 44 Mikołaj Kopernik Street, in Wesoła. It was built between 1720 and 1730 with the funding of Chancellor Jan Szembek, and the consecration of the new temple was performed in 1730 by the Warmian bishop Krzysztof Jan Szembek, the founder’s brother. In the second half of the 18th century, the Carmelites moved here from the convent house near St. Martin's Church. The church is built in the Baroque style, in the shape of a Greek cross. The modest façade adorned with pilasters features a portal. In front of the church stands a marble column from 1668. In the main altar, there is a painting of St. Teresa of Avila gifted by the founder. The church is associated with the story of the nun Barbara Ubryk, who, after strange behaviors, laughter in church, confessions lasting many hours, and fits of exalted piety, was bricked up in a cell, where she was imprisoned under inhumane conditions for 21 years (from 1848 to 1869). News of this caused a scandal and riots against the clergy.\npostal_code : nan\ntoilets : nan\nnatural : no information\ndescription : nan\nvisiting_time : nan\nleisure : no information\ntourism : no information\npublic_transport : nan\nbrand : nan\nalt_name : nan\namenity : place_of_worship\nreservation : nan\nattraction : nan\nhighchair : nan\nparking : nan\nswimming_pool : nan\ncontact_phone : nan\ncommunity_centre : nan\naddr_street : nan\ncontact_twitter : nan\nsocial_facility : nan\ncontact_facebook : nan\nzoo : nan\nemail : nan\nwheelchair : nan\ncuisine : nan\ncontact_website : nan\ninternet_access : nan\nopening_hours_reception : nan\nguest_house : nan\naddr_city : nan\ncontact_instagram : nan\nimage : https://commons.wikimedia.org/wiki/File:Church_of_Saint_Teresa,_Krak%C3%B3w.JPG\nlocation : nan\noutdoor_seating : nan\nmuseum : nan\ntakeaway : nan\nsmoking : nan\nname : Kościół pw. Świętej Teresy od Jezusa i Świętego Jana od Krzyża;Jézusról nevezett Szent Terész és Keresztes Szent János templom\nid : 3678\n\nphone : nan\ncemetery : nan\nemergency : nan\nopening_hours : nan\nwebsite : nan\npets_allowed : nan\ngeometry : POINT (19.8494043 50.0797926)\nhistoric : no information\nwiki_summary_en : Kraków Zakliki is a railway station in Kraków on the railway line no. 118, servicing passenger trains that transport travelers from the Main Station in Kraków to John Paul II International Airport Kraków-Balice.\npostal_code : nan\ntoilets : nan\nnatural : no information\ndescription : nan\nvisiting_time : nan\nleisure : no information\ntourism : no information\npublic_transport : station\nbrand : nan\nalt_name : nan\namenity : no information\nreservation : nan\nattraction : nan\nhighchair : nan\nparking : nan\nswimming_pool : nan\ncontact_phone : nan\ncommunity_centre : nan\naddr_street : nan\ncontact_twitter : nan\nsocial_facility : nan\ncontact_facebook : nan\nzoo : nan\nemail : nan\nwheelchair : nan\ncuisine : nan\ncontact_website : nan\ninternet_access : nan\nopening_hours_reception : nan\nguest_house : nan\naddr_city : nan\ncontact_instagram : nan\nimage : nan\nlocation : nan\noutdoor_seating : nan\nmuseum : nan\ntakeaway : nan\nsmoking : nan\nname : Kraków Zakliki\nid : 7615\n\nphone : nan\ncemetery : nan\nemergency : nan\nopening_hours : nan\nwebsite : nan\npets_allowed : nan\ngeometry : POINT (19.9451864 50.0475227)\nhistoric : no information\nwiki_summary_en : The Hospital of the Order of Saint John of God – a specialized hospital in Krakow located at 11 Trynitarska Street, in Kazimierz.\npostal_code : nan\ntoilets : nan\nnatural : no information\ndescription : nan\nvisiting_time : nan\nleisure : no information\ntourism : no information\npublic_transport : nan\nbrand : nan\nalt_name : nan\namenity : hospital\nreservation : nan\nattraction : nan\nhighchair : nan\nparking : nan\nswimming_pool : nan\ncontact_phone : +48 12 3797377\ncommunity_centre : nan\naddr_street : nan\ncontact_twitter : nan\nsocial_facility : nan\ncontact_facebook : nan\nzoo : nan\nemail : nan\nwheelchair : nan\ncuisine : nan\ncontact_website : https://bonifratrzy.pl/szpital-krakow/\ninternet_access : nan\nopening_hours_reception : nan\nguest_house : nan\naddr_city : nan\ncontact_instagram : nan\nimage : nan\nlocation : nan\noutdoor_seating : nan\nmuseum : nan\ntakeaway : nan\nsmoking : nan\nname : Szpital Zakonu Bonifratrów Świętego Jana Grandego\nid : 9677\n\nphone : nan\ncemetery : nan\nemergency : yes\nopening_hours : nan\nwebsite : nan\npets_allowed : nan\ngeometry : POLYGON ((19.9379781 50.0834433, 19.9379516 50.0832949, 19.9379659 50.0832753, 19.9378701 50.082736, 19.9378499 50.0826244, 19.9377853 50.0821242, 19.9383819 50.0820649, 19.9397007 50.0819183, 19.939704 50.0820113, 19.9397414 50.0820128, 19.9397413 50.0821199, 19.9397212 50.0822262, 19.9397609 50.0825138, 19.9397199 50.0825225, 19.9396777 50.082532, 19.9397118 50.0825999, 19.9397324 50.0827605, 19.9397356 50.0827831, 19.9397769 50.083029, 19.9406198 50.082979, 19.9406597 50.0833537, 19.9403933 50.0833689, 19.9405027 50.0841288, 19.93983 50.0841739, 19.9397167 50.0835111, 19.9397134 50.0834879, 19.9397092 50.0834597, 19.9397086 50.0834519, 19.9397008 50.0833982, 19.9395748 50.0833976, 19.9395384 50.0834105, 19.9394369 50.0834278, 19.9389323 50.0834455, 19.9388965 50.0834466, 19.9388503 50.083448, 19.938839 50.0834483, 19.9380329 50.0834746, 19.9379781 50.0834433))\nhistoric : no information\nwiki_summary_en : Gabriel Narutowicz City Specialist Hospital in Kraków – a hospital in Kraków located at 35–37 Prądnicka Street.\npostal_code : nan\ntoilets : nan\nnatural : no information\ndescription : nan\nvisiting_time : nan\nleisure : no information\ntourism : no information\npublic_transport : nan\nbrand : nan\nalt_name : nan\namenity : hospital\nreservation : nan\nattraction : nan\nhighchair : nan\nparking : nan\nswimming_pool : nan\ncontact_phone : +48 12 416 2266\ncommunity_centre : nan\naddr_street : nan\ncontact_twitter : nan\nsocial_facility : nan\ncontact_facebook : nan\nzoo : nan\nemail : nan\nwheelchair : nan\ncuisine : nan\ncontact_website : http://narutowicz.krakow.pl/\ninternet_access : nan\nopening_hours_reception : nan\nguest_house : nan\naddr_city : nan\ncontact_instagram : nan\nimage : nan\nlocation : nan\noutdoor_seating : nan\nmuseum : nan\ntakeaway : nan\nsmoking : nan\nname : Szpital Miejski Specjalistyczny imienia Gabriela Narutowicza\nid : 11274\n\nphone : nan\ncemetery : nan\nemergency : yes\nopening_hours : nan\nwebsite : nan\npets_allowed : nan\ngeometry : POLYGON ((19.9136062 50.0723088, 19.9117846 50.072724, 19.9113688 50.0716984, 19.9121162 50.0716076, 19.9121767 50.0716003, 19.9132514 50.0714819, 19.9132887 50.0715004, 19.9133699 50.0717435, 19.913468 50.0720095, 19.9136062 50.0723088))\nhistoric : no information\nwiki_summary_en : Hospital of the Ministry of the Interior and Administration in Krakow - the basic organizational unit of the Health Care Facility MSWiA in Krakow.\npostal_code : nan\ntoilets : nan\nnatural : no information\ndescription : nan\nvisiting_time : nan\nleisure : no information\ntourism : no information\npublic_transport : nan\nbrand : nan\nalt_name : nan\namenity : hospital\nreservation : nan\nattraction : nan\nhighchair : nan\nparking : nan\nswimming_pool : nan\ncontact_phone : nan\ncommunity_centre : nan\naddr_street : nan\ncontact_twitter : nan\nsocial_facility : nan\ncontact_facebook : nan\nzoo : nan\nemail : nan\nwheelchair : nan\ncuisine : nan\ncontact_website : nan\ninternet_access : nan\nopening_hours_reception : nan\nguest_house : nan\naddr_city : nan\ncontact_instagram : nan\nimage : nan\nlocation : nan\noutdoor_seating : nan\nmuseum : nan\ntakeaway : nan\nsmoking : nan\nname : Samodzielny Publiczny Zakład Opieki Zdrowotnej MSW;Samodzielny Publiczny Zakład Opieki Zdrowotnej MSW w Krakowie;SPZOZ MSW\nid : 11326\n\nphone : nan\ncemetery : nan\nemergency : nan\nopening_hours : nan\nwebsite : nan\npets_allowed : nan\ngeometry : POINT (19.9326692 50.0905443)\nhistoric : no information\nwiki_summary_en : no information\npostal_code : nan\ntoilets : nan\nnatural : no information\ndescription : nan\nvisiting_time : nan\nleisure : no information\ntourism : no information\npublic_transport : nan\nbrand : nan\nalt_name : nan\namenity : clinic\nreservation : nan\nattraction : nan\nhighchair : nan\nparking : nan\nswimming_pool : nan\ncontact_phone : nan\ncommunity_centre : nan\naddr_street : nan\ncontact_twitter : nan\nsocial_facility : nan\ncontact_facebook : nan\nzoo : nan\nemail : nan\nwheelchair : nan\ncuisine : nan\ncontact_website : nan\ninternet_access : nan\nopening_hours_reception : nan\nguest_house : nan\naddr_city : nan\ncontact_instagram : nan\nimage : nan\nlocation : nan\noutdoor_seating : nan\nmuseum : nan\ntakeaway : nan\nsmoking : nan\nname : Oddział Rehabilitacji Kardiologicznej\nid : 10951\n\nphone : nan\ncemetery : nan\nemergency : nan\nopening_hours : nan\nwebsite : nan\npets_allowed : nan\ngeometry : POINT (19.9364754 50.0908617)\nhistoric : no information\nwiki_summary_en : no information\npostal_code : nan\ntoilets : nan\nnatural : no information\ndescription : nan\nvisiting_time : nan\nleisure : no information\ntourism : no information\npublic_transport : nan\nbrand : nan\nalt_name : nan\namenity : clinic\nreservation : nan\nattraction : nan\nhighchair : nan\nparking : nan\nswimming_pool : nan\ncontact_phone : nan\ncommunity_centre : nan\naddr_street : nan\ncontact_twitter : nan\nsocial_facility : nan\ncontact_facebook : nan\nzoo : nan\nemail : nan\nwheelchair : nan\ncuisine : nan\ncontact_website : nan\ninternet_access : nan\nopening_hours_reception : nan\nguest_house : nan\naddr_city : nan\ncontact_instagram : nan\nimage : nan\nlocation : nan\noutdoor_seating : nan\nmuseum : nan\ntakeaway : nan\nsmoking : nan\nname : Oddział Szybkiej Diagnostyki\nid : 10940\n\n",
  "answer": "I don't have enough information to answer that.",
  "labels": {
    "faithfulness": "NON_FAITHFUL",
    "groundedness": "NON_GROUNDED",
    "relevance": "RELEVANT",
    "completeness": "NON_COMPLETE",
    "coherence": "COHERENT",
    "conciseness": "CONCISE"
  },
  "quality_score": 3
}