{
  "model": "gemini_llm",
  "prompt": "prompt_B",
  "id": 3317,
  "question": "Are there any specific guidelines or facilities for visitors with disabilities at the Geological Museum?",
  "context": "phone : nan\ncemetery : nan\nemergency : nan\nopening_hours : Tu-Su 11:00-19:00\nwebsite : https://bunkier.art.pl/\npets_allowed : nan\ngeometry : POINT (19.9344469 50.0635805)\nhistoric : no information\nwiki_summary_en : Gallery of Contemporary Art \"Bunkier Sztuki\" – an art gallery in Kraków located at plac Szczepański 3a, in the Old Town by the Planty park. Established in 1965, it is considered one of the most important Polish institutions presenting contemporary art. It is an artistically independent cultural institution, funded by the City of Kraków.\npostal_code : nan\ntoilets : nan\nnatural : no information\ndescription : nan\nvisiting_time : nan\nleisure : no information\ntourism : museum\npublic_transport : nan\nbrand : nan\nalt_name : nan\namenity : no information\nreservation : nan\nattraction : nan\nhighchair : nan\nparking : nan\nswimming_pool : nan\ncontact_phone : nan\ncommunity_centre : nan\naddr_street : Plac Szczepański\ncontact_twitter : nan\nsocial_facility : nan\ncontact_facebook : nan\nzoo : nan\nemail : nan\nwheelchair : nan\ncuisine : nan\ncontact_website : nan\ninternet_access : nan\nopening_hours_reception : nan\nguest_house : nan\naddr_city : Kraków\ncontact_instagram : nan\nimage : nan\nlocation : nan\noutdoor_seating : nan\nmuseum : nan\ntakeaway : nan\nsmoking : nan\nname : Bunkier Sztuki;Művészetek Bunkere\nid : 2417\n\nphone : nan\ncemetery : nan\nemergency : nan\nopening_hours : nan\nwebsite : https://ib.uj.edu.pl/instytut/muzeum\npets_allowed : nan\ngeometry : POINT (19.9573898 50.0644028)\nhistoric : no information\nwiki_summary_en : The Paleobotanical Museum of the Jagiellonian University – a museum operating from 2003 to 2017 in the building of the Botanical Institute of the Jagiellonian University at 31 Kopernika Street in Krakow. The exhibition included, among other things, imprints and casts in rock material collected by Marian Raciborski and Franciszek Tonder. It was organized by Dr. hab. Danuta Zdebska and was mainly available to students and pupils. It was closed down for various reasons, including space issues. At least part of the collection was transferred to the Nature Education Center operating at the 600th Anniversary Renewal Campus of the Jagiellonian University.\npostal_code : nan\ntoilets : nan\nnatural : no information\ndescription : nan\nvisiting_time : nan\nleisure : no information\ntourism : museum\npublic_transport : nan\nbrand : nan\nalt_name : nan\namenity : no information\nreservation : nan\nattraction : nan\nhighchair : nan\nparking : nan\nswimming_pool : nan\ncontact_phone : nan\ncommunity_centre : nan\naddr_street : nan\ncontact_twitter : nan\nsocial_facility : nan\ncontact_facebook : nan\nzoo : nan\nemail : nan\nwheelchair : nan\ncuisine : nan\ncontact_website : nan\ninternet_access : nan\nopening_hours_reception : nan\nguest_house : nan\naddr_city : nan\ncontact_instagram : nan\nimage : nan\nlocation : nan\noutdoor_seating : nan\nmuseum : nan\ntakeaway : nan\nsmoking : nan\nname : Muzeum Paleobotaniczne UJ;Muzeum Paleobotaniczne Instytutu Botaniki Uniwersytetu Jagiellońskiego;Jagelló Egyetem Ősnövénytani Múzeuma\nid : 2695\n\nphone : +48 606 510 084\ncemetery : nan\nemergency : nan\nopening_hours : nan\nwebsite : http://www.geol.agh.edu.pl/~muzeum/index.php\npets_allowed : nan\ngeometry : POINT (19.9231397 50.0641425)\nhistoric : no information\nwiki_summary_en : The Geological Museum of the AGH University of Science and Technology in Krakow – a geological museum operating as part of the Faculty of Geology, Geophysics and Environmental Protection of the AGH University of Science and Technology.\npostal_code : nan\ntoilets : nan\nnatural : no information\ndescription : nan\nvisiting_time : nan\nleisure : no information\ntourism : museum\npublic_transport : nan\nbrand : nan\nalt_name : nan\namenity : no information\nreservation : nan\nattraction : nan\nhighchair : nan\nparking : nan\nswimming_pool : nan\ncontact_phone : nan\ncommunity_centre : nan\naddr_street : Aleja Adama Mickiewicza\ncontact_twitter : nan\nsocial_facility : nan\ncontact_facebook : nan\nzoo : nan\nemail : nan\nwheelchair : nan\ncuisine : nan\ncontact_website : nan\ninternet_access : nan\nopening_hours_reception : nan\nguest_house : nan\naddr_city : Kraków\ncontact_instagram : nan\nimage : nan\nlocation : nan\noutdoor_seating : nan\nmuseum : nan\ntakeaway : nan\nsmoking : nan\nname : Muzeum Geologiczne WGGiOŚ AGH;Földtani Múzeum (Műszaki Egyetem, Geológiai Kar)\nid : 2711\n\nphone : nan\ncemetery : nan\nemergency : nan\nopening_hours : Th-Fr 10:00-15:00; Sa 10:00-14:00\nwebsite : https://www.ing.pan.pl/muzeum/muzeum-geologiczne-ing-pan\npets_allowed : nan\ngeometry : POINT (19.9366798 50.0575584)\nhistoric : no information\nwiki_summary_en : Muzeum Geologiczne Instytutu Nauk Geologicznych PAN w Krakowie is a museum in Kraków, Poland. The collection dates back to 1865.\npostal_code : nan\ntoilets : nan\nnatural : no information\ndescription : nan\nvisiting_time : nan\nleisure : no information\ntourism : museum\npublic_transport : nan\nbrand : nan\nalt_name : nan\namenity : no information\nreservation : nan\nattraction : nan\nhighchair : nan\nparking : nan\nswimming_pool : nan\ncontact_phone : nan\ncommunity_centre : nan\naddr_street : nan\ncontact_twitter : nan\nsocial_facility : nan\ncontact_facebook : nan\nzoo : nan\nemail : nan\nwheelchair : nan\ncuisine : nan\ncontact_website : nan\ninternet_access : nan\nopening_hours_reception : nan\nguest_house : nan\naddr_city : nan\ncontact_instagram : nan\nimage : nan\nlocation : nan\noutdoor_seating : nan\nmuseum : nan\ntakeaway : nan\nsmoking : nan\nname : Muzeum Geologiczne PAN;Geological Museum;Muzeum Geologiczne ING PAN;Geologisches Museum;Lengyel Tudományos Akadémia Földtani Múzeuma\nid : 3317\n\nphone : nan\ncemetery : nan\nemergency : nan\nopening_hours : Mo-Fr 08:00-16:00\nwebsite : https://dworek.eu/\npets_allowed : nan\ngeometry : POLYGON ((19.9406886 50.0928475, 19.9407847 50.0929495, 19.9410392 50.0928509, 19.9411519 50.0928072, 19.9411251 50.0927787, 19.9411201 50.0927734, 19.9410568 50.0927062, 19.9409401 50.0927514, 19.9409062 50.0927154, 19.9408476 50.0927381, 19.9407875 50.0927614, 19.9408204 50.0927964, 19.9406886 50.0928475))\nhistoric : no information\nwiki_summary_en : The Cultural Center “Dworek Białoprądnicki” - a cultural center located in a historic manor house in Kraków on Biały Prądnik, surrounded by the Tadeusz Kościuszko Park.\npostal_code : nan\ntoilets : nan\nnatural : no information\ndescription : nan\nvisiting_time : nan\nleisure : no information\ntourism : attraction\npublic_transport : nan\nbrand : nan\nalt_name : nan\namenity : no information\nreservation : nan\nattraction : nan\nhighchair : nan\nparking : nan\nswimming_pool : nan\ncontact_phone : nan\ncommunity_centre : nan\naddr_street : Papiernicza\ncontact_twitter : nan\nsocial_facility : nan\ncontact_facebook : nan\nzoo : nan\nemail : nan\nwheelchair : nan\ncuisine : nan\ncontact_website : nan\ninternet_access : nan\nopening_hours_reception : nan\nguest_house : nan\naddr_city : Kraków\ncontact_instagram : nan\nimage : nan\nlocation : nan\noutdoor_seating : nan\nmuseum : nan\ntakeaway : nan\nsmoking : nan\nname : Dworek Białoprądnicki\nid : 3456\n\nphone : nan\ncemetery : nan\nemergency : nan\nopening_hours : nan\nwebsite : nan\npets_allowed : nan\ngeometry : POLYGON ((19.9920443 49.9948323, 19.9920239 49.9948523, 19.9919712 49.9948286, 19.9919906 49.9948095, 19.9918014 49.9947269, 19.9917981 49.9947298, 19.9916796 49.994678, 19.9917668 49.9945711, 19.9924046 49.9948483, 19.9924023 49.9948789, 19.9924268 49.9949105, 19.9924463 49.9949224, 19.992454 49.9949327, 19.9924059 49.9949856, 19.9923786 49.994983, 19.9922277 49.9949168, 19.9922307 49.9949136, 19.9920443 49.9948323))\nhistoric : fort\nwiki_summary_en : Fort 50 ½ O Kosocice – one of the forts of the Kraków Fortress. It was built between 1897 and 1899. In 1945, it was stripped of its towers – both armored and observation. It belonged to the VII fortified area. The object was designed by Emil Gołogórski. \n\nIt defended the railway line to Przemyśl and the Lwów Route. In December 1914, the fort, along with the neighboring forts 50 \"Prokocim\" and 51 \"Rajsko,\" held back the main force of the Russian assault on Kraków. The fort is in good condition and is occasionally open to visitors. It is part of the Kraków Fortress Museum. The object is located at J. Hallera Street in Kraków.\npostal_code : nan\ntoilets : nan\nnatural : no information\ndescription : nan\nvisiting_time : nan\nleisure : no information\ntourism : attraction\npublic_transport : nan\nbrand : nan\nalt_name : Fort 50½ O \"Barycz\"\namenity : no information\nreservation : nan\nattraction : nan\nhighchair : nan\nparking : nan\nswimming_pool : nan\ncontact_phone : nan\ncommunity_centre : nan\naddr_street : nan\ncontact_twitter : nan\nsocial_facility : nan\ncontact_facebook : nan\nzoo : nan\nemail : nan\nwheelchair : nan\ncuisine : nan\ncontact_website : nan\ninternet_access : nan\nopening_hours_reception : nan\nguest_house : nan\naddr_city : nan\ncontact_instagram : nan\nimage : nan\nlocation : nan\noutdoor_seating : nan\nmuseum : nan\ntakeaway : nan\nsmoking : nan\nname : Fort 50½ O \"Kosocice\";Fort 50½ O \"Barycz\"\nid : 3631\n\nphone : +48 12 370 54 60\ncemetery : nan\nemergency : nan\nopening_hours : Tu-Su 10:00-18:00\nwebsite : https://mnk.pl/oddzial/mnk-muzeum-czartoryskich\npets_allowed : nan\ngeometry : POLYGON ((19.9397205 50.0645331, 19.9397143 50.0645349, 19.9397189 50.0645406, 19.939721 50.0645399, 19.9397372 50.0645591, 19.9397349 50.0645599, 19.9397394 50.0645655, 19.9397418 50.0645647, 19.9397578 50.064584, 19.9397556 50.0645849, 19.9397603 50.0645901, 19.9397628 50.0645893, 19.9397785 50.0646093, 19.9397761 50.0646102, 19.9397808 50.0646153, 19.939786 50.0646139, 19.9397893 50.0646179, 19.9397921 50.0646172, 19.9398284 50.064662, 19.9398258 50.0646624, 19.9398298 50.0646683, 19.9398336 50.0646673, 19.9398414 50.064682, 19.9398492 50.0646966, 19.9398461 50.0646975, 19.9398493 50.0647037, 19.9398536 50.0647027, 19.9398662 50.0647271, 19.9398629 50.0647283, 19.9398658 50.0647336, 19.93987 50.0647335, 19.9398718 50.0647371, 19.9398783 50.0647378, 19.9398778 50.0647403, 19.9398876 50.064741, 19.9398883 50.0647384, 19.9399371 50.064742, 19.9399367 50.0647444, 19.9399459 50.0647451, 19.9399464 50.0647428, 19.9400504 50.0647498, 19.9400506 50.0647522, 19.9400603 50.0647531, 19.9400615 50.0647505, 19.9401655 50.0647585, 19.9401657 50.064761, 19.940175 50.0647614, 19.9401754 50.0647589, 19.9402043 50.0647611, 19.9402333 50.0647634, 19.9402336 50.0647659, 19.9402428 50.0647663, 19.9402431 50.0647638, 19.9403035 50.0647686, 19.9403139 50.0648357, 19.9402651 50.0648327, 19.9402655 50.0648304, 19.9402558 50.0648298, 19.940255 50.0648326, 19.9401351 50.0648254, 19.9401353 50.0648231, 19.9401255 50.0648231, 19.9401247 50.064826, 19.9400759 50.0648274, 19.9400756 50.064825, 19.9400658 50.0648253, 19.9400656 50.0648281, 19.9399825 50.0648355, 19.9400913 50.0650582, 19.9403091 50.0650132, 19.9403114 50.0650176, 19.9403173 50.0650306, 19.9403232 50.0650435, 19.9403252 50.0650472, 19.9401942 50.0650734, 19.9401794 50.0650744, 19.9401675 50.0650768, 19.940168 50.0650777, 19.9400925 50.0650928, 19.9400929 50.0650937, 19.9400487 50.0651025, 19.940046 50.0650967, 19.9400064 50.0651041, 19.9400092 50.0651108, 19.9400018 50.0651122, 19.9399988 50.0651052, 19.9399661 50.0651112, 19.9399669 50.065113, 19.9399685 50.0651168, 19.939957 50.0651188, 19.9399443 50.065121, 19.9399475 50.0651286, 19.9399323 50.0651312, 19.9399387 50.0651465, 19.9399434 50.065146, 19.9399647 50.0651967, 19.939972 50.0651957, 19.9399937 50.0652486, 19.940746 50.0651072, 19.9407084 50.0650228, 19.940697 50.0649973, 19.9406938 50.0649763, 19.94069 50.0649685, 19.940653 50.0649761, 19.9406558 50.0649819, 19.9406384 50.0649861, 19.9406209 50.0649902, 19.9406172 50.0649837, 19.9405667 50.0649943, 19.9405685 50.0649986, 19.9403788 50.0650366, 19.9403768 50.0650327, 19.9403706 50.0650197, 19.9403644 50.0650066, 19.9403627 50.0650018, 19.9404149 50.0649921, 19.940413 50.0649873, 19.9404172 50.0649871, 19.9404162 50.0649809, 19.9404123 50.0649812, 19.9404041 50.0649423, 19.940408 50.0649424, 19.9404077 50.0649361, 19.9404037 50.0649363, 19.9403998 50.0649166, 19.9403959 50.0648969, 19.9404 50.0648971, 19.9403992 50.0648904, 19.9403954 50.0648903, 19.9403866 50.0648495, 19.9403908 50.0648493, 19.9403898 50.0648427, 19.940385 50.0648424, 19.9403857 50.0648395, 19.940381 50.0648391, 19.9403815 50.0648376, 19.9403716 50.0648365, 19.9403656 50.0647735, 19.9403689 50.0647738, 19.9403597 50.064687, 19.9403436 50.064647, 19.9403248 50.0645912, 19.9402904 50.0645206, 19.9402606 50.0644774, 19.9402657 50.0644758, 19.9402399 50.0644394, 19.9402656 50.0644307, 19.9402262 50.0643787, 19.9399875 50.0644543, 19.9397205 50.0645331))\nhistoric : no information\nwiki_summary_en : The Princes Czartoryski Museum (Polish: Muzeum Książąt Czartoryskich [muˈzɛ.um ˈkɕɔ̃ʐɔnt t͡ʂartɔˈrɨskʲix]) – often abbreviated to Czartoryski Museum – is a historic museum in Kraków, Poland, and one of the country's oldest museums. The initial collection was formed in 1796 in Puławy by Princess Izabela Czartoryska. The Museum officially opened in 1878. It is now a division of the National Museum in Kraków.\nThe Puławy collection was partly destroyed after the November 1830 Uprising and the confiscation of the Czartoryski properties. Most of the Museum holdings, however, were saved and moved to Paris, where they reposed at the Hôtel Lambert. In 1870 Prince Władysław Czartoryski decided to move the collections to Kraków, where they arrived in 1876.\nThe most renowned painting at the Museum is one of Leonardo da Vinci's best-known works, the Lady with an Ermine. Other highlights include two works by Rembrandt; several antiquities, including sculptures; Renaissance tapestries and decorative arts; and paintings by Hans Holbein the Younger, Jacob Jordaens, Luca Giordano, Pieter Brueghel the Younger, Dieric Bouts, Joos van Cleve, Lorenzo Lotto, Lucas Cranach the Younger, Lorenzo Monaco, Andrea Mantegna, Alessandro Magnasco, and the Master of the Female Half-Lengths.\nThe Museum's main facility closed for restoration in 2010 and reopened in December 2019. During this time, parts of the collection were displayed at other venues.\npostal_code : nan\ntoilets : nan\nnatural : no information\ndescription : nan\nvisiting_time : nan\nleisure : no information\ntourism : museum\npublic_transport : nan\nbrand : nan\nalt_name : nan\namenity : no information\nreservation : nan\nattraction : nan\nhighchair : nan\nparking : nan\nswimming_pool : nan\ncontact_phone : nan\ncommunity_centre : nan\naddr_street : nan\ncontact_twitter : nan\nsocial_facility : nan\ncontact_facebook : nan\nzoo : nan\nemail : nan\nwheelchair : yes\ncuisine : nan\ncontact_website : nan\ninternet_access : nan\nopening_hours_reception : nan\nguest_house : nan\naddr_city : Kraków\ncontact_instagram : nan\nimage : nan\nlocation : nan\noutdoor_seating : nan\nmuseum : nan\ntakeaway : nan\nsmoking : nan\nname : Muzeum Książąt Czartoryskich w Krakowie;Czartoryscy\nid : 6175\n\nphone : nan\ncemetery : nan\nemergency : nan\nopening_hours : nan\nwebsite : nan\npets_allowed : nan\ngeometry : POINT (19.8597855 50.0835874)\nhistoric : no information\nwiki_summary_en : Kraków Mydlniki is a railway station in the Bronowice district of Kraków, Poland, located in the neighbourhood of Mydlniki, northwest of the city centre. The station, with its historic building, lies within the Tenczynek Landscape Park (Tenczyński Park Krajobrazowy) protected area with numerous summer visitors, because the Park is also the location of a medieval Tenczyn Castle built as a seat of the powerful Tęczyński family. It fell into ruin during the Deluge in mid-17th century, after being pillaged and burned by Swedish-Brandenburgian forces looking for the Polish Crown Jewels and the rumored treasures of the Tęczyński family. Within the Landscape Park are five nature reserves.\nThe station serves the PKP rail line 95 between Katowice to the west (1), and Kraków Balice to the east (2); more specifically:\n\nPKP rail line 133 Dąbrowa Górnicza Ząbkowice - Kraków Główny, 70.7 kilometres (43.9 mi)\nPKP rail line 118 Kraków Mydlniki - Kraków Balice, 5.0 kilometres (3.1 mi).\n\n\n== References ==\npostal_code : nan\ntoilets : nan\nnatural : no information\ndescription : nan\nvisiting_time : nan\nleisure : no information\ntourism : no information\npublic_transport : station\nbrand : nan\nalt_name : nan\namenity : no information\nreservation : nan\nattraction : nan\nhighchair : nan\nparking : nan\nswimming_pool : nan\ncontact_phone : nan\ncommunity_centre : nan\naddr_street : nan\ncontact_twitter : nan\nsocial_facility : nan\ncontact_facebook : nan\nzoo : nan\nemail : nan\nwheelchair : nan\ncuisine : nan\ncontact_website : nan\ninternet_access : nan\nopening_hours_reception : nan\nguest_house : nan\naddr_city : nan\ncontact_instagram : nan\nimage : nan\nlocation : nan\noutdoor_seating : nan\nmuseum : nan\ntakeaway : nan\nsmoking : nan\nname : Kraków Mydlniki;Краків Мидлнікі;Краков Мыдлинки\nid : 6789\n\nphone : nan\ncemetery : nan\nemergency : no\nopening_hours : nan\nwebsite : https://babinski.pl/\npets_allowed : nan\ngeometry : POLYGON ((19.8824348 50.0069202, 19.8843417 50.0069935, 19.8849402 50.0070189, 19.8875083 50.0066649, 19.8880141 50.0065848, 19.8881842 50.0065535, 19.888112 50.00642, 19.8882092 50.0063876, 19.8880943 50.0061774, 19.8879824 50.0059916, 19.8879509 50.0059117, 19.8878967 50.0056645, 19.8878965 50.0054078, 19.8878045 50.0047803, 19.8876821 50.0041801, 19.8878225 50.0041695, 19.8892816 50.0040478, 19.8888912 50.002901, 19.88869 50.0024074, 19.888503 50.0022779, 19.8882204 50.0021777, 19.8875366 50.0019449, 19.8873654 50.0016748, 19.8869679 50.0005448, 19.8850666 50.0007807, 19.8849145 50.0003367, 19.8837538 50.0004836, 19.8835958 50.000323, 19.8826593 50.0004063, 19.8823982 50.0006701, 19.8804605 50.000921, 19.8800799 50.0017329, 19.8799691 50.0020356, 19.8799566 50.0021636, 19.8799464 50.0021859, 19.8799302 50.0022587, 19.8799131 50.0023427, 19.8798174 50.0025338, 19.8795507 50.0027998, 19.8793604 50.0029278, 19.8784102 50.0034635, 19.8779455 50.0038621, 19.877504 50.0044353, 19.8772183 50.004991, 19.8775537 50.0049451, 19.8776463 50.004924, 19.877824 50.0048961, 19.8781083 50.0048535, 19.8785713 50.0047858, 19.8804922 50.0044551, 19.8809256 50.0043778, 19.8813457 50.0050631, 19.881528 50.0053604, 19.881704 50.0056391, 19.8821694 50.0064276, 19.8824348 50.0069202))\nhistoric : no information\nwiki_summary_en : The Józef Babiński Clinical Hospital Independent Public Healthcare Institution in Kraków – a hospital in Kraków (in the Kobierzyn district) that specializes in the treatment and rehabilitation of patients in the fields of psychiatry, addiction, and neurology. In 1999, the hospital-park complex was entered on the list of historic monuments.\npostal_code : nan\ntoilets : nan\nnatural : no information\ndescription : nan\nvisiting_time : nan\nleisure : no information\ntourism : no information\npublic_transport : nan\nbrand : nan\nalt_name : nan\namenity : hospital\nreservation : nan\nattraction : nan\nhighchair : nan\nparking : nan\nswimming_pool : nan\ncontact_phone : nan\ncommunity_centre : nan\naddr_street : nan\ncontact_twitter : nan\nsocial_facility : nan\ncontact_facebook : nan\nzoo : nan\nemail : nan\nwheelchair : nan\ncuisine : nan\ncontact_website : nan\ninternet_access : nan\nopening_hours_reception : nan\nguest_house : nan\naddr_city : nan\ncontact_instagram : nan\nimage : nan\nlocation : nan\noutdoor_seating : nan\nmuseum : nan\ntakeaway : nan\nsmoking : nan\nname : Szpital Kliniczny im. doktora Józefa Babińskiego SP ZOZ\nid : 11288\n\nphone : nan\ncemetery : nan\nemergency : nan\nopening_hours : nan\nwebsite : nan\npets_allowed : nan\ngeometry : POINT (19.9475935 50.0564873)\nhistoric : no information\nwiki_summary_en : no information\npostal_code : nan\ntoilets : nan\nnatural : no information\ndescription : nan\nvisiting_time : nan\nleisure : no information\ntourism : hostel\npublic_transport : nan\nbrand : nan\nalt_name : nan\namenity : no information\nreservation : nan\nattraction : nan\nhighchair : nan\nparking : nan\nswimming_pool : nan\ncontact_phone : nan\ncommunity_centre : nan\naddr_street : nan\ncontact_twitter : nan\nsocial_facility : nan\ncontact_facebook : nan\nzoo : nan\nemail : nan\nwheelchair : nan\ncuisine : nan\ncontact_website : nan\ninternet_access : nan\nopening_hours_reception : nan\nguest_house : nan\naddr_city : nan\ncontact_instagram : nan\nimage : nan\nlocation : nan\noutdoor_seating : nan\nmuseum : nan\ntakeaway : nan\nsmoking : nan\nname : Art Hostel\nid : 6582\n\n",
  "answer": "I cannot find any specific information regarding guidelines or facilities for visitors with disabilities at the Geological Museum.",
  "labels": {
    "faithfulness": "FAITHFUL",
    "groundedness": "NON_GROUNDED",
    "relevance": "RELEVANT",
    "completeness": "PARTLY_COMPLETE",
    "coherence": "COHERENT",
    "conciseness": "CONCISE"
  },
  "quality_score": 4
}