{
  "model": "gemini_llm",
  "prompt": "prompt_C",
  "id": 11294,
  "question": "What can you tell me about the history and significance of the Princes Czartoryski Library in Kraków?",
  "context": "phone : nan\ncemetery : nan\nemergency : nan\nopening_hours : nan\nwebsite : http://katedra-anatomii.cm-uj.krakow.pl/o-katedrze/muzeum-katedry/\npets_allowed : nan\ngeometry : POINT (19.9459505 50.0617966)\nhistoric : no information\nwiki_summary_en : The Museum of the History of Medicine, officially known as the Museum of the Medical Faculty of Jagiellonian University Collegium Medicum – the oldest museum in Poland dedicated to medical sciences, a unit of the Medical Faculty of Jagiellonian University Collegium Medicum. It was established in 1900 at the initiative of Professor Walery Jaworski by a resolution of the Medical Faculty of UJ on April 27. The collections were largely sourced from donations from doctors and professors affiliated with UJ, such as Edward Korczyński, Adam Wrzosek (library), Józef Bogusz (library, collection of tools and instruments), as well as their families, including Ludwik Bierkowski, Tytus Chałubiński, and Adam Bochenek. Jaworski himself also donated his private collections to the museum. After the first year of operation, the museum had 1,222 items (1,769 exhibits), and by 1905 – 4,617.\n\nIn 1920, the Department of the History and Philosophy of Medicine was established, directed by Professor Władysław Szumowski, who focused on the systematization and display of the already significant collections. Converted into a Chair, it did not, however, have a permanent location, and the premises obtained in 1937 for the Chair and Museum on M. Kopernika Street 7 were unsuitable for setting up an exhibition. The secured collections there survived the occupation in an undamaged state. Between 1951 and 1956, the Chair was transformed into the Department of Health Organization, which saved the collections during a time when all departments of the history of medicine were being dissolved. The re-establishment of the Chair did not solve the space problem – it was not until 1990 that premises in the House of the Medical Society at 4 Radziwiłłowska Street were allocated for the Museum. The new headquarters were officially opened on June 16, 1992, by the then rector of CM UJ, Professor Andrzej Szczeklik. \n\nThe museum's collections include, among other things, incunabula, documents, manuscripts, commemorative medals, medical instruments, and portraits. An important part of the collection is a large set of surgical instruments and a collection of plaster casts from Professor Bierkowski's anatomic-pathological office, as well as a collection of the history of diseases from the clinic of Professor Maciej Józef Brodowicz. \n\nVisiting the museum is possible by prior arrangement of the date.\npostal_code : nan\ntoilets : nan\nnatural : no information\ndescription : nan\nvisiting_time : nan\nleisure : no information\ntourism : museum\npublic_transport : nan\nbrand : nan\nalt_name : nan\namenity : no information\nreservation : nan\nattraction : nan\nhighchair : nan\nparking : nan\nswimming_pool : nan\ncontact_phone : nan\ncommunity_centre : nan\naddr_street : nan\ncontact_twitter : nan\nsocial_facility : nan\ncontact_facebook : nan\nzoo : nan\nemail : mburbani@cyf-kr.edu.pl\nwheelchair : nan\ncuisine : nan\ncontact_website : nan\ninternet_access : nan\nopening_hours_reception : nan\nguest_house : nan\naddr_city : nan\ncontact_instagram : nan\nimage : nan\nlocation : nan\noutdoor_seating : nan\nmuseum : nan\ntakeaway : nan\nsmoking : nan\nname : Muzeum Anatomii;Museum of Anatomy;Muzeum Katedry Anatomii Uniwersytetu Jagiellońskiego Collegium Medicum;Orvoslástörténeti Múzeum\nid : 2845\n\nphone : nan\ncemetery : nan\nemergency : nan\nopening_hours : nan\nwebsite : nan\npets_allowed : nan\ngeometry : POLYGON ((19.9407084 50.0650228, 19.940746 50.0651072, 19.9399937 50.0652486, 19.939972 50.0651957, 19.9399647 50.0651967, 19.9399434 50.065146, 19.9399387 50.0651465, 19.9399323 50.0651312, 19.9399475 50.0651286, 19.9399443 50.065121, 19.939957 50.0651188, 19.9399685 50.0651168, 19.9399669 50.065113, 19.9399661 50.0651112, 19.9399988 50.0651052, 19.9400018 50.0651122, 19.9400092 50.0651108, 19.9400064 50.0651041, 19.940046 50.0650967, 19.9400487 50.0651025, 19.9400929 50.0650937, 19.9400925 50.0650928, 19.940168 50.0650777, 19.9401675 50.0650768, 19.9401794 50.0650744, 19.9401942 50.0650734, 19.9403252 50.0650472, 19.9403232 50.0650435, 19.9403768 50.0650327, 19.9403788 50.0650366, 19.9405685 50.0649986, 19.940589 50.0650423, 19.9406059 50.0650559, 19.9406298 50.0650638, 19.9406628 50.0650638, 19.9406939 50.0650516, 19.9407068 50.0650376, 19.9407084 50.0650228))\nhistoric : castle\nwiki_summary_en : City Arsenal – a historic building intended for storing weapons and gunpowder, located on Pijarska Street in the Old Town of Kraków. By the end of the 19th century, it was designated as the Museum of the Princes Czartoryski.\npostal_code : nan\ntoilets : nan\nnatural : no information\ndescription : nan\nvisiting_time : nan\nleisure : no information\ntourism : no information\npublic_transport : nan\nbrand : nan\nalt_name : nan\namenity : no information\nreservation : nan\nattraction : nan\nhighchair : nan\nparking : nan\nswimming_pool : nan\ncontact_phone : nan\ncommunity_centre : nan\naddr_street : nan\ncontact_twitter : nan\nsocial_facility : nan\ncontact_facebook : nan\nzoo : nan\nemail : nan\nwheelchair : nan\ncuisine : nan\ncontact_website : nan\ninternet_access : nan\nopening_hours_reception : nan\nguest_house : nan\naddr_city : nan\ncontact_instagram : nan\nimage : nan\nlocation : nan\noutdoor_seating : nan\nmuseum : nan\ntakeaway : nan\nsmoking : nan\nname : Arsenał Miejski;Arsenal;Városi Fegyvertár\nid : 3567\n\nphone : nan\ncemetery : nan\nemergency : nan\nopening_hours : nan\nwebsite : nan\npets_allowed : nan\ngeometry : POLYGON ((19.956023 50.0638095, 19.9558394 50.0637331, 19.9556558 50.0636567, 19.9557022 50.06361, 19.9557307 50.0636213, 19.9557754 50.0635753, 19.9557746 50.0635705, 19.955775 50.0635624, 19.9557794 50.0635547, 19.9557889 50.0635481, 19.9558036 50.0635455, 19.9558103 50.0635391, 19.9558377 50.0635515, 19.9558414 50.0635478, 19.9559687 50.0636006, 19.9560959 50.0636534, 19.9560891 50.06366, 19.9562267 50.0637167, 19.9562134 50.0637309, 19.9561953 50.0637498, 19.9561871 50.0637585, 19.9561725 50.0637739, 19.9561174 50.063751, 19.9560909 50.0637402, 19.956023 50.0638095))\nhistoric : castle\nwiki_summary_en : Collegium Śniadeckiego – a historic building of the Jagiellonian University located in Krakow, in the II Grzegórzki district at 27 Kopernik Street, in Wesoła. The college is named after the mathematician and astronomer Jan Śniadecki, who worked at the UJ during the period of the great reform by Kołłątaj. The building has a long history. As early as the 16th century, there was a Renaissance garden in this location, on the grounds of which a palace was built around 1600. Later, it came into the possession of the Czartoryski princes, who created their suburban residence (villa suburbana) here. In 1752, they sold it to the Jesuits, who carried out renovations for their college. After the dissolution of the order, the palace along with the garden passed into the ownership of the Krakow Academy. The palace was remodeled between 1788 and 1792 according to the design of Stanisław Zawadzki. An astronomical observatory was organized here at the inspiration of Śniadecki, and in 1783 a botanical garden was created around the building, where the then chemist and botanist Jan Dominik Jaśkiewicz worked. In the 1960s, the astronomical observatory was moved to Fort 38 \"Skała.\" Currently, the college houses the UJ Institute of Botany, the Botanical Garden Museum, as well as the facilities of the Copernicus Center for Interdisciplinary Research. Next to the building is the entrance to the Botanical Garden. On September 29, 1947, the building was entered into the heritage register. It is also included in the municipal register of monuments.\npostal_code : nan\ntoilets : nan\nnatural : no information\ndescription : nan\nvisiting_time : nan\nleisure : no information\ntourism : no information\npublic_transport : nan\nbrand : nan\nalt_name : nan\namenity : no information\nreservation : nan\nattraction : nan\nhighchair : nan\nparking : nan\nswimming_pool : nan\ncontact_phone : nan\ncommunity_centre : nan\naddr_street : Mikołaja Kopernika\ncontact_twitter : nan\nsocial_facility : nan\ncontact_facebook : nan\nzoo : nan\nemail : nan\nwheelchair : nan\ncuisine : nan\ncontact_website : nan\ninternet_access : nan\nopening_hours_reception : nan\nguest_house : nan\naddr_city : Kraków\ncontact_instagram : nan\nimage : nan\nlocation : nan\noutdoor_seating : nan\nmuseum : nan\ntakeaway : nan\nsmoking : nan\nname : Collegium Śniadeckiego;Botanic Garden Museum;Obserwatorium Astronomiczne UJ;http://www.ogrod.uj.edu.pl/english\nid : 3781\n\nphone : +48 12 370 54 60\ncemetery : nan\nemergency : nan\nopening_hours : Tu-Su 10:00-18:00\nwebsite : https://mnk.pl/oddzial/mnk-muzeum-czartoryskich\npets_allowed : nan\ngeometry : POLYGON ((19.9397205 50.0645331, 19.9397143 50.0645349, 19.9397189 50.0645406, 19.939721 50.0645399, 19.9397372 50.0645591, 19.9397349 50.0645599, 19.9397394 50.0645655, 19.9397418 50.0645647, 19.9397578 50.064584, 19.9397556 50.0645849, 19.9397603 50.0645901, 19.9397628 50.0645893, 19.9397785 50.0646093, 19.9397761 50.0646102, 19.9397808 50.0646153, 19.939786 50.0646139, 19.9397893 50.0646179, 19.9397921 50.0646172, 19.9398284 50.064662, 19.9398258 50.0646624, 19.9398298 50.0646683, 19.9398336 50.0646673, 19.9398414 50.064682, 19.9398492 50.0646966, 19.9398461 50.0646975, 19.9398493 50.0647037, 19.9398536 50.0647027, 19.9398662 50.0647271, 19.9398629 50.0647283, 19.9398658 50.0647336, 19.93987 50.0647335, 19.9398718 50.0647371, 19.9398783 50.0647378, 19.9398778 50.0647403, 19.9398876 50.064741, 19.9398883 50.0647384, 19.9399371 50.064742, 19.9399367 50.0647444, 19.9399459 50.0647451, 19.9399464 50.0647428, 19.9400504 50.0647498, 19.9400506 50.0647522, 19.9400603 50.0647531, 19.9400615 50.0647505, 19.9401655 50.0647585, 19.9401657 50.064761, 19.940175 50.0647614, 19.9401754 50.0647589, 19.9402043 50.0647611, 19.9402333 50.0647634, 19.9402336 50.0647659, 19.9402428 50.0647663, 19.9402431 50.0647638, 19.9403035 50.0647686, 19.9403139 50.0648357, 19.9402651 50.0648327, 19.9402655 50.0648304, 19.9402558 50.0648298, 19.940255 50.0648326, 19.9401351 50.0648254, 19.9401353 50.0648231, 19.9401255 50.0648231, 19.9401247 50.064826, 19.9400759 50.0648274, 19.9400756 50.064825, 19.9400658 50.0648253, 19.9400656 50.0648281, 19.9399825 50.0648355, 19.9400913 50.0650582, 19.9403091 50.0650132, 19.9403114 50.0650176, 19.9403173 50.0650306, 19.9403232 50.0650435, 19.9403252 50.0650472, 19.9401942 50.0650734, 19.9401794 50.0650744, 19.9401675 50.0650768, 19.940168 50.0650777, 19.9400925 50.0650928, 19.9400929 50.0650937, 19.9400487 50.0651025, 19.940046 50.0650967, 19.9400064 50.0651041, 19.9400092 50.0651108, 19.9400018 50.0651122, 19.9399988 50.0651052, 19.9399661 50.0651112, 19.9399669 50.065113, 19.9399685 50.0651168, 19.939957 50.0651188, 19.9399443 50.065121, 19.9399475 50.0651286, 19.9399323 50.0651312, 19.9399387 50.0651465, 19.9399434 50.065146, 19.9399647 50.0651967, 19.939972 50.0651957, 19.9399937 50.0652486, 19.940746 50.0651072, 19.9407084 50.0650228, 19.940697 50.0649973, 19.9406938 50.0649763, 19.94069 50.0649685, 19.940653 50.0649761, 19.9406558 50.0649819, 19.9406384 50.0649861, 19.9406209 50.0649902, 19.9406172 50.0649837, 19.9405667 50.0649943, 19.9405685 50.0649986, 19.9403788 50.0650366, 19.9403768 50.0650327, 19.9403706 50.0650197, 19.9403644 50.0650066, 19.9403627 50.0650018, 19.9404149 50.0649921, 19.940413 50.0649873, 19.9404172 50.0649871, 19.9404162 50.0649809, 19.9404123 50.0649812, 19.9404041 50.0649423, 19.940408 50.0649424, 19.9404077 50.0649361, 19.9404037 50.0649363, 19.9403998 50.0649166, 19.9403959 50.0648969, 19.9404 50.0648971, 19.9403992 50.0648904, 19.9403954 50.0648903, 19.9403866 50.0648495, 19.9403908 50.0648493, 19.9403898 50.0648427, 19.940385 50.0648424, 19.9403857 50.0648395, 19.940381 50.0648391, 19.9403815 50.0648376, 19.9403716 50.0648365, 19.9403656 50.0647735, 19.9403689 50.0647738, 19.9403597 50.064687, 19.9403436 50.064647, 19.9403248 50.0645912, 19.9402904 50.0645206, 19.9402606 50.0644774, 19.9402657 50.0644758, 19.9402399 50.0644394, 19.9402656 50.0644307, 19.9402262 50.0643787, 19.9399875 50.0644543, 19.9397205 50.0645331))\nhistoric : no information\nwiki_summary_en : The Princes Czartoryski Museum (Polish: Muzeum Książąt Czartoryskich [muˈzɛ.um ˈkɕɔ̃ʐɔnt t͡ʂartɔˈrɨskʲix]) – often abbreviated to Czartoryski Museum – is a historic museum in Kraków, Poland, and one of the country's oldest museums. The initial collection was formed in 1796 in Puławy by Princess Izabela Czartoryska. The Museum officially opened in 1878. It is now a division of the National Museum in Kraków.\nThe Puławy collection was partly destroyed after the November 1830 Uprising and the confiscation of the Czartoryski properties. Most of the Museum holdings, however, were saved and moved to Paris, where they reposed at the Hôtel Lambert. In 1870 Prince Władysław Czartoryski decided to move the collections to Kraków, where they arrived in 1876.\nThe most renowned painting at the Museum is one of Leonardo da Vinci's best-known works, the Lady with an Ermine. Other highlights include two works by Rembrandt; several antiquities, including sculptures; Renaissance tapestries and decorative arts; and paintings by Hans Holbein the Younger, Jacob Jordaens, Luca Giordano, Pieter Brueghel the Younger, Dieric Bouts, Joos van Cleve, Lorenzo Lotto, Lucas Cranach the Younger, Lorenzo Monaco, Andrea Mantegna, Alessandro Magnasco, and the Master of the Female Half-Lengths.\nThe Museum's main facility closed for restoration in 2010 and reopened in December 2019. During this time, parts of the collection were displayed at other venues.\npostal_code : nan\ntoilets : nan\nnatural : no information\ndescription : nan\nvisiting_time : nan\nleisure : no information\ntourism : museum\npublic_transport : nan\nbrand : nan\nalt_name : nan\namenity : no information\nreservation : nan\nattraction : nan\nhighchair : nan\nparking : nan\nswimming_pool : nan\ncontact_phone : nan\ncommunity_centre : nan\naddr_street : nan\ncontact_twitter : nan\nsocial_facility : nan\ncontact_facebook : nan\nzoo : nan\nemail : nan\nwheelchair : yes\ncuisine : nan\ncontact_website : nan\ninternet_access : nan\nopening_hours_reception : nan\nguest_house : nan\naddr_city : Kraków\ncontact_instagram : nan\nimage : nan\nlocation : nan\noutdoor_seating : nan\nmuseum : nan\ntakeaway : nan\nsmoking : nan\nname : Muzeum Książąt Czartoryskich w Krakowie;Czartoryscy\nid : 6175\n\nphone : nan\ncemetery : nan\nemergency : nan\nopening_hours : nan\nwebsite : nan\npets_allowed : nan\ngeometry : POINT (20.0298488 50.0214997)\nhistoric : no information\nwiki_summary_en : Kraków Bieżanów – a key railway station in Kraków, in the XII district Bieżanów-Prokocim, in Bieżanów.\npostal_code : nan\ntoilets : nan\nnatural : no information\ndescription : nan\nvisiting_time : nan\nleisure : no information\ntourism : no information\npublic_transport : station\nbrand : nan\nalt_name : nan\namenity : no information\nreservation : nan\nattraction : nan\nhighchair : nan\nparking : nan\nswimming_pool : nan\ncontact_phone : nan\ncommunity_centre : nan\naddr_street : nan\ncontact_twitter : nan\nsocial_facility : nan\ncontact_facebook : nan\nzoo : nan\nemail : nan\nwheelchair : nan\ncuisine : nan\ncontact_website : nan\ninternet_access : nan\nopening_hours_reception : nan\nguest_house : nan\naddr_city : nan\ncontact_instagram : nan\nimage : nan\nlocation : nan\noutdoor_seating : nan\nmuseum : nan\ntakeaway : nan\nsmoking : nan\nname : Kraków Bieżanów;Краків Бежанув;Краков Бежанув\nid : 6947\n\nphone : nan\ncemetery : nan\nemergency : nan\nopening_hours : Mo-Sa 08:00-19:00; Su 08:00-14:00\nwebsite : nan\npets_allowed : nan\ngeometry : POLYGON ((19.9309538 50.0652501, 19.9308976 50.0652424, 19.930888 50.0652411, 19.9308683 50.0652384, 19.9308618 50.0652373, 19.9308589 50.0652369, 19.9308392 50.065234, 19.9308205 50.0652312, 19.9307311 50.065218, 19.9307324 50.0652138, 19.9307272 50.0652131, 19.9307182 50.0652118, 19.9306826 50.0652068, 19.9306016 50.0651955, 19.9305476 50.065188, 19.9304913 50.0651801, 19.930358 50.0651615, 19.9303287 50.0652455, 19.9303269 50.0652453, 19.93012 50.0652149, 19.9301487 50.0651314, 19.930017 50.0651131, 19.929963 50.0651056, 19.9299073 50.0650979, 19.9297746 50.0650794, 19.9297737 50.0650837, 19.9296564 50.065067, 19.9296575 50.0650647, 19.9296517 50.065064, 19.929648 50.0650763, 19.9296358 50.065115, 19.9296052 50.0651362, 19.9295613 50.0651446, 19.9295186 50.065138, 19.9294849 50.0651194, 19.9294718 50.0650921, 19.9294852 50.0650528, 19.9294895 50.0650403, 19.9294843 50.0650396, 19.9294836 50.0650422, 19.9293822 50.0650268, 19.9293692 50.0650251, 19.9293707 50.0650206, 19.9292371 50.065002, 19.9291825 50.0649945, 19.9291269 50.0649867, 19.9289966 50.0649687, 19.9289686 50.0650531, 19.9287607 50.0650229, 19.928757 50.0650225, 19.9287878 50.0649388, 19.9286531 50.06492, 19.9285973 50.0649124, 19.9285417 50.0649047, 19.9284132 50.0648871, 19.928412 50.0648911, 19.9283196 50.064878, 19.9282982 50.064875, 19.9281877 50.0648593, 19.9282496 50.0646805, 19.9284699 50.0647124, 19.9284657 50.064724, 19.9294243 50.0648582, 19.9294289 50.0648455, 19.9295451 50.064862, 19.9295438 50.0648665, 19.9296322 50.0648788, 19.9297184 50.0648908, 19.9297197 50.0648868, 19.9298363 50.0649031, 19.9298327 50.0649158, 19.9307876 50.0650507, 19.9307909 50.0650396, 19.9310138 50.065072, 19.9309759 50.0651855, 19.9309707 50.0652002, 19.9309538 50.0652501))\nhistoric : no information\nwiki_summary_en : The Provincial Public Library in Krakow – the main public library of the Małopolska Voivodeship. It has the status of a cultural institution of the Małopolska Voivodeship and is financed by the local government of the voivodeship. The library's headquarters is located in a historic building of former barracks at 1 Rajska Street in Krakow.\npostal_code : nan\ntoilets : nan\nnatural : no information\ndescription : nan\nvisiting_time : nan\nleisure : no information\ntourism : no information\npublic_transport : nan\nbrand : nan\nalt_name : nan\namenity : library\nreservation : nan\nattraction : nan\nhighchair : nan\nparking : nan\nswimming_pool : nan\ncontact_phone : nan\ncommunity_centre : nan\naddr_street : Rajska\ncontact_twitter : nan\nsocial_facility : nan\ncontact_facebook : nan\nzoo : nan\nemail : biblioteka@rajska.info\nwheelchair : yes\ncuisine : nan\ncontact_website : nan\ninternet_access : wlan\nopening_hours_reception : nan\nguest_house : nan\naddr_city : Kraków\ncontact_instagram : nan\nimage : nan\nlocation : nan\noutdoor_seating : nan\nmuseum : nan\ntakeaway : nan\nsmoking : nan\nname : Wojewódzka Biblioteka Publiczna w Krakowie\nid : 11275\n\nphone : nan\ncemetery : nan\nemergency : nan\nopening_hours : nan\nwebsite : https://mnk.pl/oddzial/biblioteka-ksiazat-czartoryskich\npets_allowed : nan\ngeometry : POLYGON ((19.9394115 50.063879, 19.9393596 50.0638107, 19.9393595 50.0638104, 19.9394366 50.0637893, 19.9394214 50.0637675, 19.9394479 50.06376, 19.9397202 50.0636821, 19.9397215 50.063684, 19.9397811 50.0637739, 19.9394115 50.063879))\nhistoric : no information\nwiki_summary_en : The Princes Czartoryski Library (Polish: Biblioteka Książąt Czartoryskich) – often abbreviated to Czartoryski Library – is a branch of the National Museum in Kraków, located at 17 St Mark Street in Kraków. It is a Polish foundation library established at the initiative of Prince Adam Kazimierz Czartoryski and Izabela Czartoryska nee Fleming in the second half of the 18th century.\npostal_code : nan\ntoilets : nan\nnatural : no information\ndescription : nan\nvisiting_time : nan\nleisure : no information\ntourism : no information\npublic_transport : nan\nbrand : nan\nalt_name : nan\namenity : library\nreservation : nan\nattraction : nan\nhighchair : nan\nparking : nan\nswimming_pool : nan\ncontact_phone : nan\ncommunity_centre : nan\naddr_street : Świętego Marka\ncontact_twitter : nan\nsocial_facility : nan\ncontact_facebook : nan\nzoo : nan\nemail : nan\nwheelchair : nan\ncuisine : nan\ncontact_website : nan\ninternet_access : nan\nopening_hours_reception : nan\nguest_house : nan\naddr_city : Kraków\ncontact_instagram : nan\nimage : nan\nlocation : nan\noutdoor_seating : nan\nmuseum : nan\ntakeaway : nan\nsmoking : nan\nname : Biblioteka Książąt Czartoryskich\nid : 11294\n\n",
  "answer": "The Princes Czartoryski Library, often abbreviated as Czartoryski Library, is a branch of the National Museum in Kraków, located at 17 St Mark Street. It was established in the second half of the 18th century at the initiative of Prince Adam Kazimierz Czartoryski and Izabela Czartoryska nee Fleming.",
  "labels": {
    "faithfulness": "FAITHFUL",
    "groundedness": "GROUNDED",
    "relevance": "RELEVANT",
    "completeness": "PARTLY_COMPLETE",
    "coherence": "COHERENT",
    "conciseness": "CONCISE"
  },
  "quality_score": 5
}