{
  "model": "gemini_llm",
  "prompt": "prompt_A",
  "id": 2381,
  "question": "Can you describe the views from the top of Kościuszko Mound?",
  "context": "phone : nan\ncemetery : nan\nemergency : nan\nopening_hours : nan\nwebsite : https://kopieckosciuszki.pl/\npets_allowed : nan\ngeometry : POINT (19.8933537 50.054915)\nhistoric : monument\nwiki_summary_en : Kościuszko Mound (Polish: kopiec Kościuszki) is an artificial mound in Kraków, Poland. It was erected by Cracovians in commemoration of the Polish national leader Tadeusz Kościuszko, and modelled after Kraków's prehistoric mounds of Krak and Wanda. A serpentine path leads to the top, approximately 326 metres (1,070 ft) above sea level, with a panoramic view of the Vistula River and the city.\npostal_code : nan\ntoilets : nan\nnatural : peak\ndescription : Kopiec Kościuszki usypany w 1823 roku przez społeczeństwo polskie\nvisiting_time : nan\nleisure : no information\ntourism : no information\npublic_transport : nan\nbrand : nan\nalt_name : nan\namenity : no information\nreservation : nan\nattraction : nan\nhighchair : nan\nparking : nan\nswimming_pool : nan\ncontact_phone : nan\ncommunity_centre : nan\naddr_street : nan\ncontact_twitter : nan\nsocial_facility : nan\ncontact_facebook : nan\nzoo : nan\nemail : nan\nwheelchair : nan\ncuisine : nan\ncontact_website : nan\ninternet_access : nan\nopening_hours_reception : nan\nguest_house : nan\naddr_city : nan\ncontact_instagram : nan\nimage : nan\nlocation : nan\noutdoor_seating : nan\nmuseum : nan\ntakeaway : nan\nsmoking : nan\nname : Kopiec Kościuszki;Kościuszko Mound;Kościuszko-Hügel;Курган Костюшко\nid : 2381\n\nphone : nan\ncemetery : nan\nemergency : nan\nopening_hours : nan\nwebsite : nan\npets_allowed : nan\ngeometry : POINT (19.8471666 50.06005)\nhistoric : monument\nwiki_summary_en : Piłsudski's Mound (Polish: kopiec Piłsudskiego; also known as Independence Mound or Freedom Mound) is located in Kraków, Poland, and was established by the Polish nation in honor of Józef Piłsudski. An artificial mound, it was constructed between the years 1934 and 1937. It is located in the western part of Kraków, on the Sowiniec Heights, Kraków's VII District \"Zwierzyniec\". It is the newest and largest of Kraków's four mounds.[a]\npostal_code : nan\ntoilets : nan\nnatural : peak\ndescription : The highest point in Kraków\nvisiting_time : nan\nleisure : no information\ntourism : viewpoint\npublic_transport : nan\nbrand : nan\nalt_name : nan\namenity : no information\nreservation : nan\nattraction : nan\nhighchair : nan\nparking : nan\nswimming_pool : nan\ncontact_phone : nan\ncommunity_centre : nan\naddr_street : nan\ncontact_twitter : nan\nsocial_facility : nan\ncontact_facebook : nan\nzoo : nan\nemail : nan\nwheelchair : nan\ncuisine : nan\ncontact_website : nan\ninternet_access : nan\nopening_hours_reception : nan\nguest_house : nan\naddr_city : nan\ncontact_instagram : nan\nimage : nan\nlocation : nan\noutdoor_seating : nan\nmuseum : nan\ntakeaway : nan\nsmoking : nan\nname : Kopiec Piłsudskiego;Piłsudski's Mound;Piłsudski-Hügel\nid : 2393\n\nphone : nan\ncemetery : nan\nemergency : nan\nopening_hours : nan\nwebsite : nan\npets_allowed : nan\ngeometry : POINT (19.958435 50.0380822)\nhistoric : archaeological_site\nwiki_summary_en : Krakus Mound or Kopiec Krakusa in Polish, also called the Krak Mound, is a tumulus located in the Podgórze district of Kraków, Poland; it is thought to be the resting place of Kraków's mythical founder, the legendary king Krakus. It is located on Lasota Hill, approximately 3 kilometres (2 mi) south of Kraków's city centre, at an altitude of 271 metres (889 ft), with a base diameter of 60 m (197 ft) and a height of 16 m (52 ft). Together with nearby Wanda Mound, it is one of Kraków's two prehistoric mounds as well as the oldest man-made structure in Kraków. Nearby are two modern, man-made mounds, Kościuszko Mound, constructed in 1823, and Piłsudski's Mound, completed in 1937. These four make up Kraków's four memorial mounds.\npostal_code : nan\ntoilets : nan\nnatural : peak\ndescription : stanowisko archeologiczne obiekt kultowy i pochówek, wczesne średniowiecze, materiał z nasypu kultura łużycka, lateńska, przeworska\nvisiting_time : nan\nleisure : no information\ntourism : viewpoint\npublic_transport : nan\nbrand : nan\nalt_name : nan\namenity : no information\nreservation : nan\nattraction : nan\nhighchair : nan\nparking : nan\nswimming_pool : nan\ncontact_phone : nan\ncommunity_centre : nan\naddr_street : nan\ncontact_twitter : nan\nsocial_facility : nan\ncontact_facebook : nan\nzoo : nan\nemail : nan\nwheelchair : nan\ncuisine : nan\ncontact_website : nan\ninternet_access : nan\nopening_hours_reception : nan\nguest_house : nan\naddr_city : nan\ncontact_instagram : nan\nimage : nan\nlocation : nan\noutdoor_seating : nan\nmuseum : nan\ntakeaway : nan\nsmoking : nan\nname : Kopiec Krakusa;Krakus Mound\nid : 2404\n\nphone : nan\ncemetery : nan\nemergency : nan\nopening_hours : nan\nwebsite : nan\npets_allowed : nan\ngeometry : POLYGON ((19.8927573 50.0549175, 19.8927652 50.0549712, 19.8927596 50.0549718, 19.8927567 50.054976, 19.8927417 50.0549762, 19.8927345 50.0549762, 19.8927327 50.0549692, 19.8927283 50.0549674, 19.8927348 50.0549618, 19.8927402 50.0549623, 19.892739 50.0549576, 19.8927363 50.054958, 19.8927352 50.0549515, 19.8927382 50.0549512, 19.8927363 50.0549373, 19.8927332 50.0549371, 19.8927322 50.054931, 19.8927357 50.0549305, 19.8927347 50.0549249, 19.8927325 50.0549246, 19.8927251 50.054929, 19.8927178 50.0549242, 19.8927194 50.0549233, 19.8927149 50.0549195, 19.8927093 50.0549229, 19.8927059 50.0549206, 19.8926861 50.0549196, 19.8926819 50.0549218, 19.8926767 50.0549182, 19.8926723 50.0549202, 19.8926745 50.0549217, 19.8926653 50.054927, 19.8926614 50.0549243, 19.8926427 50.0549237, 19.8926387 50.0549263, 19.8926318 50.0549212, 19.8926321 50.0549089, 19.8926339 50.054904, 19.8926293 50.0549007, 19.8926247 50.0548973, 19.892617 50.0548978, 19.8925982 50.0548971, 19.8925906 50.0548922, 19.8925953 50.0548897, 19.8925954 50.0548778, 19.8925921 50.0548746, 19.8926 50.0548699, 19.8926189 50.0548705, 19.8926269 50.0548718, 19.8926321 50.0548688, 19.8926373 50.0548657, 19.8926368 50.0548606, 19.8926384 50.0548481, 19.8926465 50.0548438, 19.8926497 50.0548466, 19.8926683 50.0548471, 19.8926727 50.0548447, 19.8926781 50.0548502, 19.8926831 50.0548545, 19.8926884 50.0548511, 19.8926914 50.0548529, 19.8927119 50.0548539, 19.8927153 50.0548518, 19.8927208 50.0548557, 19.892727 50.0548529, 19.892726 50.0548521, 19.892732 50.0548469, 19.8927384 50.0548515, 19.8927413 50.0548516, 19.8927429 50.0548462, 19.8927398 50.0548457, 19.8927414 50.0548396, 19.8927453 50.05484, 19.8927475 50.0548331, 19.8927496 50.0548261, 19.8927456 50.0548256, 19.8927473 50.0548191, 19.8927506 50.0548192, 19.8927528 50.054814, 19.8927472 50.0548148, 19.8927423 50.0548093, 19.8927461 50.0548077, 19.8927491 50.0548006, 19.8927552 50.0548014, 19.8927692 50.054803, 19.8927708 50.0548044, 19.8927693 50.0548102, 19.8927998 50.054808, 19.8928256 50.0548176, 19.8928311 50.0548255, 19.8928373 50.0548348, 19.8928315 50.0548532, 19.8928194 50.0548581, 19.8928291 50.0548875, 19.8928289 50.0549193, 19.8927573 50.0549175))\nhistoric : yes\nwiki_summary_en : Chapel of Blessed Bronisława is a neo-Gothic Roman Catholic chapel in Kraków, Poland, erected in 1856–61 within the walls of a military citadel constructed during the Austrian Partition of Poland by the Habsburg monarchy. The chapel was meant as a replacement for the Polish 18th-century church demolished by the Austrians in 1854 during the construction of the stronghold in the Zwierzyniec district. \nThe imperial \"Kościuszko\" citadel surrounded the ancient burial mound and Polish national monument called Kościuszko Mound. The actual mound was used as an observation point by the army. The new chapel, based on design by Feliks Księżarski, was a result of the determined requests for a replacement made by the Polish Committee for the Construction of the Tadeusz Kościuszko Monument.\npostal_code : nan\ntoilets : nan\nnatural : no information\ndescription : nan\nvisiting_time : nan\nleisure : no information\ntourism : attraction\npublic_transport : nan\nbrand : nan\nalt_name : nan\namenity : place_of_worship\nreservation : nan\nattraction : nan\nhighchair : nan\nparking : nan\nswimming_pool : nan\ncontact_phone : nan\ncommunity_centre : nan\naddr_street : Aleja Jerzego Waszyngtona\ncontact_twitter : nan\nsocial_facility : nan\ncontact_facebook : nan\nzoo : nan\nemail : nan\nwheelchair : nan\ncuisine : nan\ncontact_website : nan\ninternet_access : nan\nopening_hours_reception : nan\nguest_house : nan\naddr_city : Kraków\ncontact_instagram : nan\nimage : nan\nlocation : nan\noutdoor_seating : nan\nmuseum : nan\ntakeaway : nan\nsmoking : nan\nname : Kaplica pw. Błogosławionej Bronisławy\nid : 3614\n\nphone : nan\ncemetery : nan\nemergency : nan\nopening_hours : nan\nwebsite : https://kopieckosciuszki.pl/\npets_allowed : nan\ngeometry : POINT (19.8933537 50.054915)\nhistoric : monument\nwiki_summary_en : Kościuszko Mound (Polish: kopiec Kościuszki) is an artificial mound in Kraków, Poland. It was erected by Cracovians in commemoration of the Polish national leader Tadeusz Kościuszko, and modelled after Kraków's prehistoric mounds of Krak and Wanda. A serpentine path leads to the top, approximately 326 metres (1,070 ft) above sea level, with a panoramic view of the Vistula River and the city.\npostal_code : nan\ntoilets : nan\nnatural : peak\ndescription : Kopiec Kościuszki usypany w 1823 roku przez społeczeństwo polskie\nvisiting_time : nan\nleisure : no information\ntourism : no information\npublic_transport : nan\nbrand : nan\nalt_name : nan\namenity : no information\nreservation : nan\nattraction : nan\nhighchair : nan\nparking : nan\nswimming_pool : nan\ncontact_phone : nan\ncommunity_centre : nan\naddr_street : nan\ncontact_twitter : nan\nsocial_facility : nan\ncontact_facebook : nan\nzoo : nan\nemail : nan\nwheelchair : nan\ncuisine : nan\ncontact_website : nan\ninternet_access : nan\nopening_hours_reception : nan\nguest_house : nan\naddr_city : nan\ncontact_instagram : nan\nimage : nan\nlocation : nan\noutdoor_seating : nan\nmuseum : nan\ntakeaway : nan\nsmoking : nan\nname : Kopiec Kościuszki;Kościuszko Mound;Kościuszko-Hügel;Курган Костюшко\nid : 11369\n\nphone : nan\ncemetery : nan\nemergency : nan\nopening_hours : nan\nwebsite : nan\npets_allowed : nan\ngeometry : POINT (19.8471666 50.06005)\nhistoric : monument\nwiki_summary_en : Piłsudski's Mound (Polish: kopiec Piłsudskiego; also known as Independence Mound or Freedom Mound) is located in Kraków, Poland, and was established by the Polish nation in honor of Józef Piłsudski. An artificial mound, it was constructed between the years 1934 and 1937. It is located in the western part of Kraków, on the Sowiniec Heights, Kraków's VII District \"Zwierzyniec\". It is the newest and largest of Kraków's four mounds.[a]\npostal_code : nan\ntoilets : nan\nnatural : peak\ndescription : The highest point in Kraków\nvisiting_time : nan\nleisure : no information\ntourism : viewpoint\npublic_transport : nan\nbrand : nan\nalt_name : nan\namenity : no information\nreservation : nan\nattraction : nan\nhighchair : nan\nparking : nan\nswimming_pool : nan\ncontact_phone : nan\ncommunity_centre : nan\naddr_street : nan\ncontact_twitter : nan\nsocial_facility : nan\ncontact_facebook : nan\nzoo : nan\nemail : nan\nwheelchair : nan\ncuisine : nan\ncontact_website : nan\ninternet_access : nan\nopening_hours_reception : nan\nguest_house : nan\naddr_city : nan\ncontact_instagram : nan\nimage : nan\nlocation : nan\noutdoor_seating : nan\nmuseum : nan\ntakeaway : nan\nsmoking : nan\nname : Kopiec Piłsudskiego;Piłsudski's Mound;Piłsudski-Hügel\nid : 11370\n\nphone : nan\ncemetery : nan\nemergency : nan\nopening_hours : nan\nwebsite : nan\npets_allowed : nan\ngeometry : POINT (19.958435 50.0380822)\nhistoric : archaeological_site\nwiki_summary_en : Krakus Mound or Kopiec Krakusa in Polish, also called the Krak Mound, is a tumulus located in the Podgórze district of Kraków, Poland; it is thought to be the resting place of Kraków's mythical founder, the legendary king Krakus. It is located on Lasota Hill, approximately 3 kilometres (2 mi) south of Kraków's city centre, at an altitude of 271 metres (889 ft), with a base diameter of 60 m (197 ft) and a height of 16 m (52 ft). Together with nearby Wanda Mound, it is one of Kraków's two prehistoric mounds as well as the oldest man-made structure in Kraków. Nearby are two modern, man-made mounds, Kościuszko Mound, constructed in 1823, and Piłsudski's Mound, completed in 1937. These four make up Kraków's four memorial mounds.\npostal_code : nan\ntoilets : nan\nnatural : peak\ndescription : stanowisko archeologiczne obiekt kultowy i pochówek, wczesne średniowiecze, materiał z nasypu kultura łużycka, lateńska, przeworska\nvisiting_time : nan\nleisure : no information\ntourism : viewpoint\npublic_transport : nan\nbrand : nan\nalt_name : nan\namenity : no information\nreservation : nan\nattraction : nan\nhighchair : nan\nparking : nan\nswimming_pool : nan\ncontact_phone : nan\ncommunity_centre : nan\naddr_street : nan\ncontact_twitter : nan\nsocial_facility : nan\ncontact_facebook : nan\nzoo : nan\nemail : nan\nwheelchair : nan\ncuisine : nan\ncontact_website : nan\ninternet_access : nan\nopening_hours_reception : nan\nguest_house : nan\naddr_city : nan\ncontact_instagram : nan\nimage : nan\nlocation : nan\noutdoor_seating : nan\nmuseum : nan\ntakeaway : nan\nsmoking : nan\nname : Kopiec Krakusa;Krakus Mound\nid : 11372\n\nphone : nan\ncemetery : nan\nemergency : nan\nopening_hours : nan\nwebsite : nan\npets_allowed : nan\ngeometry : POINT (19.8228282 50.0165366)\nhistoric : no information\nwiki_summary_en : Kowadza (261 m) – a hill in Tyniec in Kraków. Administratively, it belongs to District VIII Dębniki. Geographically, it is part of the Tyniec Hills on the Kraków Bridge within the macroregion of the Kraków Gate. These hills have been included in the area of the Bielańsko-Tyniecki Landscape Park.  \nKowadza rises on the eastern side of Świętojańska Street in Tyniec. Formed from limestone, the hill is mostly covered by a beech-hornbeam forest, but the summit and southern slopes are open fields of former pastures and meadows. It is covered by a thin layer of soil with xerothermic grassland. Thanks to the open areas, the summit of Kowadza is a good viewpoint. In the valley lies Uroczysko Tyniec, to the southwest the horizon is obscured by the hills of Wielkanoc and Bogucianka, to the south Guminek, and just to the east is the hill Duża Kowodrza.  \nAn ecological site named Uroczysko Kowadza, covering an area of 10 ha, has been established on Kowadza. Benches, trash bins, tourist information boards, and a shelter have been prepared for tourists. A marked hiking trail runs over the summit of Kowadza, with educational paths along its slopes.\npostal_code : nan\ntoilets : nan\nnatural : peak\ndescription : nan\nvisiting_time : nan\nleisure : no information\ntourism : no information\npublic_transport : nan\nbrand : nan\nalt_name : nan\namenity : no information\nreservation : nan\nattraction : nan\nhighchair : nan\nparking : nan\nswimming_pool : nan\ncontact_phone : nan\ncommunity_centre : nan\naddr_street : nan\ncontact_twitter : nan\nsocial_facility : nan\ncontact_facebook : nan\nzoo : nan\nemail : nan\nwheelchair : nan\ncuisine : nan\ncontact_website : nan\ninternet_access : nan\nopening_hours_reception : nan\nguest_house : nan\naddr_city : nan\ncontact_instagram : nan\nimage : nan\nlocation : nan\noutdoor_seating : nan\nmuseum : nan\ntakeaway : nan\nsmoking : nan\nname : Kowodrza\nid : 11439\n\n",
  "answer": "From the top of Kościuszko Mound, you can enjoy a panoramic view of the Vistula River and the city of Kraków. The mound itself reaches approximately 326 meters (1,070 ft) above sea level.",
  "labels": {
    "faithfulness": "FAITHFUL",
    "groundedness": "GROUNDED",
    "relevance": "RELEVANT",
    "completeness": "COMPLETE",
    "coherence": "COHERENT",
    "conciseness": "CONCISE"
  },
  "quality_score": 6
}