{
  "model": "gemini_llm",
  "prompt": "prompt_A",
  "id": 5701,
  "question": "Are there facilities for visitors with mobility challenges at this attraction?",
  "context": "phone : nan\ncemetery : nan\nemergency : nan\nopening_hours : nan\nwebsite : nan\npets_allowed : nan\ngeometry : POLYGON ((19.9361218 50.0547192, 19.9360938 50.0547182, 19.9360927 50.05473, 19.936121 50.0547319, 19.9361147 50.0547826, 19.9360852 50.0547812, 19.9360834 50.0547959, 19.9361126 50.0547971, 19.9361108 50.0548193, 19.9360933 50.0548272, 19.9361075 50.0548434, 19.9361031 50.0548884, 19.936103 50.0548896, 19.9361005 50.0549154, 19.936024 50.0549094, 19.93601 50.0549083, 19.9360003 50.0549279, 19.9359919 50.0549721, 19.9359831 50.0549778, 19.9359823 50.0549817, 19.9360009 50.0549973, 19.9360988 50.0550047, 19.9361232 50.0549918, 19.9361275 50.0549377, 19.9362555 50.0549449, 19.9366475 50.054927, 19.9366524 50.0549269, 19.936686 50.0549256, 19.9369442 50.0549176, 19.9372116 50.0549109, 19.9372152 50.0549607, 19.9372402 50.0549765, 19.93733 50.054978, 19.9373589 50.0549565, 19.9373503 50.0549036, 19.9373333 50.0548896, 19.9373094 50.0548923, 19.9373083 50.0548817, 19.9373337 50.0548792, 19.937345 50.0548878, 19.9373732 50.0548727, 19.9373909 50.0548881, 19.9373645 50.0549015, 19.9373776 50.0549125, 19.9373945 50.0549046, 19.9374105 50.0549174, 19.9373916 50.0549272, 19.9374119 50.0549433, 19.9374308 50.0549336, 19.9374607 50.0549575, 19.9374935 50.0549404, 19.937464 50.0549165, 19.9374818 50.0549073, 19.9374624 50.0548913, 19.9374436 50.0548999, 19.9374274 50.0548867, 19.9374422 50.0548791, 19.9374299 50.0548676, 19.9374031 50.0548799, 19.9373831 50.0548621, 19.9374094 50.0548497, 19.9373852 50.0548264, 19.9373981 50.0547835, 19.9374337 50.0547882, 19.9374413 50.0547638, 19.9374055 50.0547592, 19.9374236 50.0546993, 19.9374695 50.0547052, 19.9374773 50.0546793, 19.9374727 50.0546787, 19.9373996 50.0546695, 19.9374063 50.0546472, 19.9373832 50.0546443, 19.9373754 50.0546702, 19.9372575 50.0546559, 19.9372621 50.054615, 19.9372744 50.054504, 19.9372752 50.0544944, 19.9372866 50.0543947, 19.9373175 50.0543967, 19.9373239 50.0543595, 19.9373717 50.0543396, 19.9373918 50.0543313, 19.9373853 50.0543248, 19.9373205 50.0542606, 19.9373038 50.0542675, 19.9373181 50.0541375, 19.937325 50.0541377, 19.9373261 50.0541272, 19.9373274 50.0541155, 19.9372922 50.0541141, 19.937292 50.0541185, 19.9372768 50.0541178, 19.9371159 50.0541104, 19.937116 50.0541083, 19.9370686 50.0541065, 19.937064 50.0541468, 19.9369673 50.0541337, 19.9369588 50.0541325, 19.9369578 50.0541343, 19.93693 50.0541304, 19.9368754 50.054122, 19.9368861 50.0540933, 19.9368452 50.0540873, 19.9368433 50.0540929, 19.9367632 50.0540816, 19.9367649 50.0540755, 19.936769 50.054076, 19.9367735 50.0540474, 19.936615 50.0540057, 19.9366083 50.0540173, 19.936512 50.0539859, 19.9364993 50.0539817, 19.9364965 50.0539851, 19.9364729 50.053976, 19.9364758 50.053972, 19.9363843 50.0539401, 19.9363831 50.0539413, 19.9363297 50.0539206, 19.9361563 50.0538492, 19.9360868 50.0538207, 19.9360721 50.0538361, 19.9359852 50.0539273, 19.9360582 50.053958, 19.9362444 50.0540305, 19.9360825 50.0542427, 19.9359933 50.0543597, 19.9357975 50.0543001, 19.9357916 50.0542984, 19.9357902 50.054298, 19.9357249 50.0542795, 19.9357176 50.0542774, 19.9357109 50.0542864, 19.9356775 50.0543318, 19.9356736 50.0543369, 19.9356416 50.0543803, 19.9356379 50.0543852, 19.9356345 50.0543899, 19.9356415 50.0543922, 19.9357058 50.0544135, 19.9357129 50.0544159, 19.9359085 50.0544761, 19.9359075 50.0544785, 19.9359002 50.0544937, 19.9358975 50.0544931, 19.9358966 50.0544949, 19.9358929 50.0544942, 19.9358913 50.0544977, 19.9358949 50.0544983, 19.9358941 50.0545002, 19.9358967 50.0545007, 19.9358886 50.0545179, 19.9358826 50.0545306, 19.9358799 50.0545301, 19.9358791 50.0545318, 19.9358754 50.054531, 19.9358736 50.0545347, 19.9358773 50.0545354, 19.9358765 50.0545372, 19.9358792 50.0545378, 19.9358711 50.0545549, 19.9358638 50.0545703, 19.9358798 50.0545727, 19.9359837 50.0545885, 19.9360915 50.0546017, 19.9360932 50.0545959, 19.9361031 50.0545972, 19.936113 50.0545984, 19.9361348 50.0546002, 19.9361218 50.0547192), (19.9362915 50.0545098, 19.9363036 50.0544935, 19.9363262 50.0544596, 19.936408 50.0543419, 19.9365585 50.0541473, 19.9365693 50.0541513, 19.936577 50.0541541, 19.9365783 50.0541526, 19.9365831 50.0541465, 19.9365877 50.0541407, 19.9365923 50.054135, 19.9365971 50.054129, 19.936612 50.0541102, 19.9369207 50.0541557, 19.9370686 50.0541766, 19.9370666 50.0541961, 19.9370373 50.0544986, 19.937008 50.0547752, 19.936727 50.0547875, 19.936726 50.0547751, 19.9366705 50.0547771, 19.9366708 50.0547899, 19.9362695 50.0548074, 19.9362848 50.054619, 19.9363034 50.0546195, 19.9363053 50.0545898, 19.9362872 50.0545897, 19.9362886 50.0545721, 19.9362894 50.0545558, 19.9362899 50.0545538, 19.9363097 50.0545553, 19.9363179 50.0545119, 19.9362915 50.0545098))\nhistoric : no information\nwiki_summary_en : The Wawel Royal Castle (Polish pronunciation: [ˈvavɛl] ; Zamek Królewski na Wawelu) and the Wawel Hill on which it sits constitute the most historically and culturally significant site in Poland. A fortified residency on the Vistula River in Kraków, it was established on the orders of King Casimir III the Great and enlarged over the centuries into a number of structures around a Polish Renaissance courtyard. It represents nearly all European architectural styles of the Medieval, Renaissance and Baroque periods. \nThe castle is part of a fortified architectural complex erected atop a limestone outcrop on the left bank of the Vistula River, at an altitude of 228 metres (748 ft) above sea level. The complex consists of numerous buildings of great historical and national importance, including the Wawel Cathedral where Polish monarchs were crowned and buried. Some of Wawel's oldest stone buildings can be traced back to 970 CE, in addition to the earliest examples of Romanesque and Gothic architecture in Poland. The current castle was built in the 14th century, and expanded over the next hundreds of years. In 1978, Wawel was declared the first World Heritage Site as part of the Historic Centre of Kraków.\nFor centuries the residence of the kings of Poland and the symbol of Polish statehood, Wawel Castle is now one of the country's premier art museums. Established in 1930, the museum encompasses ten curatorial departments responsible for collections of paintings, including an important collection of Italian Renaissance paintings, prints, sculpture, textiles, among them the Sigismund II Augustus tapestry collection, goldsmith's work, arms and armor, ceramics, Meissen porcelain, and period furniture. The museum's holdings in oriental art include the largest collection of Ottoman tents in Europe. With seven specialized conservation studios, the museum is also an important center for the conservation of works of art. With over 3.1 million visitors in 2024, Wawel Castle is the most visited art museum in Poland and the 17th most visited art museum in the world.\npostal_code : nan\ntoilets : nan\nnatural : no information\ndescription : nan\nvisiting_time : nan\nleisure : no information\ntourism : attraction\npublic_transport : nan\nbrand : nan\nalt_name : nan\namenity : no information\nreservation : nan\nattraction : nan\nhighchair : nan\nparking : nan\nswimming_pool : nan\ncontact_phone : nan\ncommunity_centre : nan\naddr_street : nan\ncontact_twitter : nan\nsocial_facility : nan\ncontact_facebook : nan\nzoo : nan\nemail : nan\nwheelchair : nan\ncuisine : nan\ncontact_website : nan\ninternet_access : nan\nopening_hours_reception : nan\nguest_house : nan\naddr_city : nan\ncontact_instagram : nan\nimage : nan\nlocation : nan\noutdoor_seating : nan\nmuseum : nan\ntakeaway : nan\nsmoking : nan\nname : Zamek Królewski na Wawelu;Wawel Castle;Castillo Real;Königsschloss Wawel;Királyi palota;Castello del Wawel;Château du Wawel;Karališkoji Vavelio pilis;Královský hrad;瓦維爾城堡;바벨 성;Castelul Wawel;Wawelský hrad;Castell de Wawel;Castelo Real de Wawel\nid : 3363\n\nphone : nan\ncemetery : nan\nemergency : nan\nopening_hours : Mo-Su 10:30-18:00; Nov-Mar off\nwebsite : https://muzeumkrakowa.pl/oddzialy/barbakan\npets_allowed : nan\ngeometry : POLYGON ((19.9416052 50.0652889, 19.9415687 50.0652963, 19.9415432 50.0653015, 19.9415145 50.0653074, 19.9414795 50.0653145, 19.9414673 50.065317, 19.9414873 50.0653633, 19.9414918 50.0653738, 19.9415155 50.0654285, 19.9414128 50.0654595, 19.9414189 50.0654702, 19.9414353 50.0654649, 19.9414325 50.0654753, 19.941433 50.0655099, 19.9414376 50.0655273, 19.9414464 50.0655453, 19.9414567 50.065559, 19.9414394 50.0655698, 19.9414502 50.0655784, 19.9414648 50.0655692, 19.9414735 50.0655743, 19.9414922 50.0655877, 19.9415109 50.0656011, 19.9415206 50.0656068, 19.9415058 50.0656162, 19.9415185 50.0656237, 19.9415355 50.0656127, 19.9415672 50.0656226, 19.9415951 50.0656278, 19.9416261 50.0656308, 19.9416564 50.0656308, 19.9416875 50.0656282, 19.9417175 50.0656229, 19.9417484 50.0656135, 19.9417624 50.065608, 19.9417756 50.0656018, 19.94179 50.0655932, 19.9418026 50.0655838, 19.9418398 50.0655466, 19.9418523 50.0655183, 19.941855 50.0654814, 19.9418504 50.0654637, 19.941838 50.0654406, 19.9418225 50.0654223, 19.9418176 50.065418, 19.9418018 50.0654039, 19.9416661 50.0653898, 19.9416447 50.0653438, 19.94164 50.0653335, 19.9416183 50.0652862, 19.9416052 50.0652889), (19.9416349 50.0654157, 19.9416693 50.0654084, 19.9417628 50.0654147, 19.9417858 50.065432, 19.9417918 50.0654404, 19.9418142 50.0654351, 19.9418282 50.0654539, 19.9418052 50.0654591, 19.9418134 50.0654809, 19.941837 50.0654806, 19.9418376 50.0655017, 19.9418148 50.0655007, 19.9418055 50.0655292, 19.9418279 50.0655358, 19.9418128 50.0655552, 19.9417919 50.0655482, 19.9417661 50.0655692, 19.9417804 50.065581, 19.9417553 50.0655951, 19.9417404 50.065584, 19.9417023 50.0655964, 19.9417093 50.0656107, 19.9416776 50.0656157, 19.941671 50.0656014, 19.9416286 50.0656019, 19.9416253 50.0656152, 19.9415929 50.0656113, 19.9415923 50.0655979, 19.9415425 50.0655825, 19.9415248 50.0655688, 19.9415061 50.0655554, 19.9414844 50.065535, 19.9414822 50.0655269, 19.9414593 50.065528, 19.9414539 50.0655092, 19.9414762 50.0655054, 19.9414738 50.0654951, 19.9414509 50.0654887, 19.9414538 50.0654731, 19.9414783 50.0654711, 19.9414851 50.0654571, 19.9415344 50.0654393, 19.9415691 50.0654305, 19.9415155 50.0653237, 19.9415225 50.0653215, 19.9415504 50.0653157, 19.9415756 50.0653105, 19.9415833 50.0653099, 19.9416349 50.0654157))\nhistoric : city_gate\nwiki_summary_en : The Kraków Barbican (Polish: Barbakan Krakowski) is a barbican – a fortified outpost once connected to the city walls. It is a historic gateway leading into the Old Town of Kraków, Poland. The barbican is one of the few remaining relics of the complex network of fortifications and defensive barriers that once encircled the royal city of Kraków in the south of Poland. It currently serves as a tourist attraction and venue for a variety of exhibitions.\nToday the Barbican is under the jurisdiction of The Historical Museum of the City of Kraków. Tourists may tour its interior with its displays outlining the historical development of fortifications in Kraków.\npostal_code : nan\ntoilets : nan\nnatural : no information\ndescription : nan\nvisiting_time : nan\nleisure : no information\ntourism : museum\npublic_transport : nan\nbrand : nan\nalt_name : nan\namenity : no information\nreservation : nan\nattraction : nan\nhighchair : nan\nparking : nan\nswimming_pool : nan\ncontact_phone : nan\ncommunity_centre : nan\naddr_street : nan\ncontact_twitter : nan\nsocial_facility : nan\ncontact_facebook : nan\nzoo : nan\nemail : nan\nwheelchair : limited\ncuisine : nan\ncontact_website : nan\ninternet_access : nan\nopening_hours_reception : nan\nguest_house : nan\naddr_city : nan\ncontact_instagram : nan\nimage : nan\nlocation : nan\noutdoor_seating : nan\nmuseum : history\ntakeaway : nan\nsmoking : nan\nname : Barbakan;Barbican;Barbakán\nid : 3414\n\nphone : +48 12 3957065\ncemetery : nan\nemergency : nan\nopening_hours : Tu-Th 09:00-17:00; Fr-Su 09:00-19:00; PH off\nwebsite : https://www.cogiteon.pl/\npets_allowed : nan\ngeometry : MULTIPOLYGON (((19.9898496 50.0852354, 19.9903389 50.0851391, 19.9904527 50.0851167, 19.9904573 50.0851263, 19.990487 50.0851888, 19.9898762 50.0853096, 19.9898587 50.0853131, 19.9899393 50.0853806, 19.9901311 50.0855413, 19.9903675 50.0857393, 19.990383 50.0857363, 19.990389 50.0857351, 19.9911684 50.0855815, 19.9911743 50.0855803, 19.9911902 50.0855772, 19.9912277 50.0851656, 19.9912391 50.0850402, 19.991223 50.0850434, 19.990689 50.0851489, 19.9906594 50.0850866, 19.9906548 50.0850769, 19.9907686 50.0850545, 19.9908231 50.0850437, 19.9911631 50.0849767, 19.9911792 50.0849736, 19.9912005 50.0849694, 19.9912303 50.0849635, 19.9912472 50.0849602, 19.9912491 50.0849235, 19.991256 50.0847964, 19.9912452 50.0847985, 19.9912221 50.0848031, 19.9905694 50.0849319, 19.9904761 50.0849507, 19.990402 50.0849657, 19.989673 50.0851088, 19.9896443 50.0851145, 19.989632 50.0851169, 19.9897839 50.0852483, 19.9897996 50.0852452, 19.9898496 50.0852354)), ((19.9907781 50.0859263, 19.990934 50.0858956, 19.9911429 50.0858543, 19.9911496 50.085853, 19.9911649 50.08585, 19.9911744 50.0857455, 19.9911824 50.0856577, 19.991167 50.0856607, 19.9908515 50.0857231, 19.9906191 50.085769, 19.9904595 50.0858006, 19.9904444 50.0858036, 19.9905288 50.0858746, 19.9906258 50.0859563, 19.9906409 50.0859534, 19.9906469 50.0859522, 19.9907781 50.0859263)), ((19.9911563 50.0859308, 19.9911422 50.0859336, 19.990969 50.0859679, 19.9908122 50.0859989, 19.9907296 50.0860153, 19.9907174 50.0860177, 19.9907028 50.0860206, 19.9910015 50.0862716, 19.9911174 50.086369, 19.9911277 50.0862533, 19.9911465 50.0860414, 19.9911563 50.0859308)))\nhistoric : no information\nwiki_summary_en : Małopolskie Centrum Nauki Cogiteon – a science center, a cultural institution of the Małopolskie Voivodeship. Its aim is to educate through play and to engage in independent or team scientific experiments, research projects, and social initiatives. \n\nFormally, the institution was established in December 2017. By mid-2022, a headquarters is to be built in the Krakow district of Czyżyny, according to a design prepared by the Wrocław office of Heinle, Wischer und Partner Architekci. The project was selected through an architectural competition, with the results announced on February 17, 2018. The estimated value of the project is approximately 120 million PLN. \n\nThe building will include, among other things, a permanent exhibition, the main theme of which will be humanity. Until the construction investment is realized, the Center intends to carry out its mission, among others, through the activities of the Mobile Exhibition \"Naukowiej.\" The exhibition has been operating since February 2019 and is housed in a retractable trailer. It features several exhibits dedicated to the theme of air. The exhibition aims to visit all municipalities in the Małopolskie Voivodeship. \n\nDespite the lack of finality of the decision regarding the entry in the register of cultural landscape monuments and the absence of consideration of appeals against the issued building permit, construction work began at the end of March 2021. In the second week of May of the same year, the final decision on the entry into the register was signed, while all appeals were dismissed. \n\nOn April 5, 2024, the general contractor handed over the building of the Science Center. At the same time, the dates for the opening ceremony were announced for June 21 and 22, 2024.\npostal_code : nan\ntoilets : nan\nnatural : no information\ndescription : nan\nvisiting_time : nan\nleisure : no information\ntourism : museum\npublic_transport : nan\nbrand : nan\nalt_name : MCN Cogiteon\namenity : no information\nreservation : nan\nattraction : nan\nhighchair : nan\nparking : nan\nswimming_pool : nan\ncontact_phone : nan\ncommunity_centre : nan\naddr_street : Izydora Stella-Sawickiego\ncontact_twitter : https://x.com/cogiteon\nsocial_facility : nan\ncontact_facebook : https://www.facebook.com/cogiteon\nzoo : nan\nemail : biuro@cogiteon.pl\nwheelchair : nan\ncuisine : nan\ncontact_website : nan\ninternet_access : nan\nopening_hours_reception : nan\nguest_house : nan\naddr_city : Kraków\ncontact_instagram : https://www.instagram.com/cogiteon.pl\nimage : nan\nlocation : nan\noutdoor_seating : nan\nmuseum : science\ntakeaway : nan\nsmoking : nan\nname : Małopolskie Centrum Nauki Cogiteon;Małopolska Science Center Cogiteon;MCN Cogiteon;Cogiteon\nid : 3420\n\nphone : nan\ncemetery : nan\nemergency : nan\nopening_hours : 24/7\nwebsite : nan\npets_allowed : nan\ngeometry : POLYGON ((19.9412736 50.0648228, 19.9412786 50.0648359, 19.9412853 50.0648533, 19.9412872 50.0648582, 19.9412894 50.0648638, 19.9412975 50.0648848, 19.9413072 50.0649102, 19.9413385 50.0649051, 19.9413698 50.0649001, 19.941397 50.0648957, 19.9414324 50.06489, 19.9414223 50.0648638, 19.9414145 50.0648438, 19.9414105 50.0648333, 19.9414083 50.0648276, 19.9414038 50.0648159, 19.9413987 50.0648028, 19.9413633 50.0648085, 19.9413361 50.0648128, 19.9413048 50.0648178, 19.9412736 50.0648228))\nhistoric : city_gate\nwiki_summary_en : St. Florian's Gate (Polish: Brama Floriańska) in Kraków, Poland, is one of the best-known Polish Gothic towers, and a focal point of Kraków's Old Town. It was built about the 14th century as a rectangular Gothic tower of \"wild stone\", part of the city fortifications against Mongol attack.\npostal_code : nan\ntoilets : nan\nnatural : no information\ndescription : nan\nvisiting_time : nan\nleisure : no information\ntourism : attraction\npublic_transport : nan\nbrand : nan\nalt_name : nan\namenity : no information\nreservation : nan\nattraction : nan\nhighchair : nan\nparking : nan\nswimming_pool : nan\ncontact_phone : nan\ncommunity_centre : nan\naddr_street : nan\ncontact_twitter : nan\nsocial_facility : nan\ncontact_facebook : nan\nzoo : nan\nemail : nan\nwheelchair : yes\ncuisine : nan\ncontact_website : nan\ninternet_access : nan\nopening_hours_reception : nan\nguest_house : nan\naddr_city : nan\ncontact_instagram : nan\nimage : nan\nlocation : nan\noutdoor_seating : nan\nmuseum : nan\ntakeaway : nan\nsmoking : nan\nname : Brama Floriańska;Saint Florian's Gate;Florianstor;Флорианские ворота в Кракове;Flórián-kapu;Floriánská brána;圣福里安门;성 플로리안의 문;Florianuspoort;Poarta Florian;Floriánska brána;Florianertor\nid : 3467\n\nphone : nan\ncemetery : nan\nemergency : nan\nopening_hours : nan\nwebsite : nan\npets_allowed : nan\ngeometry : LINESTRING (19.9099889 50.1142366, 19.9101438 50.1142556, 19.9102534 50.114259)\nhistoric : no information\nwiki_summary_en : Czerwony Most – a historic structure, one of the objects of the Austrian Fortress of Kraków. A grade-separated intersection of the axial road (Waliszewskiego Street) and the access road to the Pękowice fort (Pękowicka Street), preventing congestion that could arise during combat when troops were simultaneously regrouping along both roads. This could have had very serious consequences, which is why about 100 years ago, a two-level intersection was built on the then far outskirts of the city. Recently, renovation work restored Czerwony Most to its original appearance.  \nBeneath Czerwony Most runs the Eagle's Nests Trail, which coincides with the former medieval trade route connecting Kraków with Częstochowa and further – with Greater Poland. A section of the cultural and pilgrimage trail Via Regia also runs here, which is one of the St. James' Ways leading to the sanctuary of this saint in Santiago de Compostela, Spain.\npostal_code : nan\ntoilets : nan\nnatural : no information\ndescription : nan\nvisiting_time : nan\nleisure : no information\ntourism : attraction\npublic_transport : nan\nbrand : nan\nalt_name : nan\namenity : no information\nreservation : nan\nattraction : nan\nhighchair : nan\nparking : nan\nswimming_pool : nan\ncontact_phone : nan\ncommunity_centre : nan\naddr_street : nan\ncontact_twitter : nan\nsocial_facility : nan\ncontact_facebook : nan\nzoo : nan\nemail : nan\nwheelchair : nan\ncuisine : nan\ncontact_website : nan\ninternet_access : nan\nopening_hours_reception : nan\nguest_house : nan\naddr_city : nan\ncontact_instagram : nan\nimage : nan\nlocation : nan\noutdoor_seating : nan\nmuseum : nan\ntakeaway : nan\nsmoking : nan\nname : Czerwony Most\nid : 3598\n\nphone : nan\ncemetery : nan\nemergency : nan\nopening_hours : nan\nwebsite : nan\npets_allowed : nan\ngeometry : POLYGON ((19.9920443 49.9948323, 19.9920239 49.9948523, 19.9919712 49.9948286, 19.9919906 49.9948095, 19.9918014 49.9947269, 19.9917981 49.9947298, 19.9916796 49.994678, 19.9917668 49.9945711, 19.9924046 49.9948483, 19.9924023 49.9948789, 19.9924268 49.9949105, 19.9924463 49.9949224, 19.992454 49.9949327, 19.9924059 49.9949856, 19.9923786 49.994983, 19.9922277 49.9949168, 19.9922307 49.9949136, 19.9920443 49.9948323))\nhistoric : fort\nwiki_summary_en : Fort 50 ½ O Kosocice – one of the forts of the Kraków Fortress. It was built between 1897 and 1899. In 1945, it was stripped of its towers – both armored and observation. It belonged to the VII fortified area. The object was designed by Emil Gołogórski. \n\nIt defended the railway line to Przemyśl and the Lwów Route. In December 1914, the fort, along with the neighboring forts 50 \"Prokocim\" and 51 \"Rajsko,\" held back the main force of the Russian assault on Kraków. The fort is in good condition and is occasionally open to visitors. It is part of the Kraków Fortress Museum. The object is located at J. Hallera Street in Kraków.\npostal_code : nan\ntoilets : nan\nnatural : no information\ndescription : nan\nvisiting_time : nan\nleisure : no information\ntourism : attraction\npublic_transport : nan\nbrand : nan\nalt_name : Fort 50½ O \"Barycz\"\namenity : no information\nreservation : nan\nattraction : nan\nhighchair : nan\nparking : nan\nswimming_pool : nan\ncontact_phone : nan\ncommunity_centre : nan\naddr_street : nan\ncontact_twitter : nan\nsocial_facility : nan\ncontact_facebook : nan\nzoo : nan\nemail : nan\nwheelchair : nan\ncuisine : nan\ncontact_website : nan\ninternet_access : nan\nopening_hours_reception : nan\nguest_house : nan\naddr_city : nan\ncontact_instagram : nan\nimage : nan\nlocation : nan\noutdoor_seating : nan\nmuseum : nan\ntakeaway : nan\nsmoking : nan\nname : Fort 50½ O \"Kosocice\";Fort 50½ O \"Barycz\"\nid : 3631\n\nphone : nan\ncemetery : nan\nemergency : nan\nopening_hours : nan\nwebsite : nan\npets_allowed : nan\ngeometry : POLYGON ((20.0404114 50.0987452, 20.0405076 50.0987144, 20.0417472 50.0986841, 20.0418206 50.0987123, 20.0419386 50.0986665, 20.0419346 50.0985867, 20.0422783 50.0982016, 20.0424136 50.0981943, 20.0424056 50.0981037, 20.0423085 50.0980261, 20.0413639 50.0980551, 20.0411966 50.0979653, 20.0409156 50.0980472, 20.0399161 50.098093, 20.0398499 50.0981353, 20.0398346 50.0981972, 20.0398587 50.0982339, 20.0399218 50.0982853, 20.0400018 50.0983595, 20.0404114 50.0987452))\nhistoric : fort\nwiki_summary_en : Fort pancerny główny 49a Dłubnia – a historic fort of the Kraków Fortress. It was built between 1892 and 1896. Its purpose was to protect the Dłubnia valley, assisted by the forts: 49 Krzesławice and 48a Mistrzejowice. The fortifications of the Fort included Fort 49 ¼ Grębałów and Fort 49 Krzesławice. \nThe fort did not participate in battles during World War I. In the interwar period, it was under military control. During World War II, the armored towers were blown up. After World War II, until 1990, the fort served as a warehouse. \nThe facility is located at S. Petőfiego street in Kraków.\npostal_code : nan\ntoilets : nan\nnatural : no information\ndescription : nan\nvisiting_time : nan\nleisure : no information\ntourism : attraction\npublic_transport : nan\nbrand : nan\nalt_name : nan\namenity : no information\nreservation : nan\nattraction : nan\nhighchair : nan\nparking : nan\nswimming_pool : nan\ncontact_phone : nan\ncommunity_centre : nan\naddr_street : nan\ncontact_twitter : nan\nsocial_facility : nan\ncontact_facebook : nan\nzoo : nan\nemail : nan\nwheelchair : nan\ncuisine : nan\ncontact_website : nan\ninternet_access : nan\nopening_hours_reception : nan\nguest_house : nan\naddr_city : nan\ncontact_instagram : nan\nimage : nan\nlocation : nan\noutdoor_seating : nan\nmuseum : nan\ntakeaway : nan\nsmoking : nan\nname : Fort 49a \"Dłubnia\"\nid : 3832\n\nphone : nan\ncemetery : nan\nemergency : nan\nopening_hours : nan\nwebsite : nan\npets_allowed : nan\ngeometry : POINT (19.9343201 50.0139215)\nhistoric : no information\nwiki_summary_en : Kraków Sanktuarium – a passenger stop in the Kraków Łagiewniki area, in the Małopolskie Voivodeship, built to serve the Kraków sanctuaries: the Sanctuary of Divine Mercy and the John Paul II Center, a shopping center on Zakopiańska Street, and nearby residential buildings during the World Youth Days 2016 and for the needs of the Fast Urban Railway.\npostal_code : nan\ntoilets : nan\nnatural : no information\ndescription : nan\nvisiting_time : nan\nleisure : no information\ntourism : no information\npublic_transport : station\nbrand : nan\nalt_name : nan\namenity : no information\nreservation : nan\nattraction : nan\nhighchair : nan\nparking : nan\nswimming_pool : nan\ncontact_phone : nan\ncommunity_centre : nan\naddr_street : nan\ncontact_twitter : nan\nsocial_facility : nan\ncontact_facebook : nan\nzoo : nan\nemail : nan\nwheelchair : nan\ncuisine : nan\ncontact_website : nan\ninternet_access : nan\nopening_hours_reception : nan\nguest_house : nan\naddr_city : nan\ncontact_instagram : nan\nimage : nan\nlocation : nan\noutdoor_seating : nan\nmuseum : nan\ntakeaway : nan\nsmoking : nan\nname : Kraków Sanktuarium\nid : 7685\n\nphone : nan\ncemetery : nan\nemergency : yes\nopening_hours : nan\nwebsite : nan\npets_allowed : nan\ngeometry : POLYGON ((19.9136062 50.0723088, 19.9117846 50.072724, 19.9113688 50.0716984, 19.9121162 50.0716076, 19.9121767 50.0716003, 19.9132514 50.0714819, 19.9132887 50.0715004, 19.9133699 50.0717435, 19.913468 50.0720095, 19.9136062 50.0723088))\nhistoric : no information\nwiki_summary_en : Hospital of the Ministry of the Interior and Administration in Krakow - the basic organizational unit of the Health Care Facility MSWiA in Krakow.\npostal_code : nan\ntoilets : nan\nnatural : no information\ndescription : nan\nvisiting_time : nan\nleisure : no information\ntourism : no information\npublic_transport : nan\nbrand : nan\nalt_name : nan\namenity : hospital\nreservation : nan\nattraction : nan\nhighchair : nan\nparking : nan\nswimming_pool : nan\ncontact_phone : nan\ncommunity_centre : nan\naddr_street : nan\ncontact_twitter : nan\nsocial_facility : nan\ncontact_facebook : nan\nzoo : nan\nemail : nan\nwheelchair : nan\ncuisine : nan\ncontact_website : nan\ninternet_access : nan\nopening_hours_reception : nan\nguest_house : nan\naddr_city : nan\ncontact_instagram : nan\nimage : nan\nlocation : nan\noutdoor_seating : nan\nmuseum : nan\ntakeaway : nan\nsmoking : nan\nname : Samodzielny Publiczny Zakład Opieki Zdrowotnej MSW;Samodzielny Publiczny Zakład Opieki Zdrowotnej MSW w Krakowie;SPZOZ MSW\nid : 11326\n\n",
  "answer": "I cannot answer your question. The provided context does not contain information about facilities for visitors with mobility challenges at this attraction.",
  "labels": {
    "faithfulness": "FAITHFUL",
    "groundedness": "GROUNDED",
    "relevance": "RELEVANT",
    "completeness": "COMPLETE",
    "coherence": "COHERENT",
    "conciseness": "CONCISE"
  },
  "quality_score": 6
}