{
  "model": "gemini_llm",
  "prompt": "prompt_A",
  "id": 4453,
  "question": "Can you tell me if pets are permitted at this attraction?",
  "context": "phone : +48 12 656 56 25\ncemetery : nan\nemergency : nan\nopening_hours : We-Su 10:00-17:00\nwebsite : https://muzeumkrakowa.pl/oddzialy/apteka-pod-orlem\npets_allowed : nan\ngeometry : POINT (19.9541481 50.0462364)\nhistoric : no information\nwiki_summary_en : The Eagle Pharmacy Museum (Polish: Apteka Pod Orłem) is a branch of the Historical Museum of Kraków located in the Podgórze district of Kraków, Poland. Originally established as a private pharmacy in 1910, during World War II it operated within the Kraków Ghetto. Its owner, Tadeusz Pankiewicz, was the only non-Jewish Pole permitted to remain and operate a business inside the ghetto. The pharmacy served as a vital hub for clandestine aid, communication, and resistance, providing shelter, medical supplies, and moral support to the persecuted Jewish community. \nAfter the war, the site was gradually transformed into a commemorative museum. The permanent exhibition opened in 2003 following contributions from Holocaust survivor and filmmaker Roman Polanski.\npostal_code : nan\ntoilets : nan\nnatural : no information\ndescription : nan\nvisiting_time : nan\nleisure : no information\ntourism : museum\npublic_transport : nan\nbrand : nan\nalt_name : nan\namenity : no information\nreservation : nan\nattraction : nan\nhighchair : nan\nparking : nan\nswimming_pool : nan\ncontact_phone : nan\ncommunity_centre : nan\naddr_street : Plac Bohaterów Getta\ncontact_twitter : nan\nsocial_facility : nan\ncontact_facebook : nan\nzoo : nan\nemail : nan\nwheelchair : limited\ncuisine : nan\ncontact_website : nan\ninternet_access : nan\nopening_hours_reception : nan\nguest_house : nan\naddr_city : Kraków\ncontact_instagram : nan\nimage : nan\nlocation : nan\noutdoor_seating : nan\nmuseum : history\ntakeaway : nan\nsmoking : nan\nname : Apteka Pod Orłem;Eagle Pharmacy;Patika a Sas Alatt\nid : 2424\n\nphone : +48 12 4100770\ncemetery : nan\nemergency : nan\nopening_hours : Tu-Su 11:00-17:00\nwebsite : https://www.muzeum-ak.pl/\npets_allowed : nan\ngeometry : POLYGON ((19.9491122 50.0724855, 19.9487021 50.0721103, 19.9485364 50.0721859, 19.9485161 50.0721681, 19.9484828 50.0721826, 19.948452 50.0721976, 19.9484705 50.0722157, 19.948302 50.0722917, 19.9487129 50.072667, 19.9491122 50.0724855), (19.9487021 50.0722809, 19.9488988 50.0724612, 19.9487439 50.0725302, 19.9485498 50.0723497, 19.9487021 50.0722809))\nhistoric : yes\nwiki_summary_en : The Home Army Museum (Polish: Muzeum Armii Krajowej) was created in Kraków, Poland in 2000, to commemorate the struggle for independence by the underground Polish Secret State and its military arm, the Hope Army, the largest resistance movement in occupied Europe during World War II. The museum is named after general Emil August Fieldorf \"Nil\". It is the only such institution in Poland promoting knowledge about the Polish Underground State and its armed forces during World War II. The idea behind the Home Army Museum is to provide a holistic picture of the Polish underground, its spiritual origins and the shape of patriotic heritage to the present day.\nThe museum was established in 2000 as a local self-government unit but the formal establishment was preceded by a ten-year effort of collecting the historical items of the Home Army Veterans. So far, the museum has collected more than 8,000 exhibits and more than 12,000 archives – mostly gifts of Army Soldiers and their families around the world – historical memorabilia, often with the tenor of relics. The library resources reach about 11,500 volumes.\n\nThe permanent exhibition presents the history of Polish Underground State and Home Army in their complexity. The main section of the exhibition begins with the so-called September Campaign (Invasion of Poland, 1939). The division of Poland into two occupied zones, German and Soviet, consists of several sections (pe. Society, Terror, concentration camps, Holocaust and attitude of the Underground State towards persecuted Jews, etc.) and are well documented with photographic displays. Day-by-day life, both civilian and military, and the policy of both occupants is shown in the rich narrative scenography of the exhibition, based on documents and artefacts such as uniforms, munitions, many documents and decorations.\nThe main part of the exhibition is situated in the basement. Visitors are confronted with hundreds of photos and memorabilia telling stories of selected Home Army members. One of the most precious exhibits is the diary of a famous major \"Hubal\" – Henryk Dobrzański, the first guerilla commander of the World War II in Europe. Among other artefacts there is a replica of a fuselage section of Halifax (British heavy bomber) and a reconstructed inner structure of a V-2 rocket. The reconstruction of a detention cell in which after 1944 Polish Urząd Bezpieczeństwa (Department of Security) held members of the Home Army and postwar Freedom and Independence organisation gives the opportunity to experience the communist terror. The museum has an extensive weapon collection, including homemade projectiles.\nThe museum is located at Ulica Wita Stwosza 12, in the Grzegórzki District of Kraków.\npostal_code : nan\ntoilets : nan\nnatural : no information\ndescription : nan\nvisiting_time : nan\nleisure : no information\ntourism : museum\npublic_transport : nan\nbrand : nan\nalt_name : nan\namenity : no information\nreservation : nan\nattraction : nan\nhighchair : nan\nparking : nan\nswimming_pool : nan\ncontact_phone : nan\ncommunity_centre : nan\naddr_street : Wita Stwosza\ncontact_twitter : nan\nsocial_facility : nan\ncontact_facebook : nan\nzoo : nan\nemail : nan\nwheelchair : nan\ncuisine : nan\ncontact_website : nan\ninternet_access : nan\nopening_hours_reception : nan\nguest_house : nan\naddr_city : Kraków\ncontact_instagram : nan\nimage : nan\nlocation : nan\noutdoor_seating : nan\nmuseum : history\ntakeaway : nan\nsmoking : nan\nname : Muzeum Armii Krajowej;Muzeum Armii Krajowej im. Gen. Emila Fieldorfa \"Nila\";Lengyel Honi Hadsereg Múzeuma;Muzeum AK\nid : 3361\n\nphone : +48 12 3957065\ncemetery : nan\nemergency : nan\nopening_hours : Tu-Th 09:00-17:00; Fr-Su 09:00-19:00; PH off\nwebsite : https://www.cogiteon.pl/\npets_allowed : nan\ngeometry : MULTIPOLYGON (((19.9898496 50.0852354, 19.9903389 50.0851391, 19.9904527 50.0851167, 19.9904573 50.0851263, 19.990487 50.0851888, 19.9898762 50.0853096, 19.9898587 50.0853131, 19.9899393 50.0853806, 19.9901311 50.0855413, 19.9903675 50.0857393, 19.990383 50.0857363, 19.990389 50.0857351, 19.9911684 50.0855815, 19.9911743 50.0855803, 19.9911902 50.0855772, 19.9912277 50.0851656, 19.9912391 50.0850402, 19.991223 50.0850434, 19.990689 50.0851489, 19.9906594 50.0850866, 19.9906548 50.0850769, 19.9907686 50.0850545, 19.9908231 50.0850437, 19.9911631 50.0849767, 19.9911792 50.0849736, 19.9912005 50.0849694, 19.9912303 50.0849635, 19.9912472 50.0849602, 19.9912491 50.0849235, 19.991256 50.0847964, 19.9912452 50.0847985, 19.9912221 50.0848031, 19.9905694 50.0849319, 19.9904761 50.0849507, 19.990402 50.0849657, 19.989673 50.0851088, 19.9896443 50.0851145, 19.989632 50.0851169, 19.9897839 50.0852483, 19.9897996 50.0852452, 19.9898496 50.0852354)), ((19.9907781 50.0859263, 19.990934 50.0858956, 19.9911429 50.0858543, 19.9911496 50.085853, 19.9911649 50.08585, 19.9911744 50.0857455, 19.9911824 50.0856577, 19.991167 50.0856607, 19.9908515 50.0857231, 19.9906191 50.085769, 19.9904595 50.0858006, 19.9904444 50.0858036, 19.9905288 50.0858746, 19.9906258 50.0859563, 19.9906409 50.0859534, 19.9906469 50.0859522, 19.9907781 50.0859263)), ((19.9911563 50.0859308, 19.9911422 50.0859336, 19.990969 50.0859679, 19.9908122 50.0859989, 19.9907296 50.0860153, 19.9907174 50.0860177, 19.9907028 50.0860206, 19.9910015 50.0862716, 19.9911174 50.086369, 19.9911277 50.0862533, 19.9911465 50.0860414, 19.9911563 50.0859308)))\nhistoric : no information\nwiki_summary_en : Małopolskie Centrum Nauki Cogiteon – a science center, a cultural institution of the Małopolskie Voivodeship. Its aim is to educate through play and to engage in independent or team scientific experiments, research projects, and social initiatives. \n\nFormally, the institution was established in December 2017. By mid-2022, a headquarters is to be built in the Krakow district of Czyżyny, according to a design prepared by the Wrocław office of Heinle, Wischer und Partner Architekci. The project was selected through an architectural competition, with the results announced on February 17, 2018. The estimated value of the project is approximately 120 million PLN. \n\nThe building will include, among other things, a permanent exhibition, the main theme of which will be humanity. Until the construction investment is realized, the Center intends to carry out its mission, among others, through the activities of the Mobile Exhibition \"Naukowiej.\" The exhibition has been operating since February 2019 and is housed in a retractable trailer. It features several exhibits dedicated to the theme of air. The exhibition aims to visit all municipalities in the Małopolskie Voivodeship. \n\nDespite the lack of finality of the decision regarding the entry in the register of cultural landscape monuments and the absence of consideration of appeals against the issued building permit, construction work began at the end of March 2021. In the second week of May of the same year, the final decision on the entry into the register was signed, while all appeals were dismissed. \n\nOn April 5, 2024, the general contractor handed over the building of the Science Center. At the same time, the dates for the opening ceremony were announced for June 21 and 22, 2024.\npostal_code : nan\ntoilets : nan\nnatural : no information\ndescription : nan\nvisiting_time : nan\nleisure : no information\ntourism : museum\npublic_transport : nan\nbrand : nan\nalt_name : MCN Cogiteon\namenity : no information\nreservation : nan\nattraction : nan\nhighchair : nan\nparking : nan\nswimming_pool : nan\ncontact_phone : nan\ncommunity_centre : nan\naddr_street : Izydora Stella-Sawickiego\ncontact_twitter : https://x.com/cogiteon\nsocial_facility : nan\ncontact_facebook : https://www.facebook.com/cogiteon\nzoo : nan\nemail : biuro@cogiteon.pl\nwheelchair : nan\ncuisine : nan\ncontact_website : nan\ninternet_access : nan\nopening_hours_reception : nan\nguest_house : nan\naddr_city : Kraków\ncontact_instagram : https://www.instagram.com/cogiteon.pl\nimage : nan\nlocation : nan\noutdoor_seating : nan\nmuseum : science\ntakeaway : nan\nsmoking : nan\nname : Małopolskie Centrum Nauki Cogiteon;Małopolska Science Center Cogiteon;MCN Cogiteon;Cogiteon\nid : 3420\n\nphone : nan\ncemetery : nan\nemergency : nan\nopening_hours : 24/7\nwebsite : nan\npets_allowed : nan\ngeometry : POLYGON ((19.9068228 50.059374, 19.9051515 50.058345, 19.9040932 50.0589615, 19.9035986 50.0592326, 19.9030558 50.059492, 19.9012175 50.0602093, 19.9010762 50.0604061, 19.9018127 50.0614121, 19.902546 50.062412, 19.9231318 50.0592513, 19.9231335 50.0592212, 19.9219675 50.0590566, 19.9192393 50.0586649, 19.9181629 50.0585154, 19.9160288 50.0582089, 19.9139449 50.0579078, 19.909055 50.0572063, 19.907823 50.0570365, 19.9076985 50.0570248, 19.9075061 50.0570248, 19.9077121 50.0570524, 19.9078348 50.0571219, 19.9078745 50.057181, 19.9078169 50.0572328, 19.9079877 50.0573294, 19.9090244 50.0580153, 19.9077734 50.0588218, 19.9077394 50.0587998, 19.9068228 50.059374))\nhistoric : no information\nwiki_summary_en : Błonia Park is a vast meadow with an area of 48 hectares directly adjacent to the historic centre of the city of Kraków, Poland.\nThe history of the park began in 1162, when a wealthy nobleman Jaksa z Miechowa – founder of the Polish branch of the Order of the Holy Sepulchre – donated the land between Zwierzyniec and Łobzów to Norbertine Nuns. His intention was to receive a blessing prior to his pilgrimage to the Holy Land. For the next two centuries the meadow belonged to nuns, who in 1366 exchanged it with the city's authorities for a manor at Florianska Street. The meadow was used by peasants from neighboring villages to graze their cattle.\nUntil the 19th century Błonia Park was largely neglected, and often flooded by the Rudawa river in the spring turning it into wetland with small islands, probably contributing to the spread of epidemics. After draining the swamps, Błonia became perfectly suitable to host large gatherings. In 1809, when the city was incorporated into the Duchy of Warsaw, Błonia was a place of salute of the troops of Napoleon, organized by Prince Jozef Poniatowski and General Jan Henryk Dąbrowski.  \nToday Błonia is a recreation area, frequently hosting large events like concerts and exhibitions. The place is best known for great Masses celebrated by Pope John Paul II in 1979, 1983, 1987, 1997 and 2002. Pope Benedict XVI also celebrated the Mass there during his journey to Poland in May 2006. The opening Mass of the 2016 World Youth Day was held at Błonia Park in July 2016, however the main events, including the Mass celebrated by Pope Francis, were held outside the city.\nBłonia Park is also used to host popular culture events, such as concerts organized by a local radio station or the Iuvenalia student festival. Pop star Celine Dion's Taking Chances World Tour concert on June 28, 2008 performed to nearly 55,000 people  The vast meadow was also used for politicized promotion of the Małopolska region farming industry by PSL in 2011 with a herd of 150 sheep trucked in from hundreds of kilometres away for one month, and the city permit worth 3,200 złoty. The last cattle grazed at Błonia in the 1970s.\npostal_code : nan\ntoilets : nan\nnatural : no information\ndescription : nan\nvisiting_time : nan\nleisure : no information\ntourism : attraction\npublic_transport : nan\nbrand : nan\nalt_name : Błonia krakowskie\namenity : no information\nreservation : nan\nattraction : nan\nhighchair : nan\nparking : nan\nswimming_pool : nan\ncontact_phone : nan\ncommunity_centre : nan\naddr_street : nan\ncontact_twitter : nan\nsocial_facility : nan\ncontact_facebook : nan\nzoo : nan\nemail : nan\nwheelchair : limited\ncuisine : nan\ncontact_website : nan\ninternet_access : nan\nopening_hours_reception : nan\nguest_house : nan\naddr_city : nan\ncontact_instagram : nan\nimage : nan\nlocation : nan\noutdoor_seating : nan\nmuseum : nan\ntakeaway : nan\nsmoking : nan\nname : Błonia;Błonia krakowskie;Lange Wiese;Краковский луг\nid : 3430\n\nphone : nan\ncemetery : nan\nemergency : nan\nopening_hours : Mo-Su 09:00-18:00\nwebsite : nan\npets_allowed : nan\ngeometry : POLYGON ((19.8544454 50.0545941, 19.8513279 50.0525794, 19.8512548 50.0525321, 19.8511744 50.0524801, 19.8507488 50.0522051, 19.8507158 50.0522163, 19.8503122 50.0518655, 19.8503751 50.0518318, 19.8490534 50.0506826, 19.8489725 50.0506686, 19.8488099 50.0506885, 19.8486477 50.0507781, 19.8485565 50.0508942, 19.8484762 50.0509871, 19.8474358 50.0521431, 19.8467803 50.0529164, 19.8468602 50.0530148, 19.8467528 50.0531254, 19.8465877 50.0531328, 19.8459108 50.0538935, 19.8456514 50.0542426, 19.845667 50.0543655, 19.8472169 50.0540001, 19.8473186 50.0541633, 19.8474529 50.0541787, 19.8475135 50.0540757, 19.8520714 50.055191, 19.8536422 50.0556469, 19.8539772 50.0551911, 19.8539428 50.0551804, 19.8540152 50.0550778, 19.8540409 50.0550859, 19.8544454 50.0545941))\nhistoric : no information\nwiki_summary_en : The Kraków Zoo (Polish: Ogród Zoologiczny w Krakowie) is located in Kraków, Poland and was established in 1929. It is home to over 1500 animals and about 260 species. The zoo is a member of the European Association of Zoos and Aquaria and the World Association of Zoos and Aquariums.\npostal_code : nan\ntoilets : nan\nnatural : no information\ndescription : nan\nvisiting_time : nan\nleisure : no information\ntourism : zoo\npublic_transport : nan\nbrand : nan\nalt_name : nan\namenity : no information\nreservation : nan\nattraction : nan\nhighchair : nan\nparking : nan\nswimming_pool : nan\ncontact_phone : 12-425-35-51\ncommunity_centre : nan\naddr_street : Aleja Kasy Oszczędności Miasta Krakowa\ncontact_twitter : nan\nsocial_facility : nan\ncontact_facebook : nan\nzoo : nan\nemail : nan\nwheelchair : yes\ncuisine : nan\ncontact_website : nan\ninternet_access : nan\nopening_hours_reception : nan\nguest_house : nan\naddr_city : Kraków\ncontact_instagram : nan\nimage : nan\nlocation : nan\noutdoor_seating : nan\nmuseum : nan\ntakeaway : nan\nsmoking : nan\nname : Ogród Zoologiczny w Krakowie;Zoologischer Garten;Krakkói Állatkert;Zoo Kraków\nid : 3437\n\nphone : nan\ncemetery : nan\nemergency : nan\nopening_hours : nan\nwebsite : nan\npets_allowed : nan\ngeometry : POLYGON ((19.9387655 50.0935991, 19.9387982 50.0936304, 19.9388396 50.0936718, 19.9393858 50.0942121, 19.9394003 50.0942265, 19.939796 50.0946183, 19.9398792 50.0946985, 19.9399606 50.0947802, 19.9399982 50.0948177, 19.9402786 50.0946815, 19.9403077 50.0946788, 19.9403427 50.0946755, 19.9405167 50.0946592, 19.9418397 50.0942213, 19.9440851 50.0934546, 19.9444359 50.0933794, 19.9444766 50.0933723, 19.9445166 50.0933698, 19.9445478 50.0933716, 19.9445366 50.0933124, 19.9444255 50.0929758, 19.9444451 50.0927785, 19.94445 50.0927286, 19.9436043 50.0929382, 19.9432829 50.0930179, 19.9431364 50.0930083, 19.9430851 50.0930049, 19.9428692 50.0929307, 19.9428198 50.0929148, 19.9427197 50.0928883, 19.9425719 50.0928676, 19.9423736 50.0928399, 19.9422212 50.0928317, 19.9420936 50.0927518, 19.9420714 50.0927372, 19.9417284 50.0925121, 19.9414615 50.0924064, 19.9411309 50.0922671, 19.9409954 50.0922188, 19.9408707 50.0921865, 19.9407755 50.0921731, 19.9400066 50.0922184, 19.9401298 50.0923461, 19.9401859 50.0924695, 19.9402139 50.0926669, 19.9401838 50.0926958, 19.9401536 50.0927204, 19.9401186 50.0927481, 19.9400867 50.0927698, 19.9400531 50.0927896, 19.9400189 50.0928083, 19.9399791 50.0928299, 19.9398461 50.0928916, 19.9396273 50.0929924, 19.9393434 50.0931236, 19.9389671 50.0929558, 19.9387234 50.0934174, 19.9387162 50.0934324, 19.9387118 50.0934474, 19.9387085 50.0934627, 19.9387074 50.0934779, 19.9387096 50.0934923, 19.9387153 50.0935071, 19.9387275 50.0935362, 19.9387528 50.0935823, 19.9387587 50.0935902, 19.9387655 50.0935991))\nhistoric : no information\nwiki_summary_en : Tadeusz Kościuszko Park – a park in Krakow near the Białoprądnicki Manor (until the end of the 1950s Mirockich), bordered by the streets: Łukasza Górnickiego, Białoprądnicka, Papiernicza, and Józefa Mackiewicza. Nearby is the Clepardia sports club and an outdoor swimming pool. The Białucha River (Prądnik) flows through the park. The park serves a recreational purpose for local residents, as well as for participants in artistic programs organized by the “Dworek Białoprądnicki” Cultural Center. There is a playground for children within the park.\npostal_code : nan\ntoilets : nan\nnatural : no information\ndescription : nan\nvisiting_time : nan\nleisure : park\ntourism : no information\npublic_transport : nan\nbrand : nan\nalt_name : nan\namenity : no information\nreservation : nan\nattraction : nan\nhighchair : nan\nparking : nan\nswimming_pool : nan\ncontact_phone : nan\ncommunity_centre : nan\naddr_street : nan\ncontact_twitter : nan\nsocial_facility : nan\ncontact_facebook : nan\nzoo : nan\nemail : nan\nwheelchair : nan\ncuisine : nan\ncontact_website : nan\ninternet_access : nan\nopening_hours_reception : nan\nguest_house : nan\naddr_city : nan\ncontact_instagram : nan\nimage : nan\nlocation : nan\noutdoor_seating : nan\nmuseum : nan\ntakeaway : nan\nsmoking : nan\nname : Park im. Tadeusza Kościuszki;Park imienia Tadeusza Kościuszki\nid : 3450\n\nphone : nan\ncemetery : nan\nemergency : nan\nopening_hours : Mo-Fr 08:00-16:00\nwebsite : https://dworek.eu/\npets_allowed : nan\ngeometry : POLYGON ((19.9406886 50.0928475, 19.9407847 50.0929495, 19.9410392 50.0928509, 19.9411519 50.0928072, 19.9411251 50.0927787, 19.9411201 50.0927734, 19.9410568 50.0927062, 19.9409401 50.0927514, 19.9409062 50.0927154, 19.9408476 50.0927381, 19.9407875 50.0927614, 19.9408204 50.0927964, 19.9406886 50.0928475))\nhistoric : no information\nwiki_summary_en : The Cultural Center “Dworek Białoprądnicki” - a cultural center located in a historic manor house in Kraków on Biały Prądnik, surrounded by the Tadeusz Kościuszko Park.\npostal_code : nan\ntoilets : nan\nnatural : no information\ndescription : nan\nvisiting_time : nan\nleisure : no information\ntourism : attraction\npublic_transport : nan\nbrand : nan\nalt_name : nan\namenity : no information\nreservation : nan\nattraction : nan\nhighchair : nan\nparking : nan\nswimming_pool : nan\ncontact_phone : nan\ncommunity_centre : nan\naddr_street : Papiernicza\ncontact_twitter : nan\nsocial_facility : nan\ncontact_facebook : nan\nzoo : nan\nemail : nan\nwheelchair : nan\ncuisine : nan\ncontact_website : nan\ninternet_access : nan\nopening_hours_reception : nan\nguest_house : nan\naddr_city : Kraków\ncontact_instagram : nan\nimage : nan\nlocation : nan\noutdoor_seating : nan\nmuseum : nan\ntakeaway : nan\nsmoking : nan\nname : Dworek Białoprądnicki\nid : 3456\n\nphone : nan\ncemetery : nan\nemergency : nan\nopening_hours : nan\nwebsite : nan\npets_allowed : nan\ngeometry : POLYGON ((20.111406 50.1070841, 20.1114911 50.1067895, 20.1116 50.1065681, 20.1116878 50.1063915, 20.1117517 50.1062293, 20.1119843 50.1059433, 20.1121885 50.1058116, 20.1125549 50.1055753, 20.1128953 50.1053647, 20.1130641 50.105595, 20.1131597 50.1058006, 20.1137647 50.1056256, 20.1140403 50.1059871, 20.1155259 50.1082775, 20.1137021 50.1085299, 20.1129247 50.1086262, 20.1125032 50.1079346, 20.1124652 50.1077676, 20.1125941 50.1076354, 20.1126033 50.1075526, 20.112493 50.1071857, 20.1124419 50.1070851, 20.1118732 50.1072334, 20.1115276 50.1072153, 20.111406 50.1070841))\nhistoric : no information\nwiki_summary_en : Park in Łuczanowice – a park in Kraków, in the XVII district of Wzgórza Krzesławickie, located between the streets: Andrzej Mycielski, Ludwik Hieronim Morstin, and Lasowisko, entered into the register of immovable monuments of the Małopolska Voivodeship. It belongs to manor parks. It occupies an area of 4.60 hectares. It surrounds a manor designed in 1902 by Tadeusz Stryjeński for Count Władysław Mycielski. The palace and park complex was entered into the register of monuments of the city of Kraków on November 26, 1980, under number A-604. The manor complex was originally surrounded by a park in the English style. On its grounds, there were two ponds fed by the waters of the Łucjanówka stream. One of the ponds has been filled in. The other is very neglected. The water bodies are home to protected species of amphibians, including: the common frog, the marsh frog, and newts. Additionally, the park serves as a habitat for other legally protected animal species, including woodpeckers, tits, and blackbirds, as well as squirrels, martens, and hares. The park contains remnants of ancient trees. The park's plantings consist of the following species: black locust, small-leaved lime, prickly spruce, black elder, edible dogwood, common pine, oaks, and exotic plants.\npostal_code : nan\ntoilets : nan\nnatural : no information\ndescription : nan\nvisiting_time : nan\nleisure : park\ntourism : no information\npublic_transport : nan\nbrand : nan\nalt_name : nan\namenity : no information\nreservation : nan\nattraction : nan\nhighchair : nan\nparking : nan\nswimming_pool : nan\ncontact_phone : nan\ncommunity_centre : nan\naddr_street : nan\ncontact_twitter : nan\nsocial_facility : nan\ncontact_facebook : nan\nzoo : nan\nemail : nan\nwheelchair : nan\ncuisine : nan\ncontact_website : nan\ninternet_access : nan\nopening_hours_reception : nan\nguest_house : nan\naddr_city : nan\ncontact_instagram : nan\nimage : nan\nlocation : nan\noutdoor_seating : nan\nmuseum : nan\ntakeaway : nan\nsmoking : nan\nname : Park dworski w Łuczanowicach\nid : 3564\n\nphone : +48 12 642 87 00;+48 12 642 87 01;+48 12 642 40 70;+48 12 642 40 71\ncemetery : nan\nemergency : nan\nopening_hours : nan\nwebsite : https://muzeumlotnictwa.pl/muzeum/pl/\npets_allowed : nan\ngeometry : POLYGON ((19.9892381 50.0865836, 19.9894045 50.0849145, 19.991821 50.0843764, 19.9922833 50.0842237, 19.9957528 50.0834325, 19.9954072 50.0827986, 19.9919336 50.0835775, 19.9918269 50.0836881, 19.9894817 50.0841356, 19.9894964 50.0839292, 19.9888836 50.0839084, 19.9888272 50.08341, 19.9875043 50.0834205, 19.987372 50.0837324, 19.986768 50.0837468, 19.9867325 50.0841354, 19.9864581 50.0843445, 19.9856156 50.084558, 19.9851017 50.0848111, 19.9849667 50.084962, 19.9845493 50.0853662, 19.983882 50.0856232, 19.9822984 50.0856173, 19.9823758 50.0859194, 19.9834138 50.0859407, 19.9846016 50.0860298, 19.9866951 50.0863242, 19.9892381 50.0865836))\nhistoric : no information\nwiki_summary_en : Lądowisko Kraków-Czyżyny is a landing site in Kraków, located in the northeastern part of the city, in two areas: Rakowice and Czyżyny, in the Małopolskie Voivodeship, operating since 2003 on the grounds of the former Kraków-Rakowice-Czyżyny airport. The landing site belongs to the Polish Aviation Museum and has been listed in the ULC landing sites registry since 2012. Since 2004, it has been the venue for the Małopolski Aviation Picnic, during which air shows take place (since 2018, the Civil Aviation Authority has not permitted takeoffs and landings by aircraft from the runway during the event). It has a concrete runway with a length of 730 m.\npostal_code : nan\ntoilets : nan\nnatural : no information\ndescription : nan\nvisiting_time : nan\nleisure : no information\ntourism : no information\npublic_transport : nan\nbrand : nan\nalt_name : nan\namenity : no information\nreservation : nan\nattraction : nan\nhighchair : nan\nparking : nan\nswimming_pool : nan\ncontact_phone : nan\ncommunity_centre : nan\naddr_street : nan\ncontact_twitter : nan\nsocial_facility : nan\ncontact_facebook : nan\nzoo : nan\nemail : info@muzeumlotnictwa.pl\nwheelchair : nan\ncuisine : nan\ncontact_website : nan\ninternet_access : nan\nopening_hours_reception : nan\nguest_house : nan\naddr_city : nan\ncontact_instagram : nan\nimage : nan\nlocation : nan\noutdoor_seating : nan\nmuseum : nan\ntakeaway : nan\nsmoking : nan\nname : Lądowisko Kraków-Czyżyny;EPKC Kraków-Rakowice-Czyżyny\nid : 9267\n\nphone : nan\ncemetery : nan\nemergency : nan\nopening_hours : nan\nwebsite : nan\npets_allowed : nan\ngeometry : POLYGON ((19.8517468 50.055023, 19.8517671 50.0549905, 19.8525177 50.0551833, 19.8525726 50.0551981, 19.8526113 50.0552001, 19.8526435 50.0551956, 19.852756 50.0551243, 19.8527959 50.0551502, 19.8526894 50.0552178, 19.8526251 50.0552296, 19.8525516 50.0552296, 19.8517468 50.055023))\nhistoric : no information\nwiki_summary_en : no information\npostal_code : nan\ntoilets : nan\nnatural : no information\ndescription : nan\nvisiting_time : nan\nleisure : no information\ntourism : attraction\npublic_transport : nan\nbrand : nan\nalt_name : nan\namenity : no information\nreservation : nan\nattraction : animal\nhighchair : nan\nparking : nan\nswimming_pool : nan\ncontact_phone : nan\ncommunity_centre : nan\naddr_street : nan\ncontact_twitter : nan\nsocial_facility : nan\ncontact_facebook : nan\nzoo : nan\nemail : nan\nwheelchair : yes\ncuisine : nan\ncontact_website : nan\ninternet_access : nan\nopening_hours_reception : nan\nguest_house : nan\naddr_city : nan\ncontact_instagram : nan\nimage : nan\nlocation : nan\noutdoor_seating : nan\nmuseum : nan\ntakeaway : nan\nsmoking : nan\nname : Woliery ptaków;Ptačí voliéry\nid : 3957\n\n",
  "answer": "I'm sorry, but the information regarding pet policies is not available for the attractions you've inquired about.",
  "labels": {
    "faithfulness": "FAITHFUL",
    "groundedness": "NON_GROUNDED",
    "relevance": "RELEVANT",
    "completeness": "PARTLY_COMPLETE",
    "coherence": "COHERENT",
    "conciseness": "CONCISE"
  },
  "quality_score": 4
}