{
  "model": "gemini_llm",
  "prompt": "prompt_A",
  "id": 2929,
  "question": "What is the significance of the Church of the Dormition of the Most Holy Theotokos in Kraków's religious landscape?",
  "context": "phone : nan\ncemetery : nan\nemergency : nan\nopening_hours : nan\nwebsite : https://www.krakow.cerkiew.pl/\npets_allowed : nan\ngeometry : POINT (19.9412887 50.0630285)\nhistoric : church\nwiki_summary_en : The Church of the Dormition of the Most Holy Theotokos (Dormition of the Most Holy Mother of God) is an Orthodox parish church located in Kraków, in a tenement at 24 Szpitalna Street, in the Old Town. The temple belongs to the Kraków deanery of the Łódź-Poznań Diocese of the Polish Autocephalous Orthodox Church.\npostal_code : nan\ntoilets : nan\nnatural : no information\ndescription : nan\nvisiting_time : nan\nleisure : no information\ntourism : no information\npublic_transport : nan\nbrand : nan\nalt_name : nan\namenity : place_of_worship\nreservation : nan\nattraction : nan\nhighchair : nan\nparking : nan\nswimming_pool : nan\ncontact_phone : nan\ncommunity_centre : nan\naddr_street : Szpitalna\ncontact_twitter : nan\nsocial_facility : nan\ncontact_facebook : nan\nzoo : nan\nemail : nan\nwheelchair : limited\ncuisine : nan\ncontact_website : nan\ninternet_access : nan\nopening_hours_reception : nan\nguest_house : nan\naddr_city : Kraków\ncontact_instagram : nan\nimage : nan\nlocation : nan\noutdoor_seating : nan\nmuseum : nan\ntakeaway : nan\nsmoking : nan\nname : Cerkiew Zaśnięcia Najświętszej Marii Panny;Synagoga Ahawat Raim;Mária mennybevétele ortodox templom\nid : 2929\n\nphone : nan\ncemetery : nan\nemergency : nan\nopening_hours : nan\nwebsite : http://www.mogila.cystersi.pl/\npets_allowed : nan\ngeometry : MULTIPOLYGON (((20.0538649 50.0638007, 20.0538396 50.0637816, 20.0537103 50.0637541, 20.0533827 50.0637729, 20.053311 50.0637762, 20.0531343 50.063785, 20.0527574 50.0638044, 20.052771 50.0638545, 20.0527839 50.063895, 20.0528677 50.0640716, 20.0528746 50.0640835, 20.0528959 50.0641283, 20.0529168 50.0641652, 20.0527529 50.0642286, 20.0526798 50.0642436, 20.0525246 50.064245, 20.0522881 50.0642501, 20.0522515 50.0643846, 20.0522458 50.06441, 20.0522394 50.0644326, 20.0522131 50.0645282, 20.0522109 50.0646453, 20.0522664 50.0646915, 20.0522868 50.0646929, 20.0522878 50.0647657, 20.0522896 50.0648958, 20.0522871 50.0652177, 20.0522844 50.0652573, 20.0522802 50.0652573, 20.0522833 50.0653822, 20.0522871 50.0653822, 20.0522893 50.0654085, 20.0522903 50.0654246, 20.052286 50.0654245, 20.0522916 50.0656417, 20.0522957 50.0656418, 20.0522956 50.0656667, 20.0522956 50.0656849, 20.0522913 50.0656849, 20.0522954 50.0659534, 20.0522996 50.0659654, 20.0523034 50.0659647, 20.0523758 50.0659671, 20.0529246 50.065963, 20.0532632 50.0659703, 20.0538947 50.0659899, 20.0547618 50.0660164, 20.0550288 50.0649613, 20.0550418 50.0649596, 20.0550503 50.0649524, 20.0550517 50.0649468, 20.0550498 50.0649396, 20.0550432 50.0649336, 20.0550332 50.0649314, 20.055024 50.0649325, 20.0550156 50.0649367, 20.0550089 50.0649428, 20.0546864 50.0649338, 20.0547042 50.0647861, 20.0547166 50.0646257, 20.0547404 50.0643191, 20.054744 50.064303, 20.054744 50.064292, 20.054743 50.064292, 20.054757 50.063885, 20.054758 50.063885, 20.0547594 50.063874, 20.054758 50.063791, 20.0547571 50.0637007, 20.054448 50.063715, 20.0542373 50.063726, 20.054096 50.063761, 20.054038 50.063843, 20.0540223 50.0638447, 20.0539928 50.0638471, 20.0539526 50.06385, 20.0539526 50.063853, 20.0539362 50.0638554, 20.0539224 50.063844, 20.0538649 50.0638007)), ((20.0512667 50.065802, 20.0513406 50.0658079, 20.0513529 50.0658089, 20.0513593 50.0658096, 20.0514807 50.0658228, 20.0516022 50.0658326, 20.0518335 50.0658433, 20.0520117 50.0658373, 20.0520494 50.0658347, 20.0520532 50.0658347, 20.0520312 50.0655537, 20.0520301 50.06552, 20.0520291 50.0654927, 20.0520291 50.0654458, 20.0520246 50.0654457, 20.0520206 50.0653292, 20.0514107 50.0653403, 20.0512667 50.065802)))\nhistoric : no information\nwiki_summary_en : Mogiła Abbey (Polish: Opactwo Cystersów w Mogile; Latin: Abbatia B.M.V. de Clara Tumba) is a Cistercian monastery in the Nowa Huta District of Kraków, Poland. The abbey was founded in 1222 by the Bishop of Kraków, Iwo Odrowąż. The religious complex was built for religious reasons as well as for prestige. It was the largest and most impressive church in medieval Poland after Wawel Cathedral, and served as the Odrowąż family's burial place until the 16th century.\nThe architectural complex includes the stuccoed Polish Gothic church, the Basilica of the Holy Cross (Polish: Bazylika Krzyża Świętego), which serves as the Parish Church of St. Bartholomew the Apostle as well as the abbey church for the monks. There is also the Polish Renaissance-style abbot's palace, built around 1569, as well as the red-brick monastery, with a broad inner courtyard, outbuildings, vegetable garden, greenhouse, etc.\npostal_code : nan\ntoilets : nan\nnatural : no information\ndescription : nan\nvisiting_time : nan\nleisure : no information\ntourism : attraction\npublic_transport : nan\nbrand : nan\nalt_name : nan\namenity : monastery\nreservation : nan\nattraction : nan\nhighchair : nan\nparking : nan\nswimming_pool : nan\ncontact_phone : nan\ncommunity_centre : nan\naddr_street : nan\ncontact_twitter : nan\nsocial_facility : nan\ncontact_facebook : nan\nzoo : nan\nemail : nan\nwheelchair : nan\ncuisine : nan\ncontact_website : nan\ninternet_access : nan\nopening_hours_reception : nan\nguest_house : nan\naddr_city : nan\ncontact_instagram : nan\nimage : nan\nlocation : nan\noutdoor_seating : nan\nmuseum : nan\ntakeaway : nan\nsmoking : nan\nname : Opactwo Cystersów w Mogile\nid : 3425\n\nphone : nan\ncemetery : nan\nemergency : nan\nopening_hours : Mo-Sa 09:00-17:00; Su 13:30-18:00\nwebsite : http://www.kosciolwojciecha.pl/\npets_allowed : nan\ngeometry : POLYGON ((19.9376467 50.0609416, 19.9377635 50.0609446, 19.937768 50.0609525, 19.9377746 50.0609573, 19.9377835 50.0609603, 19.937795 50.0609631, 19.9378085 50.0609625, 19.9378202 50.0609603, 19.9378321 50.0609536, 19.9378363 50.0609489, 19.9378391 50.0609421, 19.9378389 50.0609212, 19.9378382 50.0608655, 19.9378376 50.0608168, 19.9378351 50.0608149, 19.9378306 50.0608128, 19.9377281 50.0608138, 19.9377226 50.0608158, 19.9377211 50.0608184, 19.9377221 50.0608429, 19.9377229 50.0608675, 19.9377046 50.0608672, 19.9376958 50.060867, 19.9376499 50.0608664, 19.9376481 50.0609093, 19.9376467 50.0609416))\nhistoric : church\nwiki_summary_en : The Church of St. Adalbert or the Church of St. Wojciech (Polish: Kościół św. Wojciecha), located on the intersection of the Main Market Square and Grodzka Street in Old Town, Kraków, is one of the oldest stone churches in Poland. Its almost 1000-year-old history goes back to the beginning of the Polish Romanesque architecture of the early Middle Ages. Throughout the early history of Kraków the Church of St. Wojciech was a place of worship first visited by merchants travelling from across Europe. It was a place where citizens and nobility would meet.\npostal_code : nan\ntoilets : nan\nnatural : no information\ndescription : nan\nvisiting_time : nan\nleisure : no information\ntourism : attraction\npublic_transport : nan\nbrand : nan\nalt_name : nan\namenity : place_of_worship\nreservation : nan\nattraction : nan\nhighchair : nan\nparking : nan\nswimming_pool : nan\ncontact_phone : nan\ncommunity_centre : nan\naddr_street : nan\ncontact_twitter : nan\nsocial_facility : nan\ncontact_facebook : nan\nzoo : nan\nemail : nan\nwheelchair : nan\ncuisine : nan\ncontact_website : nan\ninternet_access : nan\nopening_hours_reception : nan\nguest_house : nan\naddr_city : nan\ncontact_instagram : nan\nimage : http://commons.wikimedia.org/wiki/File:Church_of_St_Adalbert,_2_Main_Market_square,Old_Town,Krakow,Poland.jpg\nlocation : nan\noutdoor_seating : nan\nmuseum : nan\ntakeaway : nan\nsmoking : nan\nname : Kościół pw. Świętego Wojciecha Biskupa i Męczennika;St. Adalbert's church;Iglesia de San Adalberto;Prágai Szent Adalbert templom;Касцёл Святога Войцеха;성 보치에하 성당\nid : 3453\n\nphone : nan\ncemetery : nan\nemergency : nan\nopening_hours : nan\nwebsite : nan\npets_allowed : nan\ngeometry : POLYGON ((19.9275262 50.0605272, 19.9275366 50.0604942, 19.9275125 50.0604903, 19.9275261 50.0604577, 19.9275031 50.0604537, 19.9275172 50.0604225, 19.9275407 50.0604269, 19.9275547 50.0603937, 19.9275734 50.0603969, 19.9275935 50.0603658, 19.9277809 50.0604318, 19.9278005 50.0604541, 19.9278586 50.0604643, 19.9278624 50.0604551, 19.9278662 50.0604558, 19.92787 50.0604453, 19.9280045 50.0604683, 19.9279927 50.0604965, 19.9280105 50.0604997, 19.9279896 50.0605493, 19.9279104 50.0605354, 19.9279085 50.0605397, 19.9279163 50.0605483, 19.9279066 50.060552, 19.9278956 50.0605409, 19.9278417 50.0605314, 19.9278373 50.0605408, 19.9278266 50.0605388, 19.9278307 50.0605298, 19.9277728 50.0605192, 19.9277393 50.0605315, 19.9275262 50.0605272))\nhistoric : church\nwiki_summary_en : The Church of the Most Sacred Heart of Jesus – a historic Roman Catholic parish church and conventual church of the Sisters of the Sacred Heart located in Krakow, in the Old Town district at 24 Garncarska Street, in Nowy Świat.  \nIt was built at the end of the 19th century in an eclectic style with a predominance of Neo-Romanesque elements according to the plans of Władysław Kaczmarski, on land donated to the nuns by Duchess Wanda Jabłonowska, and funded by Zofia Wołodkowicz. It was consecrated in 1900.  \nOn the front facade of the church and monastery, there are sculptures by Jan Tombiński. In the convent house by the church, there is a museum dedicated to Bishop Józef Sebastian Pelczar, the founder of the congregation of the Sisters of the Sacred Heart. In the church, in a side chapel, there is an altar with a portrait and relics of Bishop Pelczar, and another altar where the mortal remains of the founder of the congregation, Klara Ludwika Szczęsna, were laid to rest in 1995, having been transferred from Rakowicki Cemetery. A small altar of John Paul II with relics was placed at the altar of St. Joseph in 2011. The main altar was made in 1899 by Kazimierz Wakulski, while the author of the side altars was Wit Wisz.\npostal_code : nan\ntoilets : nan\nnatural : no information\ndescription : nan\nvisiting_time : nan\nleisure : no information\ntourism : no information\npublic_transport : nan\nbrand : nan\nalt_name : nan\namenity : place_of_worship\nreservation : nan\nattraction : nan\nhighchair : nan\nparking : nan\nswimming_pool : nan\ncontact_phone : nan\ncommunity_centre : nan\naddr_street : Garncarska\ncontact_twitter : nan\nsocial_facility : nan\ncontact_facebook : nan\nzoo : nan\nemail : nan\nwheelchair : nan\ncuisine : nan\ncontact_website : nan\ninternet_access : nan\nopening_hours_reception : nan\nguest_house : nan\naddr_city : Kraków\ncontact_instagram : nan\nimage : http://commons.wikimedia.org/wiki/File:Ko%C5%9Bci%C3%B3%C5%82_Naj%C5%9Bwi%C4%99tszego_Serca_Pana_Jezusa,_Krak%C3%B3w.JPG\nlocation : nan\noutdoor_seating : nan\nmuseum : nan\ntakeaway : nan\nsmoking : nan\nname : Kościół pw. Najświętszego Serca Pana Jezusa;Jézus Szent Szíve templom\nid : 3470\n\nphone : +48 12 4299516\ncemetery : nan\nemergency : nan\nopening_hours : Mo-Sa 06:30-17:00; Su 07:00-17:30; Apr-Oct Mo-Sa 06:30-18:00; Apr-Oct Su 07:00-18:30\nwebsite : https://katedra-wawelska.pl/\npets_allowed : nan\ngeometry : POLYGON ((19.9350267 50.0547621, 19.9351801 50.0547877, 19.9351852 50.054776, 19.9352863 50.0547883, 19.935287 50.0547842, 19.9353228 50.0547912, 19.9353207 50.054796, 19.9353981 50.0548095, 19.9354382 50.0548137, 19.9354318 50.0548365, 19.9355033 50.0548445, 19.935508 50.0548209, 19.9356347 50.0548346, 19.935633 50.0548414, 19.9356313 50.0548482, 19.9356071 50.0548456, 19.9356039 50.0548584, 19.9357008 50.0548683, 19.9357106 50.0548393, 19.9359061 50.0548663, 19.9359083 50.0548479, 19.9359115 50.054821, 19.9359141 50.0548217, 19.9359204 50.0548158, 19.9359075 50.0548102, 19.9359128 50.0547898, 19.9359218 50.0547906, 19.9359231 50.0547799, 19.935929 50.0547634, 19.9359722 50.0547703, 19.9359682 50.0547857, 19.9360072 50.0547911, 19.9360104 50.0547714, 19.9359976 50.0547702, 19.9360077 50.0547402, 19.9360293 50.0547424, 19.9360324 50.0547325, 19.9360109 50.0547293, 19.9360225 50.0546945, 19.9359589 50.0546852, 19.9359852 50.0546175, 19.935974 50.0546156, 19.9359753 50.0546121, 19.9359837 50.0545885, 19.9358638 50.0545703, 19.9358711 50.0545549, 19.9358382 50.0545504, 19.9358298 50.0545493, 19.9358319 50.0545435, 19.9358228 50.0545421, 19.9358203 50.054548, 19.9356055 50.0545195, 19.9356124 50.0544999, 19.9354891 50.0544821, 19.9354671 50.054545, 19.9354408 50.0545407, 19.9354145 50.0545363, 19.9354442 50.0544728, 19.9353166 50.0544484, 19.9353066 50.0544694, 19.935213 50.0544481, 19.9352133 50.0544473, 19.9351785 50.0544407, 19.9351351 50.0544304, 19.9351279 50.0544194, 19.9351161 50.0544224, 19.9351245 50.0544339, 19.9351163 50.054453, 19.9350942 50.054448, 19.9350819 50.0544632, 19.9350238 50.0544517, 19.9349742 50.054555, 19.9350638 50.0545727, 19.9350576 50.0545886, 19.9350511 50.0546051, 19.9350272 50.0546015, 19.9349591 50.0545914, 19.9349577 50.0545955, 19.9349268 50.0546834, 19.9350349 50.054699, 19.9350396 50.0546904, 19.9350477 50.0546921, 19.9350433 50.0547004, 19.9350204 50.0547442, 19.9349971 50.0547531, 19.935004 50.0547606, 19.9350195 50.0547609, 19.9350267 50.0547621))\nhistoric : yes\nwiki_summary_en : The Wawel Cathedral (Polish: Katedra Wawelska), formally titled the Archcathedral Basilica of Saint Stanislaus and Saint Wenceslaus, (Polish: Bazylika archikatedralna św. Stanisława i św. Wacława) is a Catholic cathedral situated on Wawel Hill in Kraków, Poland. Nearly 1000 years old, it is part of the Wawel Castle Complex and is a national sanctuary which served as the coronation site of Polish monarchs.\nThe current Gothic cathedral is the third edifice on this site; the first was constructed and destroyed in the 11th century and the second one, constructed in the 12th century, was destroyed by a fire in 1305. The construction of the existing church began in the 14th century on the orders of Bishop Nanker. Over time, the building was expanded by successive rulers resulting in its versatile and eclectic architectural composition. There are examples of Romanesque, Gothic, Renaissance, Baroque, Neoclassical and Neogothic elements in the cathedral's façade and interior. The exterior is adorned by side chapels and representative mausoleums, most notable being the golden-domed Sigismund's Chapel.\nIt is the official seat of the Archbishop of Kraków and of the Archdiocese of Kraków. A symbol of Polish statehood and faith, the cathedral hosts important religious events and annual celebrations. Karol Wojtyła, who in 1978 became Pope John Paul II, the day after his ordination to the priesthood offered his first Mass as a priest at the Wawel Crypt on 2 November 1946, and was ordained Kraków's auxiliary bishop in the cathedral on 28 September 1958.\npostal_code : nan\ntoilets : nan\nnatural : no information\ndescription : nan\nvisiting_time : nan\nleisure : no information\ntourism : attraction\npublic_transport : nan\nbrand : nan\nalt_name : Bazylika archikatedralna pw. Świętych Stanisława i Wacława\namenity : place_of_worship\nreservation : nan\nattraction : nan\nhighchair : nan\nparking : nan\nswimming_pool : nan\ncontact_phone : nan\ncommunity_centre : nan\naddr_street : nan\ncontact_twitter : nan\nsocial_facility : nan\ncontact_facebook : nan\nzoo : nan\nemail : info@katedra-wawelska.pl\nwheelchair : yes\ncuisine : nan\ncontact_website : nan\ninternet_access : nan\nopening_hours_reception : nan\nguest_house : nan\naddr_city : Kraków\ncontact_instagram : nan\nimage : http://commons.wikimedia.org/wiki/File:Wawel_cathedral.PNG\nlocation : nan\noutdoor_seating : nan\nmuseum : nan\ntakeaway : nan\nsmoking : nan\nname : Kościół pw. Świętych Stanisława i Wacława;Royal Archcathedral Basilica of Saints Stanislaus and Wenceslaus;Bazylika archikatedralna pw. Świętych Stanisława i Wacława;Catedral de San Wenceslao y San Estanislao;Кафедральний собор святих Станіслава і Вацлава;Kathedrale St. Stanislaus und Wenzel;Собор Святых Станислава и Вацлава;Waweli főszékesegyház (Szent Szaniszló és Vencel);Сабор Святых Станіслава і Вацлава;Cattedrale del Wawel;Cathédrale du Wawel;ヴァヴェル大聖堂;Šventųjų Stanislovo ir Vaclovo katedra;קתדרלת ואוול;Vavelska katedrala;Katedrála na Wawelu;瓦維爾主教座堂;바벨 대성당;Wawelkathedraal;Catedrala Wawel;Wawelská katedrála;Wawel Cathedral;Wawel-katedraal;Вавелска катедрала;Catedral de Wawel;Καθεδρικός Ναός της Κρακοβίας;Wawelin katedraali;Katedral Wawel;Wawelkatedralen;มหาวิหารวาเวล\nid : 3502\n\nphone : nan\ncemetery : nan\nemergency : nan\nopening_hours : nan\nwebsite : https://www.franciszkanska.pl/\npets_allowed : nan\ngeometry : POLYGON ((19.9360453 50.0593627, 19.9360469 50.0593477, 19.9359662 50.0593431, 19.935963 50.0593572, 19.9359395 50.0593554, 19.9359408 50.0593405, 19.93587 50.0593358, 19.9358672 50.05935, 19.9358438 50.0593481, 19.9358462 50.0593342, 19.9357696 50.0593289, 19.9357671 50.0593435, 19.9357433 50.0593415, 19.9357461 50.0593267, 19.935667 50.0593204, 19.9356644 50.0593359, 19.9355814 50.059326, 19.9355849 50.0593183, 19.9355829 50.059318, 19.935584 50.0592994, 19.9355858 50.0592995, 19.9355969 50.0592277, 19.935595 50.0592274, 19.9356048 50.059174, 19.9356079 50.0591741, 19.9356112 50.0591704, 19.9356179 50.0591699, 19.9356219 50.0591701, 19.9356236 50.0591596, 19.9356254 50.0591481, 19.9356217 50.0591479, 19.9356152 50.0591462, 19.9356133 50.0591425, 19.93561 50.0591421, 19.9356162 50.0590991, 19.9356177 50.0590892, 19.9362173 50.0591319, 19.9362286 50.0590723, 19.9364226 50.0590902, 19.9364291 50.0590596, 19.9364809 50.0590643, 19.9364705 50.059098, 19.9364995 50.0591222, 19.936494 50.0591529, 19.9365123 50.0591544, 19.9365104 50.0591711, 19.9365411 50.0591734, 19.9365552 50.0591568, 19.9365702 50.0591624, 19.9365559 50.0591791, 19.9365838 50.0592002, 19.9366139 50.059195, 19.9366183 50.0592055, 19.9365891 50.0592115, 19.9365846 50.0592389, 19.9366105 50.059249, 19.9366019 50.059259, 19.9365762 50.0592492, 19.936541 50.0592653, 19.9365471 50.0592841, 19.93653 50.0592862, 19.9365248 50.059269, 19.9364932 50.0592667, 19.9364901 50.0592857, 19.9364735 50.0592845, 19.9364788 50.0592658, 19.9364397 50.0592637, 19.9364567 50.0592812, 19.9364544 50.0592923, 19.9364496 50.0593165, 19.9364083 50.0593405, 19.9363033 50.0593336, 19.9362996 50.0593621, 19.9363038 50.0593622, 19.9363026 50.0593695, 19.9362916 50.0593689, 19.9362916 50.0593661, 19.9362474 50.0593633, 19.936183 50.0593593, 19.9361771 50.0593589, 19.9361763 50.0593655, 19.9360694 50.0593605, 19.9360684 50.059364, 19.9360453 50.0593627))\nhistoric : church\nwiki_summary_en : The Church of St. Francis of Assisi (Polish: Kościół św. Franciszka z Asyżu) and Friary of the Conventual Friars Minor located in the Old Town district of Kraków, Poland, are a Roman Catholic religious complex on the west side of All Saints Square at Franciszkańska 2, across the street from the Bishop's Palace in Krakow – which served as the residence of Pope John Paul II during his stays in the city. The Church dates back to the 13th century. The saint Maximilian Kolbe was a friar there in 1919, and led his first service at this church upon Poland's return to sovereignty.\npostal_code : nan\ntoilets : nan\nnatural : no information\ndescription : Ojców Franciszkanów\nvisiting_time : nan\nleisure : no information\ntourism : no information\npublic_transport : nan\nbrand : nan\nalt_name : Kościół pw. Świętego Franciszka z Asyżu\namenity : place_of_worship\nreservation : nan\nattraction : nan\nhighchair : nan\nparking : nan\nswimming_pool : nan\ncontact_phone : nan\ncommunity_centre : nan\naddr_street : Plac Wszystkich Świętych\ncontact_twitter : nan\nsocial_facility : nan\ncontact_facebook : nan\nzoo : nan\nemail : nan\nwheelchair : nan\ncuisine : nan\ncontact_website : nan\ninternet_access : nan\nopening_hours_reception : nan\nguest_house : nan\naddr_city : Kraków\ncontact_instagram : nan\nimage : http://commons.wikimedia.org/wiki/File:Krak%C3%B3w_-_Church_of_St._Francis_01.JPG\nlocation : nan\noutdoor_seating : nan\nmuseum : nan\ntakeaway : nan\nsmoking : nan\nname : Bazylika Świętego Franciszka z Asyżu;Franciscan Church;Kościół pw. Świętego Franciszka z Asyżu;Kościół pw. Świętego Franciszka z Asyżu w Krakowie;Basílica de los Franciscanos;Kościół Franciszkanów;Franziskanerkirche;Костёл Святого Франциска Ассизского;Assisi Szent Ferenc templom;Sanktuarium Matki Bożej Bolesnej\nid : 3566\n\nphone : nan\ncemetery : nan\nemergency : nan\nopening_hours : nan\nwebsite : nan\npets_allowed : nan\ngeometry : POLYGON ((19.9398796 50.0592974, 19.9398824 50.0592804, 19.9399096 50.0592812, 19.9399116 50.0592354, 19.9399163 50.0592351, 19.9399176 50.0592095, 19.9399135 50.059209, 19.9399155 50.0591712, 19.9399177 50.0591704, 19.9399192 50.0591498, 19.9399143 50.0591467, 19.9399006 50.0591461, 19.9399004 50.0591496, 19.9398556 50.059148, 19.9398401 50.0591361, 19.9398424 50.0591082, 19.9398467 50.0591081, 19.939847 50.0591028, 19.9398474 50.0590959, 19.9398075 50.059095, 19.9398067 50.0590975, 19.9397524 50.0590954, 19.939753 50.0590927, 19.9397116 50.0590912, 19.9397098 50.0591023, 19.9397149 50.0591026, 19.9397126 50.0591328, 19.9396939 50.0591424, 19.9396522 50.0591378, 19.9396497 50.0591461, 19.9396206 50.0591442, 19.939488 50.0591354, 19.9394846 50.0591614, 19.9393687 50.059155, 19.9391801 50.0591435, 19.9391827 50.059126, 19.9390526 50.0591187, 19.9390404 50.0591948, 19.9390361 50.0592213, 19.9390334 50.0592383, 19.9390326 50.0592488, 19.9390112 50.0592475, 19.9390105 50.059251, 19.9389786 50.0592489, 19.9389702 50.0592533, 19.93898 50.0592599, 19.9389764 50.0592822, 19.9389709 50.059282, 19.9389647 50.0592771, 19.9389561 50.0592817, 19.9389633 50.0592872, 19.9389625 50.0592927, 19.938976 50.0592932, 19.9389741 50.0593054, 19.9389725 50.059316, 19.9389596 50.0593152, 19.938959 50.0593204, 19.9389507 50.059325, 19.938958 50.0593305, 19.9389663 50.0593258, 19.9389715 50.0593262, 19.9389671 50.0593482, 19.9389568 50.0593543, 19.9389633 50.0593597, 19.939017 50.0593627, 19.9390141 50.0593878, 19.9390116 50.0594094, 19.9390028 50.0594089, 19.9390031 50.0594077, 19.9389848 50.0594067, 19.9389834 50.0594182, 19.9389854 50.0594183, 19.9389851 50.0594215, 19.9389873 50.0594216, 19.9389811 50.0594763, 19.9389792 50.0594764, 19.9389784 50.0594797, 19.9389766 50.0594797, 19.9389754 50.0594908, 19.9389932 50.0594917, 19.9389934 50.0594902, 19.9390092 50.0594914, 19.9390095 50.0594883, 19.9391055 50.0594922, 19.9393563 50.0595026, 19.9393732 50.0593944, 19.9395914 50.0594079, 19.9399977 50.0594333, 19.9400765 50.0594383, 19.9401361 50.0594413, 19.9401466 50.0593108, 19.9401466 50.0592994, 19.9400363 50.0593168, 19.9400589 50.0593061, 19.9400475 50.0592933, 19.9400204 50.0593059, 19.9398796 50.0592974))\nhistoric : church\nwiki_summary_en : The Church of the Holy Trinity (Polish: Kościół Świętej Trójcy), known colloquially as the Dominicans Church (Polish: Kościół dominikanów) is a historic Roman Catholic conventual church of the Order of Preachers located at 12 Stolarska Street in the Old Town of  Kraków, Poland. \nBuilt in a gothic style, it also houses a monastery of the Order of Preachers. Its history dates from the year 1223.\nSaint Hyacinth of Poland is buried in the church, as well as Polish monarch Leszek II the Black and Renaissance humanist Filippo Buonaccorsi.\npostal_code : nan\ntoilets : nan\nnatural : no information\ndescription : Ojców Dominikanów\nvisiting_time : nan\nleisure : no information\ntourism : no information\npublic_transport : nan\nbrand : nan\nalt_name : Kościół pw. Świętej Trójcy\namenity : place_of_worship\nreservation : nan\nattraction : nan\nhighchair : nan\nparking : nan\nswimming_pool : nan\ncontact_phone : nan\ncommunity_centre : nan\naddr_street : Stolarska\ncontact_twitter : nan\nsocial_facility : nan\ncontact_facebook : nan\nzoo : nan\nemail : nan\nwheelchair : yes\ncuisine : nan\ncontact_website : nan\ninternet_access : nan\nopening_hours_reception : nan\nguest_house : nan\naddr_city : Kraków\ncontact_instagram : nan\nimage : nan\nlocation : nan\noutdoor_seating : nan\nmuseum : nan\ntakeaway : nan\nsmoking : nan\nname : Bazylika Przenajświętszej Trójcy;Kościół pw. Świętej Trójcy;Kościół Dominikanów w Krakowie;Szentháromság templom;Sanktuarium Matki Bożej Śnieżnej\nid : 3630\n\nphone : +48 12 429 28 61\ncemetery : nan\nemergency : nan\nopening_hours : nan\nwebsite : nan\npets_allowed : nan\ngeometry : POLYGON ((19.9340569 50.0604307, 19.9339799 50.0603278, 19.9340809 50.0602952, 19.9340799 50.0602938, 19.9340863 50.0602918, 19.9340872 50.0602928, 19.9340891 50.0602922, 19.9340915 50.0602915, 19.9341167 50.0602836, 19.9341197 50.0602826, 19.9341364 50.0602774, 19.934143 50.0602753, 19.934129 50.0602567, 19.9341348 50.0602548, 19.9341384 50.0602536, 19.9342499 50.0602173, 19.9342484 50.0602152, 19.9342502 50.0602147, 19.9342663 50.0602099, 19.9342825 50.0602306, 19.9342963 50.0602264, 19.9343734 50.060332, 19.9340569 50.0604307))\nhistoric : church\nwiki_summary_en : The Orthodox Church of the Exaltation of the Holy Cross  (Polish: Cerkiew Podwyższenia Krzyża Świętego), is a historic parish Greek Catholic orthodox church (tserkov) located at 11 Wiślna Street in the Old Town of Kraków, Poland.\nIn the years 1636 to 1803 and from 1949 to 1998 it was the St. Norbert's Church.\npostal_code : nan\ntoilets : nan\nnatural : no information\ndescription : nan\nvisiting_time : nan\nleisure : no information\ntourism : no information\npublic_transport : nan\nbrand : nan\nalt_name : nan\namenity : place_of_worship\nreservation : nan\nattraction : nan\nhighchair : nan\nparking : nan\nswimming_pool : nan\ncontact_phone : nan\ncommunity_centre : nan\naddr_street : Wiślna\ncontact_twitter : nan\nsocial_facility : nan\ncontact_facebook : nan\nzoo : nan\nemail : pawliszcze@wp.pl\nwheelchair : nan\ncuisine : nan\ncontact_website : nan\ninternet_access : nan\nopening_hours_reception : nan\nguest_house : nan\naddr_city : Kraków\ncontact_instagram : nan\nimage : https://commons.wikimedia.org/wiki/File:Greek_Catholic_Church_of_St.Norbert,_11_Wislna_street,_Krakow,Poland.jpg\nlocation : nan\noutdoor_seating : nan\nmuseum : nan\ntakeaway : nan\nsmoking : nan\nname : Cerkiew pw. Podwyższenia Krzyża Świętego;Kościół św. Norberta;Szent Norbert templom\nid : 3684\n\nphone : nan\ncemetery : nan\nemergency : nan\nopening_hours : nan\nwebsite : nan\npets_allowed : nan\ngeometry : POINT (19.8258642 50.0140052)\nhistoric : no information\nwiki_summary_en : Duża Kowodrza (273 m) – a two-peaked hill in Tyniec, Kraków. Administratively, it belongs to District VIII Dębniki. Geographically, it is part of the Tyniec Hills on the Kraków Bridge within the macroregion of the Kraków Gate. These hills have been incorporated into the area of the Bielańsko-Tyniecki Landscape Park. The lower (261 m) western peak is described in some sources as Kowadza Hill. There is an ecological site named Uroczysko Kowadza on it.  \nDuża Kowodrza rises above Skołczanka and Obrony Tyńca streets. It is covered with a forest, in the middle of which are clearings. They are covered with thin soil overgrown with xerothermic grasslands. In places, limestone rocks protrude, bare or covered with mosses and lichens. It is a place for recreation, walks, and sports activities. Paths lead along all its slopes, and a marked tourist trail runs through the hill. It is located in the area of the Skołczanka nature reserve.  \nIn the southern part of the hill, there are two mass graves, where about 500 Jews from the vicinity of Kraków rest—victims of the German genocide murdered in the summer of 1942. Above, on the rocky slope, there is a Catholic center for religious worship; a picture of the Blessed Virgin Mary mounted on the rock wall, a field altar, and benches for the faithful.\npostal_code : nan\ntoilets : nan\nnatural : peak\ndescription : nan\nvisiting_time : nan\nleisure : no information\ntourism : no information\npublic_transport : nan\nbrand : nan\nalt_name : nan\namenity : no information\nreservation : nan\nattraction : nan\nhighchair : nan\nparking : nan\nswimming_pool : nan\ncontact_phone : nan\ncommunity_centre : nan\naddr_street : nan\ncontact_twitter : nan\nsocial_facility : nan\ncontact_facebook : nan\nzoo : nan\nemail : nan\nwheelchair : nan\ncuisine : nan\ncontact_website : nan\ninternet_access : nan\nopening_hours_reception : nan\nguest_house : nan\naddr_city : nan\ncontact_instagram : nan\nimage : nan\nlocation : nan\noutdoor_seating : nan\nmuseum : nan\ntakeaway : nan\nsmoking : nan\nname : Duża Kowodrza\nid : 11438\n\n",
  "answer": "The Church of the Dormition of the Most Holy Theotokos in Kraków is an Orthodox parish church located in the Old Town at 24 Szpitalna Street. It is part of the Kraków deanery of the Łódź-Poznań Diocese of the Polish Autocephalous Orthodox Church.",
  "labels": {
    "faithfulness": "FAITHFUL",
    "groundedness": "GROUNDED",
    "relevance": "RELEVANT",
    "completeness": "PARTLY_COMPLETE",
    "coherence": "COHERENT",
    "conciseness": "CONCISE"
  },
  "quality_score": 5
}