{
  "model": "gemini_llm",
  "prompt": "prompt_A",
  "id": 35,
  "question": "Can you tell me if Tradycyja has highchairs available for young children?",
  "context": "phone : nan\ncemetery : nan\nemergency : nan\nopening_hours : nan\nwebsite : nan\npets_allowed : nan\ngeometry : POINT (20.0060099 50.093101)\nhistoric : no information\nwiki_summary_en : Outdoor sculptures in Nowa Huta – outdoor sculptures in the Krakow districts: Nowa Huta, Bieńczyce, Mistrzejowice.  \nThe outdoor sculptures are scattered in various parts of Nowa Huta in squares, parks, playgrounds, and lawns within housing estates. They were created en masse in the 1960s and 70s during the thaw, when the rules of socialist realism were no longer in effect. The authorities of the newly established city created ideal working conditions for young creators. The Housing Cooperative \"Hutnik\" played a significant role in promoting art and creating an artistic environment in Nowa Huta, collaborating with the ZPAP District Board and the Creative Association \"Nowa Huta,\" which was established at the initiative of Janusz Trzebiatowski in 1969. Young artists, mostly graduates of the Krakow Academy of Fine Arts, received housing, studios, and scholarships in exchange for their sculptures, which began to adorn the green spaces of Nowa Huta. The works created during this period vary in artistic value and style. The artists employed diverse techniques and materials. Many sculptures resulting from this initiative have been preserved in Nowa Huta. In 2018, as part of a project supported by the European Year of Cultural Heritage 2018, a trail of outdoor sculptures and installations in Nowa Huta was created.\npostal_code : nan\ntoilets : nan\nnatural : no information\ndescription : nan\nvisiting_time : nan\nleisure : no information\ntourism : artwork\npublic_transport : nan\nbrand : nan\nalt_name : nan\namenity : no information\nreservation : nan\nattraction : nan\nhighchair : nan\nparking : nan\nswimming_pool : nan\ncontact_phone : nan\ncommunity_centre : nan\naddr_street : nan\ncontact_twitter : nan\nsocial_facility : nan\ncontact_facebook : nan\nzoo : nan\nemail : nan\nwheelchair : nan\ncuisine : nan\ncontact_website : nan\ninternet_access : nan\nopening_hours_reception : nan\nguest_house : nan\naddr_city : nan\ncontact_instagram : nan\nimage : nan\nlocation : nan\noutdoor_seating : nan\nmuseum : nan\ntakeaway : nan\nsmoking : nan\nname : Spirala kosmiczna;Antoni Hajdecki\nid : 3148\n\nphone : nan\ncemetery : nan\nemergency : nan\nopening_hours : nan\nwebsite : nan\npets_allowed : nan\ngeometry : POINT (20.0517538 50.0712049)\nhistoric : no information\nwiki_summary_en : Outdoor sculptures in Nowa Huta – outdoor sculptures in the districts of Kraków: Nowa Huta, Bieńczyce, Mistrzejowice.  \nThe outdoor sculptures are scattered in various parts of Nowa Huta, in squares, parks, playgrounds, and lawns within housing estates. They were created en masse in the 1960s and 1970s during the thaw when the rules of socialist realism ceased to apply. The authorities of the newly created city provided ideal working conditions for young creators. The Housing Cooperative “Hutnik” played a significant role in popularizing art and creating an artistic environment in Nowa Huta, collaborating with the Management Board of the District ZPAP and the Creative Association “Nowa Huta,” which was initiated by Janusz Trzebiatowski in 1969. Young artists, mostly graduates of the Kraków Academy of Fine Arts, were provided with apartments, studios, and scholarships; in return, their sculptures began to adorn the green spaces of Nowa Huta. The works created during this period have varying artistic value and styles. Artists used diverse techniques and materials. Many sculptures resulting from this initiative have been preserved in Nowa Huta. In 2018, as part of a project under the patronage of the European Year of Cultural Heritage 2018, a trail of outdoor sculptures and installations in Nowa Huta was created.\npostal_code : nan\ntoilets : nan\nnatural : no information\ndescription : nan\nvisiting_time : nan\nleisure : no information\ntourism : artwork\npublic_transport : nan\nbrand : nan\nalt_name : nan\namenity : no information\nreservation : nan\nattraction : nan\nhighchair : nan\nparking : nan\nswimming_pool : nan\ncontact_phone : nan\ncommunity_centre : nan\naddr_street : nan\ncontact_twitter : nan\nsocial_facility : nan\ncontact_facebook : nan\nzoo : nan\nemail : nan\nwheelchair : nan\ncuisine : nan\ncontact_website : nan\ninternet_access : nan\nopening_hours_reception : nan\nguest_house : nan\naddr_city : nan\ncontact_instagram : nan\nimage : nan\nlocation : nan\noutdoor_seating : nan\nmuseum : nan\ntakeaway : nan\nsmoking : nan\nname : Organy;Lucjan Orzech\nid : 3149\n\nphone : nan\ncemetery : nan\nemergency : nan\nopening_hours : nan\nwebsite : nan\npets_allowed : nan\ngeometry : POLYGON ((19.9350859 50.0528871, 19.9350506 50.0529029, 19.9350452 50.0528976, 19.9350498 50.0528954, 19.9350355 50.0528846, 19.9350432 50.0528788, 19.9349921 50.0528405, 19.934946 50.0528597, 19.9349245 50.052837, 19.9349627 50.0528243, 19.9350677 50.0527634, 19.9350746 50.0527324, 19.9351014 50.052738, 19.9351007 50.0527441, 19.9350939 50.0527543, 19.9351346 50.0527784, 19.9351552 50.0527644, 19.9351719 50.0527743, 19.9351533 50.0527892, 19.9351829 50.0528062, 19.9352129 50.0527961, 19.9352315 50.0528142, 19.9352061 50.0528239, 19.9351951 50.0528265, 19.9351868 50.0528292, 19.9351637 50.0528428, 19.9350859 50.0528871))\nhistoric : fortification\nwiki_summary_en : Sandomierska Tower – one of the three existing towers on Wawel Hill, located at its southwestern edge. Along with the Lubranka Tower (Senatorska), it creates a unique set of the so-called fire towers from the mid-15th century.\npostal_code : nan\ntoilets : nan\nnatural : no information\ndescription : nan\nvisiting_time : nan\nleisure : no information\ntourism : attraction\npublic_transport : nan\nbrand : nan\nalt_name : nan\namenity : no information\nreservation : nan\nattraction : nan\nhighchair : nan\nparking : nan\nswimming_pool : nan\ncontact_phone : nan\ncommunity_centre : nan\naddr_street : nan\ncontact_twitter : nan\nsocial_facility : nan\ncontact_facebook : nan\nzoo : nan\nemail : nan\nwheelchair : nan\ncuisine : nan\ncontact_website : nan\ninternet_access : nan\nopening_hours_reception : nan\nguest_house : nan\naddr_city : nan\ncontact_instagram : nan\nimage : nan\nlocation : nan\noutdoor_seating : nan\nmuseum : nan\ntakeaway : nan\nsmoking : nan\nname : Baszta Sandomierska;Sandomierska Tower;Башня Сандомирская;Sandomierzi bástya\nid : 3439\n\nphone : nan\ncemetery : nan\nemergency : nan\nopening_hours : nan\nwebsite : nan\npets_allowed : nan\ngeometry : POLYGON ((19.9087754 50.0549646, 19.9088087 50.0550642, 19.9088759 50.0550554, 19.908881 50.0550678, 19.9089439 50.0550587, 19.9089391 50.0550453, 19.9089768 50.0550399, 19.9089443 50.0549395, 19.9087754 50.0549646))\nhistoric : no information\nwiki_summary_en : Zwierzyniecki House (formerly Zwierzyniecki Artistic Salon) is a branch of the Museum of Krakow located at 41 Queen Hedwig Street in Zwierzyńec, Krakow, at the foot of The Mountain of St. Bronisławy, near the monastery of Ss. Norbertanek, the Church of the Holy Salwator and the Kosciuszko mound. Zwierzyniecki House focuses on local microhistory, researching and documenting the changes that have taken place in the former suburbs of Krakow since their integration into the city. It also organizes short exhibitions devoted to the history of Krakow's suburbs, Krakow customs and outstanding representatives of the local community. A regular resident and caretaker of the Zwierzyniecki House is a black cat Włodek.\nThis branch of the Museum of Krakow is housed in a typical sub-urban tenement building from the turn of the 19th and 20th centuries. It was built by the mason Jan Florczyk. Between July and August 1912, the upstairs apartment accommodated the family of Russian revolutionary Vladimir Ulianov, better known as Lenin. To commemorate this fact, the first Lenin apartment in Krakow exhibit opened in 1970. For ten years, starting in 1980, the building was owned and operated by the Lenin Museum in Kraków, as a subsidiary. Its presentations included temporary exhibitions on the workers' movement and the proletarian revolution, presented alongside the permanent collection (Lenin's apartment). \nIn 1990, after the decommissioning of the Lenin Museum, the building was transferred to the Museum of Krakow. Initially, the structure served as a museum warehouse. From 1991 to 1996, some of the halls were used by the Ewa Demarczyk Theatre. In 1996, as a result of an agreement between the museum, the District Council of the VII Zwierzyniec, and the Zwierzyniecki Circle of Friends of All Arts (founded by the Krakow painter Halina Cieślińska-Brzeska), the Zwierzyniecki Artistic Salon, a branch of the Krakow Museum, was established in the location. In cooperation with the Circle of Friends, the branch organized temporary exhibitions, presenting the paintings, graphics and sculptures of local artists. The art exhibitions continued till 2009, when the branch updated its creative direction, dropping art exhibitions in favour of presentations showcasing the history of Zwierzyńc. The branch changed its name from Zwierzyniecki Artistic Salon to Zwierzyniecki House in 2014.\nThe permanent exhibition now features the interior of a Krakow suburb apartment at the beginning of the 20th century. Temporary exhibitions tell the history of Krakow's suburbs, ancient traditions and specific urban folklore. The branch also hosts meetings, lectures, and educational activities for children focusing on the microhistory of Krakow. Seasonal cultural events top the list of activities that harken to pre-city traditions. Key among these events is the Emaus Easter Fiesta, which features a contest for the most beautiful emaus tree. Others include the Corpus Christi meeting with the accompanying Lajkonik parade (also known as Konik Zwierzyniecki) and joint carolling at Yuletide showcasing Christmas trees decorated with toys made by children. \nZwierzyniecki House also serves as an information centre for Zwierzyńec, where you can buy guides, souvenirs and literature on the history of Krakow's suburbs published by the Museum of Krakow.\npostal_code : nan\ntoilets : nan\nnatural : no information\ndescription : nan\nvisiting_time : nan\nleisure : no information\ntourism : museum\npublic_transport : nan\nbrand : nan\nalt_name : nan\namenity : no information\nreservation : nan\nattraction : nan\nhighchair : nan\nparking : nan\nswimming_pool : nan\ncontact_phone : nan\ncommunity_centre : nan\naddr_street : Królowej Jadwigi\ncontact_twitter : nan\nsocial_facility : nan\ncontact_facebook : nan\nzoo : nan\nemail : nan\nwheelchair : nan\ncuisine : nan\ncontact_website : nan\ninternet_access : nan\nopening_hours_reception : nan\nguest_house : nan\naddr_city : Kraków\ncontact_instagram : nan\nimage : nan\nlocation : nan\noutdoor_seating : nan\nmuseum : history\ntakeaway : nan\nsmoking : nan\nname : Dom Zwierzyniecki;Zwierzyniec House;Zwierzyniec Ház\nid : 3613\n\nphone : nan\ncemetery : nan\nemergency : nan\nopening_hours : nan\nwebsite : nan\npets_allowed : nan\ngeometry : POINT (19.9451864 50.0475227)\nhistoric : no information\nwiki_summary_en : The Hospital of the Order of Saint John of God – a specialized hospital in Krakow located at 11 Trynitarska Street, in Kazimierz.\npostal_code : nan\ntoilets : nan\nnatural : no information\ndescription : nan\nvisiting_time : nan\nleisure : no information\ntourism : no information\npublic_transport : nan\nbrand : nan\nalt_name : nan\namenity : hospital\nreservation : nan\nattraction : nan\nhighchair : nan\nparking : nan\nswimming_pool : nan\ncontact_phone : +48 12 3797377\ncommunity_centre : nan\naddr_street : nan\ncontact_twitter : nan\nsocial_facility : nan\ncontact_facebook : nan\nzoo : nan\nemail : nan\nwheelchair : nan\ncuisine : nan\ncontact_website : https://bonifratrzy.pl/szpital-krakow/\ninternet_access : nan\nopening_hours_reception : nan\nguest_house : nan\naddr_city : nan\ncontact_instagram : nan\nimage : nan\nlocation : nan\noutdoor_seating : nan\nmuseum : nan\ntakeaway : nan\nsmoking : nan\nname : Szpital Zakonu Bonifratrów Świętego Jana Grandego\nid : 9677\n\nphone : nan\ncemetery : nan\nemergency : nan\nopening_hours : nan\nwebsite : nan\npets_allowed : nan\ngeometry : POLYGON ((19.9273596 50.0617535, 19.9273517 50.0617066, 19.9273122 50.0617094, 19.9273132 50.061715, 19.9273069 50.061719, 19.9272677 50.0617217, 19.9272598 50.0617202, 19.9272569 50.0617036, 19.9271999 50.0617076, 19.927205 50.0617424, 19.9270616 50.0617309, 19.9270538 50.0617301, 19.9270529 50.0617256, 19.9270418 50.0616678, 19.927072 50.0616655, 19.9270711 50.0616607, 19.9270495 50.0615452, 19.9272619 50.0615273, 19.9272648 50.0615401, 19.9272641 50.0615427, 19.9272621 50.0615453, 19.9272472 50.0615494, 19.9272392 50.0615523, 19.9272327 50.0615561, 19.927228 50.0615609, 19.9272254 50.0615665, 19.9272241 50.0615726, 19.9272242 50.0615791, 19.9272257 50.0615855, 19.9272284 50.0615914, 19.92723 50.061594, 19.9272334 50.0615975, 19.9272401 50.0616024, 19.9272481 50.0616059, 19.9272542 50.0616078, 19.9272843 50.061605, 19.9272839 50.0616032, 19.9272868 50.0616006, 19.9273307 50.0615964, 19.9273299 50.0615925, 19.9274236 50.0615841, 19.9274196 50.061566, 19.927484 50.0615599, 19.9274929 50.061559, 19.9275289 50.061753, 19.9275263 50.061753, 19.927526 50.061755, 19.9273596 50.0617535))\nhistoric : no information\nwiki_summary_en : The Maria Skłodowska-Curie National Research Institute of Oncology - Branch in Kraków - Kraków branch of the Oncology Center - Institute of Maria Skłodowska-Curie in Warsaw. The Institute is located at 11 Garncarska Street.\npostal_code : nan\ntoilets : nan\nnatural : no information\ndescription : nan\nvisiting_time : nan\nleisure : no information\ntourism : no information\npublic_transport : nan\nbrand : nan\nalt_name : nan\namenity : hospital\nreservation : nan\nattraction : nan\nhighchair : nan\nparking : nan\nswimming_pool : nan\ncontact_phone : nan\ncommunity_centre : nan\naddr_street : Garncarska\ncontact_twitter : nan\nsocial_facility : nan\ncontact_facebook : nan\nzoo : nan\nemail : nan\nwheelchair : nan\ncuisine : nan\ncontact_website : nan\ninternet_access : nan\nopening_hours_reception : nan\nguest_house : nan\naddr_city : Kraków\ncontact_instagram : nan\nimage : nan\nlocation : nan\noutdoor_seating : nan\nmuseum : nan\ntakeaway : nan\nsmoking : nan\nname : Centrum Onkologii Instytut imienia Marii Skłodowskiej\nid : 11276\n\nphone : nan\ncemetery : nan\nemergency : nan\nopening_hours : nan\nwebsite : https://mnk.pl/oddzial/biblioteka-ksiazat-czartoryskich\npets_allowed : nan\ngeometry : POLYGON ((19.9394115 50.063879, 19.9393596 50.0638107, 19.9393595 50.0638104, 19.9394366 50.0637893, 19.9394214 50.0637675, 19.9394479 50.06376, 19.9397202 50.0636821, 19.9397215 50.063684, 19.9397811 50.0637739, 19.9394115 50.063879))\nhistoric : no information\nwiki_summary_en : The Princes Czartoryski Library (Polish: Biblioteka Książąt Czartoryskich) – often abbreviated to Czartoryski Library – is a branch of the National Museum in Kraków, located at 17 St Mark Street in Kraków. It is a Polish foundation library established at the initiative of Prince Adam Kazimierz Czartoryski and Izabela Czartoryska nee Fleming in the second half of the 18th century.\npostal_code : nan\ntoilets : nan\nnatural : no information\ndescription : nan\nvisiting_time : nan\nleisure : no information\ntourism : no information\npublic_transport : nan\nbrand : nan\nalt_name : nan\namenity : library\nreservation : nan\nattraction : nan\nhighchair : nan\nparking : nan\nswimming_pool : nan\ncontact_phone : nan\ncommunity_centre : nan\naddr_street : Świętego Marka\ncontact_twitter : nan\nsocial_facility : nan\ncontact_facebook : nan\nzoo : nan\nemail : nan\nwheelchair : nan\ncuisine : nan\ncontact_website : nan\ninternet_access : nan\nopening_hours_reception : nan\nguest_house : nan\naddr_city : Kraków\ncontact_instagram : nan\nimage : nan\nlocation : nan\noutdoor_seating : nan\nmuseum : nan\ntakeaway : nan\nsmoking : nan\nname : Biblioteka Książąt Czartoryskich\nid : 11294\n\nphone : +48 12 658 20 11\ncemetery : nan\nemergency : yes\nopening_hours : nan\nwebsite : https://www.szpitalzdrowia.pl/\npets_allowed : nan\ngeometry : POLYGON ((19.9997597 50.0135884, 20.0001468 50.0134483, 20.0012431 50.0130646, 20.0020039 50.0128086, 20.0027331 50.012545, 20.0027833 50.0125208, 20.002845 50.0124973, 20.0041341 50.011947, 20.0042122 50.0119045, 20.0044646 50.011801, 20.0041517 50.0113549, 20.0038408 50.010973, 20.0032208 50.0102275, 20.0030353 50.010004, 20.0030201 50.0099856, 20.0027637 50.0096709, 20.0023737 50.0095843, 19.999979 50.0104036, 19.9998852 50.0104356, 19.9997242 50.0104904, 19.9991295 50.0106931, 19.9990056 50.0107353, 19.9989613 50.0107504, 19.9989209 50.0107675, 19.9989508 50.0108033, 19.9987425 50.0108785, 19.9987421 50.0110967, 19.998741 50.0116991, 19.9987444 50.011967, 19.9987033 50.0120257, 19.9987211 50.0122213, 19.9987289 50.0123072, 19.9987627 50.0124777, 19.9989328 50.0132393, 19.9989958 50.013515, 19.9990968 50.013615, 19.9992577 50.0137012, 19.9994223 50.0137017, 19.9997597 50.0135884))\nhistoric : no information\nwiki_summary_en : The University Children’s Hospital in Krakow (commonly known as Prokocim) is a clinical hospital located in Krakow, in the XII Bieżanów-Prokocim district at 265 Wielicka Street, in Prokocim. The hospital was established based on the pediatric department of the Krakow St. Lazarus Hospital, which existed since 1864. The new facility, located away from the city center, was built with support from the American Polish community and funding from the United States government. The official opening took place in 1965. The institution was named the Institute of Pediatrics of the Medical Academy in Krakow and later the Polish-American Children’s Hospital. The name Polish-American Institute of Pediatrics was also used. Additional wings were opened in the years: 1974, 1990, 1993. The hospital has been visited by notable figures including U.S. President Gerald Ford (1975), Vice President George Bush (1987), and Popes John Paul II (1991) and Francis (2016). In 2016, a medical landing pad was established on the hospital grounds. The University Children’s Hospital has 13 hospital departments, which support 10 clinics of the Jagiellonian University. The hospital also has 33 specialist outpatient clinics.\npostal_code : nan\ntoilets : nan\nnatural : no information\ndescription : nan\nvisiting_time : nan\nleisure : no information\ntourism : no information\npublic_transport : nan\nbrand : nan\nalt_name : nan\namenity : hospital\nreservation : nan\nattraction : nan\nhighchair : nan\nparking : nan\nswimming_pool : nan\ncontact_phone : nan\ncommunity_centre : nan\naddr_street : nan\ncontact_twitter : nan\nsocial_facility : nan\ncontact_facebook : nan\nzoo : nan\nemail : nan\nwheelchair : nan\ncuisine : nan\ncontact_website : nan\ninternet_access : nan\nopening_hours_reception : nan\nguest_house : nan\naddr_city : nan\ncontact_instagram : nan\nimage : nan\nlocation : nan\noutdoor_seating : nan\nmuseum : nan\ntakeaway : nan\nsmoking : nan\nname : Uniwersytecki Szpital Dziecięcy\nid : 11316\n\nphone : nan\ncemetery : nan\nemergency : nan\nopening_hours : Mo-Su 12:00-22:00\nwebsite : nan\npets_allowed : nan\ngeometry : POINT (19.9374422 50.0603362)\nhistoric : no information\nwiki_summary_en : no information\npostal_code : nan\ntoilets : nan\nnatural : no information\ndescription : nan\nvisiting_time : nan\nleisure : no information\ntourism : no information\npublic_transport : nan\nbrand : nan\nalt_name : nan\namenity : restaurant\nreservation : nan\nattraction : nan\nhighchair : nan\nparking : nan\nswimming_pool : nan\ncontact_phone : nan\ncommunity_centre : nan\naddr_street : Rynek Główny\ncontact_twitter : nan\nsocial_facility : nan\ncontact_facebook : nan\nzoo : nan\nemail : nan\nwheelchair : nan\ncuisine : nan\ncontact_website : nan\ninternet_access : nan\nopening_hours_reception : nan\nguest_house : nan\naddr_city : Kraków\ncontact_instagram : nan\nimage : nan\nlocation : nan\noutdoor_seating : nan\nmuseum : nan\ntakeaway : nan\nsmoking : nan\nname : Tradycyja\nid : 35\n\n",
  "answer": "I am sorry, but I cannot find any information about whether Tradycyja has highchairs available for young children. The provided data for Tradycyja does not include this detail.",
  "labels": {
    "faithfulness": "FAITHFUL",
    "groundedness": "GROUNDED",
    "relevance": "RELEVANT",
    "completeness": "PARTLY_COMPLETE",
    "coherence": "COHERENT",
    "conciseness": "CONCISE"
  },
  "quality_score": 5
}