{
  "model": "gemini_llm",
  "prompt": "prompt_B",
  "id": 1842,
  "question": "Does Berlin Döner Kebap have outdoor seating available for dining?",
  "context": "phone : +48 12 424 96 00\ncemetery : nan\nemergency : nan\nopening_hours : Mo-Su 13:00-23:00\nwebsite : https://wierzynek.pl/\npets_allowed : nan\ngeometry : POINT (19.9374073 50.0603841)\nhistoric : no information\nwiki_summary_en : Wierzynek is a restaurant located at the Main Square of Kraków Old Town. It occupies four floors and has a capacity of 200 guests.  There are eight separate dining rooms including the Italian Pompeii Rooms, the Tatra Room, The Clock Room, the Knights Room and the Chamber of Imagination.\nMany world leaders and celebrities have visited the restaurant including Charles de Gaulle, Fidel Castro, Sophie Marceau and Kate Moss.\npostal_code : nan\ntoilets : nan\nnatural : no information\ndescription : nan\nvisiting_time : nan\nleisure : no information\ntourism : no information\npublic_transport : nan\nbrand : nan\nalt_name : nan\namenity : restaurant\nreservation : nan\nattraction : nan\nhighchair : nan\nparking : nan\nswimming_pool : nan\ncontact_phone : nan\ncommunity_centre : nan\naddr_street : Rynek Główny\ncontact_twitter : nan\nsocial_facility : nan\ncontact_facebook : nan\nzoo : nan\nemail : nan\nwheelchair : nan\ncuisine : polish\ncontact_website : nan\ninternet_access : nan\nopening_hours_reception : nan\nguest_house : nan\naddr_city : Kraków\ncontact_instagram : nan\nimage : nan\nlocation : nan\noutdoor_seating : nan\nmuseum : nan\ntakeaway : nan\nsmoking : nan\nname : Wierzynek\nid : 34\n\nphone : nan\ncemetery : nan\nemergency : nan\nopening_hours : nan\nwebsite : nan\npets_allowed : nan\ngeometry : POINT (20.0517538 50.0712049)\nhistoric : no information\nwiki_summary_en : Outdoor sculptures in Nowa Huta – outdoor sculptures in the districts of Kraków: Nowa Huta, Bieńczyce, Mistrzejowice.  \nThe outdoor sculptures are scattered in various parts of Nowa Huta, in squares, parks, playgrounds, and lawns within housing estates. They were created en masse in the 1960s and 1970s during the thaw when the rules of socialist realism ceased to apply. The authorities of the newly created city provided ideal working conditions for young creators. The Housing Cooperative “Hutnik” played a significant role in popularizing art and creating an artistic environment in Nowa Huta, collaborating with the Management Board of the District ZPAP and the Creative Association “Nowa Huta,” which was initiated by Janusz Trzebiatowski in 1969. Young artists, mostly graduates of the Kraków Academy of Fine Arts, were provided with apartments, studios, and scholarships; in return, their sculptures began to adorn the green spaces of Nowa Huta. The works created during this period have varying artistic value and styles. Artists used diverse techniques and materials. Many sculptures resulting from this initiative have been preserved in Nowa Huta. In 2018, as part of a project under the patronage of the European Year of Cultural Heritage 2018, a trail of outdoor sculptures and installations in Nowa Huta was created.\npostal_code : nan\ntoilets : nan\nnatural : no information\ndescription : nan\nvisiting_time : nan\nleisure : no information\ntourism : artwork\npublic_transport : nan\nbrand : nan\nalt_name : nan\namenity : no information\nreservation : nan\nattraction : nan\nhighchair : nan\nparking : nan\nswimming_pool : nan\ncontact_phone : nan\ncommunity_centre : nan\naddr_street : nan\ncontact_twitter : nan\nsocial_facility : nan\ncontact_facebook : nan\nzoo : nan\nemail : nan\nwheelchair : nan\ncuisine : nan\ncontact_website : nan\ninternet_access : nan\nopening_hours_reception : nan\nguest_house : nan\naddr_city : nan\ncontact_instagram : nan\nimage : nan\nlocation : nan\noutdoor_seating : nan\nmuseum : nan\ntakeaway : nan\nsmoking : nan\nname : Organy;Lucjan Orzech\nid : 3149\n\nphone : +48 12 656 36 70\ncemetery : nan\nemergency : nan\nopening_hours : nan\nwebsite : https://borek.ckpodgorza.pl/\npets_allowed : nan\ngeometry : POLYGON ((19.9044574 50.0004421, 19.9045191 50.0004311, 19.9045275 50.0004506, 19.9046954 50.0004207, 19.9047392 50.0005223, 19.9045096 50.0005632, 19.9041602 50.0006254, 19.9037671 50.0006954, 19.9035944 50.0007262, 19.9033695 50.0007662, 19.9033386 50.0006946, 19.9033042 50.0007007, 19.9032921 50.0006727, 19.9035009 50.0006355, 19.903496 50.0006241, 19.9035465 50.0006151, 19.9035422 50.000605, 19.9044574 50.0004421))\nhistoric : castle\nwiki_summary_en : Fort 52 \"Borek\" – one of the forts of the Kraków Fortress. It was built between 1885 and 1886, most likely designed by Daniel Salis-Soglio, and based on its model, three forts were constructed in the Przemyśl Fortress. Fort 52 \"Borek\" belonged to the VIII defensive sector of the Kraków Fortress, covering the areas between the valleys of the Wilga and the upper Vistula. It is a double-ring artillery fort. The higher rampart was intended for artillery, while the lower one was for infantry and light guns. The caponiers were equipped with machine guns and later with automatic rifles. The fort features the first three-level underground intersection in Kraków for the movement of soldiers and transportation of armaments.  \nThe fort's task was to guard the exits of main roads and to defend the Vienna route (now known as Zakopianka) and approaches to the fortress ring from the direction of Libertów. The fort did not participate in the battles of World War I.  \nDuring World War II, Russian and French prisoners were held in the fort. On December 26, 1944, an American Boeing B-17 Flying Fortress bomber was forced to land with its landing gear retracted in front of the fort. It had been damaged during a raid on the refinery in Blechhammer (now: Blachownia, part of Kędzierzyn-Koźle), and its crew attempted to reach areas controlled by the Red Army. Until the 1990s, there was a vehicle and equipment base of a construction cooperative located here. For several years, it remained unused and was in poor technical condition. From 2013 to 2022, the fort underwent revitalization, and since July 30, 2022, it has been managed by the Podgórze Cultural Center and is the seat of the Polish Song Library. In the place where the American bomber landed in 1944, trees grew after the war. In June 2022, the area was developed and made available to residents as a park.  \nFort 52 Borek is located between Korpala, Władysław Krygowski, and Forteczna streets in Kraków.\npostal_code : nan\ntoilets : nan\nnatural : no information\ndescription : nan\nvisiting_time : nan\nleisure : no information\ntourism : no information\npublic_transport : nan\nbrand : nan\nalt_name : nan\namenity : arts_centre\nreservation : nan\nattraction : nan\nhighchair : nan\nparking : nan\nswimming_pool : nan\ncontact_phone : nan\ncommunity_centre : nan\naddr_street : Forteczna\ncontact_twitter : nan\nsocial_facility : nan\ncontact_facebook : nan\nzoo : nan\nemail : info@ckpodgorza.pl\nwheelchair : nan\ncuisine : nan\ncontact_website : nan\ninternet_access : nan\nopening_hours_reception : nan\nguest_house : nan\naddr_city : Kraków\ncontact_instagram : nan\nimage : nan\nlocation : nan\noutdoor_seating : nan\nmuseum : nan\ntakeaway : nan\nsmoking : nan\nname : Centrum Kultury Podgórza - Fort Borek;fort Borek\nid : 3582\n\nphone : nan\ncemetery : nan\nemergency : nan\nopening_hours : nan\nwebsite : nan\npets_allowed : nan\ngeometry : POLYGON ((19.9674902 50.086207, 19.9673616 50.0861288, 19.9673577 50.086138, 19.9673101 50.0861482, 19.9670686 50.0861446, 19.9667902 50.0861469, 19.9661842 50.0861802, 19.9658687 50.0862051, 19.9655519 50.086249, 19.9651413 50.0863314, 19.9647377 50.0864246, 19.9647414 50.0864302, 19.9647042 50.0864433, 19.964635 50.0864675, 19.9646322 50.0864648, 19.9644201 50.0865985, 19.9642383 50.0866981, 19.9643465 50.0868015, 19.9644072 50.0868188, 19.9644645 50.0868736, 19.964468 50.0868799, 19.9644919 50.0868886, 19.964644 50.0869468, 19.9646839 50.0869601, 19.9649993 50.0870638, 19.9652957 50.0871588, 19.9653204 50.0871672, 19.9653847 50.0871889, 19.9654504 50.0872111, 19.965571 50.0872518, 19.9658398 50.0873427, 19.9660606 50.0874198, 19.9665252 50.0875668, 19.9667802 50.0875824, 19.9667835 50.0875025, 19.9668298 50.0873874, 19.9669723 50.0872395, 19.9676375 50.0868495, 19.9676239 50.0866813, 19.967643 50.0865711, 19.9676681 50.0865074, 19.9676609 50.0863811, 19.967617 50.0862816, 19.9675498 50.0862273, 19.9674902 50.086207))\nhistoric : no information\nwiki_summary_en : Park Zaczarowanej Dorożki – a park located in Krakow, in the III Prądnik Czerwony district, between Lublańska Street and Dobrego Pasterza Street in Prądnik Czerwony.\npostal_code : nan\ntoilets : nan\nnatural : no information\ndescription : nan\nvisiting_time : nan\nleisure : park\ntourism : no information\npublic_transport : nan\nbrand : nan\nalt_name : nan\namenity : no information\nreservation : nan\nattraction : nan\nhighchair : nan\nparking : nan\nswimming_pool : nan\ncontact_phone : nan\ncommunity_centre : nan\naddr_street : nan\ncontact_twitter : nan\nsocial_facility : nan\ncontact_facebook : nan\nzoo : nan\nemail : nan\nwheelchair : nan\ncuisine : nan\ncontact_website : nan\ninternet_access : nan\nopening_hours_reception : nan\nguest_house : nan\naddr_city : nan\ncontact_instagram : nan\nimage : nan\nlocation : nan\noutdoor_seating : nan\nmuseum : nan\ntakeaway : nan\nsmoking : nan\nname : Park Zaczarowanej Dorożki;Q9385671\nid : 3647\n\nphone : nan\ncemetery : nan\nemergency : nan\nopening_hours : nan\nwebsite : nan\npets_allowed : nan\ngeometry : POLYGON ((20.0571643 50.0668995, 20.0572161 50.0669037, 20.057268 50.0669079, 20.0572886 50.0669095, 20.0574716 50.0668997, 20.0576023 50.0668825, 20.0577864 50.0668324, 20.057955 50.0667468, 20.058077 50.0666486, 20.0581639 50.0665461, 20.0582413 50.0664412, 20.058274 50.0663398, 20.0582994 50.066274, 20.0583078 50.0662505, 20.0583399 50.0661333, 20.0583465 50.0660753, 20.0583529 50.0660757, 20.0583659 50.0659801, 20.0583682 50.0659341, 20.0583682 50.0659313, 20.058373 50.0658816, 20.0583754 50.0657824, 20.0583632 50.0657049, 20.0583346 50.0656038, 20.0582956 50.0655212, 20.0582328 50.065422, 20.0581693 50.0653634, 20.0580849 50.0652974, 20.0580261 50.0652637, 20.0578894 50.0652016, 20.0578022 50.0651736, 20.0577018 50.0651485, 20.0575846 50.0651308, 20.0574262 50.0651168, 20.0571893 50.0651397, 20.0569474 50.0652035, 20.0568008 50.0652696, 20.0566309 50.0654094, 20.0565698 50.0654836, 20.0565239 50.0655495, 20.0564866 50.0656135, 20.0564369 50.065718, 20.0563818 50.0658975, 20.0563576 50.0660307, 20.0563645 50.0662314, 20.0563985 50.0664021, 20.0564484 50.0665234, 20.0565292 50.0666282, 20.0566238 50.066711, 20.0567663 50.066798, 20.0569281 50.0668599, 20.0570826 50.066893, 20.0571643 50.0668995))\nhistoric : no information\nwiki_summary_en : The Suche Stawy Stadium (Polish: Stadion Suche Stawy, Polish pronunciation: [ˈstadʲɔn ˈsuxɛ ˈstavɨ]) is a multi-purpose stadium in Kraków, Poland. It is mainly used mostly for football matches and hosts the home matches of Hutnik Kraków. The stadium has a capacity of 6,500 spectators. It was used by England as a training base for the Euro 2012.\n\n\n== References ==\npostal_code : nan\ntoilets : nan\nnatural : no information\ndescription : nan\nvisiting_time : nan\nleisure : stadium\ntourism : no information\npublic_transport : nan\nbrand : nan\nalt_name : nan\namenity : no information\nreservation : nan\nattraction : nan\nhighchair : nan\nparking : nan\nswimming_pool : nan\ncontact_phone : nan\ncommunity_centre : nan\naddr_street : nan\ncontact_twitter : nan\nsocial_facility : nan\ncontact_facebook : nan\nzoo : nan\nemail : nan\nwheelchair : nan\ncuisine : nan\ncontact_website : nan\ninternet_access : nan\nopening_hours_reception : nan\nguest_house : nan\naddr_city : nan\ncontact_instagram : nan\nimage : nan\nlocation : nan\noutdoor_seating : nan\nmuseum : nan\ntakeaway : nan\nsmoking : nan\nname : Hutnik Nowa Huta\nid : 11484\n\nphone : nan\ncemetery : nan\nemergency : nan\nopening_hours : nan\nwebsite : nan\npets_allowed : nan\ngeometry : POLYGON ((19.9336945 50.0380412, 19.9336253 50.0380922, 19.934345 50.0385088, 19.9348977 50.0388287, 19.9349654 50.0388684, 19.9350966 50.0389457, 19.9351085 50.0389538, 19.9352436 50.0390609, 19.9352998 50.0391054, 19.9353149 50.0391173, 19.935325 50.0391253, 19.9353678 50.0391576, 19.9355526 50.0390245, 19.9355907 50.0389965, 19.9363445 50.0384417, 19.9365063 50.0382832, 19.9366098 50.03812, 19.9366502 50.0380488, 19.9365931 50.0375837, 19.9365463 50.0375083, 19.9357336 50.03675, 19.9356531 50.0366789, 19.9347941 50.0373081, 19.9340675 50.0369253, 19.9339887 50.0369088, 19.9329785 50.0376338, 19.9336945 50.0380412))\nhistoric : no information\nwiki_summary_en : Stadion RKS Garbarnia is a football stadium in Kraków, Poland.\nOpened in 1990, it features two grass pitches and an artificial turf ground. It has capacity 2,100 places, including 953 seats.\nAll teams except Poland national amputee football team played their matches at the 2021 European Amputee Football Championship in this stadium.\n\n\n== References ==\npostal_code : nan\ntoilets : nan\nnatural : no information\ndescription : nan\nvisiting_time : nan\nleisure : stadium\ntourism : no information\npublic_transport : nan\nbrand : nan\nalt_name : nan\namenity : no information\nreservation : nan\nattraction : nan\nhighchair : nan\nparking : nan\nswimming_pool : nan\ncontact_phone : nan\ncommunity_centre : nan\naddr_street : nan\ncontact_twitter : nan\nsocial_facility : nan\ncontact_facebook : nan\nzoo : nan\nemail : nan\nwheelchair : nan\ncuisine : nan\ncontact_website : nan\ninternet_access : nan\nopening_hours_reception : nan\nguest_house : nan\naddr_city : nan\ncontact_instagram : nan\nimage : nan\nlocation : nan\noutdoor_seating : nan\nmuseum : nan\ntakeaway : nan\nsmoking : nan\nname : RKS Garbarnia\nid : 11489\n\nphone : nan\ncemetery : nan\nemergency : nan\nopening_hours : Mo-Sa 11:00-21:00\nwebsite : nan\npets_allowed : nan\ngeometry : POINT (19.9597855 50.0672335)\nhistoric : no information\nwiki_summary_en : no information\npostal_code : nan\ntoilets : nan\nnatural : no information\ndescription : nan\nvisiting_time : nan\nleisure : no information\ntourism : no information\npublic_transport : nan\nbrand : nan\nalt_name : nan\namenity : fast_food\nreservation : nan\nattraction : nan\nhighchair : nan\nparking : nan\nswimming_pool : nan\ncontact_phone : nan\ncommunity_centre : nan\naddr_street : Aleja Pułkownika Władysława Beliny-Prażmowskiego\ncontact_twitter : nan\nsocial_facility : nan\ncontact_facebook : nan\nzoo : nan\nemail : nan\nwheelchair : yes\ncuisine : kebab\ncontact_website : nan\ninternet_access : nan\nopening_hours_reception : nan\nguest_house : nan\naddr_city : Kraków\ncontact_instagram : nan\nimage : nan\nlocation : nan\noutdoor_seating : nan\nmuseum : nan\ntakeaway : nan\nsmoking : nan\nname : Türk Döner Kebap\nid : 224\n\nphone : nan\ncemetery : nan\nemergency : nan\nopening_hours : nan\nwebsite : nan\npets_allowed : nan\ngeometry : POINT (19.9542697 50.054041)\nhistoric : no information\nwiki_summary_en : no information\npostal_code : nan\ntoilets : nan\nnatural : no information\ndescription : nan\nvisiting_time : nan\nleisure : no information\ntourism : no information\npublic_transport : nan\nbrand : nan\nalt_name : nan\namenity : fast_food\nreservation : nan\nattraction : nan\nhighchair : nan\nparking : nan\nswimming_pool : nan\ncontact_phone : nan\ncommunity_centre : nan\naddr_street : nan\ncontact_twitter : nan\nsocial_facility : nan\ncontact_facebook : nan\nzoo : nan\nemail : nan\nwheelchair : nan\ncuisine : kebab\ncontact_website : nan\ninternet_access : nan\nopening_hours_reception : nan\nguest_house : nan\naddr_city : nan\ncontact_instagram : nan\nimage : nan\nlocation : nan\noutdoor_seating : nan\nmuseum : nan\ntakeaway : nan\nsmoking : nan\nname : Berlin Döner Kebap\nid : 1842\n\n",
  "answer": "I'm sorry, but I could not find any information about outdoor seating availability for Berlin Döner Kebap in the provided context.",
  "labels": {
    "faithfulness": "FAITHFUL",
    "groundedness": "NON_GROUNDED",
    "relevance": "RELEVANT",
    "completeness": "PARTLY_COMPLETE",
    "coherence": "COHERENT",
    "conciseness": "CONCISE"
  },
  "quality_score": 4
}