{
  "model": "gemini_llm",
  "prompt": "prompt_C",
  "id": 4070,
  "question": "How does Floriańska Street connect with other landmarks or areas within the Kraków Old Town?",
  "context": "phone : nan\ncemetery : nan\nemergency : nan\nopening_hours : nan\nwebsite : nan\npets_allowed : nan\ngeometry : MULTIPOLYGON (((19.9414616 50.0648576, 19.941469 50.0648563, 19.9421795 50.0647424, 19.9421714 50.064722, 19.9415238 50.064827, 19.9415211 50.0648187, 19.9415268 50.0648178, 19.9415234 50.0648106, 19.9415179 50.0648112, 19.9415152 50.0648058, 19.9415075 50.0648072, 19.941509 50.0648127, 19.9415031 50.0648137, 19.941504 50.064816, 19.9414705 50.0648208, 19.9414691 50.0648184, 19.9414639 50.0648194, 19.9414621 50.0648139, 19.941454 50.0648152, 19.941456 50.0648208, 19.9414483 50.0648216, 19.9414347 50.0648237, 19.9414211 50.0648258, 19.9414083 50.0648276, 19.9414105 50.0648333, 19.9414145 50.0648438, 19.9414223 50.0648638, 19.9414344 50.0648618, 19.941448 50.0648597, 19.9414616 50.0648576)), ((19.940697 50.0649973, 19.9412442 50.0648949, 19.9412975 50.0648848, 19.9412894 50.0648638, 19.9411661 50.0648871, 19.9406938 50.0649763, 19.940697 50.0649973)))\nhistoric : no information\nwiki_summary_en : The city walls in Krakow – a series of city walls along with defensive structures (including gates and towers), which once surrounded the entire area of Krakow (now the Old Town), of which a small section has been preserved to this day along Pijarska Street.\npostal_code : nan\ntoilets : nan\nnatural : no information\ndescription : nan\nvisiting_time : nan\nleisure : no information\ntourism : attraction\npublic_transport : nan\nbrand : nan\nalt_name : nan\namenity : no information\nreservation : nan\nattraction : nan\nhighchair : nan\nparking : nan\nswimming_pool : nan\ncontact_phone : nan\ncommunity_centre : nan\naddr_street : nan\ncontact_twitter : nan\nsocial_facility : nan\ncontact_facebook : nan\nzoo : nan\nemail : nan\nwheelchair : nan\ncuisine : nan\ncontact_website : nan\ninternet_access : nan\nopening_hours_reception : nan\nguest_house : nan\naddr_city : nan\ncontact_instagram : nan\nimage : nan\nlocation : nan\noutdoor_seating : nan\nmuseum : nan\ntakeaway : nan\nsmoking : nan\nname : Mury miejskie Krakowa;Krakauer Stadtmauer;Városfal\nid : 3378\n\nphone : nan\ncemetery : nan\nemergency : yes\nopening_hours : nan\nwebsite : nan\npets_allowed : nan\ngeometry : LINESTRING (19.9413361 50.0648128, 19.9413343 50.0648091, 19.9411854 50.0646282, 19.9411021 50.0645142, 19.9410415 50.0644312, 19.9409583 50.0643197, 19.9406983 50.0639774, 19.9406214 50.0638754, 19.9404334 50.0636278, 19.9402823 50.063437, 19.9401984 50.0633311, 19.940176 50.0633028, 19.9401043 50.0632123, 19.9398225 50.0628588, 19.9397298 50.0627334, 19.9396257 50.0625966, 19.9391757 50.0620188)\nhistoric : no information\nwiki_summary_en : Floriańska Street (Polish: ulica Floriańska, Latin: platea Sancti Floriani) is one of the main streets in Kraków Old Town and one of the most famous promenades in the city. The street forms part of the regular grid plan of Kraków Old Town, the merchants' town that extends the medieval heart of the city, which was drawn up in 1257 after the destruction of the city during the first Mongol invasion of Poland of 1241.\npostal_code : nan\ntoilets : nan\nnatural : no information\ndescription : nan\nvisiting_time : nan\nleisure : no information\ntourism : attraction\npublic_transport : nan\nbrand : nan\nalt_name : nan\namenity : no information\nreservation : nan\nattraction : nan\nhighchair : nan\nparking : nan\nswimming_pool : nan\ncontact_phone : nan\ncommunity_centre : nan\naddr_street : nan\ncontact_twitter : nan\nsocial_facility : nan\ncontact_facebook : nan\nzoo : nan\nemail : nan\nwheelchair : yes\ncuisine : nan\ncontact_website : nan\ninternet_access : nan\nopening_hours_reception : nan\nguest_house : nan\naddr_city : nan\ncontact_instagram : nan\nimage : nan\nlocation : nan\noutdoor_seating : nan\nmuseum : nan\ntakeaway : nan\nsmoking : nan\nname : Floriańska;Floriangasse;Флорианская улица;Flórián utca;Q298845\nid : 3428\n\nphone : nan\ncemetery : nan\nemergency : nan\nopening_hours : 24/7\nwebsite : nan\npets_allowed : nan\ngeometry : POLYGON ((19.9412736 50.0648228, 19.9412786 50.0648359, 19.9412853 50.0648533, 19.9412872 50.0648582, 19.9412894 50.0648638, 19.9412975 50.0648848, 19.9413072 50.0649102, 19.9413385 50.0649051, 19.9413698 50.0649001, 19.941397 50.0648957, 19.9414324 50.06489, 19.9414223 50.0648638, 19.9414145 50.0648438, 19.9414105 50.0648333, 19.9414083 50.0648276, 19.9414038 50.0648159, 19.9413987 50.0648028, 19.9413633 50.0648085, 19.9413361 50.0648128, 19.9413048 50.0648178, 19.9412736 50.0648228))\nhistoric : city_gate\nwiki_summary_en : St. Florian's Gate (Polish: Brama Floriańska) in Kraków, Poland, is one of the best-known Polish Gothic towers, and a focal point of Kraków's Old Town. It was built about the 14th century as a rectangular Gothic tower of \"wild stone\", part of the city fortifications against Mongol attack.\npostal_code : nan\ntoilets : nan\nnatural : no information\ndescription : nan\nvisiting_time : nan\nleisure : no information\ntourism : attraction\npublic_transport : nan\nbrand : nan\nalt_name : nan\namenity : no information\nreservation : nan\nattraction : nan\nhighchair : nan\nparking : nan\nswimming_pool : nan\ncontact_phone : nan\ncommunity_centre : nan\naddr_street : nan\ncontact_twitter : nan\nsocial_facility : nan\ncontact_facebook : nan\nzoo : nan\nemail : nan\nwheelchair : yes\ncuisine : nan\ncontact_website : nan\ninternet_access : nan\nopening_hours_reception : nan\nguest_house : nan\naddr_city : nan\ncontact_instagram : nan\nimage : nan\nlocation : nan\noutdoor_seating : nan\nmuseum : nan\ntakeaway : nan\nsmoking : nan\nname : Brama Floriańska;Saint Florian's Gate;Florianstor;Флорианские ворота в Кракове;Flórián-kapu;Floriánská brána;圣福里安门;성 플로리안의 문;Florianuspoort;Poarta Florian;Floriánska brána;Florianertor\nid : 3467\n\nphone : nan\ncemetery : nan\nemergency : nan\nopening_hours : nan\nwebsite : nan\npets_allowed : nan\ngeometry : LINESTRING (19.9413361 50.0648128, 19.9413698 50.0649001)\nhistoric : no information\nwiki_summary_en : Floriańska Street (Polish: ulica Floriańska, Latin: platea Sancti Floriani) is one of the main streets in Kraków Old Town and one of the most famous promenades in the city. The street forms part of the regular grid plan of Kraków Old Town, the merchants' town that extends the medieval heart of the city, which was drawn up in 1257 after the destruction of the city during the first Mongol invasion of Poland of 1241.\npostal_code : nan\ntoilets : nan\nnatural : no information\ndescription : nan\nvisiting_time : nan\nleisure : no information\ntourism : attraction\npublic_transport : nan\nbrand : nan\nalt_name : nan\namenity : no information\nreservation : nan\nattraction : nan\nhighchair : nan\nparking : nan\nswimming_pool : nan\ncontact_phone : nan\ncommunity_centre : nan\naddr_street : nan\ncontact_twitter : nan\nsocial_facility : nan\ncontact_facebook : nan\nzoo : nan\nemail : nan\nwheelchair : yes\ncuisine : nan\ncontact_website : nan\ninternet_access : nan\nopening_hours_reception : nan\nguest_house : nan\naddr_city : nan\ncontact_instagram : nan\nimage : nan\nlocation : nan\noutdoor_seating : nan\nmuseum : nan\ntakeaway : nan\nsmoking : nan\nname : Floriańska;Floriangasse;Флорианская улица;Flórián utca;Q298845\nid : 3621\n\nphone : nan\ncemetery : nan\nemergency : nan\nopening_hours : nan\nwebsite : nan\npets_allowed : nan\ngeometry : LINESTRING (19.9413698 50.0649001, 19.941469 50.0651271, 19.9414957 50.0651911)\nhistoric : no information\nwiki_summary_en : Floriańska Street (Polish: ulica Floriańska, Latin: platea Sancti Floriani) is one of the main streets in Kraków Old Town and one of the most famous promenades in the city. The street forms part of the regular grid plan of Kraków Old Town, the merchants' town that extends the medieval heart of the city, which was drawn up in 1257 after the destruction of the city during the first Mongol invasion of Poland of 1241.\npostal_code : nan\ntoilets : nan\nnatural : no information\ndescription : nan\nvisiting_time : nan\nleisure : no information\ntourism : attraction\npublic_transport : nan\nbrand : nan\nalt_name : nan\namenity : no information\nreservation : nan\nattraction : nan\nhighchair : nan\nparking : nan\nswimming_pool : nan\ncontact_phone : nan\ncommunity_centre : nan\naddr_street : nan\ncontact_twitter : nan\nsocial_facility : nan\ncontact_facebook : nan\nzoo : nan\nemail : nan\nwheelchair : yes\ncuisine : nan\ncontact_website : nan\ninternet_access : nan\nopening_hours_reception : nan\nguest_house : nan\naddr_city : nan\ncontact_instagram : nan\nimage : nan\nlocation : nan\noutdoor_seating : nan\nmuseum : nan\ntakeaway : nan\nsmoking : nan\nname : Floriańska;Floriangasse;Флорианская улица;Flórián utca;Q298845\nid : 3788\n\nphone : nan\ncemetery : nan\nemergency : nan\nopening_hours : nan\nwebsite : nan\npets_allowed : nan\ngeometry : LINESTRING (19.9414957 50.0651911, 19.9415006 50.0652025)\nhistoric : no information\nwiki_summary_en : Floriańska Street (Polish: ulica Floriańska, Latin: platea Sancti Floriani) is one of the main streets in Kraków Old Town and one of the most famous promenades in the city. The street forms part of the regular grid plan of Kraków Old Town, the merchants' town that extends the medieval heart of the city, which was drawn up in 1257 after the destruction of the city during the first Mongol invasion of Poland of 1241.\npostal_code : nan\ntoilets : nan\nnatural : no information\ndescription : nan\nvisiting_time : nan\nleisure : no information\ntourism : attraction\npublic_transport : nan\nbrand : nan\nalt_name : nan\namenity : no information\nreservation : nan\nattraction : nan\nhighchair : nan\nparking : nan\nswimming_pool : nan\ncontact_phone : nan\ncommunity_centre : nan\naddr_street : nan\ncontact_twitter : nan\nsocial_facility : nan\ncontact_facebook : nan\nzoo : nan\nemail : nan\nwheelchair : nan\ncuisine : nan\ncontact_website : nan\ninternet_access : nan\nopening_hours_reception : nan\nguest_house : nan\naddr_city : nan\ncontact_instagram : nan\nimage : nan\nlocation : nan\noutdoor_seating : nan\nmuseum : nan\ntakeaway : nan\nsmoking : nan\nname : Floriańska;Floriangasse;Флорианская улица;Flórián utca;Q298845\nid : 4070\n\n",
  "answer": "Floriańska Street is part of the regular grid plan of Kraków Old Town. A section of the city walls, including defensive structures like gates and towers, has been preserved along Pijarska Street. St. Florian's Gate is also mentioned in relation to the city fortifications.",
  "labels": {
    "faithfulness": "PARTLY_FAITHFUL",
    "groundedness": "PARTLY_GROUNDED",
    "relevance": "RELEVANT",
    "completeness": "PARTLY_COMPLETE",
    "coherence": "COHERENT",
    "conciseness": "PARTLY_CONCISE"
  },
  "quality_score": 2
}