{
  "model": "gemini_llm",
  "prompt": "prompt_B",
  "id": 7872,
  "question": "What is the best way to reach Sieroszewskiego 01 using public transport?",
  "context": "phone : nan\ncemetery : nan\nemergency : nan\nopening_hours : 24/7\nwebsite : nan\npets_allowed : nan\ngeometry : POLYGON ((19.9068228 50.059374, 19.9051515 50.058345, 19.9040932 50.0589615, 19.9035986 50.0592326, 19.9030558 50.059492, 19.9012175 50.0602093, 19.9010762 50.0604061, 19.9018127 50.0614121, 19.902546 50.062412, 19.9231318 50.0592513, 19.9231335 50.0592212, 19.9219675 50.0590566, 19.9192393 50.0586649, 19.9181629 50.0585154, 19.9160288 50.0582089, 19.9139449 50.0579078, 19.909055 50.0572063, 19.907823 50.0570365, 19.9076985 50.0570248, 19.9075061 50.0570248, 19.9077121 50.0570524, 19.9078348 50.0571219, 19.9078745 50.057181, 19.9078169 50.0572328, 19.9079877 50.0573294, 19.9090244 50.0580153, 19.9077734 50.0588218, 19.9077394 50.0587998, 19.9068228 50.059374))\nhistoric : no information\nwiki_summary_en : Błonia Park is a vast meadow with an area of 48 hectares directly adjacent to the historic centre of the city of Kraków, Poland.\nThe history of the park began in 1162, when a wealthy nobleman Jaksa z Miechowa – founder of the Polish branch of the Order of the Holy Sepulchre – donated the land between Zwierzyniec and Łobzów to Norbertine Nuns. His intention was to receive a blessing prior to his pilgrimage to the Holy Land. For the next two centuries the meadow belonged to nuns, who in 1366 exchanged it with the city's authorities for a manor at Florianska Street. The meadow was used by peasants from neighboring villages to graze their cattle.\nUntil the 19th century Błonia Park was largely neglected, and often flooded by the Rudawa river in the spring turning it into wetland with small islands, probably contributing to the spread of epidemics. After draining the swamps, Błonia became perfectly suitable to host large gatherings. In 1809, when the city was incorporated into the Duchy of Warsaw, Błonia was a place of salute of the troops of Napoleon, organized by Prince Jozef Poniatowski and General Jan Henryk Dąbrowski.  \nToday Błonia is a recreation area, frequently hosting large events like concerts and exhibitions. The place is best known for great Masses celebrated by Pope John Paul II in 1979, 1983, 1987, 1997 and 2002. Pope Benedict XVI also celebrated the Mass there during his journey to Poland in May 2006. The opening Mass of the 2016 World Youth Day was held at Błonia Park in July 2016, however the main events, including the Mass celebrated by Pope Francis, were held outside the city.\nBłonia Park is also used to host popular culture events, such as concerts organized by a local radio station or the Iuvenalia student festival. Pop star Celine Dion's Taking Chances World Tour concert on June 28, 2008 performed to nearly 55,000 people  The vast meadow was also used for politicized promotion of the Małopolska region farming industry by PSL in 2011 with a herd of 150 sheep trucked in from hundreds of kilometres away for one month, and the city permit worth 3,200 złoty. The last cattle grazed at Błonia in the 1970s.\npostal_code : nan\ntoilets : nan\nnatural : no information\ndescription : nan\nvisiting_time : nan\nleisure : no information\ntourism : attraction\npublic_transport : nan\nbrand : nan\nalt_name : Błonia krakowskie\namenity : no information\nreservation : nan\nattraction : nan\nhighchair : nan\nparking : nan\nswimming_pool : nan\ncontact_phone : nan\ncommunity_centre : nan\naddr_street : nan\ncontact_twitter : nan\nsocial_facility : nan\ncontact_facebook : nan\nzoo : nan\nemail : nan\nwheelchair : limited\ncuisine : nan\ncontact_website : nan\ninternet_access : nan\nopening_hours_reception : nan\nguest_house : nan\naddr_city : nan\ncontact_instagram : nan\nimage : nan\nlocation : nan\noutdoor_seating : nan\nmuseum : nan\ntakeaway : nan\nsmoking : nan\nname : Błonia;Błonia krakowskie;Lange Wiese;Краковский луг\nid : 3430\n\nphone : +48 12 656 36 70\ncemetery : nan\nemergency : nan\nopening_hours : nan\nwebsite : https://borek.ckpodgorza.pl/\npets_allowed : nan\ngeometry : POLYGON ((19.9044574 50.0004421, 19.9045191 50.0004311, 19.9045275 50.0004506, 19.9046954 50.0004207, 19.9047392 50.0005223, 19.9045096 50.0005632, 19.9041602 50.0006254, 19.9037671 50.0006954, 19.9035944 50.0007262, 19.9033695 50.0007662, 19.9033386 50.0006946, 19.9033042 50.0007007, 19.9032921 50.0006727, 19.9035009 50.0006355, 19.903496 50.0006241, 19.9035465 50.0006151, 19.9035422 50.000605, 19.9044574 50.0004421))\nhistoric : castle\nwiki_summary_en : Fort 52 \"Borek\" – one of the forts of the Kraków Fortress. It was built between 1885 and 1886, most likely designed by Daniel Salis-Soglio, and based on its model, three forts were constructed in the Przemyśl Fortress. Fort 52 \"Borek\" belonged to the VIII defensive sector of the Kraków Fortress, covering the areas between the valleys of the Wilga and the upper Vistula. It is a double-ring artillery fort. The higher rampart was intended for artillery, while the lower one was for infantry and light guns. The caponiers were equipped with machine guns and later with automatic rifles. The fort features the first three-level underground intersection in Kraków for the movement of soldiers and transportation of armaments.  \nThe fort's task was to guard the exits of main roads and to defend the Vienna route (now known as Zakopianka) and approaches to the fortress ring from the direction of Libertów. The fort did not participate in the battles of World War I.  \nDuring World War II, Russian and French prisoners were held in the fort. On December 26, 1944, an American Boeing B-17 Flying Fortress bomber was forced to land with its landing gear retracted in front of the fort. It had been damaged during a raid on the refinery in Blechhammer (now: Blachownia, part of Kędzierzyn-Koźle), and its crew attempted to reach areas controlled by the Red Army. Until the 1990s, there was a vehicle and equipment base of a construction cooperative located here. For several years, it remained unused and was in poor technical condition. From 2013 to 2022, the fort underwent revitalization, and since July 30, 2022, it has been managed by the Podgórze Cultural Center and is the seat of the Polish Song Library. In the place where the American bomber landed in 1944, trees grew after the war. In June 2022, the area was developed and made available to residents as a park.  \nFort 52 Borek is located between Korpala, Władysław Krygowski, and Forteczna streets in Kraków.\npostal_code : nan\ntoilets : nan\nnatural : no information\ndescription : nan\nvisiting_time : nan\nleisure : no information\ntourism : no information\npublic_transport : nan\nbrand : nan\nalt_name : nan\namenity : arts_centre\nreservation : nan\nattraction : nan\nhighchair : nan\nparking : nan\nswimming_pool : nan\ncontact_phone : nan\ncommunity_centre : nan\naddr_street : Forteczna\ncontact_twitter : nan\nsocial_facility : nan\ncontact_facebook : nan\nzoo : nan\nemail : info@ckpodgorza.pl\nwheelchair : nan\ncuisine : nan\ncontact_website : nan\ninternet_access : nan\nopening_hours_reception : nan\nguest_house : nan\naddr_city : Kraków\ncontact_instagram : nan\nimage : nan\nlocation : nan\noutdoor_seating : nan\nmuseum : nan\ntakeaway : nan\nsmoking : nan\nname : Centrum Kultury Podgórza - Fort Borek;fort Borek\nid : 3582\n\nphone : +48126428700\ncemetery : nan\nemergency : nan\nopening_hours : Tu-Su 09:00-17:00\nwebsite : http://muzeumlotnictwa.pl/\npets_allowed : nan\ngeometry : POLYGON ((19.9894097 50.0771715, 19.9893109 50.0770682, 19.9892712 50.0770326, 19.9895548 50.076921, 19.9896035 50.0769019, 19.9896521 50.0768828, 19.989874 50.0767987, 19.9900183 50.076739, 19.9900903 50.0768137, 19.9902721 50.076729, 19.9902864 50.0767224, 19.990201 50.0766778, 19.9906502 50.0765182, 19.9908907 50.0764325, 19.9908655 50.076385, 19.9908559 50.0763604, 19.9908397 50.076325, 19.9908217 50.0762873, 19.9922844 50.0759569, 19.9934818 50.0756958, 19.9935903 50.0758875, 19.9936267 50.0759519, 19.9937193 50.0761294, 19.9937399 50.0762959, 19.9937426 50.076318, 19.9937932 50.0767388, 19.993794 50.0767454, 19.9937948 50.0767515, 19.9938167 50.0769338, 19.9938286 50.0770174, 19.9937958 50.0772471, 19.9937946 50.0772549, 19.993793 50.0772658, 19.9937844 50.0773262, 19.993766 50.0774648, 19.9936948 50.0779994, 19.9935974 50.0787195, 19.9935465 50.0790876, 19.9912373 50.0789627, 19.9899317 50.0819032, 19.9896477 50.0818495, 19.9891593 50.0819981, 19.9872994 50.081566, 19.9881542 50.0800061, 19.9881632 50.0798963, 19.9881022 50.0797973, 19.9880641 50.0797228, 19.9880176 50.0795916, 19.9880222 50.0795111, 19.9881583 50.0793549, 19.9882735 50.0792666, 19.988418 50.0791971, 19.9885625 50.0791593, 19.9893944 50.0793353, 19.9899142 50.0785837, 19.9899032 50.078574, 19.9898927 50.0785647, 19.9898314 50.0784866, 19.9898129 50.078463, 19.9897752 50.0783908, 19.9897466 50.0782947, 19.9897306 50.078171, 19.9897183 50.078015, 19.9896703 50.0778782, 19.9896295 50.0778278, 19.9895436 50.077757, 19.9894933 50.0777526, 19.9894769 50.0777506, 19.9885874 50.0774723, 19.9887615 50.0771894, 19.9889453 50.0769908, 19.9892504 50.0772283, 19.9894097 50.0771715))\nhistoric : no information\nwiki_summary_en : The Polish Aviation Museum (Polish: Muzeum Lotnictwa Polskiego w Krakowie) is a large museum of historic aircraft and aircraft engines in Kraków, Poland. It is located at the site of the no-longer functional Kraków-Rakowice-Czyżyny Airport.  This airfield, established by Austria-Hungary in 1912, is one of the oldest in the world.  The museum opened in 1964, after the airfield closed in 1963. It was listed among the world's best aviation museums by CNN.\nFor the first half century of its existence the museum used four hangars of the former airfield to display its exhibits.  These buildings were not originally designed for this purpose and suffered from various inadequacies, notably insufficient heating in winter. The situation improved when a new main building for the museum opened on 18 September 2010.\npostal_code : nan\ntoilets : nan\nnatural : no information\ndescription : nan\nvisiting_time : nan\nleisure : no information\ntourism : museum\npublic_transport : nan\nbrand : nan\nalt_name : nan\namenity : no information\nreservation : nan\nattraction : nan\nhighchair : nan\nparking : nan\nswimming_pool : nan\ncontact_phone : nan\ncommunity_centre : nan\naddr_street : Jana Pawła II\ncontact_twitter : nan\nsocial_facility : nan\ncontact_facebook : nan\nzoo : nan\nemail : info@muzeumlotnictwa.pl\nwheelchair : nan\ncuisine : nan\ncontact_website : nan\ninternet_access : nan\nopening_hours_reception : nan\nguest_house : nan\naddr_city : Kraków\ncontact_instagram : nan\nimage : nan\nlocation : nan\noutdoor_seating : nan\nmuseum : aviation\ntakeaway : nan\nsmoking : nan\nname : Muzeum Lotnictwa Polskiego;Polish Aviation Museum;Museo Polaco de Aviación;Музей польської авіації;Polnisches Luftfahrtmuseum;Музей польской авиации;Lengyel Repülési Múzeum;Музей польскай авіяцыі;Museo dell'aviazione polacca;Musée de l'Aviation polonaise;Muzeum polského letectví v Krakově;波兰航空博物馆;Pools Luchtvaartmuseum;Muzeul Polonez de Aviație;Puolan ilmailumuseo;Muzeo de la Pola Aviado en Krakovo\nid : 3690\n\nphone : nan\ncemetery : nan\nemergency : nan\nopening_hours : nan\nwebsite : nan\npets_allowed : nan\ngeometry : POINT (19.8444739 50.091177)\nhistoric : no information\nwiki_summary_en : Kraków Mydlniki Wapiennik – a railway stop in Kraków, in the VI Bronowice district, in Mydlniki. The stop serves local traffic towards Katowice, Oświęcim, and Częstochowa.\npostal_code : nan\ntoilets : nan\nnatural : no information\ndescription : nan\nvisiting_time : nan\nleisure : no information\ntourism : no information\npublic_transport : station\nbrand : nan\nalt_name : nan\namenity : no information\nreservation : nan\nattraction : nan\nhighchair : nan\nparking : nan\nswimming_pool : nan\ncontact_phone : nan\ncommunity_centre : nan\naddr_street : nan\ncontact_twitter : nan\nsocial_facility : nan\ncontact_facebook : nan\nzoo : nan\nemail : nan\nwheelchair : nan\ncuisine : nan\ncontact_website : nan\ninternet_access : nan\nopening_hours_reception : nan\nguest_house : nan\naddr_city : nan\ncontact_instagram : nan\nimage : nan\nlocation : nan\noutdoor_seating : nan\nmuseum : nan\ntakeaway : nan\nsmoking : nan\nname : Kraków Mydlniki Wapiennik\nid : 7091\n\nphone : nan\ncemetery : nan\nemergency : nan\nopening_hours : nan\nwebsite : nan\npets_allowed : nan\ngeometry : POINT (19.8255173 50.0764912)\nhistoric : no information\nwiki_summary_en : Kraków Olszanica – a railway stop in Kraków on railway line no. 118, serving passenger trains that transport travelers from the Main Station in Kraków to John Paul II International Airport Kraków-Balice.\npostal_code : nan\ntoilets : nan\nnatural : no information\ndescription : nan\nvisiting_time : nan\nleisure : no information\ntourism : no information\npublic_transport : station\nbrand : nan\nalt_name : nan\namenity : no information\nreservation : nan\nattraction : nan\nhighchair : nan\nparking : nan\nswimming_pool : nan\ncontact_phone : nan\ncommunity_centre : nan\naddr_street : nan\ncontact_twitter : nan\nsocial_facility : nan\ncontact_facebook : nan\nzoo : nan\nemail : nan\nwheelchair : nan\ncuisine : nan\ncontact_website : nan\ninternet_access : nan\nopening_hours_reception : nan\nguest_house : nan\naddr_city : nan\ncontact_instagram : nan\nimage : nan\nlocation : nan\noutdoor_seating : nan\nmuseum : nan\ntakeaway : nan\nsmoking : nan\nname : Kraków Olszanica\nid : 7617\n\nphone : nan\ncemetery : nan\nemergency : nan\nopening_hours : nan\nwebsite : nan\npets_allowed : nan\ngeometry : POINT (19.8923031 50.0828345)\nhistoric : no information\nwiki_summary_en : Kraków Bronowice – a passenger stop of PKP Polish State Railways located in Kraków, in the VI Bronowice district at Armii Krajowej Street.  \nThe stop was opened for use on June 14, 2020, as part of the project \"Modernization of the E30 railway line, on the section Zabrze – Katowice – Kraków, stage IIb,\" co-financed by the European Union through the \"Connecting Europe\" instrument. The stop is one of the elements of the project to build an integrated transfer hub, which also includes the construction of a P+R parking lot and a bus terminal.\npostal_code : nan\ntoilets : nan\nnatural : no information\ndescription : nan\nvisiting_time : nan\nleisure : no information\ntourism : no information\npublic_transport : station\nbrand : nan\nalt_name : nan\namenity : no information\nreservation : nan\nattraction : nan\nhighchair : nan\nparking : nan\nswimming_pool : nan\ncontact_phone : nan\ncommunity_centre : nan\naddr_street : nan\ncontact_twitter : nan\nsocial_facility : nan\ncontact_facebook : nan\nzoo : nan\nemail : nan\nwheelchair : yes\ncuisine : nan\ncontact_website : nan\ninternet_access : nan\nopening_hours_reception : nan\nguest_house : nan\naddr_city : nan\ncontact_instagram : nan\nimage : nan\nlocation : nan\noutdoor_seating : nan\nmuseum : nan\ntakeaway : nan\nsmoking : nan\nname : Kraków Bronowice\nid : 8145\n\nphone : nan\ncemetery : nan\nemergency : nan\nopening_hours : nan\nwebsite : nan\npets_allowed : nan\ngeometry : POINT (19.9480267 50.0570638)\nhistoric : no information\nwiki_summary_en : Kraków Grzegórzki is a railway station on railway line no. 629 in Kraków at Dietla and Grzegórzecka Streets, near the historic railway viaduct. It is located at the boundary of the historical districts: Kazimierz (district I) and Grzegórzki (district II). Its establishment was related to the reconstruction of the railway line in this section and the creation of additional tracks on viaducts for the needs of the Fast Urban Railway. This station serves as a transfer hub in downtown Kraków, integrated with the tram and bus networks. The official opening of the station took place on September 3, 2023.\npostal_code : nan\ntoilets : nan\nnatural : no information\ndescription : nan\nvisiting_time : nan\nleisure : no information\ntourism : no information\npublic_transport : station\nbrand : nan\nalt_name : nan\namenity : no information\nreservation : nan\nattraction : nan\nhighchair : nan\nparking : nan\nswimming_pool : nan\ncontact_phone : nan\ncommunity_centre : nan\naddr_street : nan\ncontact_twitter : nan\nsocial_facility : nan\ncontact_facebook : nan\nzoo : nan\nemail : nan\nwheelchair : yes\ncuisine : nan\ncontact_website : nan\ninternet_access : nan\nopening_hours_reception : nan\nguest_house : nan\naddr_city : nan\ncontact_instagram : nan\nimage : nan\nlocation : nan\noutdoor_seating : nan\nmuseum : nan\ntakeaway : nan\nsmoking : nan\nname : Kraków Grzegórzki\nid : 8954\n\nphone : nan\ncemetery : nan\nemergency : nan\nopening_hours : nan\nwebsite : nan\npets_allowed : nan\ngeometry : POLYGON ((19.9214623 50.0575786, 19.9211232 50.057429, 19.9211115 50.057424, 19.9208286 50.0573925, 19.9205616 50.057364, 19.9201142 50.0573124, 19.9201124 50.0573178, 19.9200654 50.0573109, 19.9200667 50.057307, 19.9200602 50.0573062, 19.9200583 50.0573112, 19.9200149 50.0573048, 19.920016 50.0573011, 19.919955 50.0572939, 19.9199494 50.0573097, 19.9198971 50.0573022, 19.919902 50.0572877, 19.9198949 50.057287, 19.9198901 50.0573012, 19.9198378 50.0572936, 19.9198421 50.057281, 19.9198345 50.0572799, 19.9198335 50.0572833, 19.9197297 50.0572692, 19.9197287 50.0572723, 19.9196822 50.0572669, 19.9196832 50.0572637, 19.9195837 50.0572521, 19.9195828 50.0572553, 19.9195702 50.0572538, 19.9195711 50.0572507, 19.9195071 50.0572434, 19.9194349 50.0574514, 19.9193354 50.0577369, 19.9192346 50.0580261, 19.9191687 50.0582143, 19.919146 50.0582798, 19.919183 50.0582851, 19.9192122 50.0582892, 19.9192492 50.0582944, 19.9193647 50.0583108, 19.919351 50.0583494, 19.9193607 50.0583509, 19.9193628 50.0583449, 19.9194081 50.0583516, 19.9194061 50.0583574, 19.9194158 50.0583586, 19.9194178 50.0583529, 19.9194625 50.0583595, 19.9194605 50.0583652, 19.9194702 50.0583666, 19.9194721 50.0583608, 19.9195171 50.0583673, 19.919515 50.058373, 19.9195245 50.0583744, 19.9195267 50.0583687, 19.9195715 50.0583752, 19.9195695 50.0583809, 19.9195792 50.0583823, 19.919581 50.0583766, 19.919626 50.058383, 19.9196239 50.0583887, 19.9196336 50.0583902, 19.9196357 50.0583844, 19.9196805 50.0583908, 19.9196785 50.0583966, 19.9196882 50.058398, 19.9196902 50.0583923, 19.9197349 50.0583987, 19.9197329 50.0584046, 19.9197426 50.0584059, 19.9197446 50.0584001, 19.9197896 50.0584066, 19.9197874 50.0584124, 19.9197971 50.0584138, 19.9197992 50.058408, 19.9198439 50.0584144, 19.9198419 50.0584202, 19.9198516 50.0584217, 19.9198536 50.0584159, 19.9198986 50.0584224, 19.9198965 50.0584281, 19.9199061 50.0584294, 19.9199082 50.0584237, 19.9199529 50.0584302, 19.919951 50.058436, 19.9199606 50.0584374, 19.9199626 50.0584316, 19.9200075 50.0584381, 19.9200055 50.0584438, 19.9200151 50.0584452, 19.9200171 50.0584395, 19.9200621 50.058446, 19.92006 50.0584518, 19.9200697 50.0584531, 19.9200718 50.0584473, 19.9201168 50.0584538, 19.9201146 50.0584597, 19.9201245 50.0584611, 19.9201263 50.0584553, 19.920171 50.0584617, 19.9201689 50.0584675, 19.9201785 50.0584689, 19.9201807 50.058463, 19.9202255 50.0584696, 19.9202235 50.0584754, 19.9202332 50.0584768, 19.9202352 50.058471, 19.9202799 50.0584775, 19.9202779 50.0584832, 19.9202876 50.0584847, 19.9202896 50.0584788, 19.9203345 50.0584854, 19.9203324 50.0584911, 19.9203421 50.0584924, 19.9203441 50.0584869, 19.9203889 50.0584932, 19.9203869 50.058499, 19.9203966 50.0585004, 19.9203986 50.0584947, 19.9204434 50.0585012, 19.9204414 50.0585069, 19.9204511 50.0585083, 19.9204532 50.0585025, 19.9204981 50.0585089, 19.9204961 50.0585147, 19.9205058 50.0585162, 19.9205077 50.0585103, 19.9205524 50.0585168, 19.9205505 50.0585226, 19.9205601 50.058524, 19.9205621 50.0585182, 19.9206071 50.0585247, 19.920605 50.0585305, 19.9206146 50.0585319, 19.9206168 50.0585261, 19.9206615 50.0585325, 19.9206595 50.0585383, 19.9206692 50.0585397, 19.9206711 50.0585339, 19.920716 50.0585404, 19.9207139 50.0585462, 19.9207237 50.0585475, 19.9207258 50.0585419, 19.9207705 50.0585482, 19.9207685 50.058554, 19.9207782 50.0585555, 19.9207802 50.0585496, 19.9208249 50.0585562, 19.9208229 50.0585619, 19.9208326 50.0585633, 19.9208345 50.0585575, 19.9208795 50.0585639, 19.9208774 50.0585698, 19.9208869 50.0585712, 19.9208891 50.0585653, 19.920934 50.0585719, 19.9209321 50.0585776, 19.9209417 50.0585791, 19.9209437 50.0585732, 19.9209886 50.0585797, 19.9209864 50.0585855, 19.9209961 50.0585869, 19.9209982 50.0585812, 19.9210429 50.0585875, 19.9210409 50.0585933, 19.9210508 50.0585948, 19.9210527 50.0585889, 19.9210974 50.0585955, 19.9210955 50.0586014, 19.9211051 50.0586026, 19.9211071 50.0585969, 19.9211521 50.0586033, 19.92115 50.0586091, 19.9211596 50.0586106, 19.9211618 50.0586047, 19.9212065 50.0586111, 19.9212045 50.058617, 19.9212143 50.0586184, 19.9212163 50.0586126, 19.9212611 50.058619, 19.921259 50.0586249, 19.9212687 50.0586262, 19.9212708 50.0586205, 19.9213155 50.0586269, 19.9213135 50.0586327, 19.9213232 50.0586342, 19.9213252 50.0586283, 19.9213743 50.0586352, 19.9213712 50.0586408, 19.9213806 50.0586431, 19.9214849 50.05846, 19.9214763 50.058458, 19.9214738 50.0584627, 19.9214509 50.0584573, 19.9215764 50.0582102, 19.9216964 50.0579742, 19.9218172 50.0577368, 19.9216678 50.0576711, 19.9216693 50.0576697, 19.9214623 50.0575786))\nhistoric : no information\nwiki_summary_en : The Józef Piłsudski Cracovia Stadium (Polish: Stadion Cracovii im. Józefa Piłsudskiego) is a football stadium located in Kraków, Poland. It is used mostly for football matches and is the home ground of Cracovia. Originally, the first Cracovia stadium was built in 1912. It was demolished in mid-2009.  From then until late 2010, an entirely new construction was raised in roughly the same location where the old stadium stood. After reconstruction the stadium holds 15,114 people.\nThe stadium meets the criteria for UEFA Category 3\nThe stadium's design and construction has been frequently awarded in many architectural contests. \nIn 2010, it was honored with the Janusz Bogdanowskie award, given by the Archi-Szopa Association for the best architectural construction in Kraków City.\nThe stadium is located south of Błonia Park (in the Zwierzyniec district of Cracovia), near the stadium of Cracovia's archrival Wisła Kraków.\nThe stadium is named after Polish Chief of State, Marshal Józef Piłsudski\nThe 2018 FIFA World Cup qualification match between Ukraine and Kosovo on 9 October 2016 was played in the stadium due to Ukraine's Ukraine's non-recognition of Kosovo's travel documents. Ukraine's 2022–23 UEFA Nations League home fixtures were also played in this stadium due to the 2022 Russian invasion of Ukraine. From 2023 to 2025, the venue was used by Puszcza Niepołomice to host their home games following promotion to the top-flight, due to the stadium in Niepołomice not meeting the Ekstraklasa requirements.\npostal_code : nan\ntoilets : nan\nnatural : no information\ndescription : nan\nvisiting_time : nan\nleisure : stadium\ntourism : no information\npublic_transport : nan\nbrand : nan\nalt_name : nan\namenity : no information\nreservation : nan\nattraction : nan\nhighchair : nan\nparking : nan\nswimming_pool : nan\ncontact_phone : nan\ncommunity_centre : nan\naddr_street : Józefa Kałuży\ncontact_twitter : nan\nsocial_facility : nan\ncontact_facebook : nan\nzoo : nan\nemail : nan\nwheelchair : nan\ncuisine : nan\ncontact_website : nan\ninternet_access : nan\nopening_hours_reception : nan\nguest_house : nan\naddr_city : Kraków\ncontact_instagram : nan\nimage : nan\nlocation : nan\noutdoor_seating : nan\nmuseum : nan\ntakeaway : nan\nsmoking : nan\nname : Stadion Cracovii im. Józefa Piłsudskiego\nid : 11552\n\nphone : nan\ncemetery : nan\nemergency : nan\nopening_hours : nan\nwebsite : nan\npets_allowed : nan\ngeometry : POINT (20.0511771 50.0661039)\nhistoric : no information\nwiki_summary_en : no information\npostal_code : nan\ntoilets : nan\nnatural : no information\ndescription : nan\nvisiting_time : nan\nleisure : no information\ntourism : no information\npublic_transport : stop_position\nbrand : nan\nalt_name : nan\namenity : no information\nreservation : nan\nattraction : nan\nhighchair : nan\nparking : nan\nswimming_pool : nan\ncontact_phone : nan\ncommunity_centre : nan\naddr_street : nan\ncontact_twitter : nan\nsocial_facility : nan\ncontact_facebook : nan\nzoo : nan\nemail : nan\nwheelchair : nan\ncuisine : nan\ncontact_website : nan\ninternet_access : nan\nopening_hours_reception : nan\nguest_house : nan\naddr_city : nan\ncontact_instagram : nan\nimage : nan\nlocation : nan\noutdoor_seating : nan\nmuseum : nan\ntakeaway : nan\nsmoking : nan\nname : Sieroszewskiego 01\nid : 7872\n\n",
  "answer": "To reach Sieroszewskiego 01 using public transport, you can take the **bus**. The nearest bus stop is **Sieroszewskiego 01**.",
  "labels": {
    "faithfulness": "FAITHFUL",
    "groundedness": "NON_GROUNDED",
    "relevance": "RELEVANT",
    "completeness": "PARTLY_COMPLETE",
    "coherence": "COHERENT",
    "conciseness": "CONCISE"
  },
  "quality_score": 4
}