{
  "model": "gemini_llm",
  "prompt": "prompt_B",
  "id": 2513,
  "question": "When was the Monument of Martyrdom unveiled, and what does it look like?",
  "context": "phone : nan\ncemetery : nan\nemergency : nan\nopening_hours : nan\nwebsite : nan\npets_allowed : nan\ngeometry : POINT (19.9276006 50.060019)\nhistoric : memorial\nwiki_summary_en : The monument of Marshal Józef Piłsudski, located at the intersection of Piłsudski, Wenecja, and Garncarska streets in Kraków, is the work of Czesław Dźwigaj. The monument was unveiled on November 10, 2008.\npostal_code : nan\ntoilets : nan\nnatural : no information\ndescription : nan\nvisiting_time : nan\nleisure : no information\ntourism : no information\npublic_transport : nan\nbrand : nan\nalt_name : nan\namenity : no information\nreservation : nan\nattraction : nan\nhighchair : nan\nparking : nan\nswimming_pool : nan\ncontact_phone : nan\ncommunity_centre : nan\naddr_street : nan\ncontact_twitter : nan\nsocial_facility : nan\ncontact_facebook : nan\nzoo : nan\nemail : nan\nwheelchair : nan\ncuisine : nan\ncontact_website : nan\ninternet_access : nan\nopening_hours_reception : nan\nguest_house : nan\naddr_city : nan\ncontact_instagram : nan\nimage : nan\nlocation : nan\noutdoor_seating : nan\nmuseum : nan\ntakeaway : nan\nsmoking : nan\nname : Pomnik Marszałka Józefa Piłsudskiego i Legionistów;Józef Piłsudski;маршал Юзэф Пілсудскі;Czesław Dźwigaj\nid : 2406\n\nphone : nan\ncemetery : nan\nemergency : nan\nopening_hours : nan\nwebsite : nan\npets_allowed : nan\ngeometry : POINT (19.9661461 50.0326418)\nhistoric : memorial\nwiki_summary_en : The Monument of Martyrdom – Executed on September 10, 1939 – is a monument located in Krakow in its right-bank part relative to the Vistula River – Podgórze, at Abrahama Street. Krakow was occupied by the Wehrmacht on September 6, 1939, and just four days later, on September 10, 1939, the Germans carried out the first mass execution of Poles at this site. Thirteen residents of Krakow were executed at the wall of the new Jewish cemetery in Podgórze. Eleven men, known by name, and two unknown individuals were killed. The monument, unveiled in 1984, is a granite stone block with a black marble plaque on which the inscription appears.\npostal_code : nan\ntoilets : nan\nnatural : no information\ndescription : nan\nvisiting_time : nan\nleisure : no information\ntourism : no information\npublic_transport : nan\nbrand : nan\nalt_name : nan\namenity : no information\nreservation : nan\nattraction : nan\nhighchair : nan\nparking : nan\nswimming_pool : nan\ncontact_phone : nan\ncommunity_centre : nan\naddr_street : nan\ncontact_twitter : nan\nsocial_facility : nan\ncontact_facebook : nan\nzoo : nan\nemail : nan\nwheelchair : nan\ncuisine : nan\ncontact_website : nan\ninternet_access : nan\nopening_hours_reception : nan\nguest_house : nan\naddr_city : nan\ncontact_instagram : nan\nimage : nan\nlocation : nan\noutdoor_seating : nan\nmuseum : nan\ntakeaway : nan\nsmoking : nan\nname : Pomnik rozstrzelanych 10 września 1939 roku\nid : 2513\n\nphone : nan\ncemetery : nan\nemergency : nan\nopening_hours : nan\nwebsite : nan\npets_allowed : nan\ngeometry : POINT (19.94182 50.0473547)\nhistoric : no information\nwiki_summary_en : The Piotr Skrzynecki Monument – a monument located in Krakow in Kazimierz, at Skawińska Street 8. On November 27, 1998, a monument was unveiled in memory of Piotr Skrzynecki, the creator and animator of the cabaret Piwnica pod Baranami, in front of the II Department of Internal Diseases at the Collegium Medicum of the Jagiellonian University. It depicts two acrobat-like figures. A man stands on movable blocks, with a woman on his right shoulder, raising her arms up. In his outstretched left hand, which he holds for balance, the man grips a bell, an inseparable attribute of Piotr Skrzynecki. The pedestal bears the inscription \"In Memory of Piotr Skrzynecki.\" The bronze monument was funded by Professor Andrzej Szczeklik, who was the head of the clinic, and Piotr Skrzynecki was his longtime friend and patient for almost 20 years. He dedicated the award from the Polish Science Foundation for the monument dedicated to his friend. The sculpture is the work of Karol Gąsienica Szostak.\npostal_code : nan\ntoilets : nan\nnatural : no information\ndescription : nan\nvisiting_time : nan\nleisure : no information\ntourism : artwork\npublic_transport : nan\nbrand : nan\nalt_name : nan\namenity : no information\nreservation : nan\nattraction : nan\nhighchair : nan\nparking : nan\nswimming_pool : nan\ncontact_phone : nan\ncommunity_centre : nan\naddr_street : nan\ncontact_twitter : nan\nsocial_facility : nan\ncontact_facebook : nan\nzoo : nan\nemail : nan\nwheelchair : nan\ncuisine : nan\ncontact_website : nan\ninternet_access : nan\nopening_hours_reception : nan\nguest_house : nan\naddr_city : nan\ncontact_instagram : nan\nimage : nan\nlocation : nan\noutdoor_seating : nan\nmuseum : nan\ntakeaway : nan\nsmoking : nan\nname : Piotr Skrzynecki;Piotr Skrzynecki emlékére\nid : 2551\n\nphone : nan\ncemetery : nan\nemergency : nan\nopening_hours : nan\nwebsite : nan\npets_allowed : nan\ngeometry : POINT (19.9965431 50.0945834)\nhistoric : memorial\nwiki_summary_en : The monument of John Paul II in front of the church in Mistrzejowice – the monument of John Paul II, located in Kraków-Nowa Huta, in District XV Mistrzejowice on the Tysiąclecia estate. It was erected in the square in front of the church of St. Maximilian Maria Kolbe. \nIt is a bronze cast figure of the pope on a granite pedestal with his coat of arms. The author of the monument is the artist-sculptor, Prof. Gustaw Zemła; the monument in front of the church in Mistrzejowice was the first monument of John Paul II made by this artist. It was unveiled in January 1991.\npostal_code : nan\ntoilets : nan\nnatural : no information\ndescription : nan\nvisiting_time : nan\nleisure : no information\ntourism : no information\npublic_transport : nan\nbrand : nan\nalt_name : nan\namenity : no information\nreservation : nan\nattraction : nan\nhighchair : nan\nparking : nan\nswimming_pool : nan\ncontact_phone : nan\ncommunity_centre : nan\naddr_street : nan\ncontact_twitter : nan\nsocial_facility : nan\ncontact_facebook : nan\nzoo : nan\nemail : nan\nwheelchair : nan\ncuisine : nan\ncontact_website : nan\ninternet_access : nan\nopening_hours_reception : nan\nguest_house : nan\naddr_city : nan\ncontact_instagram : nan\nimage : nan\nlocation : nan\noutdoor_seating : nan\nmuseum : nan\ntakeaway : nan\nsmoking : nan\nname : Jan Paweł II;Gustaw Zemła\nid : 2689\n\nphone : nan\ncemetery : nan\nemergency : nan\nopening_hours : nan\nwebsite : nan\npets_allowed : nan\ngeometry : POINT (19.9719279 50.0362614)\nhistoric : memorial\nwiki_summary_en : The Monument to the Martyrdom of Those Hanged on June 26, 1942, in Kraków – a monument in the form of an obelisk located on Wodna Street next to the Kraków Płaszów railway station in District XIII Podgórze. \nThe German occupiers hanged seven Poles in retaliation for a sabotage action that involved derailing a military train at the local station. \nIn Tadeusz Wroński's book titled \"Chronicle of Occupied Kraków\" on page 213, there is a photograph depicting the execution by hanging. \nThe inscription on the plaque:\npostal_code : nan\ntoilets : nan\nnatural : no information\ndescription : nan\nvisiting_time : nan\nleisure : no information\ntourism : no information\npublic_transport : nan\nbrand : nan\nalt_name : nan\namenity : no information\nreservation : nan\nattraction : nan\nhighchair : nan\nparking : nan\nswimming_pool : nan\ncontact_phone : nan\ncommunity_centre : nan\naddr_street : nan\ncontact_twitter : nan\nsocial_facility : nan\ncontact_facebook : nan\nzoo : nan\nemail : nan\nwheelchair : nan\ncuisine : nan\ncontact_website : nan\ninternet_access : nan\nopening_hours_reception : nan\nguest_house : nan\naddr_city : nan\ncontact_instagram : nan\nimage : nan\nlocation : nan\noutdoor_seating : nan\nmuseum : nan\ntakeaway : nan\nsmoking : nan\nname : Pomnik Martyrologii Powieszonych 26 czerwca 1942 roku w Krakowie\nid : 2900\n\nphone : nan\ncemetery : nan\nemergency : nan\nopening_hours : nan\nwebsite : nan\npets_allowed : nan\ngeometry : POINT (20.0291537 50.0840326)\nhistoric : memorial\nwiki_summary_en : The monument to Bogdan Włosik and other victims of martial law is located in Kraków-Nowa Huta, in District XVI Bieńczyce, in the Przy Arce housing estate, in front of block number 11. The small monument was erected in the square where Bogdan Włosik lost his life. On the thirteenth day of each month after 1981, masses for the homeland were held in the nearby Ark of the Lord church, and demonstrations of Solidarity took place, which led to riots and clashes between the residents of Nowa Huta and ZOMO units. During one of the clashes, on October 13, 1982, Bogdan Włosik was shot by an officer of the SB and died. Currently, the square in front of the Ark of the Lord bears his name. The monument, designed by Helena Łyżwa, was unveiled in 1992, on the tenth anniversary of the events. It consists of two blocks of granite, and the space between them is shaped like a cross. At the foot of the cross is an inscription.\npostal_code : nan\ntoilets : nan\nnatural : no information\ndescription : nan\nvisiting_time : nan\nleisure : no information\ntourism : no information\npublic_transport : nan\nbrand : nan\nalt_name : nan\namenity : no information\nreservation : nan\nattraction : nan\nhighchair : nan\nparking : nan\nswimming_pool : nan\ncontact_phone : nan\ncommunity_centre : nan\naddr_street : nan\ncontact_twitter : nan\nsocial_facility : nan\ncontact_facebook : nan\nzoo : nan\nemail : nan\nwheelchair : nan\ncuisine : nan\ncontact_website : nan\ninternet_access : nan\nopening_hours_reception : nan\nguest_house : nan\naddr_city : nan\ncontact_instagram : nan\nimage : nan\nlocation : nan\noutdoor_seating : nan\nmuseum : nan\ntakeaway : nan\nsmoking : nan\nname : no information\nid : 3058\n\nphone : nan\ncemetery : nan\nemergency : nan\nopening_hours : nan\nwebsite : nan\npets_allowed : nan\ngeometry : POINT (20.0477564 50.0859829)\nhistoric : memorial\nwiki_summary_en : The Monument to the Executed in Krzesławice (Monument of Martyrdom) is a monument located in the northern part of Krakow, in District XVII Wzgórza Krzesławickie, in the Krzesławice housing estate at Wańkowicza Street.\npostal_code : nan\ntoilets : nan\nnatural : no information\ndescription : nan\nvisiting_time : nan\nleisure : no information\ntourism : no information\npublic_transport : nan\nbrand : nan\nalt_name : nan\namenity : no information\nreservation : nan\nattraction : nan\nhighchair : nan\nparking : nan\nswimming_pool : nan\ncontact_phone : nan\ncommunity_centre : nan\naddr_street : nan\ncontact_twitter : nan\nsocial_facility : nan\ncontact_facebook : nan\nzoo : nan\nemail : nan\nwheelchair : nan\ncuisine : nan\ncontact_website : nan\ninternet_access : nan\nopening_hours_reception : nan\nguest_house : nan\naddr_city : nan\ncontact_instagram : nan\nimage : nan\nlocation : nan\noutdoor_seating : nan\nmuseum : nan\ntakeaway : nan\nsmoking : nan\nname : no information\nid : 3108\n\n",
  "answer": "The Monument of Martyrdom – Executed on September 10, 1939 – was unveiled in 1984. It is a granite stone block with a black marble plaque bearing an inscription.",
  "labels": {
    "faithfulness": "FAITHFUL",
    "groundedness": "GROUNDED",
    "relevance": "RELEVANT",
    "completeness": "COMPLETE",
    "coherence": "COHERENT",
    "conciseness": "CONCISE"
  },
  "quality_score": 6
}