{
  "model": "gemini_llm",
  "prompt": "prompt_B",
  "id": 696,
  "question": "Is there wheelchair accessibility at Corner Pizza for guests who may need assistance?",
  "context": "phone : nan\ncemetery : nan\nemergency : nan\nopening_hours : nan\nwebsite : nan\npets_allowed : nan\ngeometry : POINT (19.9461619 50.0644771)\nhistoric : no information\nwiki_summary_en : Hotel Europejski in Kraków – a three-star hotel located in the center of Kraków, in close proximity to the Main Railway Station, at 5 Lubicz Street. The hotel was built in 1884 by Jan Kazimierz Lubicz Łapiński. It has three floors (the first floor was reserved for guests, and the others for staff). The hotel featured a restaurant, to which a theatrical-ballroom and a carriage house were later added. In 1966, the hotel was nationalized and came under the management of the Municipal Hotel Directorate, and in 1973 the Krakow Tourist Enterprise Wawel-Tourist, during which it suffered significant deterioration. On May 23, 1991, it was returned to the heiress (the founder's granddaughter), Maria Lubicz Łapińska-Czepczyk. After a thorough renovation, it is currently run by Ms. Maria's son – Jacek Czepczyk. It now offers 87 accommodation places in 41 rooms, as well as a restaurant, café, magic garden, billiard club, ballroom, conference rooms, and a currency exchange office.\npostal_code : nan\ntoilets : nan\nnatural : no information\ndescription : nan\nvisiting_time : nan\nleisure : no information\ntourism : hotel\npublic_transport : nan\nbrand : nan\nalt_name : nan\namenity : no information\nreservation : nan\nattraction : nan\nhighchair : nan\nparking : nan\nswimming_pool : nan\ncontact_phone : nan\ncommunity_centre : nan\naddr_street : Lubicz\ncontact_twitter : nan\nsocial_facility : nan\ncontact_facebook : nan\nzoo : nan\nemail : nan\nwheelchair : nan\ncuisine : nan\ncontact_website : nan\ninternet_access : nan\nopening_hours_reception : nan\nguest_house : nan\naddr_city : nan\ncontact_instagram : nan\nimage : nan\nlocation : nan\noutdoor_seating : nan\nmuseum : nan\ntakeaway : nan\nsmoking : nan\nname : Hotel Europejski\nid : 6412\n\nphone : nan\ncemetery : nan\nemergency : nan\nopening_hours : nan\nwebsite : nan\npets_allowed : nan\ngeometry : POINT (19.9569831 50.0484407)\nhistoric : no information\nwiki_summary_en : Kraków Zabłocie – a train station in Kraków, in the Podgórze district, in its formerly industrial part, Zabłocie. It was opened in 1979. Only passenger trains stop at the station. The station can be accessed via Kącik Street (from the Old Podgórze side) and Lipowa Street (from the Zabłocie side).\npostal_code : nan\ntoilets : nan\nnatural : no information\ndescription : nan\nvisiting_time : nan\nleisure : no information\ntourism : no information\npublic_transport : station\nbrand : nan\nalt_name : nan\namenity : no information\nreservation : nan\nattraction : nan\nhighchair : nan\nparking : nan\nswimming_pool : nan\ncontact_phone : nan\ncommunity_centre : nan\naddr_street : nan\ncontact_twitter : nan\nsocial_facility : nan\ncontact_facebook : nan\nzoo : nan\nemail : nan\nwheelchair : yes\ncuisine : nan\ncontact_website : nan\ninternet_access : nan\nopening_hours_reception : nan\nguest_house : nan\naddr_city : nan\ncontact_instagram : nan\nimage : http://commons.wikimedia.org/wiki/File:Krak%C3%B3w_Zab%C5%82ocie.jpg\nlocation : nan\noutdoor_seating : nan\nmuseum : nan\ntakeaway : nan\nsmoking : nan\nname : Kraków Zabłocie\nid : 7162\n\nphone : nan\ncemetery : nan\nemergency : nan\nopening_hours : Mo-Fr 08:00-20:00; Sa 08:00-14:00\nwebsite : nan\npets_allowed : nan\ngeometry : POLYGON ((19.9425519 50.059745, 19.9425448 50.0597491, 19.9424857 50.0597071, 19.942468 50.0596945, 19.9424728 50.0596911, 19.9424625 50.0596831, 19.9424664 50.0596811, 19.942467 50.0596737, 19.9424518 50.0596681, 19.9424395 50.0596614, 19.9424299 50.0596532, 19.9424228 50.0596433, 19.942418 50.0596294, 19.9424191 50.0596161, 19.9424257 50.0596033, 19.942435 50.0595936, 19.942448 50.059585, 19.9424592 50.0595802, 19.9424688 50.0595773, 19.9424784 50.0595725, 19.9424746 50.0595704, 19.9424851 50.0595624, 19.942481 50.0595593, 19.9425677 50.0595115, 19.9425739 50.0595162, 19.9427288 50.059431, 19.9427235 50.059427, 19.9428701 50.0593464, 19.9428764 50.0593512, 19.9430295 50.0592649, 19.9430246 50.0592608, 19.943111 50.059213, 19.9431159 50.0592164, 19.9431191 50.0592146, 19.9431401 50.0592308, 19.9431544 50.059223, 19.9432124 50.0591914, 19.9431997 50.0591814, 19.9431958 50.0591835, 19.9431875 50.0591769, 19.9431928 50.0591742, 19.943201 50.0591698, 19.9432019 50.0591705, 19.9433433 50.059299, 19.9432778 50.0593354, 19.9428271 50.0595832, 19.9428363 50.0595904, 19.9428123 50.0596037, 19.9428397 50.0596237, 19.9428361 50.0596603, 19.9428055 50.0596776, 19.9428264 50.0596928, 19.9428179 50.0596979, 19.9428468 50.0597209, 19.9428941 50.0596962, 19.9428986 50.0596993, 19.9429526 50.0597372, 19.9429031 50.0597664, 19.9429732 50.0598155, 19.9429482 50.0598303, 19.94294 50.0598351, 19.9428184 50.0599069, 19.9427759 50.0599056, 19.9425519 50.059745))\nhistoric : no information\nwiki_summary_en : The Main Post Office in Kraków (Polish: Poczta Główna w Krakowie) is a building of the Polish Post located at the corner of Wielopole 2 and Westerplatte 20 streets in Kraków.\nThe building was designed by the Viennese architect F. Setz. Joseph Sareg adapted the project and it was built between 1887 and 1889 by Charles Knaus and Tadeusz Stryjeński.\nSince 1899 it was the headquarters of mail in Kraków. In 1909, it was the location of what is now the Polish automatic telephone exchange with a capacity of 3600 numbers.\nDue to growing needs for office surface, between 1930 and 1931 it was rebuilt by Frederick Tadaniera. The interiors and furnishings were updated and in 1933 the intercity telephone exchange was installed.\nAnother reconstruction took place during the German occupation. The Polish Post Office reopened on January 22, 1945.\nAfter the war, the post office has repeatedly being modernized and repaired. Since 1991 it has housed the Polish Post and Telecommunications.\npostal_code : nan\ntoilets : nan\nnatural : no information\ndescription : nan\nvisiting_time : nan\nleisure : no information\ntourism : no information\npublic_transport : nan\nbrand : Poczta Polska\nalt_name : nan\namenity : post_office\nreservation : nan\nattraction : nan\nhighchair : nan\nparking : nan\nswimming_pool : nan\ncontact_phone : nan\ncommunity_centre : nan\naddr_street : nan\ncontact_twitter : nan\nsocial_facility : nan\ncontact_facebook : nan\nzoo : nan\nemail : nan\nwheelchair : nan\ncuisine : nan\ncontact_website : nan\ninternet_access : nan\nopening_hours_reception : nan\nguest_house : nan\naddr_city : nan\ncontact_instagram : nan\nimage : nan\nlocation : nan\noutdoor_seating : nan\nmuseum : nan\ntakeaway : nan\nsmoking : nan\nname : Urząd Pocztowy Kraków 1;Почта;UP Kraków\nid : 11277\n\nphone : nan\ncemetery : nan\nemergency : nan\nopening_hours : Su-Th 11:00-20:00; Fr-Sa 11:00-22:00\nwebsite : https://www.facebook.com/cornerpizza.krakow/\npets_allowed : nan\ngeometry : POINT (19.9349718 50.0606381)\nhistoric : no information\nwiki_summary_en : no information\npostal_code : nan\ntoilets : nan\nnatural : no information\ndescription : PIZZA AL TAGLIO - pizza na wagę - lasagne - gnocchi - pasta - tiramisu\nvisiting_time : nan\nleisure : no information\ntourism : no information\npublic_transport : nan\nbrand : nan\nalt_name : nan\namenity : fast_food\nreservation : nan\nattraction : nan\nhighchair : nan\nparking : nan\nswimming_pool : nan\ncontact_phone : nan\ncommunity_centre : nan\naddr_street : Wiślna\ncontact_twitter : nan\nsocial_facility : nan\ncontact_facebook : nan\nzoo : nan\nemail : nan\nwheelchair : yes\ncuisine : pizza\ncontact_website : nan\ninternet_access : nan\nopening_hours_reception : nan\nguest_house : nan\naddr_city : Kraków\ncontact_instagram : nan\nimage : nan\nlocation : nan\noutdoor_seating : nan\nmuseum : nan\ntakeaway : nan\nsmoking : no\nname : Corner Pizza\nid : 696\n\nphone : +48122623131\ncemetery : nan\nemergency : nan\nopening_hours : Mo-Sa 11:00-22:00; Su 11:00-21:00\nwebsite : https://pizzeriatoskania.com.pl\npets_allowed : nan\ngeometry : POINT (19.89422 50.0078799)\nhistoric : no information\nwiki_summary_en : no information\npostal_code : nan\ntoilets : nan\nnatural : no information\ndescription : nan\nvisiting_time : nan\nleisure : no information\ntourism : no information\npublic_transport : nan\nbrand : nan\nalt_name : nan\namenity : restaurant\nreservation : nan\nattraction : nan\nhighchair : nan\nparking : nan\nswimming_pool : nan\ncontact_phone : nan\ncommunity_centre : nan\naddr_street : Kobierzyńska\ncontact_twitter : nan\nsocial_facility : nan\ncontact_facebook : nan\nzoo : nan\nemail : nan\nwheelchair : nan\ncuisine : pizza\ncontact_website : nan\ninternet_access : nan\nopening_hours_reception : nan\nguest_house : nan\naddr_city : Kraków\ncontact_instagram : nan\nimage : nan\nlocation : nan\noutdoor_seating : nan\nmuseum : nan\ntakeaway : nan\nsmoking : nan\nname : Pizzeria Toskania\nid : 2090\n\nphone : +48 506 820 222\ncemetery : nan\nemergency : nan\nopening_hours : Mo-Su 12:00-23:00\nwebsite : http://pastabar.com.pl\npets_allowed : nan\ngeometry : POINT (19.9379567 50.0640481)\nhistoric : no information\nwiki_summary_en : no information\npostal_code : nan\ntoilets : nan\nnatural : no information\ndescription : nan\nvisiting_time : nan\nleisure : no information\ntourism : no information\npublic_transport : nan\nbrand : nan\nalt_name : nan\namenity : restaurant\nreservation : nan\nattraction : nan\nhighchair : nan\nparking : nan\nswimming_pool : nan\ncontact_phone : nan\ncommunity_centre : nan\naddr_street : Sławkowska\ncontact_twitter : nan\nsocial_facility : nan\ncontact_facebook : nan\nzoo : nan\nemail : nan\nwheelchair : nan\ncuisine : nan\ncontact_website : nan\ninternet_access : nan\nopening_hours_reception : nan\nguest_house : nan\naddr_city : Kraków\ncontact_instagram : nan\nimage : nan\nlocation : nan\noutdoor_seating : nan\nmuseum : nan\ntakeaway : nan\nsmoking : nan\nname : Pasta Bar\nid : 849\n\nphone : nan\ncemetery : nan\nemergency : nan\nopening_hours : nan\nwebsite : nan\npets_allowed : nan\ngeometry : POINT (19.9279125 50.0938379)\nhistoric : no information\nwiki_summary_en : no information\npostal_code : nan\ntoilets : nan\nnatural : no information\ndescription : nan\nvisiting_time : nan\nleisure : no information\ntourism : no information\npublic_transport : nan\nbrand : nan\nalt_name : nan\namenity : fast_food\nreservation : nan\nattraction : nan\nhighchair : nan\nparking : nan\nswimming_pool : nan\ncontact_phone : nan\ncommunity_centre : nan\naddr_street : nan\ncontact_twitter : nan\nsocial_facility : nan\ncontact_facebook : nan\nzoo : nan\nemail : nan\nwheelchair : nan\ncuisine : pizza\ncontact_website : nan\ninternet_access : nan\nopening_hours_reception : nan\nguest_house : nan\naddr_city : nan\ncontact_instagram : nan\nimage : nan\nlocation : nan\noutdoor_seating : nan\nmuseum : nan\ntakeaway : nan\nsmoking : nan\nname : Pizza u Łysego\nid : 888\n\nphone : nan\ncemetery : nan\nemergency : nan\nopening_hours : Mo-We 11:00-22:00; Th-Su 11:00-23:00\nwebsite : nan\npets_allowed : nan\ngeometry : POINT (19.9494707 50.0504971)\nhistoric : no information\nwiki_summary_en : no information\npostal_code : nan\ntoilets : nan\nnatural : no information\ndescription : nan\nvisiting_time : nan\nleisure : no information\ntourism : no information\npublic_transport : nan\nbrand : nan\nalt_name : nan\namenity : fast_food\nreservation : nan\nattraction : nan\nhighchair : nan\nparking : nan\nswimming_pool : nan\ncontact_phone : nan\ncommunity_centre : nan\naddr_street : nan\ncontact_twitter : nan\nsocial_facility : nan\ncontact_facebook : nan\nzoo : nan\nemail : nan\nwheelchair : nan\ncuisine : burger\ncontact_website : nan\ninternet_access : nan\nopening_hours_reception : nan\nguest_house : nan\naddr_city : nan\ncontact_instagram : nan\nimage : nan\nlocation : nan\noutdoor_seating : nan\nmuseum : nan\ntakeaway : nan\nsmoking : nan\nname : Corner Burger\nid : 296\n\n",
  "answer": "Yes, Corner Pizza is wheelchair accessible.",
  "labels": {
    "faithfulness": "FAITHFUL",
    "groundedness": "GROUNDED",
    "relevance": "RELEVANT",
    "completeness": "COMPLETE",
    "coherence": "COHERENT",
    "conciseness": "CONCISE"
  },
  "quality_score": 6
}