{
  "model": "mistral_llm",
  "prompt": "prompt_C",
  "id": 297,
  "question": "Does the Pancake House offer any outdoor seating for dining?",
  "context": "phone : nan\ncemetery : nan\nemergency : nan\nopening_hours : nan\nwebsite : https://jamamichalika.pl/\npets_allowed : nan\ngeometry : POINT (19.940929 50.0640836)\nhistoric : no information\nwiki_summary_en : Jama Michalika is a historic café in Kraków, Poland, established in 1895. It is located at Floriańska Street in Kraków, the capital of the Lesser Poland region.\nJama Michalika (lit. Michalik's Den in Polish) is one of the oldest Kraków cafes. It was founded in 1895 by Jan Apolinary Michalik as Cukiernia Lwowska (Lwów Confiserie). The current name, also translated as the Michalik's Cave, came into existence because initially Michalik could afford only a single room in the back, without any windows. The central location in the Ulica Floriańska 45 as well as the patisserie offering and the invitation to students from the nearby Academy of Fine Arts to dine there free of charge in exchange for their small works of art, the cafe became quickly popular.\n\nIn 1905, the cabaret Zielony Balonik (Green Balloon) began staging performances at the café. As a highlight of every cabaret evening was the appearance of a puppet theatre designed and produced for widely popular shows against bigotry and imperial censorship, by Bronisława Janowska among others. Some of the puppets depicted prominent Cracovians. A selection of those historic puppets are displayed at the cafe. The interior is decorated with Art Nouveau furniture, mirrors, stained glass, lamps and cabinets.\npostal_code : nan\ntoilets : nan\nnatural : no information\ndescription : nan\nvisiting_time : nan\nleisure : no information\ntourism : no information\npublic_transport : nan\nbrand : nan\nalt_name : nan\namenity : cafe\nreservation : nan\nattraction : nan\nhighchair : nan\nparking : nan\nswimming_pool : nan\ncontact_phone : nan\ncommunity_centre : nan\naddr_street : Floriańska\ncontact_twitter : nan\nsocial_facility : nan\ncontact_facebook : nan\nzoo : nan\nemail : nan\nwheelchair : nan\ncuisine : nan\ncontact_website : nan\ninternet_access : nan\nopening_hours_reception : nan\nguest_house : nan\naddr_city : Kraków\ncontact_instagram : nan\nimage : nan\nlocation : nan\noutdoor_seating : nan\nmuseum : nan\ntakeaway : nan\nsmoking : nan\nname : Kawiarnia Jama Michalika;Kaffee \"Jama Michalika\" Michaels Grotte\nid : 449\n\nphone : nan\ncemetery : nan\nemergency : nan\nopening_hours : nan\nwebsite : nan\npets_allowed : nan\ngeometry : POINT (20.0060099 50.093101)\nhistoric : no information\nwiki_summary_en : Outdoor sculptures in Nowa Huta – outdoor sculptures in the Krakow districts: Nowa Huta, Bieńczyce, Mistrzejowice.  \nThe outdoor sculptures are scattered in various parts of Nowa Huta in squares, parks, playgrounds, and lawns within housing estates. They were created en masse in the 1960s and 70s during the thaw, when the rules of socialist realism were no longer in effect. The authorities of the newly established city created ideal working conditions for young creators. The Housing Cooperative \"Hutnik\" played a significant role in promoting art and creating an artistic environment in Nowa Huta, collaborating with the ZPAP District Board and the Creative Association \"Nowa Huta,\" which was established at the initiative of Janusz Trzebiatowski in 1969. Young artists, mostly graduates of the Krakow Academy of Fine Arts, received housing, studios, and scholarships in exchange for their sculptures, which began to adorn the green spaces of Nowa Huta. The works created during this period vary in artistic value and style. The artists employed diverse techniques and materials. Many sculptures resulting from this initiative have been preserved in Nowa Huta. In 2018, as part of a project supported by the European Year of Cultural Heritage 2018, a trail of outdoor sculptures and installations in Nowa Huta was created.\npostal_code : nan\ntoilets : nan\nnatural : no information\ndescription : nan\nvisiting_time : nan\nleisure : no information\ntourism : artwork\npublic_transport : nan\nbrand : nan\nalt_name : nan\namenity : no information\nreservation : nan\nattraction : nan\nhighchair : nan\nparking : nan\nswimming_pool : nan\ncontact_phone : nan\ncommunity_centre : nan\naddr_street : nan\ncontact_twitter : nan\nsocial_facility : nan\ncontact_facebook : nan\nzoo : nan\nemail : nan\nwheelchair : nan\ncuisine : nan\ncontact_website : nan\ninternet_access : nan\nopening_hours_reception : nan\nguest_house : nan\naddr_city : nan\ncontact_instagram : nan\nimage : nan\nlocation : nan\noutdoor_seating : nan\nmuseum : nan\ntakeaway : nan\nsmoking : nan\nname : Spirala kosmiczna;Antoni Hajdecki\nid : 3148\n\nphone : nan\ncemetery : nan\nemergency : nan\nopening_hours : nan\nwebsite : nan\npets_allowed : nan\ngeometry : POINT (20.0517538 50.0712049)\nhistoric : no information\nwiki_summary_en : Outdoor sculptures in Nowa Huta – outdoor sculptures in the districts of Kraków: Nowa Huta, Bieńczyce, Mistrzejowice.  \nThe outdoor sculptures are scattered in various parts of Nowa Huta, in squares, parks, playgrounds, and lawns within housing estates. They were created en masse in the 1960s and 1970s during the thaw when the rules of socialist realism ceased to apply. The authorities of the newly created city provided ideal working conditions for young creators. The Housing Cooperative “Hutnik” played a significant role in popularizing art and creating an artistic environment in Nowa Huta, collaborating with the Management Board of the District ZPAP and the Creative Association “Nowa Huta,” which was initiated by Janusz Trzebiatowski in 1969. Young artists, mostly graduates of the Kraków Academy of Fine Arts, were provided with apartments, studios, and scholarships; in return, their sculptures began to adorn the green spaces of Nowa Huta. The works created during this period have varying artistic value and styles. Artists used diverse techniques and materials. Many sculptures resulting from this initiative have been preserved in Nowa Huta. In 2018, as part of a project under the patronage of the European Year of Cultural Heritage 2018, a trail of outdoor sculptures and installations in Nowa Huta was created.\npostal_code : nan\ntoilets : nan\nnatural : no information\ndescription : nan\nvisiting_time : nan\nleisure : no information\ntourism : artwork\npublic_transport : nan\nbrand : nan\nalt_name : nan\namenity : no information\nreservation : nan\nattraction : nan\nhighchair : nan\nparking : nan\nswimming_pool : nan\ncontact_phone : nan\ncommunity_centre : nan\naddr_street : nan\ncontact_twitter : nan\nsocial_facility : nan\ncontact_facebook : nan\nzoo : nan\nemail : nan\nwheelchair : nan\ncuisine : nan\ncontact_website : nan\ninternet_access : nan\nopening_hours_reception : nan\nguest_house : nan\naddr_city : nan\ncontact_instagram : nan\nimage : nan\nlocation : nan\noutdoor_seating : nan\nmuseum : nan\ntakeaway : nan\nsmoking : nan\nname : Organy;Lucjan Orzech\nid : 3149\n\nphone : nan\ncemetery : nan\nemergency : nan\nopening_hours : nan\nwebsite : nan\npets_allowed : nan\ngeometry : POINT (20.0501147 50.0725295)\nhistoric : no information\nwiki_summary_en : Outdoor sculptures in Nowa Huta – outdoor sculptures in the districts of Kraków: Nowa Huta, Bieńczyce, Mistrzejowice. Outdoor sculptures are scattered in various parts of Nowa Huta in squares, parks, playgrounds, and lawns within housing estates. They were created en masse in the 1960s and 70s during the thaw when the rules of socialist realism ceased to apply. The authorities of the newly established city created ideal working conditions for young creators. The Housing Cooperative \"Hutnik\" played a significant role in promoting art and creating an artistic environment in Nowa Huta, collaborating with the ZPAP District Board and the Artistic Association \"Nowa Huta,\" which was initiated by Janusz Trzebiatowski in 1969. Young artists, mostly graduates of the Kraków Academy of Fine Arts, were provided with apartments, studios, and scholarships, in exchange for which their sculptures began to adorn the green spaces of Nowa Huta. The works created during this period have varying artistic value and different styles. The artists used a variety of techniques and materials. Many sculptures resulting from this initiative have been preserved in Nowa Huta. In 2018, as part of a project under the patronage of the European Year of Cultural Heritage 2018, a trail of outdoor sculptures and installations in Nowa Huta was created.\npostal_code : nan\ntoilets : nan\nnatural : no information\ndescription : nan\nvisiting_time : nan\nleisure : no information\ntourism : artwork\npublic_transport : nan\nbrand : nan\nalt_name : Choinka\namenity : no information\nreservation : nan\nattraction : nan\nhighchair : nan\nparking : nan\nswimming_pool : nan\ncontact_phone : nan\ncommunity_centre : nan\naddr_street : nan\ncontact_twitter : nan\nsocial_facility : nan\ncontact_facebook : nan\nzoo : nan\nemail : nan\nwheelchair : nan\ncuisine : nan\ncontact_website : nan\ninternet_access : nan\nopening_hours_reception : nan\nguest_house : nan\naddr_city : nan\ncontact_instagram : nan\nimage : nan\nlocation : nan\noutdoor_seating : nan\nmuseum : nan\ntakeaway : nan\nsmoking : nan\nname : Ptaki;Choinka;Lucjan Orzech\nid : 3150\n\nphone : nan\ncemetery : nan\nemergency : nan\nopening_hours : Mo-Fr 08:00-16:00\nwebsite : https://dworek.eu/\npets_allowed : nan\ngeometry : POLYGON ((19.9406886 50.0928475, 19.9407847 50.0929495, 19.9410392 50.0928509, 19.9411519 50.0928072, 19.9411251 50.0927787, 19.9411201 50.0927734, 19.9410568 50.0927062, 19.9409401 50.0927514, 19.9409062 50.0927154, 19.9408476 50.0927381, 19.9407875 50.0927614, 19.9408204 50.0927964, 19.9406886 50.0928475))\nhistoric : no information\nwiki_summary_en : The Cultural Center “Dworek Białoprądnicki” - a cultural center located in a historic manor house in Kraków on Biały Prądnik, surrounded by the Tadeusz Kościuszko Park.\npostal_code : nan\ntoilets : nan\nnatural : no information\ndescription : nan\nvisiting_time : nan\nleisure : no information\ntourism : attraction\npublic_transport : nan\nbrand : nan\nalt_name : nan\namenity : no information\nreservation : nan\nattraction : nan\nhighchair : nan\nparking : nan\nswimming_pool : nan\ncontact_phone : nan\ncommunity_centre : nan\naddr_street : Papiernicza\ncontact_twitter : nan\nsocial_facility : nan\ncontact_facebook : nan\nzoo : nan\nemail : nan\nwheelchair : nan\ncuisine : nan\ncontact_website : nan\ninternet_access : nan\nopening_hours_reception : nan\nguest_house : nan\naddr_city : Kraków\ncontact_instagram : nan\nimage : nan\nlocation : nan\noutdoor_seating : nan\nmuseum : nan\ntakeaway : nan\nsmoking : nan\nname : Dworek Białoprądnicki\nid : 3456\n\nphone : nan\ncemetery : nan\nemergency : nan\nopening_hours : nan\nwebsite : nan\npets_allowed : nan\ngeometry : POLYGON ((20.0571643 50.0668995, 20.0572161 50.0669037, 20.057268 50.0669079, 20.0572886 50.0669095, 20.0574716 50.0668997, 20.0576023 50.0668825, 20.0577864 50.0668324, 20.057955 50.0667468, 20.058077 50.0666486, 20.0581639 50.0665461, 20.0582413 50.0664412, 20.058274 50.0663398, 20.0582994 50.066274, 20.0583078 50.0662505, 20.0583399 50.0661333, 20.0583465 50.0660753, 20.0583529 50.0660757, 20.0583659 50.0659801, 20.0583682 50.0659341, 20.0583682 50.0659313, 20.058373 50.0658816, 20.0583754 50.0657824, 20.0583632 50.0657049, 20.0583346 50.0656038, 20.0582956 50.0655212, 20.0582328 50.065422, 20.0581693 50.0653634, 20.0580849 50.0652974, 20.0580261 50.0652637, 20.0578894 50.0652016, 20.0578022 50.0651736, 20.0577018 50.0651485, 20.0575846 50.0651308, 20.0574262 50.0651168, 20.0571893 50.0651397, 20.0569474 50.0652035, 20.0568008 50.0652696, 20.0566309 50.0654094, 20.0565698 50.0654836, 20.0565239 50.0655495, 20.0564866 50.0656135, 20.0564369 50.065718, 20.0563818 50.0658975, 20.0563576 50.0660307, 20.0563645 50.0662314, 20.0563985 50.0664021, 20.0564484 50.0665234, 20.0565292 50.0666282, 20.0566238 50.066711, 20.0567663 50.066798, 20.0569281 50.0668599, 20.0570826 50.066893, 20.0571643 50.0668995))\nhistoric : no information\nwiki_summary_en : The Suche Stawy Stadium (Polish: Stadion Suche Stawy, Polish pronunciation: [ˈstadʲɔn ˈsuxɛ ˈstavɨ]) is a multi-purpose stadium in Kraków, Poland. It is mainly used mostly for football matches and hosts the home matches of Hutnik Kraków. The stadium has a capacity of 6,500 spectators. It was used by England as a training base for the Euro 2012.\n\n\n== References ==\npostal_code : nan\ntoilets : nan\nnatural : no information\ndescription : nan\nvisiting_time : nan\nleisure : stadium\ntourism : no information\npublic_transport : nan\nbrand : nan\nalt_name : nan\namenity : no information\nreservation : nan\nattraction : nan\nhighchair : nan\nparking : nan\nswimming_pool : nan\ncontact_phone : nan\ncommunity_centre : nan\naddr_street : nan\ncontact_twitter : nan\nsocial_facility : nan\ncontact_facebook : nan\nzoo : nan\nemail : nan\nwheelchair : nan\ncuisine : nan\ncontact_website : nan\ninternet_access : nan\nopening_hours_reception : nan\nguest_house : nan\naddr_city : nan\ncontact_instagram : nan\nimage : nan\nlocation : nan\noutdoor_seating : nan\nmuseum : nan\ntakeaway : nan\nsmoking : nan\nname : Hutnik Nowa Huta\nid : 11484\n\nphone : nan\ncemetery : nan\nemergency : nan\nopening_hours : nan\nwebsite : nan\npets_allowed : nan\ngeometry : POINT (19.9266916 50.0506622)\nhistoric : no information\nwiki_summary_en : no information\npostal_code : nan\ntoilets : nan\nnatural : no information\ndescription : nan\nvisiting_time : nan\nleisure : no information\ntourism : no information\npublic_transport : nan\nbrand : nan\nalt_name : nan\namenity : restaurant\nreservation : nan\nattraction : nan\nhighchair : nan\nparking : nan\nswimming_pool : nan\ncontact_phone : nan\ncommunity_centre : nan\naddr_street : nan\ncontact_twitter : nan\nsocial_facility : nan\ncontact_facebook : nan\nzoo : nan\nemail : nan\nwheelchair : nan\ncuisine : nan\ncontact_website : nan\ninternet_access : nan\nopening_hours_reception : nan\nguest_house : nan\naddr_city : nan\ncontact_instagram : nan\nimage : nan\nlocation : nan\noutdoor_seating : nan\nmuseum : nan\ntakeaway : nan\nsmoking : nan\nname : U Pana Cogito\nid : 372\n\nphone : +46 666 622 337\ncemetery : nan\nemergency : nan\nopening_hours : nan\nwebsite : https://www.instagram.com/slayspacekrakow/\npets_allowed : nan\ngeometry : POINT (19.9476805 50.0470283)\nhistoric : no information\nwiki_summary_en : no information\npostal_code : nan\ntoilets : nan\nnatural : no information\ndescription : nan\nvisiting_time : nan\nleisure : no information\ntourism : no information\npublic_transport : nan\nbrand : nan\nalt_name : nan\namenity : restaurant\nreservation : nan\nattraction : nan\nhighchair : nan\nparking : nan\nswimming_pool : nan\ncontact_phone : nan\ncommunity_centre : nan\naddr_street : nan\ncontact_twitter : nan\nsocial_facility : nan\ncontact_facebook : https://www.facebook.com/profile.php?id=61557617255917\nzoo : nan\nemail : nan\nwheelchair : nan\ncuisine : pizza;coffee_shop;burger;noodle\ncontact_website : nan\ninternet_access : nan\nopening_hours_reception : nan\nguest_house : nan\naddr_city : nan\ncontact_instagram : nan\nimage : nan\nlocation : nan\noutdoor_seating : nan\nmuseum : nan\ntakeaway : nan\nsmoking : nan\nname : Slay Space\nid : 923\n\nphone : nan\ncemetery : nan\nemergency : nan\nopening_hours : nan\nwebsite : nan\npets_allowed : nan\ngeometry : POINT (19.9494041 50.0507656)\nhistoric : no information\nwiki_summary_en : no information\npostal_code : nan\ntoilets : nan\nnatural : no information\ndescription : nan\nvisiting_time : nan\nleisure : no information\ntourism : no information\npublic_transport : nan\nbrand : nan\nalt_name : nan\namenity : fast_food\nreservation : nan\nattraction : nan\nhighchair : nan\nparking : nan\nswimming_pool : nan\ncontact_phone : nan\ncommunity_centre : nan\naddr_street : nan\ncontact_twitter : nan\nsocial_facility : nan\ncontact_facebook : nan\nzoo : nan\nemail : nan\nwheelchair : nan\ncuisine : nan\ncontact_website : nan\ninternet_access : nan\nopening_hours_reception : nan\nguest_house : nan\naddr_city : nan\ncontact_instagram : nan\nimage : nan\nlocation : nan\noutdoor_seating : nan\nmuseum : nan\ntakeaway : nan\nsmoking : nan\nname : Pancake House\nid : 297\n\n",
  "answer": "I don't have enough information to answer that.",
  "labels": {
    "faithfulness": "FAITHFUL",
    "groundedness": "NON_GROUNDED",
    "relevance": "RELEVANT",
    "completeness": "NON_COMPLETE",
    "coherence": "COHERENT",
    "conciseness": "CONCISE"
  },
  "quality_score": 4
}