{
  "model": "mistral_llm",
  "prompt": "prompt_C",
  "id": 3359,
  "question": "What are the main features of the Jagiellonian University Museum located within the Collegium Maius?",
  "context": "phone : nan\ncemetery : nan\nemergency : nan\nopening_hours : nan\nwebsite : nan\npets_allowed : nan\ngeometry : POINT (19.9327559 50.0613222)\nhistoric : memorial\nwiki_summary_en : The Nicolaus Copernicus Monument in Kraków (Polish: Pomnik Mikołaja Kopernika) is a notable landmark of Kraków, Poland.  It memorializes the astronomer Copernicus, who studied at the Kraków Academy and whose father came from that city, then the capital of Poland.\nThe statue, designed by sculptor Cyprian Godebski in 1899, was completed in 1900. It originally stood in the courtyard of the Jagiellonian University's Collegium Maius. In 1953 it was moved to Kraków's Planty Park, in front of the Collegium Witkowski building.\npostal_code : nan\ntoilets : nan\nnatural : no information\ndescription : nan\nvisiting_time : nan\nleisure : no information\ntourism : no information\npublic_transport : nan\nbrand : nan\nalt_name : nan\namenity : no information\nreservation : nan\nattraction : nan\nhighchair : nan\nparking : nan\nswimming_pool : nan\ncontact_phone : nan\ncommunity_centre : nan\naddr_street : nan\ncontact_twitter : nan\nsocial_facility : nan\ncontact_facebook : nan\nzoo : nan\nemail : nan\nwheelchair : nan\ncuisine : nan\ncontact_website : nan\ninternet_access : nan\nopening_hours_reception : nan\nguest_house : nan\naddr_city : nan\ncontact_instagram : nan\nimage : nan\nlocation : nan\noutdoor_seating : nan\nmuseum : nan\ntakeaway : nan\nsmoking : nan\nname : Mikołaj Kopernik;Statue of Nicolaus Copernicus;Nikolaus-Kopernikus-Denkmal;Cyprian Godebski\nid : 2382\n\nphone : nan\ncemetery : nan\nemergency : nan\nopening_hours : Mo-Fr 10:00-17:00\nwebsite : https://maius.uj.edu.pl/\npets_allowed : nan\ngeometry : POINT (19.9337367 50.0615617)\nhistoric : no information\nwiki_summary_en : The Jagiellonian University Museum – a museum located in the Collegium Maius building of the Jagiellonian University, at the corner of St. Anna and Jagiellońska streets in Kraków. It originates from the Archaeological Cabinet of the University, established in 1867 by Professor Józef Łepkowski, and its current form is primarily due to Karol Estreicher.\npostal_code : nan\ntoilets : nan\nnatural : no information\ndescription : nan\nvisiting_time : nan\nleisure : no information\ntourism : museum\npublic_transport : nan\nbrand : nan\nalt_name : nan\namenity : no information\nreservation : nan\nattraction : nan\nhighchair : nan\nparking : nan\nswimming_pool : nan\ncontact_phone : nan\ncommunity_centre : nan\naddr_street : nan\ncontact_twitter : nan\nsocial_facility : nan\ncontact_facebook : nan\nzoo : nan\nemail : nan\nwheelchair : nan\ncuisine : nan\ncontact_website : nan\ninternet_access : nan\nopening_hours_reception : nan\nguest_house : nan\naddr_city : nan\ncontact_instagram : nan\nimage : nan\nlocation : nan\noutdoor_seating : nan\nmuseum : nan\ntakeaway : nan\nsmoking : nan\nname : Muzeum Uniwersytetu Jagiellońskiego;University Museum;Museum des Jagiellonen-Universitäts;Jagelló Egyetem Múzeuma\nid : 2409\n\nphone : nan\ncemetery : nan\nemergency : nan\nopening_hours : Th,Fr 10:00-14:00; Su 11:00-15:00; Oct 15-Apr 15 off\nwebsite : https://ogrod.uj.edu.pl/ogrod/ekspozycja-muzealna\npets_allowed : nan\ngeometry : POINT (19.9559687 50.0636006)\nhistoric : no information\nwiki_summary_en : The Museum of the Botanical Garden – a museum located in the area of the Botanical Garden of Jagiellonian University in Collegium Śniadeckiego. It has the oldest botanical collection of a museum nature in Poland. From 1994 to 2011, the museum functioned as the Botanical Museum and the History of Botany Workshop named after J. Dyakowska. After the workshop was closed, there was a return to the former name.\npostal_code : nan\ntoilets : nan\nnatural : no information\ndescription : nan\nvisiting_time : nan\nleisure : no information\ntourism : museum\npublic_transport : nan\nbrand : nan\nalt_name : nan\namenity : no information\nreservation : nan\nattraction : nan\nhighchair : nan\nparking : nan\nswimming_pool : nan\ncontact_phone : nan\ncommunity_centre : nan\naddr_street : nan\ncontact_twitter : nan\nsocial_facility : nan\ncontact_facebook : nan\nzoo : nan\nemail : nan\nwheelchair : nan\ncuisine : nan\ncontact_website : nan\ninternet_access : nan\nopening_hours_reception : nan\nguest_house : nan\naddr_city : nan\ncontact_instagram : nan\nimage : nan\nlocation : nan\noutdoor_seating : nan\nmuseum : nan\ntakeaway : nan\nsmoking : nan\nname : Muzeum Ogrodu Botanicznego UJ;Muzeum Ogrodu Botanicznego i Pracownia Historii Botaniki im. J. Dyakowskiej;Jagelló Egyetem Botanikus Kertjének Múzeuma\nid : 2518\n\nphone : nan\ncemetery : nan\nemergency : nan\nopening_hours : nan\nwebsite : https://ib.uj.edu.pl/instytut/muzeum\npets_allowed : nan\ngeometry : POINT (19.9573898 50.0644028)\nhistoric : no information\nwiki_summary_en : The Paleobotanical Museum of the Jagiellonian University – a museum operating from 2003 to 2017 in the building of the Botanical Institute of the Jagiellonian University at 31 Kopernika Street in Krakow. The exhibition included, among other things, imprints and casts in rock material collected by Marian Raciborski and Franciszek Tonder. It was organized by Dr. hab. Danuta Zdebska and was mainly available to students and pupils. It was closed down for various reasons, including space issues. At least part of the collection was transferred to the Nature Education Center operating at the 600th Anniversary Renewal Campus of the Jagiellonian University.\npostal_code : nan\ntoilets : nan\nnatural : no information\ndescription : nan\nvisiting_time : nan\nleisure : no information\ntourism : museum\npublic_transport : nan\nbrand : nan\nalt_name : nan\namenity : no information\nreservation : nan\nattraction : nan\nhighchair : nan\nparking : nan\nswimming_pool : nan\ncontact_phone : nan\ncommunity_centre : nan\naddr_street : nan\ncontact_twitter : nan\nsocial_facility : nan\ncontact_facebook : nan\nzoo : nan\nemail : nan\nwheelchair : nan\ncuisine : nan\ncontact_website : nan\ninternet_access : nan\nopening_hours_reception : nan\nguest_house : nan\naddr_city : nan\ncontact_instagram : nan\nimage : nan\nlocation : nan\noutdoor_seating : nan\nmuseum : nan\ntakeaway : nan\nsmoking : nan\nname : Muzeum Paleobotaniczne UJ;Muzeum Paleobotaniczne Instytutu Botaniki Uniwersytetu Jagiellońskiego;Jagelló Egyetem Ősnövénytani Múzeuma\nid : 2695\n\nphone : nan\ncemetery : nan\nemergency : nan\nopening_hours : nan\nwebsite : nan\npets_allowed : nan\ngeometry : POLYGON ((19.933682 50.0619581, 19.9336794 50.0619554, 19.93376 50.0619234, 19.9337852 50.0619124, 19.9338365 50.061892, 19.9338401 50.0618946, 19.9339314 50.0618572, 19.9339297 50.0618549, 19.9339677 50.0618389, 19.9339734 50.0618393, 19.9341984 50.061748, 19.9341802 50.0617257, 19.9341692 50.0617289, 19.9340004 50.0615151, 19.9339949 50.061508, 19.9338726 50.0613322, 19.9338638 50.0613346, 19.9337849 50.0613578, 19.9337762 50.0613465, 19.9337627 50.0613512, 19.9337711 50.0613622, 19.9336939 50.0613865, 19.9336862 50.0613764, 19.9336726 50.061379, 19.9336825 50.0613913, 19.9336391 50.0614049, 19.9336361 50.061402, 19.9336177 50.0614071, 19.9336193 50.0614106, 19.9335644 50.0614279, 19.9335517 50.0614222, 19.9335446 50.0614302, 19.9335588 50.0614352, 19.9335865 50.0614722, 19.9335699 50.0614777, 19.9335761 50.061486, 19.9335852 50.0614834, 19.9336045 50.0615083, 19.9335449 50.0615303, 19.9335386 50.0615229, 19.9335295 50.0615259, 19.9335354 50.0615335, 19.9334745 50.0615562, 19.9334679 50.0615486, 19.9334591 50.0615521, 19.933466 50.0615596, 19.9333625 50.0615983, 19.9333553 50.0615905, 19.9333468 50.0615942, 19.9333534 50.0616017, 19.9332812 50.0616294, 19.9332746 50.061622, 19.9332656 50.0616252, 19.9332722 50.0616327, 19.9332611 50.0616369, 19.9332628 50.0616387, 19.93323 50.0616512, 19.9332281 50.0616495, 19.933217 50.0616538, 19.9332103 50.0616462, 19.9332009 50.0616497, 19.9332075 50.0616567, 19.9333504 50.0618084, 19.9334606 50.0617645, 19.933545 50.0618602, 19.9335186 50.0618708, 19.9335453 50.0619023, 19.9335644 50.0618957, 19.9336337 50.0619646, 19.9336282 50.0619664, 19.9336326 50.0619708, 19.9336377 50.0619759, 19.933682 50.0619581), (19.9336825 50.0618116, 19.9336561 50.0618222, 19.9336019 50.0617568, 19.933556 50.0616917, 19.9335512 50.061694, 19.9335386 50.0616798, 19.9338765 50.0615467, 19.9338858 50.0615576, 19.9340157 50.0617166, 19.9337063 50.0618359, 19.9336825 50.0618116))\nhistoric : building\nwiki_summary_en : The Collegium Maius (Latin for \"Great College\") located in Kraków Old Town, Poland, is the Jagiellonian University's oldest building, dating back to the 14th century. It stands at the corner of ulica Jagiellońska (Jagiellon Street) and ulica Świętej Anny (St. Anne Street) near the Main Square of the historic city centre. Collegium Maius is the location of the Jagiellonian University Museum (Polish: Muzeum Uniwersytetu Jagiellońskiego), a registered museum established on the initiative of Prof. Karol Estreicher after meticulous restorations which lasted from 1949 through 1964, bringing the edifice back to its original look from before 1840.\npostal_code : nan\ntoilets : nan\nnatural : no information\ndescription : nan\nvisiting_time : nan\nleisure : no information\ntourism : attraction\npublic_transport : nan\nbrand : nan\nalt_name : nan\namenity : no information\nreservation : nan\nattraction : nan\nhighchair : nan\nparking : nan\nswimming_pool : nan\ncontact_phone : nan\ncommunity_centre : nan\naddr_street : nan\ncontact_twitter : nan\nsocial_facility : nan\ncontact_facebook : nan\nzoo : nan\nemail : nan\nwheelchair : nan\ncuisine : nan\ncontact_website : nan\ninternet_access : nan\nopening_hours_reception : nan\nguest_house : nan\naddr_city : nan\ncontact_instagram : nan\nimage : nan\nlocation : nan\noutdoor_seating : nan\nmuseum : nan\ntakeaway : nan\nsmoking : nan\nname : Collegium Maius;콜레기움 마이우스\nid : 3359\n\nphone : nan\ncemetery : nan\nemergency : nan\nopening_hours : nan\nwebsite : nan\npets_allowed : nan\ngeometry : POLYGON ((19.9332075 50.0616567, 19.9329076 50.0617656, 19.9329032 50.0617605, 19.9328525 50.0617016, 19.9328881 50.0616894, 19.9328895 50.0616914, 19.932891 50.0616909, 19.9330288 50.0616423, 19.9329334 50.0615272, 19.9329676 50.0615155, 19.9329706 50.0615191, 19.9330343 50.061497, 19.9330305 50.0614929, 19.933151 50.0614507, 19.9331751 50.0614769, 19.9333315 50.0614192, 19.9332777 50.06136, 19.9333272 50.0613423, 19.9332764 50.0612827, 19.9333051 50.0612742, 19.9332585 50.0612188, 19.9334102 50.0611663, 19.9334208 50.0611626, 19.933441 50.0611924, 19.9333871 50.0612076, 19.9334171 50.0612524, 19.9334176 50.0612531, 19.9334717 50.0612377, 19.9334905 50.0612649, 19.9334963 50.0612733, 19.9335024 50.0612716, 19.933508 50.0612785, 19.9336407 50.0612366, 19.9337664 50.061197, 19.9337734 50.0612075, 19.9337989 50.0612457, 19.9337991 50.0612459, 19.9338024 50.0612506, 19.9338197 50.0612746, 19.933821 50.0612763, 19.9338361 50.0612969, 19.9338638 50.0613346, 19.9337849 50.0613578, 19.9337762 50.0613465, 19.9337627 50.0613512, 19.9337711 50.0613622, 19.9336939 50.0613865, 19.9336862 50.0613764, 19.9336726 50.061379, 19.9336825 50.0613913, 19.9336391 50.0614049, 19.9336361 50.061402, 19.9336177 50.0614071, 19.9336193 50.0614106, 19.9335644 50.0614279, 19.9335517 50.0614222, 19.9335446 50.0614302, 19.9335588 50.0614352, 19.9335865 50.0614722, 19.9335699 50.0614777, 19.9335761 50.061486, 19.9335852 50.0614834, 19.9336045 50.0615083, 19.9335449 50.0615303, 19.9335386 50.0615229, 19.9335295 50.0615259, 19.9335354 50.0615335, 19.9334745 50.0615562, 19.9334679 50.0615486, 19.9334591 50.0615521, 19.933466 50.0615596, 19.9333625 50.0615983, 19.9333553 50.0615905, 19.9333468 50.0615942, 19.9333534 50.0616017, 19.9332812 50.0616294, 19.9332746 50.061622, 19.9332656 50.0616252, 19.9332722 50.0616327, 19.9332611 50.0616369, 19.9332628 50.0616387, 19.93323 50.0616512, 19.9332281 50.0616495, 19.933217 50.0616538, 19.9332103 50.0616462, 19.9332009 50.0616497, 19.9332075 50.0616567))\nhistoric : no information\nwiki_summary_en : The Professors' Garden is a garden covering an area of about 0.15 hectares in Kraków's Old Town at 17 Jagiellońska Street. It is located between the buildings of Jagiellonian University: to the northeast, it is bounded by Collegium Medicum and Collegium Maius, to the southeast by Jagiellońska Street, to the southwest by Collegium Minus and Collegium Witkowski, and to the northwest by the Planty.\npostal_code : nan\ntoilets : nan\nnatural : no information\ndescription : nan\nvisiting_time : nan\nleisure : park\ntourism : no information\npublic_transport : nan\nbrand : nan\nalt_name : nan\namenity : no information\nreservation : nan\nattraction : nan\nhighchair : nan\nparking : nan\nswimming_pool : nan\ncontact_phone : nan\ncommunity_centre : nan\naddr_street : nan\ncontact_twitter : nan\nsocial_facility : nan\ncontact_facebook : nan\nzoo : nan\nemail : nan\nwheelchair : nan\ncuisine : nan\ncontact_website : nan\ninternet_access : nan\nopening_hours_reception : nan\nguest_house : nan\naddr_city : nan\ncontact_instagram : nan\nimage : nan\nlocation : nan\noutdoor_seating : nan\nmuseum : nan\ntakeaway : nan\nsmoking : nan\nname : Ogród Profesorski;Professor's Garden;Professoralgarten;Professzorok Kertje\nid : 3573\n\nphone : nan\ncemetery : nan\nemergency : nan\nopening_hours : nan\nwebsite : https://bj.uj.edu.pl/\npets_allowed : nan\ngeometry : POLYGON ((19.9215283 50.0619659, 19.9227159 50.0620481, 19.9231896 50.0620809, 19.9237281 50.0610292, 19.9226263 50.0608002, 19.921717 50.0608519, 19.9215283 50.0619659))\nhistoric : no information\nwiki_summary_en : The Jagiellonian Library (Polish: Biblioteka Jagiellońska, popular nickname Jagiellonka) is the library of the Jagiellonian University in Kraków and with almost 6.7 million volumes, one of the largest libraries in Poland, serving as a public library, university library and part of the Polish national library system. It has a large collection of medieval manuscripts, for example the autograph of Copernicus' De Revolutionibus and Jan Długosz's Banderia Prutenorum, and a large collection of underground literature (so-called drugi obieg or samizdat) from the period of communist rule in Poland (1945–1989). The Jagiellonian also houses the Berlinka art collection, whose legal status is in dispute with Germany.\npostal_code : nan\ntoilets : nan\nnatural : no information\ndescription : nan\nvisiting_time : nan\nleisure : no information\ntourism : no information\npublic_transport : nan\nbrand : nan\nalt_name : nan\namenity : library\nreservation : nan\nattraction : nan\nhighchair : nan\nparking : nan\nswimming_pool : nan\ncontact_phone : nan\ncommunity_centre : nan\naddr_street : Aleja Adama Mickiewicza\ncontact_twitter : nan\nsocial_facility : nan\ncontact_facebook : nan\nzoo : nan\nemail : nan\nwheelchair : nan\ncuisine : nan\ncontact_website : nan\ninternet_access : nan\nopening_hours_reception : nan\nguest_house : nan\naddr_city : Kraków\ncontact_instagram : nan\nimage : nan\nlocation : nan\noutdoor_seating : nan\nmuseum : nan\ntakeaway : nan\nsmoking : nan\nname : Biblioteka Jagiellońska;Jagiellonian Library;Jagiellonka;Jagiellonische Bibliothek;Biblioteca Jagellonica;Bibliothèque Jagellonne;Jogailos universiteto biblioteka;Bibliotheca Iagellonica;Jagiellonische Bibliotheek\nid : 11310\n\n",
  "answer": "I don't have enough information to answer that. The **CONTEXT** only states that the **Jagiellonian University Museum** is located in the **Collegium Maius** building and was established after restorations (1949–1964) to return it to its pre-1840 appearance. No specific details about its main features are provided.",
  "labels": {
    "faithfulness": "FAITHFUL",
    "groundedness": "PARTLY_GROUNDED",
    "relevance": "RELEVANT",
    "completeness": "PARTLY_COMPLETE",
    "coherence": "COHERENT",
    "conciseness": "CONCISE"
  },
  "quality_score": 4
}