{
  "model": "mistral_llm",
  "prompt": "prompt_C",
  "id": 10633,
  "question": "Does this location offer facilities like restrooms for guests?",
  "context": "phone : +48 12 424 96 00\ncemetery : nan\nemergency : nan\nopening_hours : Mo-Su 13:00-23:00\nwebsite : https://wierzynek.pl/\npets_allowed : nan\ngeometry : POINT (19.9374073 50.0603841)\nhistoric : no information\nwiki_summary_en : Wierzynek is a restaurant located at the Main Square of Kraków Old Town. It occupies four floors and has a capacity of 200 guests.  There are eight separate dining rooms including the Italian Pompeii Rooms, the Tatra Room, The Clock Room, the Knights Room and the Chamber of Imagination.\nMany world leaders and celebrities have visited the restaurant including Charles de Gaulle, Fidel Castro, Sophie Marceau and Kate Moss.\npostal_code : nan\ntoilets : nan\nnatural : no information\ndescription : nan\nvisiting_time : nan\nleisure : no information\ntourism : no information\npublic_transport : nan\nbrand : nan\nalt_name : nan\namenity : restaurant\nreservation : nan\nattraction : nan\nhighchair : nan\nparking : nan\nswimming_pool : nan\ncontact_phone : nan\ncommunity_centre : nan\naddr_street : Rynek Główny\ncontact_twitter : nan\nsocial_facility : nan\ncontact_facebook : nan\nzoo : nan\nemail : nan\nwheelchair : nan\ncuisine : polish\ncontact_website : nan\ninternet_access : nan\nopening_hours_reception : nan\nguest_house : nan\naddr_city : Kraków\ncontact_instagram : nan\nimage : nan\nlocation : nan\noutdoor_seating : nan\nmuseum : nan\ntakeaway : nan\nsmoking : nan\nname : Wierzynek\nid : 34\n\nphone : nan\ncemetery : nan\nemergency : nan\nopening_hours : Mo-Fr 08:00-16:00\nwebsite : https://dworek.eu/\npets_allowed : nan\ngeometry : POLYGON ((19.9406886 50.0928475, 19.9407847 50.0929495, 19.9410392 50.0928509, 19.9411519 50.0928072, 19.9411251 50.0927787, 19.9411201 50.0927734, 19.9410568 50.0927062, 19.9409401 50.0927514, 19.9409062 50.0927154, 19.9408476 50.0927381, 19.9407875 50.0927614, 19.9408204 50.0927964, 19.9406886 50.0928475))\nhistoric : no information\nwiki_summary_en : The Cultural Center “Dworek Białoprądnicki” - a cultural center located in a historic manor house in Kraków on Biały Prądnik, surrounded by the Tadeusz Kościuszko Park.\npostal_code : nan\ntoilets : nan\nnatural : no information\ndescription : nan\nvisiting_time : nan\nleisure : no information\ntourism : attraction\npublic_transport : nan\nbrand : nan\nalt_name : nan\namenity : no information\nreservation : nan\nattraction : nan\nhighchair : nan\nparking : nan\nswimming_pool : nan\ncontact_phone : nan\ncommunity_centre : nan\naddr_street : Papiernicza\ncontact_twitter : nan\nsocial_facility : nan\ncontact_facebook : nan\nzoo : nan\nemail : nan\nwheelchair : nan\ncuisine : nan\ncontact_website : nan\ninternet_access : nan\nopening_hours_reception : nan\nguest_house : nan\naddr_city : Kraków\ncontact_instagram : nan\nimage : nan\nlocation : nan\noutdoor_seating : nan\nmuseum : nan\ntakeaway : nan\nsmoking : nan\nname : Dworek Białoprądnicki\nid : 3456\n\nphone : nan\ncemetery : nan\nemergency : nan\nopening_hours : nan\nwebsite : nan\npets_allowed : nan\ngeometry : POINT (19.9414953 50.0634912)\nhistoric : no information\nwiki_summary_en : Hotel Pollera – a historic hotel located in Kraków at Szpitalna Street 30, on the corner of St. Mark's Street and St. Spirit Square, in the Old Town.\npostal_code : nan\ntoilets : nan\nnatural : no information\ndescription : nan\nvisiting_time : nan\nleisure : no information\ntourism : hotel\npublic_transport : nan\nbrand : nan\nalt_name : nan\namenity : no information\nreservation : nan\nattraction : nan\nhighchair : nan\nparking : nan\nswimming_pool : nan\ncontact_phone : nan\ncommunity_centre : nan\naddr_street : nan\ncontact_twitter : nan\nsocial_facility : nan\ncontact_facebook : nan\nzoo : nan\nemail : nan\nwheelchair : nan\ncuisine : nan\ncontact_website : nan\ninternet_access : nan\nopening_hours_reception : nan\nguest_house : nan\naddr_city : nan\ncontact_instagram : nan\nimage : nan\nlocation : nan\noutdoor_seating : nan\nmuseum : nan\ntakeaway : nan\nsmoking : nan\nname : Hotel Pollera\nid : 6321\n\nphone : +48 12 421 35 00\ncemetery : nan\nemergency : nan\nopening_hours : nan\nwebsite : http://www.hotelewam.pl/510-hotel-royal-krakow.html\npets_allowed : nan\ngeometry : POINT (19.9393285 50.0545092)\nhistoric : no information\nwiki_summary_en : Hotel Royal is a hotel in Krakow in the Old Town, located at 26–29 St. Gertrude Street.  \nThe hotel occupies four historic tenement houses; the oldest of them, from the 19th century, was built in the Art Nouveau style. Before World War II, each of the tenements housed a different hotel: Royal, Union, City, and Garrison. During World War II, it was home to German soldiers, and after the war, until 1954, it housed the Command of the Krakow Military District, followed by a casino and a garrison hotel.  \nThe hotel has hosted many distinguished personalities, including presidents and prime ministers of the Republic. Guests have also included heads of other states.  \nCurrently, the hotel offers 99 rooms for guests, including stylish apartments with views of Wawel, as well as conference rooms, a restaurant, and a café. The hotel provides its services at a three-star standard.\npostal_code : nan\ntoilets : nan\nnatural : no information\ndescription : nan\nvisiting_time : nan\nleisure : no information\ntourism : hotel\npublic_transport : nan\nbrand : nan\nalt_name : nan\namenity : no information\nreservation : nan\nattraction : nan\nhighchair : nan\nparking : nan\nswimming_pool : nan\ncontact_phone : nan\ncommunity_centre : nan\naddr_street : Świętej Gertrudy\ncontact_twitter : nan\nsocial_facility : nan\ncontact_facebook : nan\nzoo : nan\nemail : royal@amwhotele.pl\nwheelchair : no\ncuisine : nan\ncontact_website : nan\ninternet_access : wlan\nopening_hours_reception : nan\nguest_house : nan\naddr_city : nan\ncontact_instagram : nan\nimage : nan\nlocation : nan\noutdoor_seating : nan\nmuseum : nan\ntakeaway : nan\nsmoking : nan\nname : Royal\nid : 6351\n\nphone : nan\ncemetery : nan\nemergency : nan\nopening_hours : nan\nwebsite : nan\npets_allowed : nan\ngeometry : POINT (19.9461619 50.0644771)\nhistoric : no information\nwiki_summary_en : Hotel Europejski in Kraków – a three-star hotel located in the center of Kraków, in close proximity to the Main Railway Station, at 5 Lubicz Street. The hotel was built in 1884 by Jan Kazimierz Lubicz Łapiński. It has three floors (the first floor was reserved for guests, and the others for staff). The hotel featured a restaurant, to which a theatrical-ballroom and a carriage house were later added. In 1966, the hotel was nationalized and came under the management of the Municipal Hotel Directorate, and in 1973 the Krakow Tourist Enterprise Wawel-Tourist, during which it suffered significant deterioration. On May 23, 1991, it was returned to the heiress (the founder's granddaughter), Maria Lubicz Łapińska-Czepczyk. After a thorough renovation, it is currently run by Ms. Maria's son – Jacek Czepczyk. It now offers 87 accommodation places in 41 rooms, as well as a restaurant, café, magic garden, billiard club, ballroom, conference rooms, and a currency exchange office.\npostal_code : nan\ntoilets : nan\nnatural : no information\ndescription : nan\nvisiting_time : nan\nleisure : no information\ntourism : hotel\npublic_transport : nan\nbrand : nan\nalt_name : nan\namenity : no information\nreservation : nan\nattraction : nan\nhighchair : nan\nparking : nan\nswimming_pool : nan\ncontact_phone : nan\ncommunity_centre : nan\naddr_street : Lubicz\ncontact_twitter : nan\nsocial_facility : nan\ncontact_facebook : nan\nzoo : nan\nemail : nan\nwheelchair : nan\ncuisine : nan\ncontact_website : nan\ninternet_access : nan\nopening_hours_reception : nan\nguest_house : nan\naddr_city : nan\ncontact_instagram : nan\nimage : nan\nlocation : nan\noutdoor_seating : nan\nmuseum : nan\ntakeaway : nan\nsmoking : nan\nname : Hotel Europejski\nid : 6412\n\nphone : nan\ncemetery : nan\nemergency : nan\nopening_hours : nan\nwebsite : nan\npets_allowed : nan\ngeometry : POLYGON ((19.9389588 50.067012, 19.9389055 50.0671582, 19.9390932 50.0671684, 19.9391498 50.0671714, 19.939173 50.0671146, 19.9391918 50.067109, 19.9392118 50.0671002, 19.9392114 50.0670793, 19.9391918 50.0670681, 19.9392106 50.0670217, 19.9391795 50.0670203, 19.9389588 50.067012))\nhistoric : no information\nwiki_summary_en : Dom Pod Głowami (also known as the Trembecki Tenement) is a historic tenement located in Kraków, in district I at 5 Długa Street, in Kleparz. It is a building erected in the Neo-Renaissance style in 1889 according to the design of Maksymilian Nitsch for the well-known Kraków stonemason Adam Trembecki. In 2020, the tenement underwent conservation renovation. \n\nThe tenement is characterized by a very richly decorated front elevation. Above the entrance gate, below the bay window, there is a sculpture of a large eagle, while above the windows on the ground floor are cartouches with sculpted likenesses of Stefan Czerniecki, Julian Ursyn Niemcewicz, Tadeusz Kościuszko, and Hugo Kołłątaj. The entire facade decoration was created by Michał Korpala.\npostal_code : nan\ntoilets : nan\nnatural : no information\ndescription : nan\nvisiting_time : nan\nleisure : no information\ntourism : hotel\npublic_transport : nan\nbrand : nan\nalt_name : nan\namenity : no information\nreservation : nan\nattraction : nan\nhighchair : nan\nparking : nan\nswimming_pool : nan\ncontact_phone : nan\ncommunity_centre : nan\naddr_street : Długa\ncontact_twitter : nan\nsocial_facility : nan\ncontact_facebook : nan\nzoo : nan\nemail : nan\nwheelchair : nan\ncuisine : nan\ncontact_website : nan\ninternet_access : nan\nopening_hours_reception : nan\nguest_house : nan\naddr_city : Kraków\ncontact_instagram : nan\nimage : nan\nlocation : nan\noutdoor_seating : nan\nmuseum : nan\ntakeaway : nan\nsmoking : nan\nname : Komorowski Luxury Guest Rooms\nid : 6705\n\nphone : nan\ncemetery : nan\nemergency : nan\nopening_hours : nan\nwebsite : nan\npets_allowed : nan\ngeometry : POINT (19.9343201 50.0139215)\nhistoric : no information\nwiki_summary_en : Kraków Sanktuarium – a passenger stop in the Kraków Łagiewniki area, in the Małopolskie Voivodeship, built to serve the Kraków sanctuaries: the Sanctuary of Divine Mercy and the John Paul II Center, a shopping center on Zakopiańska Street, and nearby residential buildings during the World Youth Days 2016 and for the needs of the Fast Urban Railway.\npostal_code : nan\ntoilets : nan\nnatural : no information\ndescription : nan\nvisiting_time : nan\nleisure : no information\ntourism : no information\npublic_transport : station\nbrand : nan\nalt_name : nan\namenity : no information\nreservation : nan\nattraction : nan\nhighchair : nan\nparking : nan\nswimming_pool : nan\ncontact_phone : nan\ncommunity_centre : nan\naddr_street : nan\ncontact_twitter : nan\nsocial_facility : nan\ncontact_facebook : nan\nzoo : nan\nemail : nan\nwheelchair : nan\ncuisine : nan\ncontact_website : nan\ninternet_access : nan\nopening_hours_reception : nan\nguest_house : nan\naddr_city : nan\ncontact_instagram : nan\nimage : nan\nlocation : nan\noutdoor_seating : nan\nmuseum : nan\ntakeaway : nan\nsmoking : nan\nname : Kraków Sanktuarium\nid : 7685\n\nphone : nan\ncemetery : nan\nemergency : no\nopening_hours : nan\nwebsite : https://babinski.pl/\npets_allowed : nan\ngeometry : POLYGON ((19.8824348 50.0069202, 19.8843417 50.0069935, 19.8849402 50.0070189, 19.8875083 50.0066649, 19.8880141 50.0065848, 19.8881842 50.0065535, 19.888112 50.00642, 19.8882092 50.0063876, 19.8880943 50.0061774, 19.8879824 50.0059916, 19.8879509 50.0059117, 19.8878967 50.0056645, 19.8878965 50.0054078, 19.8878045 50.0047803, 19.8876821 50.0041801, 19.8878225 50.0041695, 19.8892816 50.0040478, 19.8888912 50.002901, 19.88869 50.0024074, 19.888503 50.0022779, 19.8882204 50.0021777, 19.8875366 50.0019449, 19.8873654 50.0016748, 19.8869679 50.0005448, 19.8850666 50.0007807, 19.8849145 50.0003367, 19.8837538 50.0004836, 19.8835958 50.000323, 19.8826593 50.0004063, 19.8823982 50.0006701, 19.8804605 50.000921, 19.8800799 50.0017329, 19.8799691 50.0020356, 19.8799566 50.0021636, 19.8799464 50.0021859, 19.8799302 50.0022587, 19.8799131 50.0023427, 19.8798174 50.0025338, 19.8795507 50.0027998, 19.8793604 50.0029278, 19.8784102 50.0034635, 19.8779455 50.0038621, 19.877504 50.0044353, 19.8772183 50.004991, 19.8775537 50.0049451, 19.8776463 50.004924, 19.877824 50.0048961, 19.8781083 50.0048535, 19.8785713 50.0047858, 19.8804922 50.0044551, 19.8809256 50.0043778, 19.8813457 50.0050631, 19.881528 50.0053604, 19.881704 50.0056391, 19.8821694 50.0064276, 19.8824348 50.0069202))\nhistoric : no information\nwiki_summary_en : The Józef Babiński Clinical Hospital Independent Public Healthcare Institution in Kraków – a hospital in Kraków (in the Kobierzyn district) that specializes in the treatment and rehabilitation of patients in the fields of psychiatry, addiction, and neurology. In 1999, the hospital-park complex was entered on the list of historic monuments.\npostal_code : nan\ntoilets : nan\nnatural : no information\ndescription : nan\nvisiting_time : nan\nleisure : no information\ntourism : no information\npublic_transport : nan\nbrand : nan\nalt_name : nan\namenity : hospital\nreservation : nan\nattraction : nan\nhighchair : nan\nparking : nan\nswimming_pool : nan\ncontact_phone : nan\ncommunity_centre : nan\naddr_street : nan\ncontact_twitter : nan\nsocial_facility : nan\ncontact_facebook : nan\nzoo : nan\nemail : nan\nwheelchair : nan\ncuisine : nan\ncontact_website : nan\ninternet_access : nan\nopening_hours_reception : nan\nguest_house : nan\naddr_city : nan\ncontact_instagram : nan\nimage : nan\nlocation : nan\noutdoor_seating : nan\nmuseum : nan\ntakeaway : nan\nsmoking : nan\nname : Szpital Kliniczny im. doktora Józefa Babińskiego SP ZOZ\nid : 11288\n\nphone : nan\ncemetery : nan\nemergency : nan\nopening_hours : nan\nwebsite : nan\npets_allowed : nan\ngeometry : POINT (19.8664022 50.0342557)\nhistoric : no information\nwiki_summary_en : Solnik (259 m) – a hill in Krakow, in District VIII Dębniki. It is sometimes called Kostrzewska Hill. It stretches from the Kostrze housing estate in a north-eastern direction towards the Vistula River. At its south-eastern foothills, there is the Pychowice housing estate and Tyniecka Street, while at the north-western side lies Bodzów estate. In the physical and geographical division of Poland, it is located in the Kraków Bridge mesoregion.  \nThe hill rises about 60 m above the surrounding areas. It is situated within the Bielańsko-Tyniecki Landscape Park and is part of the Uroczysko Kostrze. It is built of limestone and covered with forest, predominantly consisting of sycamore, common maple, ash, and Scots pine. The hill serves a recreational function for the city's residents. On its extensive ridge, there is a large meadow, part of which is covered by xerothermic grasslands. This meadow offers a good viewpoint. In good visibility, one can observe the Beskids, Gorce Mountains, Tatras, and the Babia Góra range from there. Marked hiking trails, information boards, and benches have been created for tourists.  \nIn the eastern part of the hill, there used to be a quarry in Bodzów. Motocross riders have taken a liking to its excavation and the surrounding areas of the Solnik hill, resulting in its being worn down. Solnik is also a launch site for paragliders.  \nThe hill and the surrounding streets, including Widłakowa, Tyniecka, and Winnicka, were part of the fortress built by the Austrians known as Fort Krakow. On Solnik, there is an artillery fort belonging to this fortress, the interfield fort 53 \"Bodzów,\" as well as the Caves in Kostrze and the Caves in Bodzów, which served as ammunition depots.  \nHenryk Sienkiewicz placed the story of Zbyszek from Bogdaniec's charge against the Teutonic envoy in his novel Quo Vadis on Solnik.\npostal_code : nan\ntoilets : nan\nnatural : peak\ndescription : nan\nvisiting_time : nan\nleisure : no information\ntourism : no information\npublic_transport : nan\nbrand : nan\nalt_name : nan\namenity : no information\nreservation : nan\nattraction : nan\nhighchair : nan\nparking : nan\nswimming_pool : nan\ncontact_phone : nan\ncommunity_centre : nan\naddr_street : nan\ncontact_twitter : nan\nsocial_facility : nan\ncontact_facebook : nan\nzoo : nan\nemail : nan\nwheelchair : nan\ncuisine : nan\ncontact_website : nan\ninternet_access : nan\nopening_hours_reception : nan\nguest_house : nan\naddr_city : nan\ncontact_instagram : nan\nimage : nan\nlocation : nan\noutdoor_seating : nan\nmuseum : nan\ntakeaway : nan\nsmoking : nan\nname : Solnik\nid : 11417\n\n",
  "answer": "I don't have enough information to answer that.",
  "labels": {
    "faithfulness": "FAITHFUL",
    "groundedness": "NON_GROUNDED",
    "relevance": "RELEVANT",
    "completeness": "PARTLY_COMPLETE",
    "coherence": "COHERENT",
    "conciseness": "CONCISE"
  },
  "quality_score": 4
}