{
  "model": "mistral_llm",
  "prompt": "prompt_C",
  "id": 1547,
  "question": "Are there any social media profiles for Hello India that I can follow for updates?",
  "context": "phone : nan\ncemetery : nan\nemergency : nan\nopening_hours : nan\nwebsite : nan\npets_allowed : nan\ngeometry : POLYGON ((19.9419833 50.0429698, 19.9411817 50.0435575, 19.9411604 50.0435779, 19.94115 50.0435914, 19.9411459 50.0435993, 19.9411442 50.0436076, 19.9411444 50.0436134, 19.9411464 50.0436197, 19.9411493 50.0436252, 19.9411692 50.0436614, 19.9411849 50.0436709, 19.9411968 50.0436781, 19.9417203 50.0439763, 19.9417859 50.0440049, 19.9418622 50.0440241, 19.9419366 50.0440302, 19.9422432 50.0440443, 19.9424108 50.0440517, 19.942576 50.0440615, 19.9427557 50.044076, 19.9429603 50.0440972, 19.9432103 50.044129, 19.9433189 50.0441447, 19.9434166 50.0441586, 19.9434789 50.0441609, 19.9435338 50.0441692, 19.9435513 50.0441706, 19.9435682 50.0441708, 19.943581 50.0441696, 19.9436088 50.0441655, 19.9436217 50.044162, 19.943644 50.0441523, 19.9436662 50.0441393, 19.9439239 50.0439338, 19.9439434 50.0439118, 19.9439662 50.0438879, 19.9444613 50.0434928, 19.9445706 50.043406, 19.944604 50.0433772, 19.9445934 50.0433501, 19.9445723 50.0433281, 19.9444645 50.0433045, 19.9443357 50.0432866, 19.9442824 50.0433098, 19.9435676 50.0431929, 19.9429266 50.0430879, 19.9428808 50.0430804, 19.9424463 50.0430086, 19.9424181 50.0429761, 19.942215 50.0429417, 19.9421072 50.0429232, 19.9420079 50.042954, 19.9419833 50.0429698))\nhistoric : no information\nwiki_summary_en : Planty im. Floriana Nowackiego is the oldest park in Podg贸rze, located near the confluence of the Wilga River with the Vistula, between the streets: Wadysaw Warneczyk, Sokolsk, Karola Rollego, and Jana Dugosza, at Emil Serkowski Square. It was created between 1868 and 1888 at the initiative of Florian Nowacki (the mayor of Podg贸rze and a social activist) on the site of a filled medieval royal pond. In the park, there is an obelisk erected in 1898 in honor of Maksymilian Sia-Nowicki, a zoologist, professor at the Jagiellonian University, researcher of the Tatra fauna and flora, a pioneer of nature conservation in Poland, a co-founder of the Tatra Society, and the founder of the National Fishing Society in Krak贸w in 1879, the first Polish fishing organization.\npostal_code : nan\ntoilets : nan\nnatural : no information\ndescription : nan\nvisiting_time : nan\nleisure : park\ntourism : no information\npublic_transport : nan\nbrand : nan\nalt_name : nan\namenity : no information\nreservation : nan\nattraction : nan\nhighchair : nan\nparking : nan\nswimming_pool : nan\ncontact_phone : nan\ncommunity_centre : nan\naddr_street : nan\ncontact_twitter : nan\nsocial_facility : nan\ncontact_facebook : nan\nzoo : nan\nemail : nan\nwheelchair : nan\ncuisine : nan\ncontact_website : nan\ninternet_access : nan\nopening_hours_reception : nan\nguest_house : nan\naddr_city : nan\ncontact_instagram : nan\nimage : nan\nlocation : nan\noutdoor_seating : nan\nmuseum : nan\ntakeaway : nan\nsmoking : nan\nname : Planty Floriana Nowackiego\nid : 3440\n\nphone : nan\ncemetery : nan\nemergency : nan\nopening_hours : Mo 10:00-14:00; Tu-Su 10:00-17:00\nwebsite : https://muzeumkrakowa.pl/oddzialy/stara-synagoga\npets_allowed : nan\ngeometry : POLYGON ((19.9484669 50.0514068, 19.9485093 50.051353, 19.948431 50.0513243, 19.9484181 50.0513195, 19.9484891 50.0512505, 19.9485542 50.0512782, 19.9485503 50.0512645, 19.9485658 50.0512625, 19.9485705 50.0512782, 19.9486403 50.0513076, 19.948651 50.051297, 19.9486647 50.0513027, 19.9486542 50.0513133, 19.9486862 50.0513256, 19.9487114 50.0513369, 19.9488077 50.0513806, 19.9487095 50.0514705, 19.9487167 50.0514734, 19.9486946 50.0514929, 19.9484669 50.0514068))\nhistoric : building\nwiki_summary_en : The Old Synagogue (Polish: Synagoga Stara; Yiddish: 注专 址注专 砖) was a former Orthodox Jewish congregation and fortress synagogue, located at 24 Szeroka Street, in the Kazimierz district of Krak贸w, in the Lesser Poland Voivodeship of Poland.\nDesigned by Mateo Gucci, the Younger, in the Gothic and Mannerist styles, estimates vary as to when the synagogue was completed, ranging from 1407 to 1570. It is the oldest synagogue building still standing in Poland, and one of the most precious landmarks of Jewish architecture in Europe. The synagogue served as a house of prayer until World War II when it was desecrated by Nazis in 1939. It was one of the city's most important synagogues as well as the main religious, social, and organizational centre of the Krak贸w Jewish community.\nSince 1958, the building has been repurposed as a branch of the Historical Museum of Krak贸w.\npostal_code : nan\ntoilets : nan\nnatural : no information\ndescription : nan\nvisiting_time : nan\nleisure : no information\ntourism : museum\npublic_transport : nan\nbrand : nan\nalt_name : nan\namenity : no information\nreservation : nan\nattraction : nan\nhighchair : nan\nparking : nan\nswimming_pool : nan\ncontact_phone : nan\ncommunity_centre : nan\naddr_street : nan\ncontact_twitter : nan\nsocial_facility : nan\ncontact_facebook : nan\nzoo : nan\nemail : nan\nwheelchair : nan\ncuisine : nan\ncontact_website : nan\ninternet_access : nan\nopening_hours_reception : nan\nguest_house : nan\naddr_city : nan\ncontact_instagram : nan\nimage : nan\nlocation : nan\noutdoor_seating : nan\nmuseum : history\ntakeaway : nan\nsmoking : nan\nname : Stara Synagoga;Old Synagogue\nid : 3539\n\nphone : nan\ncemetery : nan\nemergency : nan\nopening_hours : Mo-Fr 08:00-20:00; Sa 08:00-14:00\nwebsite : nan\npets_allowed : nan\ngeometry : POLYGON ((19.9425519 50.059745, 19.9425448 50.0597491, 19.9424857 50.0597071, 19.942468 50.0596945, 19.9424728 50.0596911, 19.9424625 50.0596831, 19.9424664 50.0596811, 19.942467 50.0596737, 19.9424518 50.0596681, 19.9424395 50.0596614, 19.9424299 50.0596532, 19.9424228 50.0596433, 19.942418 50.0596294, 19.9424191 50.0596161, 19.9424257 50.0596033, 19.942435 50.0595936, 19.942448 50.059585, 19.9424592 50.0595802, 19.9424688 50.0595773, 19.9424784 50.0595725, 19.9424746 50.0595704, 19.9424851 50.0595624, 19.942481 50.0595593, 19.9425677 50.0595115, 19.9425739 50.0595162, 19.9427288 50.059431, 19.9427235 50.059427, 19.9428701 50.0593464, 19.9428764 50.0593512, 19.9430295 50.0592649, 19.9430246 50.0592608, 19.943111 50.059213, 19.9431159 50.0592164, 19.9431191 50.0592146, 19.9431401 50.0592308, 19.9431544 50.059223, 19.9432124 50.0591914, 19.9431997 50.0591814, 19.9431958 50.0591835, 19.9431875 50.0591769, 19.9431928 50.0591742, 19.943201 50.0591698, 19.9432019 50.0591705, 19.9433433 50.059299, 19.9432778 50.0593354, 19.9428271 50.0595832, 19.9428363 50.0595904, 19.9428123 50.0596037, 19.9428397 50.0596237, 19.9428361 50.0596603, 19.9428055 50.0596776, 19.9428264 50.0596928, 19.9428179 50.0596979, 19.9428468 50.0597209, 19.9428941 50.0596962, 19.9428986 50.0596993, 19.9429526 50.0597372, 19.9429031 50.0597664, 19.9429732 50.0598155, 19.9429482 50.0598303, 19.94294 50.0598351, 19.9428184 50.0599069, 19.9427759 50.0599056, 19.9425519 50.059745))\nhistoric : no information\nwiki_summary_en : The Main Post Office in Krak贸w (Polish: Poczta G贸wna w Krakowie) is a building of the Polish Post located at the corner of Wielopole 2 and Westerplatte 20 streets in Krak贸w.\nThe building was designed by the Viennese architect F. Setz. Joseph Sareg adapted the project and it was built between 1887 and 1889 by Charles Knaus and Tadeusz Stryjeski.\nSince 1899 it was the headquarters of mail in Krak贸w. In 1909, it was the location of what is now the Polish automatic telephone exchange with a capacity of 3600 numbers.\nDue to growing needs for office surface, between 1930 and 1931 it was rebuilt by Frederick Tadaniera. The interiors and furnishings were updated and in 1933 the intercity telephone exchange was installed.\nAnother reconstruction took place during the German occupation. The Polish Post Office reopened on January 22, 1945.\nAfter the war, the post office has repeatedly being modernized and repaired. Since 1991 it has housed the Polish Post and Telecommunications.\npostal_code : nan\ntoilets : nan\nnatural : no information\ndescription : nan\nvisiting_time : nan\nleisure : no information\ntourism : no information\npublic_transport : nan\nbrand : Poczta Polska\nalt_name : nan\namenity : post_office\nreservation : nan\nattraction : nan\nhighchair : nan\nparking : nan\nswimming_pool : nan\ncontact_phone : nan\ncommunity_centre : nan\naddr_street : nan\ncontact_twitter : nan\nsocial_facility : nan\ncontact_facebook : nan\nzoo : nan\nemail : nan\nwheelchair : nan\ncuisine : nan\ncontact_website : nan\ninternet_access : nan\nopening_hours_reception : nan\nguest_house : nan\naddr_city : nan\ncontact_instagram : nan\nimage : nan\nlocation : nan\noutdoor_seating : nan\nmuseum : nan\ntakeaway : nan\nsmoking : nan\nname : Urzd Pocztowy Krak贸w 1;芯邪;UP Krak贸w\nid : 11277\n\nphone : nan\ncemetery : nan\nemergency : nan\nopening_hours : nan\nwebsite : nan\npets_allowed : nan\ngeometry : POLYGON ((19.9108847 50.0647312, 19.9114201 50.0646427, 19.9114737 50.0646333, 19.9115066 50.0646279, 19.9115872 50.0646144, 19.9118468 50.0645729, 19.9121223 50.0645296, 19.912394 50.0644822, 19.9126559 50.0644388, 19.912729 50.0644272, 19.9127609 50.0644219, 19.9128344 50.0644098, 19.9132303 50.0643455, 19.9133673 50.0643221, 19.9129366 50.0632373, 19.9126992 50.0626456, 19.912586 50.0626639, 19.9124407 50.0626885, 19.9122719 50.062717, 19.9121807 50.0627326, 19.9121835 50.0627398, 19.9121524 50.0627451, 19.9120996 50.0627535, 19.9120384 50.0627635, 19.9119654 50.0627758, 19.9117214 50.0628154, 19.9114518 50.06286, 19.9114485 50.0628606, 19.9113947 50.0628689, 19.911249 50.0628927, 19.9111825 50.0629041, 19.9111061 50.0629161, 19.9109251 50.0629457, 19.9108435 50.0629591, 19.9108054 50.0629653, 19.9108301 50.0630274, 19.9108471 50.0630693, 19.910784 50.0630816, 19.9107664 50.063069, 19.9107417 50.0630583, 19.9107187 50.0630506, 19.9106932 50.0630455, 19.9106638 50.0630438, 19.910635 50.0630457, 19.9106097 50.0630493, 19.9105838 50.0630556, 19.9105612 50.063066, 19.9105401 50.0630785, 19.9105239 50.063093, 19.9105113 50.0631092, 19.9105035 50.0631257, 19.9105015 50.0631441, 19.9105045 50.0631613, 19.9105114 50.0631783, 19.9105213 50.0631941, 19.9105366 50.0632095, 19.9105566 50.0632225, 19.9105808 50.0632334, 19.9106053 50.0632415, 19.9106331 50.0632472, 19.9106596 50.0632481, 19.9106859 50.0632466, 19.9107139 50.0632425, 19.9107399 50.0632345, 19.9107705 50.0633074, 19.9107568 50.0633098, 19.9107255 50.0633146, 19.9105422 50.0633463, 19.9103323 50.0633787, 19.910498 50.0637832, 19.9103365 50.0638096, 19.9103611 50.063869, 19.9102946 50.06388, 19.9103428 50.0640007, 19.9104092 50.0639898, 19.910431 50.0640482, 19.910492 50.0640389, 19.9105993 50.0640224, 19.9108847 50.0647312))\nhistoric : no information\nwiki_summary_en : Stadion Miejski im. Henryka Reymana (English: Henryk Reyman Municipal Stadium) is a football-specific stadium in Krak贸w, Poland. It is currently used as home ground by Wisa Krak贸w football team playing in the I liga matches. The address of the stadium is Krak贸w, ul. Reymonta 22. The stadium has a capacity of 33,326 spectators, who are all seated, and is fully roofed. Wisa Stadium is the second largest arena in I liga. The stadium was originally built in 1953. From 2003 to 2011, the stadium was completely reconstructed with four new stands and a media pavilion. Reconstruction was finally completed in October 2011.\nThanks to resolution passed by Krak贸w City council on 23 January 2008, the stadium is named after Wisa's legendary player Henryk Tomasz Reyman.\nMunicipal Stadium in Krak贸w meets the criteria for UEFA Category 4.\npostal_code : nan\ntoilets : nan\nnatural : no information\ndescription : nan\nvisiting_time : nan\nleisure : stadium\ntourism : no information\npublic_transport : nan\nbrand : nan\nalt_name : nan\namenity : no information\nreservation : nan\nattraction : nan\nhighchair : nan\nparking : nan\nswimming_pool : nan\ncontact_phone : nan\ncommunity_centre : nan\naddr_street : Wadysawa Reymonta\ncontact_twitter : nan\nsocial_facility : nan\ncontact_facebook : nan\nzoo : nan\nemail : nan\nwheelchair : nan\ncuisine : nan\ncontact_website : nan\ninternet_access : nan\nopening_hours_reception : nan\nguest_house : nan\naddr_city : Krak贸w\ncontact_instagram : nan\nimage : nan\nlocation : nan\noutdoor_seating : nan\nmuseum : nan\ntakeaway : nan\nsmoking : nan\nname : Stadion Miejski im. Henryka Reymana\nid : 11559\n\nphone : +48 126514820\ncemetery : nan\nemergency : nan\nopening_hours : nan\nwebsite : https://www.helloindia.pl/\npets_allowed : nan\ngeometry : POINT (19.94248 50.0488216)\nhistoric : no information\nwiki_summary_en : no information\npostal_code : nan\ntoilets : nan\nnatural : no information\ndescription : nan\nvisiting_time : nan\nleisure : no information\ntourism : no information\npublic_transport : nan\nbrand : nan\nalt_name : nan\namenity : restaurant\nreservation : nan\nattraction : nan\nhighchair : nan\nparking : nan\nswimming_pool : nan\ncontact_phone : nan\ncommunity_centre : nan\naddr_street : nan\ncontact_twitter : nan\nsocial_facility : nan\ncontact_facebook : https://www.facebook.com/profile.php?id=100044371581598\nzoo : nan\nemail : helloindia@helloindia.pl\nwheelchair : nan\ncuisine : indian\ncontact_website : nan\ninternet_access : nan\nopening_hours_reception : nan\nguest_house : nan\naddr_city : nan\ncontact_instagram : nan\nimage : nan\nlocation : nan\noutdoor_seating : yes\nmuseum : nan\ntakeaway : nan\nsmoking : nan\nname : Hello India\nid : 1547\n\nphone : nan\ncemetery : nan\nemergency : nan\nopening_hours : nan\nwebsite : nan\npets_allowed : nan\ngeometry : POINT (19.9311286 50.0884363)\nhistoric : no information\nwiki_summary_en : no information\npostal_code : nan\ntoilets : nan\nnatural : no information\ndescription : nan\nvisiting_time : nan\nleisure : no information\ntourism : no information\npublic_transport : stop_position\nbrand : nan\nalt_name : nan\namenity : no information\nreservation : nan\nattraction : nan\nhighchair : nan\nparking : nan\nswimming_pool : nan\ncontact_phone : nan\ncommunity_centre : nan\naddr_street : nan\ncontact_twitter : nan\nsocial_facility : nan\ncontact_facebook : nan\nzoo : nan\nemail : nan\nwheelchair : nan\ncuisine : nan\ncontact_website : nan\ninternet_access : nan\nopening_hours_reception : nan\nguest_house : nan\naddr_city : nan\ncontact_instagram : nan\nimage : nan\nlocation : nan\noutdoor_seating : nan\nmuseum : nan\ntakeaway : nan\nsmoking : nan\nname : Krowodrza G贸rka P+R 04\nid : 8966\n\nphone : nan\ncemetery : nan\nemergency : nan\nopening_hours : nan\nwebsite : nan\npets_allowed : nan\ngeometry : POINT (19.9368483 50.0809273)\nhistoric : no information\nwiki_summary_en : no information\npostal_code : nan\ntoilets : nan\nnatural : no information\ndescription : nan\nvisiting_time : nan\nleisure : no information\ntourism : no information\npublic_transport : stop_position\nbrand : nan\nalt_name : nan\namenity : no information\nreservation : nan\nattraction : nan\nhighchair : nan\nparking : nan\nswimming_pool : nan\ncontact_phone : nan\ncommunity_centre : nan\naddr_street : nan\ncontact_twitter : nan\nsocial_facility : nan\ncontact_facebook : nan\nzoo : nan\nemail : nan\nwheelchair : nan\ncuisine : nan\ncontact_website : nan\ninternet_access : nan\nopening_hours_reception : nan\nguest_house : nan\naddr_city : nan\ncontact_instagram : nan\nimage : nan\nlocation : nan\noutdoor_seating : nan\nmuseum : nan\ntakeaway : nan\nsmoking : nan\nname : Szpital Narutowicza 03\nid : 7994\n\nphone : nan\ncemetery : nan\nemergency : nan\nopening_hours : nan\nwebsite : nan\npets_allowed : nan\ngeometry : POINT (19.9440087 50.0633678)\nhistoric : memorial\nwiki_summary_en : no information\npostal_code : nan\ntoilets : nan\nnatural : no information\ndescription : nan\nvisiting_time : nan\nleisure : no information\ntourism : no information\npublic_transport : nan\nbrand : nan\nalt_name : nan\namenity : no information\nreservation : nan\nattraction : nan\nhighchair : nan\nparking : nan\nswimming_pool : nan\ncontact_phone : nan\ncommunity_centre : nan\naddr_street : nan\ncontact_twitter : nan\nsocial_facility : nan\ncontact_facebook : nan\nzoo : nan\nemail : nan\nwheelchair : limited\ncuisine : nan\ncontact_website : nan\ninternet_access : nan\nopening_hours_reception : nan\nguest_house : nan\naddr_city : nan\ncontact_instagram : nan\nimage : https://commons.wikimedia.org/wiki/File:Memorial_of_Micha%C5%82_Ba%C5%82ucki_(Polish_writer),_Planty_Park,_Krak%C3%B3w,_Poland.jpg\nlocation : nan\noutdoor_seating : nan\nmuseum : nan\ntakeaway : nan\nsmoking : nan\nname : Micha Baucki;Micha-Baucki-Denkmal;邪谢 邪谢泻\nid : 2396\n\nphone : nan\ncemetery : nan\nemergency : nan\nopening_hours : nan\nwebsite : nan\npets_allowed : nan\ngeometry : POINT (20.0138382 50.0362519)\nhistoric : no information\nwiki_summary_en : no information\npostal_code : nan\ntoilets : nan\nnatural : no information\ndescription : nan\nvisiting_time : nan\nleisure : no information\ntourism : no information\npublic_transport : stop_position\nbrand : nan\nalt_name : nan\namenity : no information\nreservation : nan\nattraction : nan\nhighchair : nan\nparking : nan\nswimming_pool : nan\ncontact_phone : nan\ncommunity_centre : nan\naddr_street : nan\ncontact_twitter : nan\nsocial_facility : nan\ncontact_facebook : nan\nzoo : nan\nemail : nan\nwheelchair : nan\ncuisine : nan\ncontact_website : nan\ninternet_access : nan\nopening_hours_reception : nan\nguest_house : nan\naddr_city : nan\ncontact_instagram : nan\nimage : nan\nlocation : nan\noutdoor_seating : nan\nmuseum : nan\ntakeaway : nan\nsmoking : nan\nname : Biskupiska 02\nid : 8571\n\n",
  "answer": "The **Hello India** restaurant has a **Facebook profile** that you can follow for updates:\n [Facebook](https://www.facebook.com/profile.php?id=100044371581598)\n\nNo other social media profiles (e.g., Instagram, Twitter) are listed in the provided context.",
  "labels": {
    "faithfulness": "FAITHFUL",
    "groundedness": "GROUNDED",
    "relevance": "RELEVANT",
    "completeness": "PARTLY_COMPLETE",
    "coherence": "COHERENT",
    "conciseness": "CONCISE"
  },
  "quality_score": 5
}