{
  "model": "mistral_llm",
  "prompt": "prompt_C",
  "id": 894,
  "question": "What are the opening hours for Zielonym do góry on weekends?",
  "context": "phone : nan\ncemetery : nan\nemergency : nan\nopening_hours : Mo-Su 10:00-20:00; Tu 10:00-16:00; Nov-Mar: Mo,We,Th 10:00-19:00; Nov-Mar: Tu 10:00-14:00; Nov-Mar: Fr-Su 10:00-20:00\nwebsite : https://muzeumkrakowa.pl/oddzialy/rynek-podziemny\npets_allowed : nan\ngeometry : POINT (19.9377745 50.061996)\nhistoric : no information\nwiki_summary_en : The Rynek Underground museum of Kraków is situated below the market square of the city. The museum is approximately 4000 square meters in size.\nWork on the museum first began in 2009 with a budget of 38 million złotys, equal to approximately 9.3 million United States dollars (2023). The museum was opened on September 24, 2010. The main exhibit \"In the Footsteps of Krakow's European Identity\" was launched three days after the museum's opening, on September 27, 2010.\npostal_code : nan\ntoilets : nan\nnatural : no information\ndescription : nan\nvisiting_time : nan\nleisure : no information\ntourism : museum\npublic_transport : nan\nbrand : nan\nalt_name : nan\namenity : no information\nreservation : nan\nattraction : nan\nhighchair : nan\nparking : nan\nswimming_pool : nan\ncontact_phone : nan\ncommunity_centre : nan\naddr_street : Rynek Główny\ncontact_twitter : nan\nsocial_facility : nan\ncontact_facebook : nan\nzoo : nan\nemail : nan\nwheelchair : limited\ncuisine : nan\ncontact_website : nan\ninternet_access : nan\nopening_hours_reception : nan\nguest_house : nan\naddr_city : Kraków\ncontact_instagram : nan\nimage : nan\nlocation : nan\noutdoor_seating : nan\nmuseum : history\ntakeaway : nan\nsmoking : nan\nname : Rynek Podziemny;Rynek Underground;Подземелье рынка;Föld alatti Piac tér\nid : 2430\n\nphone : +48 12 422 05 21\ncemetery : nan\nemergency : nan\nopening_hours : Mo-Sa 11:30-18:00; Su 14:00-18:00\nwebsite : https://mariacki.com\npets_allowed : nan\ngeometry : POLYGON ((19.9389202 50.0616958, 19.9389203 50.061699, 19.9389308 50.0616987, 19.9389329 50.0617701, 19.9390219 50.061769, 19.9390222 50.0617899, 19.939069 50.0617897, 19.9390689 50.0617933, 19.9390767 50.061793, 19.9390802 50.0618409, 19.939344 50.0618351, 19.939351 50.0618316, 19.9393529 50.0618287, 19.9393987 50.0618276, 19.9394004 50.0618305, 19.9394044 50.0618316, 19.9394074 50.0618335, 19.9395723 50.0618301, 19.9395709 50.0618076, 19.9396872 50.0618003, 19.9398112 50.0617858, 19.9398073 50.0617685, 19.9399081 50.0617606, 19.9399015 50.0617225, 19.9399401 50.0617198, 19.93994 50.0617183, 19.9399602 50.061717, 19.9399606 50.0617186, 19.9399692 50.061718, 19.9399702 50.0617194, 19.9399813 50.0617187, 19.9399899 50.0617279, 19.9399952 50.0617288, 19.9400217 50.0617113, 19.9400209 50.0617098, 19.9400369 50.0616991, 19.9400395 50.0616999, 19.9400659 50.0616821, 19.9400651 50.0616789, 19.9400511 50.0616717, 19.940056 50.061665, 19.9400547 50.0616639, 19.9400564 50.0616076, 19.940059 50.0616066, 19.9400525 50.0615991, 19.940068 50.0615934, 19.9400674 50.0615901, 19.9399952 50.0615393, 19.9399396 50.0615406, 19.9399397 50.0615398, 19.9399158 50.0615402, 19.9399161 50.0615412, 19.939878 50.0615421, 19.9398787 50.0615519, 19.9398721 50.0615521, 19.9398723 50.0615544, 19.9397785 50.0615573, 19.9397782 50.0615557, 19.9397579 50.0615566, 19.9397579 50.0615578, 19.9397104 50.0615598, 19.9397104 50.0615587, 19.9396443 50.0615601, 19.9396455 50.0615812, 19.9396154 50.0615819, 19.9396132 50.0615889, 19.9396 50.0615893, 19.9395861 50.0615896, 19.9395829 50.0615827, 19.9395486 50.0615837, 19.9395448 50.0615299, 19.9395668 50.0615144, 19.939553 50.0614859, 19.939531 50.0614753, 19.9395071 50.0614763, 19.9393837 50.0614812, 19.9393762 50.0614839, 19.9393761 50.0614869, 19.9393269 50.0614876, 19.9393264 50.0614846, 19.9393189 50.0614835, 19.939314 50.0614832, 19.9393132 50.0614736, 19.9392723 50.0614752, 19.9392747 50.0614847, 19.9390605 50.0614909, 19.9390002 50.0614946, 19.9390017 50.0615307, 19.9390053 50.0615305, 19.9390062 50.0615472, 19.9389247 50.0615485, 19.9389213 50.0616186, 19.9389157 50.0616188, 19.9389159 50.0616254, 19.9388923 50.0616254, 19.9388892 50.0616186, 19.938877 50.0616213, 19.9388797 50.0616277, 19.9388474 50.0616408, 19.9388378 50.0616376, 19.9388319 50.0616448, 19.9388419 50.0616479, 19.938842 50.0616615, 19.9388421 50.0616746, 19.938833 50.0616782, 19.9388394 50.0616852, 19.9388485 50.0616816, 19.9388831 50.061693, 19.93888 50.0616998, 19.9388918 50.0617023, 19.9388965 50.061696, 19.9389202 50.0616958))\nhistoric : church\nwiki_summary_en : The Church of the Assumption of the Blessed Virgin Mary (Polish: Kościół Wniebowzięcia Najświętszej Marii Panny), known colloquially as the St. Mary's Church (Polish: Kościół Mariacki), is a historic Roman Catholic parish church located at Mariacki Square at the north-eastern corner of the Main Market Square in the Old Town of Kraków, Poland.\nIt is a Brick Gothic church. Built in the 14th century, its foundations date back to the early 13th century and serve as one of the best examples of Polish Gothic architecture. Standing 80 m (262 ft) tall, it is particularly famous for its wooden altarpiece carved by Veit Stoss (Wit Stwosz). Some of its monumental polychrome murals were designed by Poland's leading history painter, Jan Matejko (1838–1893). In 1978, it became a UNESCO World Heritage Site alongside the Historic Centre of Kraków.\nOn every hour, 24 hours a day, 365 days a year, a trumpet signal—called the Hejnał mariacki—is played from the top of the taller of Saint Mary's two towers. The plaintive tune breaks off in mid-stream, to commemorate a famous 13th-century trumpeter who was shot in the throat while sounding the alarm before a Mongol attack on the city. The noon-time hejnał is heard across Poland and abroad broadcast live by Polish Radio Jedynka.\nSaint Mary's Basilica also served as an architectural model for many of the churches that were built by the Polish diaspora abroad, particularly those like Saint Michael's and Saint John Cantius in Chicago, designed in the Polish Cathedral style.\nThe church is familiar to many English-speaking readers from the 1928 book The Trumpeter of Krakow by Eric P. Kelly.\npostal_code : nan\ntoilets : nan\nnatural : no information\ndescription : nan\nvisiting_time : nan\nleisure : no information\ntourism : attraction\npublic_transport : nan\nbrand : nan\nalt_name : Kościół pw. Wniebowzięcia Najświętszej Maryi Panny\namenity : place_of_worship\nreservation : nan\nattraction : nan\nhighchair : nan\nparking : nan\nswimming_pool : nan\ncontact_phone : nan\ncommunity_centre : nan\naddr_street : Plac Mariacki\ncontact_twitter : nan\nsocial_facility : nan\ncontact_facebook : nan\nzoo : nan\nemail : biuro@mariacki.com\nwheelchair : yes\ncuisine : nan\ncontact_website : nan\ninternet_access : nan\nopening_hours_reception : nan\nguest_house : nan\naddr_city : Kraków\ncontact_instagram : nan\nimage : nan\nlocation : nan\noutdoor_seating : nan\nmuseum : nan\ntakeaway : nan\nsmoking : nan\nname : Bazylika Wniebowzięcia Najświętszej Maryi Panny;St. Mary's Basilica;Kościół pw. Wniebowzięcia Najświętszej Maryi Panny;Iglesia de Santa María;Bazylika Mariacka;Церква Успіння Пресвятої Богородиці;Marienbasilika;Мариацкий костёл;Mária Mennybevétele templom;Касцёл Унебаўзняцця Найсвяцейшай Панны Марыі;Basilica di Santa Maria;Kościół Mariacki;Basilique Sainte-Marie;Krokuvos Šv. Marijos bazilika;聖母聖殿;성모 승천 대성당;Krakówi Maria kirik;Sanktuarium Matki Bożej Częstochowskiej\nid : 3443\n\nphone : nan\ncemetery : nan\nemergency : nan\nopening_hours : nan\nwebsite : nan\npets_allowed : nan\ngeometry : POLYGON ((20.0518884 50.0661618, 20.0520215 50.0661609, 20.0520468 50.0661722, 20.0520684 50.0661853, 20.0520981 50.0663858, 20.0521003 50.0664039, 20.0521264 50.0665791, 20.0515885 50.0666571, 20.0515999 50.0667034, 20.0508794 50.0668887, 20.0508477 50.0668194, 20.0503372 50.0668957, 20.0503255 50.0668974, 20.0503147 50.066899, 20.0503 50.0669012, 20.0501707 50.0665626, 20.0501627 50.0665415, 20.0500107 50.0661706, 20.0508642 50.0661649, 20.0509508 50.0661647, 20.0509513 50.0662291, 20.0509671 50.066229, 20.0509666 50.0661646, 20.0518504 50.066162, 20.0518884 50.0661618))\nhistoric : no information\nwiki_summary_en : Park przy ulicy Klasztornej is a historic municipal park in Krakow, located in the XVIII Nowa Huta district between Klasztorna Street (to the east), Wacław Sieroszewski Street (to the south), the buildings of the Stefan Żeromski Hospital in the Młodości estate (to the west), and the plot where the Rogoziński villa is located (to the north). The park is situated on a trapezoidal area measuring 45 to 85 meters in width and 135 meters in length. It covers an area of 88 ares. The terrain of the park is generally flat, slightly sloping to the southwest.\npostal_code : nan\ntoilets : nan\nnatural : no information\ndescription : nan\nvisiting_time : nan\nleisure : park\ntourism : no information\npublic_transport : nan\nbrand : nan\nalt_name : nan\namenity : no information\nreservation : nan\nattraction : nan\nhighchair : nan\nparking : nan\nswimming_pool : nan\ncontact_phone : nan\ncommunity_centre : nan\naddr_street : nan\ncontact_twitter : nan\nsocial_facility : nan\ncontact_facebook : nan\nzoo : nan\nemail : nan\nwheelchair : nan\ncuisine : nan\ncontact_website : nan\ninternet_access : nan\nopening_hours_reception : nan\nguest_house : nan\naddr_city : nan\ncontact_instagram : nan\nimage : nan\nlocation : nan\noutdoor_seating : nan\nmuseum : nan\ntakeaway : nan\nsmoking : nan\nname : Park Rogozińskich\nid : 3486\n\nphone : nan\ncemetery : nan\nemergency : nan\nopening_hours : nan\nwebsite : nan\npets_allowed : nan\ngeometry : POLYGON ((19.9674902 50.086207, 19.9673616 50.0861288, 19.9673577 50.086138, 19.9673101 50.0861482, 19.9670686 50.0861446, 19.9667902 50.0861469, 19.9661842 50.0861802, 19.9658687 50.0862051, 19.9655519 50.086249, 19.9651413 50.0863314, 19.9647377 50.0864246, 19.9647414 50.0864302, 19.9647042 50.0864433, 19.964635 50.0864675, 19.9646322 50.0864648, 19.9644201 50.0865985, 19.9642383 50.0866981, 19.9643465 50.0868015, 19.9644072 50.0868188, 19.9644645 50.0868736, 19.964468 50.0868799, 19.9644919 50.0868886, 19.964644 50.0869468, 19.9646839 50.0869601, 19.9649993 50.0870638, 19.9652957 50.0871588, 19.9653204 50.0871672, 19.9653847 50.0871889, 19.9654504 50.0872111, 19.965571 50.0872518, 19.9658398 50.0873427, 19.9660606 50.0874198, 19.9665252 50.0875668, 19.9667802 50.0875824, 19.9667835 50.0875025, 19.9668298 50.0873874, 19.9669723 50.0872395, 19.9676375 50.0868495, 19.9676239 50.0866813, 19.967643 50.0865711, 19.9676681 50.0865074, 19.9676609 50.0863811, 19.967617 50.0862816, 19.9675498 50.0862273, 19.9674902 50.086207))\nhistoric : no information\nwiki_summary_en : Park Zaczarowanej Dorożki – a park located in Krakow, in the III Prądnik Czerwony district, between Lublańska Street and Dobrego Pasterza Street in Prądnik Czerwony.\npostal_code : nan\ntoilets : nan\nnatural : no information\ndescription : nan\nvisiting_time : nan\nleisure : park\ntourism : no information\npublic_transport : nan\nbrand : nan\nalt_name : nan\namenity : no information\nreservation : nan\nattraction : nan\nhighchair : nan\nparking : nan\nswimming_pool : nan\ncontact_phone : nan\ncommunity_centre : nan\naddr_street : nan\ncontact_twitter : nan\nsocial_facility : nan\ncontact_facebook : nan\nzoo : nan\nemail : nan\nwheelchair : nan\ncuisine : nan\ncontact_website : nan\ninternet_access : nan\nopening_hours_reception : nan\nguest_house : nan\naddr_city : nan\ncontact_instagram : nan\nimage : nan\nlocation : nan\noutdoor_seating : nan\nmuseum : nan\ntakeaway : nan\nsmoking : nan\nname : Park Zaczarowanej Dorożki;Q9385671\nid : 3647\n\nphone : nan\ncemetery : nan\nemergency : nan\nopening_hours : nan\nwebsite : nan\npets_allowed : nan\ngeometry : POLYGON ((19.9528695 50.0637715, 19.9528455 50.0638127, 19.9527797 50.0637964, 19.952706 50.0637782, 19.9527304 50.0637373, 19.9526658 50.0637214, 19.9526669 50.0637196, 19.9526656 50.0637193, 19.9527546 50.063566, 19.9527604 50.0635675, 19.9527661 50.063569, 19.9527654 50.0635701, 19.952771 50.0635715, 19.9527704 50.0635724, 19.9528006 50.0635798, 19.9528011 50.0635791, 19.9528048 50.0635799, 19.9528056 50.0635787, 19.9528141 50.0635808, 19.9528153 50.0635787, 19.9528211 50.06358, 19.9528228 50.0635775, 19.9528453 50.0635832, 19.9528439 50.0635857, 19.9528497 50.0635871, 19.9528463 50.0635935, 19.9529317 50.0636145, 19.9529356 50.0636083, 19.9529416 50.0636097, 19.9529431 50.0636073, 19.9529658 50.0636129, 19.9529643 50.0636154, 19.9529703 50.0636169, 19.9529688 50.0636193, 19.952977 50.0636212, 19.9529763 50.0636225, 19.95298 50.0636233, 19.9529797 50.0636241, 19.9530099 50.0636315, 19.9530105 50.0636308, 19.953016 50.0636322, 19.9530168 50.063631, 19.9530226 50.0636324, 19.9530283 50.0636338, 19.9530271 50.0636362, 19.9529388 50.0637882, 19.9528695 50.0637715))\nhistoric : church\nwiki_summary_en : St. Teresa of Jesus and St. John of the Cross Church – a historic Roman Catholic parish church and convent of the Discalced Carmelites located in Kraków, in the Grzegórzki district at 44 Mikołaj Kopernik Street, in Wesoła. It was built between 1720 and 1730 with the funding of Chancellor Jan Szembek, and the consecration of the new temple was performed in 1730 by the Warmian bishop Krzysztof Jan Szembek, the founder’s brother. In the second half of the 18th century, the Carmelites moved here from the convent house near St. Martin's Church. The church is built in the Baroque style, in the shape of a Greek cross. The modest façade adorned with pilasters features a portal. In front of the church stands a marble column from 1668. In the main altar, there is a painting of St. Teresa of Avila gifted by the founder. The church is associated with the story of the nun Barbara Ubryk, who, after strange behaviors, laughter in church, confessions lasting many hours, and fits of exalted piety, was bricked up in a cell, where she was imprisoned under inhumane conditions for 21 years (from 1848 to 1869). News of this caused a scandal and riots against the clergy.\npostal_code : nan\ntoilets : nan\nnatural : no information\ndescription : nan\nvisiting_time : nan\nleisure : no information\ntourism : no information\npublic_transport : nan\nbrand : nan\nalt_name : nan\namenity : place_of_worship\nreservation : nan\nattraction : nan\nhighchair : nan\nparking : nan\nswimming_pool : nan\ncontact_phone : nan\ncommunity_centre : nan\naddr_street : nan\ncontact_twitter : nan\nsocial_facility : nan\ncontact_facebook : nan\nzoo : nan\nemail : nan\nwheelchair : nan\ncuisine : nan\ncontact_website : nan\ninternet_access : nan\nopening_hours_reception : nan\nguest_house : nan\naddr_city : nan\ncontact_instagram : nan\nimage : https://commons.wikimedia.org/wiki/File:Church_of_Saint_Teresa,_Krak%C3%B3w.JPG\nlocation : nan\noutdoor_seating : nan\nmuseum : nan\ntakeaway : nan\nsmoking : nan\nname : Kościół pw. Świętej Teresy od Jezusa i Świętego Jana od Krzyża;Jézusról nevezett Szent Terész és Keresztes Szent János templom\nid : 3678\n\nphone : nan\ncemetery : nan\nemergency : nan\nopening_hours : nan\nwebsite : nan\npets_allowed : nan\ngeometry : POINT (19.9569831 50.0484407)\nhistoric : no information\nwiki_summary_en : Kraków Zabłocie – a train station in Kraków, in the Podgórze district, in its formerly industrial part, Zabłocie. It was opened in 1979. Only passenger trains stop at the station. The station can be accessed via Kącik Street (from the Old Podgórze side) and Lipowa Street (from the Zabłocie side).\npostal_code : nan\ntoilets : nan\nnatural : no information\ndescription : nan\nvisiting_time : nan\nleisure : no information\ntourism : no information\npublic_transport : station\nbrand : nan\nalt_name : nan\namenity : no information\nreservation : nan\nattraction : nan\nhighchair : nan\nparking : nan\nswimming_pool : nan\ncontact_phone : nan\ncommunity_centre : nan\naddr_street : nan\ncontact_twitter : nan\nsocial_facility : nan\ncontact_facebook : nan\nzoo : nan\nemail : nan\nwheelchair : yes\ncuisine : nan\ncontact_website : nan\ninternet_access : nan\nopening_hours_reception : nan\nguest_house : nan\naddr_city : nan\ncontact_instagram : nan\nimage : http://commons.wikimedia.org/wiki/File:Krak%C3%B3w_Zab%C5%82ocie.jpg\nlocation : nan\noutdoor_seating : nan\nmuseum : nan\ntakeaway : nan\nsmoking : nan\nname : Kraków Zabłocie\nid : 7162\n\nphone : nan\ncemetery : nan\nemergency : nan\nopening_hours : nan\nwebsite : nan\npets_allowed : nan\ngeometry : POLYGON ((19.9541636 50.0542113, 19.9541355 50.0541201, 19.9540847 50.053936, 19.9540656 50.053854, 19.9540574 50.0538185, 19.9540508 50.0537851, 19.9540444 50.0537485, 19.9540226 50.0536189, 19.9540123 50.0535112, 19.954012 50.0534585, 19.9540137 50.0534042, 19.9540142 50.053389, 19.9540267 50.0533039, 19.9540329 50.0532704, 19.9540457 50.0532139, 19.9540758 50.0531207, 19.9541076 50.0530429, 19.9541504 50.0529607, 19.9541616 50.0529392, 19.9542031 50.0529484, 19.9541886 50.052917, 19.9543383 50.0528899, 19.9543464 50.0528884, 19.9543668 50.0528848, 19.9543865 50.0528812, 19.9546935 50.0535844, 19.9550337 50.0535235, 19.9550373 50.0535322, 19.9550788 50.0535244, 19.9550782 50.05352, 19.9550792 50.0535151, 19.955082 50.0535108, 19.9550857 50.0535073, 19.9550912 50.053504, 19.9550967 50.0535023, 19.9551042 50.0535009, 19.9551113 50.0535008, 19.9551167 50.0535015, 19.9551225 50.0535031, 19.9551284 50.0535057, 19.9551323 50.0535083, 19.9551349 50.0535109, 19.9551367 50.0535138, 19.9551735 50.0535075, 19.9551731 50.0535068, 19.955178 50.0535058, 19.9551665 50.0534794, 19.9551613 50.0534801, 19.9551595 50.0534758, 19.9551645 50.0534749, 19.9551528 50.053448, 19.9551477 50.0534488, 19.955146 50.0534445, 19.955151 50.0534436, 19.9551392 50.0534167, 19.9551343 50.0534175, 19.9551321 50.0534131, 19.9551372 50.0534121, 19.9551255 50.0533853, 19.9551205 50.0533861, 19.9551186 50.0533818, 19.9551235 50.0533808, 19.9551121 50.0533548, 19.9551071 50.0533557, 19.9551054 50.0533512, 19.9551089 50.0533506, 19.955104 50.0533397, 19.9551025 50.0533399, 19.9551001 50.0533347, 19.9551015 50.0533343, 19.9550308 50.0531756, 19.9551771 50.0531483, 19.9551851 50.0531687, 19.9552037 50.0531654, 19.9552672 50.0533101, 19.9552568 50.053312, 19.9552636 50.0533258, 19.9553446 50.0533111, 19.9552118 50.053004, 19.9554279 50.0528518, 19.9555749 50.0528254, 19.9556153 50.0528181, 19.9554985 50.0525515, 19.9557841 50.0523517, 19.9557993 50.0523408, 19.9558024 50.0523428, 19.9558119 50.0523362, 19.9558087 50.0523339, 19.9558249 50.0523154, 19.9558314 50.0523178, 19.9558285 50.0523211, 19.9559207 50.0523551, 19.9559237 50.0523513, 19.9559302 50.0523533, 19.9559274 50.0523571, 19.9560149 50.052389, 19.9560177 50.0523853, 19.9560241 50.0523873, 19.9560213 50.052391, 19.9561083 50.0524229, 19.9561111 50.0524191, 19.9561175 50.0524211, 19.9561146 50.0524248, 19.9562026 50.0524571, 19.9562055 50.0524532, 19.9562119 50.0524552, 19.9562086 50.0524588, 19.9562962 50.0524909, 19.9563 50.0524872, 19.9563054 50.0524895, 19.9563023 50.0524931, 19.9563408 50.052507, 19.9563907 50.0525251, 19.956394 50.0525213, 19.9564002 50.0525234, 19.9563968 50.0525273, 19.9564462 50.0525452, 19.9564852 50.0525593, 19.9564884 50.0525556, 19.9564942 50.0525577, 19.9564911 50.0525614, 19.9565644 50.0525878, 19.9565883 50.0526428, 19.9567204 50.0529463, 19.9567239 50.0529456, 19.9567257 50.0529499, 19.9567243 50.0529503, 19.9567399 50.0529858, 19.9567415 50.0529858, 19.9567433 50.0529899, 19.9567417 50.0529903, 19.9567592 50.0530302, 19.9567607 50.05303, 19.9567628 50.0530343, 19.9567598 50.0530349, 19.9567697 50.0530572, 19.9567725 50.0530569, 19.9567744 50.0530612, 19.9567729 50.0530617, 19.9568023 50.0531295, 19.9568003 50.0531299, 19.9569548 50.0534857, 19.956954 50.0534859, 19.9569544 50.0534868, 19.9561372 50.0536342, 19.9562251 50.0538354, 19.9562571 50.05383, 19.9562533 50.0538209, 19.9563241 50.0538083, 19.9563275 50.053816, 19.9563338 50.0538153, 19.9563342 50.053816, 19.9563353 50.0538156, 19.956368 50.0538909, 19.9563642 50.0538915, 19.956377 50.0539209, 19.9564386 50.0540634, 19.9565247 50.0542596, 19.9565215 50.05426, 19.9565356 50.0542929, 19.9564764 50.0543037, 19.9564302 50.0543118, 19.9564309 50.0543139, 19.9564257 50.054315, 19.9557742 50.0544326, 19.9557745 50.0544332, 19.9557142 50.0544439, 19.9557128 50.0544411, 19.9556904 50.0544451, 19.9556916 50.0544481, 19.9556592 50.0544538, 19.955645 50.0544205, 19.9555456 50.0544385, 19.9554366 50.0544582, 19.9554465 50.0544819, 19.955339 50.0545016, 19.9553431 50.0545112, 19.9553115 50.054517, 19.9553103 50.0545142, 19.9552879 50.0545181, 19.955289 50.0545211, 19.9552297 50.0545318, 19.9552292 50.0545309, 19.9544911 50.0546619, 19.9544652 50.0546665, 19.9544507 50.0546335, 19.954447 50.0546336, 19.9543739 50.054465, 19.9543625 50.0544387, 19.9543508 50.0544116, 19.954313 50.0543244, 19.9543032 50.0543018, 19.9542881 50.0542669, 19.9542852 50.0542674, 19.9542696 50.0542333, 19.9541782 50.0542493, 19.9541777 50.0542484, 19.9541766 50.0542486, 19.9541636 50.0542113))\nhistoric : no information\nwiki_summary_en : Galeria Kazimierz is a large shopping center located in the Grzegórzki borough of Kraków. The name derives from the neighbouring district of Kazimierz.  Phase 1 opened in 2004. The mall has around 38,150 m2 of floor space, complete with a wide variety of eateries and large shops such as Zara, Puma, Quiksilver, H&M and Alma Market. In all there is more than 130 retail units present within the mall along with a ten screen cinema. In 2007 construction began on a 6-storey office space which is part of the shopping mall. Galeria Kazimierz was built on the site of the former city slaughterhouse and some of its building were renovated and incorporated into the complex.\npostal_code : nan\ntoilets : nan\nnatural : no information\ndescription : nan\nvisiting_time : nan\nleisure : no information\ntourism : no information\npublic_transport : nan\nbrand : nan\nalt_name : nan\namenity : no information\nreservation : nan\nattraction : nan\nhighchair : nan\nparking : nan\nswimming_pool : nan\ncontact_phone : nan\ncommunity_centre : nan\naddr_street : Podgórska\ncontact_twitter : nan\nsocial_facility : nan\ncontact_facebook : nan\nzoo : nan\nemail : nan\nwheelchair : yes\ncuisine : nan\ncontact_website : nan\ninternet_access : nan\nopening_hours_reception : nan\nguest_house : nan\naddr_city : Kraków\ncontact_instagram : nan\nimage : nan\nlocation : nan\noutdoor_seating : nan\nmuseum : nan\ntakeaway : nan\nsmoking : nan\nname : Galeria Kazimierz;галерея каземеж;مول\nid : 9655\n\nphone : nan\ncemetery : nan\nemergency : nan\nopening_hours : nan\nwebsite : nan\npets_allowed : nan\ngeometry : POINT (19.8228282 50.0165366)\nhistoric : no information\nwiki_summary_en : Kowadza (261 m) – a hill in Tyniec in Kraków. Administratively, it belongs to District VIII Dębniki. Geographically, it is part of the Tyniec Hills on the Kraków Bridge within the macroregion of the Kraków Gate. These hills have been included in the area of the Bielańsko-Tyniecki Landscape Park.  \nKowadza rises on the eastern side of Świętojańska Street in Tyniec. Formed from limestone, the hill is mostly covered by a beech-hornbeam forest, but the summit and southern slopes are open fields of former pastures and meadows. It is covered by a thin layer of soil with xerothermic grassland. Thanks to the open areas, the summit of Kowadza is a good viewpoint. In the valley lies Uroczysko Tyniec, to the southwest the horizon is obscured by the hills of Wielkanoc and Bogucianka, to the south Guminek, and just to the east is the hill Duża Kowodrza.  \nAn ecological site named Uroczysko Kowadza, covering an area of 10 ha, has been established on Kowadza. Benches, trash bins, tourist information boards, and a shelter have been prepared for tourists. A marked hiking trail runs over the summit of Kowadza, with educational paths along its slopes.\npostal_code : nan\ntoilets : nan\nnatural : peak\ndescription : nan\nvisiting_time : nan\nleisure : no information\ntourism : no information\npublic_transport : nan\nbrand : nan\nalt_name : nan\namenity : no information\nreservation : nan\nattraction : nan\nhighchair : nan\nparking : nan\nswimming_pool : nan\ncontact_phone : nan\ncommunity_centre : nan\naddr_street : nan\ncontact_twitter : nan\nsocial_facility : nan\ncontact_facebook : nan\nzoo : nan\nemail : nan\nwheelchair : nan\ncuisine : nan\ncontact_website : nan\ninternet_access : nan\nopening_hours_reception : nan\nguest_house : nan\naddr_city : nan\ncontact_instagram : nan\nimage : nan\nlocation : nan\noutdoor_seating : nan\nmuseum : nan\ntakeaway : nan\nsmoking : nan\nname : Kowodrza\nid : 11439\n\nphone : nan\ncemetery : nan\nemergency : nan\nopening_hours : Su-Th 07:00-22:00; Fr,Sa 07:00-23:00\nwebsite : https://www.lwowska1.pl/pl/restauracja-zielonym-do-gory/\npets_allowed : nan\ngeometry : POINT (19.95554 50.0461658)\nhistoric : no information\nwiki_summary_en : no information\npostal_code : nan\ntoilets : nan\nnatural : no information\ndescription : nan\nvisiting_time : nan\nleisure : no information\ntourism : no information\npublic_transport : nan\nbrand : nan\nalt_name : nan\namenity : restaurant\nreservation : nan\nattraction : nan\nhighchair : nan\nparking : nan\nswimming_pool : nan\ncontact_phone : nan\ncommunity_centre : nan\naddr_street : nan\ncontact_twitter : nan\nsocial_facility : nan\ncontact_facebook : nan\nzoo : nan\nemail : nan\nwheelchair : nan\ncuisine : nan\ncontact_website : nan\ninternet_access : nan\nopening_hours_reception : nan\nguest_house : nan\naddr_city : nan\ncontact_instagram : nan\nimage : nan\nlocation : nan\noutdoor_seating : nan\nmuseum : nan\ntakeaway : nan\nsmoking : nan\nname : Zielonym do góry\nid : 894\n\n",
  "answer": "The opening hours for **Zielonym do góry** on weekends are:\n- **Saturday:** 07:00–23:00\n- **Sunday:** 07:00–22:00",
  "labels": {
    "faithfulness": "FAITHFUL",
    "groundedness": "GROUNDED",
    "relevance": "RELEVANT",
    "completeness": "COMPLETE",
    "coherence": "COHERENT",
    "conciseness": "CONCISE"
  },
  "quality_score": 6
}