{
  "model": "mistral_llm",
  "prompt": "prompt_C",
  "id": 2444,
  "question": "Is the AGH Locomotive accessible for visitors with mobility challenges?",
  "context": "phone : nan\ncemetery : nan\nemergency : nan\nopening_hours : nan\nwebsite : nan\npets_allowed : nan\ngeometry : POINT (19.9173564 50.0673537)\nhistoric : locomotive\nwiki_summary_en : The AGH Locomotive (colloquially known as \"Żyleta\") – a freight steam locomotive Ty2-559 from the Ty2 series, placed as a monument of technical heritage in front of the building of the Faculty of Metals Engineering and Industrial Computer Science (pavilion B-5) of the AGH University of Science and Technology in Kraków. It weighs 115 tons and is 23 meters long.\npostal_code : nan\ntoilets : nan\nnatural : no information\ndescription : nan\nvisiting_time : nan\nleisure : no information\ntourism : attraction\npublic_transport : nan\nbrand : nan\nalt_name : nan\namenity : no information\nreservation : nan\nattraction : nan\nhighchair : nan\nparking : nan\nswimming_pool : nan\ncontact_phone : nan\ncommunity_centre : nan\naddr_street : nan\ncontact_twitter : nan\nsocial_facility : nan\ncontact_facebook : nan\nzoo : nan\nemail : nan\nwheelchair : yes\ncuisine : nan\ncontact_website : nan\ninternet_access : nan\nopening_hours_reception : nan\nguest_house : nan\naddr_city : nan\ncontact_instagram : nan\nimage : nan\nlocation : nan\noutdoor_seating : nan\nmuseum : nan\ntakeaway : nan\nsmoking : nan\nname : Lokomotywa AGH Ty2-559\nid : 2444\n\nphone : +48 606 510 084\ncemetery : nan\nemergency : nan\nopening_hours : nan\nwebsite : http://www.geol.agh.edu.pl/~muzeum/index.php\npets_allowed : nan\ngeometry : POINT (19.9231397 50.0641425)\nhistoric : no information\nwiki_summary_en : The Geological Museum of the AGH University of Science and Technology in Krakow – a geological museum operating as part of the Faculty of Geology, Geophysics and Environmental Protection of the AGH University of Science and Technology.\npostal_code : nan\ntoilets : nan\nnatural : no information\ndescription : nan\nvisiting_time : nan\nleisure : no information\ntourism : museum\npublic_transport : nan\nbrand : nan\nalt_name : nan\namenity : no information\nreservation : nan\nattraction : nan\nhighchair : nan\nparking : nan\nswimming_pool : nan\ncontact_phone : nan\ncommunity_centre : nan\naddr_street : Aleja Adama Mickiewicza\ncontact_twitter : nan\nsocial_facility : nan\ncontact_facebook : nan\nzoo : nan\nemail : nan\nwheelchair : nan\ncuisine : nan\ncontact_website : nan\ninternet_access : nan\nopening_hours_reception : nan\nguest_house : nan\naddr_city : Kraków\ncontact_instagram : nan\nimage : nan\nlocation : nan\noutdoor_seating : nan\nmuseum : nan\ntakeaway : nan\nsmoking : nan\nname : Muzeum Geologiczne WGGiOŚ AGH;Földtani Múzeum (Műszaki Egyetem, Geológiai Kar)\nid : 2711\n\nphone : nan\ncemetery : nan\nemergency : nan\nopening_hours : nan\nwebsite : https://historia.agh.edu.pl/wiki/Muzeum_AGH\npets_allowed : nan\ngeometry : POINT (19.9222029 50.0660335)\nhistoric : no information\nwiki_summary_en : The Museum of the History of AGH and Technology – a university museum operating since 1960 as part of the unit \"Center for the History of Technology with the AGH Museum,\" established three years earlier. The museum exhibits are grouped into four sections:\n\nDepartment of the History of Crafts and Industry  \nModeling of Mining and Metallurgical Equipment  \nHall of the History of AGH  \nExhibition about the University's relations with Pope John Paul II  \nThe museum is open daily from 10:00 AM to 2:00 PM - free admission. Visits are by telephone reservation.\npostal_code : nan\ntoilets : nan\nnatural : no information\ndescription : nan\nvisiting_time : nan\nleisure : no information\ntourism : museum\npublic_transport : nan\nbrand : nan\nalt_name : nan\namenity : no information\nreservation : nan\nattraction : nan\nhighchair : nan\nparking : nan\nswimming_pool : nan\ncontact_phone : nan\ncommunity_centre : nan\naddr_street : Aleja Adama Mickiewicza\ncontact_twitter : nan\nsocial_facility : nan\ncontact_facebook : nan\nzoo : nan\nemail : nan\nwheelchair : nan\ncuisine : nan\ncontact_website : nan\ninternet_access : nan\nopening_hours_reception : nan\nguest_house : nan\naddr_city : Kraków\ncontact_instagram : nan\nimage : nan\nlocation : nan\noutdoor_seating : nan\nmuseum : nan\ntakeaway : nan\nsmoking : nan\nname : Muzeum AGH\nid : 2894\n\nphone : +48 12 4100770\ncemetery : nan\nemergency : nan\nopening_hours : Tu-Su 11:00-17:00\nwebsite : https://www.muzeum-ak.pl/\npets_allowed : nan\ngeometry : POLYGON ((19.9491122 50.0724855, 19.9487021 50.0721103, 19.9485364 50.0721859, 19.9485161 50.0721681, 19.9484828 50.0721826, 19.948452 50.0721976, 19.9484705 50.0722157, 19.948302 50.0722917, 19.9487129 50.072667, 19.9491122 50.0724855), (19.9487021 50.0722809, 19.9488988 50.0724612, 19.9487439 50.0725302, 19.9485498 50.0723497, 19.9487021 50.0722809))\nhistoric : yes\nwiki_summary_en : The Home Army Museum (Polish: Muzeum Armii Krajowej) was created in Kraków, Poland in 2000, to commemorate the struggle for independence by the underground Polish Secret State and its military arm, the Hope Army, the largest resistance movement in occupied Europe during World War II. The museum is named after general Emil August Fieldorf \"Nil\". It is the only such institution in Poland promoting knowledge about the Polish Underground State and its armed forces during World War II. The idea behind the Home Army Museum is to provide a holistic picture of the Polish underground, its spiritual origins and the shape of patriotic heritage to the present day.\nThe museum was established in 2000 as a local self-government unit but the formal establishment was preceded by a ten-year effort of collecting the historical items of the Home Army Veterans. So far, the museum has collected more than 8,000 exhibits and more than 12,000 archives – mostly gifts of Army Soldiers and their families around the world – historical memorabilia, often with the tenor of relics. The library resources reach about 11,500 volumes.\n\nThe permanent exhibition presents the history of Polish Underground State and Home Army in their complexity. The main section of the exhibition begins with the so-called September Campaign (Invasion of Poland, 1939). The division of Poland into two occupied zones, German and Soviet, consists of several sections (pe. Society, Terror, concentration camps, Holocaust and attitude of the Underground State towards persecuted Jews, etc.) and are well documented with photographic displays. Day-by-day life, both civilian and military, and the policy of both occupants is shown in the rich narrative scenography of the exhibition, based on documents and artefacts such as uniforms, munitions, many documents and decorations.\nThe main part of the exhibition is situated in the basement. Visitors are confronted with hundreds of photos and memorabilia telling stories of selected Home Army members. One of the most precious exhibits is the diary of a famous major \"Hubal\" – Henryk Dobrzański, the first guerilla commander of the World War II in Europe. Among other artefacts there is a replica of a fuselage section of Halifax (British heavy bomber) and a reconstructed inner structure of a V-2 rocket. The reconstruction of a detention cell in which after 1944 Polish Urząd Bezpieczeństwa (Department of Security) held members of the Home Army and postwar Freedom and Independence organisation gives the opportunity to experience the communist terror. The museum has an extensive weapon collection, including homemade projectiles.\nThe museum is located at Ulica Wita Stwosza 12, in the Grzegórzki District of Kraków.\npostal_code : nan\ntoilets : nan\nnatural : no information\ndescription : nan\nvisiting_time : nan\nleisure : no information\ntourism : museum\npublic_transport : nan\nbrand : nan\nalt_name : nan\namenity : no information\nreservation : nan\nattraction : nan\nhighchair : nan\nparking : nan\nswimming_pool : nan\ncontact_phone : nan\ncommunity_centre : nan\naddr_street : Wita Stwosza\ncontact_twitter : nan\nsocial_facility : nan\ncontact_facebook : nan\nzoo : nan\nemail : nan\nwheelchair : nan\ncuisine : nan\ncontact_website : nan\ninternet_access : nan\nopening_hours_reception : nan\nguest_house : nan\naddr_city : Kraków\ncontact_instagram : nan\nimage : nan\nlocation : nan\noutdoor_seating : nan\nmuseum : history\ntakeaway : nan\nsmoking : nan\nname : Muzeum Armii Krajowej;Muzeum Armii Krajowej im. Gen. Emila Fieldorfa \"Nila\";Lengyel Honi Hadsereg Múzeuma;Muzeum AK\nid : 3361\n\nphone : nan\ncemetery : nan\nemergency : nan\nopening_hours : nan\nwebsite : nan\npets_allowed : nan\ngeometry : POINT (20.1282485 50.0903614)\nhistoric : no information\nwiki_summary_en : Kraków Nowa Huta – a technical station of PKP Polish State Railways located in Nowa Huta, in Kraków, in the Lesser Poland Voivodeship, Poland. Within the station, there are two passenger stops: Kraków Nowa Huta (the passenger part of the station – which includes one two-sided, 201-meter long platform).\npostal_code : nan\ntoilets : nan\nnatural : no information\ndescription : nan\nvisiting_time : nan\nleisure : no information\ntourism : no information\npublic_transport : station\nbrand : nan\nalt_name : nan\namenity : no information\nreservation : nan\nattraction : nan\nhighchair : nan\nparking : nan\nswimming_pool : nan\ncontact_phone : nan\ncommunity_centre : nan\naddr_street : nan\ncontact_twitter : nan\nsocial_facility : nan\ncontact_facebook : nan\nzoo : nan\nemail : nan\nwheelchair : nan\ncuisine : nan\ncontact_website : nan\ninternet_access : nan\nopening_hours_reception : nan\nguest_house : nan\naddr_city : nan\ncontact_instagram : nan\nimage : nan\nlocation : nan\noutdoor_seating : nan\nmuseum : nan\ntakeaway : nan\nsmoking : nan\nname : Kraków Nowa Huta\nid : 6790\n\nphone : nan\ncemetery : nan\nemergency : nan\nopening_hours : nan\nwebsite : nan\npets_allowed : nan\ngeometry : POINT (19.9569831 50.0484407)\nhistoric : no information\nwiki_summary_en : Kraków Zabłocie – a train station in Kraków, in the Podgórze district, in its formerly industrial part, Zabłocie. It was opened in 1979. Only passenger trains stop at the station. The station can be accessed via Kącik Street (from the Old Podgórze side) and Lipowa Street (from the Zabłocie side).\npostal_code : nan\ntoilets : nan\nnatural : no information\ndescription : nan\nvisiting_time : nan\nleisure : no information\ntourism : no information\npublic_transport : station\nbrand : nan\nalt_name : nan\namenity : no information\nreservation : nan\nattraction : nan\nhighchair : nan\nparking : nan\nswimming_pool : nan\ncontact_phone : nan\ncommunity_centre : nan\naddr_street : nan\ncontact_twitter : nan\nsocial_facility : nan\ncontact_facebook : nan\nzoo : nan\nemail : nan\nwheelchair : yes\ncuisine : nan\ncontact_website : nan\ninternet_access : nan\nopening_hours_reception : nan\nguest_house : nan\naddr_city : nan\ncontact_instagram : nan\nimage : http://commons.wikimedia.org/wiki/File:Krak%C3%B3w_Zab%C5%82ocie.jpg\nlocation : nan\noutdoor_seating : nan\nmuseum : nan\ntakeaway : nan\nsmoking : nan\nname : Kraków Zabłocie\nid : 7162\n\nphone : nan\ncemetery : nan\nemergency : nan\nopening_hours : nan\nwebsite : nan\npets_allowed : nan\ngeometry : POINT (19.8923031 50.0828345)\nhistoric : no information\nwiki_summary_en : Kraków Bronowice – a passenger stop of PKP Polish State Railways located in Kraków, in the VI Bronowice district at Armii Krajowej Street.  \nThe stop was opened for use on June 14, 2020, as part of the project \"Modernization of the E30 railway line, on the section Zabrze – Katowice – Kraków, stage IIb,\" co-financed by the European Union through the \"Connecting Europe\" instrument. The stop is one of the elements of the project to build an integrated transfer hub, which also includes the construction of a P+R parking lot and a bus terminal.\npostal_code : nan\ntoilets : nan\nnatural : no information\ndescription : nan\nvisiting_time : nan\nleisure : no information\ntourism : no information\npublic_transport : station\nbrand : nan\nalt_name : nan\namenity : no information\nreservation : nan\nattraction : nan\nhighchair : nan\nparking : nan\nswimming_pool : nan\ncontact_phone : nan\ncommunity_centre : nan\naddr_street : nan\ncontact_twitter : nan\nsocial_facility : nan\ncontact_facebook : nan\nzoo : nan\nemail : nan\nwheelchair : yes\ncuisine : nan\ncontact_website : nan\ninternet_access : nan\nopening_hours_reception : nan\nguest_house : nan\naddr_city : nan\ncontact_instagram : nan\nimage : nan\nlocation : nan\noutdoor_seating : nan\nmuseum : nan\ntakeaway : nan\nsmoking : nan\nname : Kraków Bronowice\nid : 8145\n\nphone : nan\ncemetery : nan\nemergency : nan\nopening_hours : Mo-Th 08:00-19:45; Fr 08:00-18:00; Sa 08:00-15:00; Su,PH off\nwebsite : nan\npets_allowed : nan\ngeometry : POLYGON ((19.9211358 50.0655761, 19.9212776 50.0659194, 19.921871 50.0658184, 19.9217292 50.0654751, 19.9212681 50.0655536, 19.9211358 50.0655761))\nhistoric : no information\nwiki_summary_en : The Main Library of the Stanisław Staszic University of Mining and Metallurgy in Kraków – an academic library that collects scientific and technical literature in the fields represented at this university.\npostal_code : nan\ntoilets : nan\nnatural : no information\ndescription : nan\nvisiting_time : nan\nleisure : no information\ntourism : no information\npublic_transport : nan\nbrand : nan\nalt_name : Biblioteka AGH\namenity : library\nreservation : nan\nattraction : nan\nhighchair : nan\nparking : nan\nswimming_pool : nan\ncontact_phone : nan\ncommunity_centre : nan\naddr_street : Aleja Adama Mickiewicza\ncontact_twitter : nan\nsocial_facility : nan\ncontact_facebook : nan\nzoo : nan\nemail : nan\nwheelchair : yes\ncuisine : nan\ncontact_website : nan\ninternet_access : nan\nopening_hours_reception : nan\nguest_house : nan\naddr_city : Kraków\ncontact_instagram : nan\nimage : nan\nlocation : nan\noutdoor_seating : nan\nmuseum : nan\ntakeaway : nan\nsmoking : nan\nname : Biblioteka Główna AGH;Biblioteka AGH;U-1\nid : 11304\n\n",
  "answer": "Yes, the **AGH Locomotive** is accessible for visitors with mobility challenges, as indicated by **\"wheelchair: yes\"** in the provided context.",
  "labels": {
    "faithfulness": "FAITHFUL",
    "groundedness": "GROUNDED",
    "relevance": "RELEVANT",
    "completeness": "COMPLETE",
    "coherence": "COHERENT",
    "conciseness": "CONCISE"
  },
  "quality_score": 6
}