{
  "model": "openai_llm",
  "prompt": "prompt_C",
  "id": 9101,
  "question": "Is there a contact number for inquiries regarding Myśliwska Szkoła 02?",
  "context": "phone : +48 12 3957065\ncemetery : nan\nemergency : nan\nopening_hours : Tu-Th 09:00-17:00; Fr-Su 09:00-19:00; PH off\nwebsite : https://www.cogiteon.pl/\npets_allowed : nan\ngeometry : MULTIPOLYGON (((19.9898496 50.0852354, 19.9903389 50.0851391, 19.9904527 50.0851167, 19.9904573 50.0851263, 19.990487 50.0851888, 19.9898762 50.0853096, 19.9898587 50.0853131, 19.9899393 50.0853806, 19.9901311 50.0855413, 19.9903675 50.0857393, 19.990383 50.0857363, 19.990389 50.0857351, 19.9911684 50.0855815, 19.9911743 50.0855803, 19.9911902 50.0855772, 19.9912277 50.0851656, 19.9912391 50.0850402, 19.991223 50.0850434, 19.990689 50.0851489, 19.9906594 50.0850866, 19.9906548 50.0850769, 19.9907686 50.0850545, 19.9908231 50.0850437, 19.9911631 50.0849767, 19.9911792 50.0849736, 19.9912005 50.0849694, 19.9912303 50.0849635, 19.9912472 50.0849602, 19.9912491 50.0849235, 19.991256 50.0847964, 19.9912452 50.0847985, 19.9912221 50.0848031, 19.9905694 50.0849319, 19.9904761 50.0849507, 19.990402 50.0849657, 19.989673 50.0851088, 19.9896443 50.0851145, 19.989632 50.0851169, 19.9897839 50.0852483, 19.9897996 50.0852452, 19.9898496 50.0852354)), ((19.9907781 50.0859263, 19.990934 50.0858956, 19.9911429 50.0858543, 19.9911496 50.085853, 19.9911649 50.08585, 19.9911744 50.0857455, 19.9911824 50.0856577, 19.991167 50.0856607, 19.9908515 50.0857231, 19.9906191 50.085769, 19.9904595 50.0858006, 19.9904444 50.0858036, 19.9905288 50.0858746, 19.9906258 50.0859563, 19.9906409 50.0859534, 19.9906469 50.0859522, 19.9907781 50.0859263)), ((19.9911563 50.0859308, 19.9911422 50.0859336, 19.990969 50.0859679, 19.9908122 50.0859989, 19.9907296 50.0860153, 19.9907174 50.0860177, 19.9907028 50.0860206, 19.9910015 50.0862716, 19.9911174 50.086369, 19.9911277 50.0862533, 19.9911465 50.0860414, 19.9911563 50.0859308)))\nhistoric : no information\nwiki_summary_en : Małopolskie Centrum Nauki Cogiteon – a science center, a cultural institution of the Małopolskie Voivodeship. Its aim is to educate through play and to engage in independent or team scientific experiments, research projects, and social initiatives. \n\nFormally, the institution was established in December 2017. By mid-2022, a headquarters is to be built in the Krakow district of Czyżyny, according to a design prepared by the Wrocław office of Heinle, Wischer und Partner Architekci. The project was selected through an architectural competition, with the results announced on February 17, 2018. The estimated value of the project is approximately 120 million PLN. \n\nThe building will include, among other things, a permanent exhibition, the main theme of which will be humanity. Until the construction investment is realized, the Center intends to carry out its mission, among others, through the activities of the Mobile Exhibition \"Naukowiej.\" The exhibition has been operating since February 2019 and is housed in a retractable trailer. It features several exhibits dedicated to the theme of air. The exhibition aims to visit all municipalities in the Małopolskie Voivodeship. \n\nDespite the lack of finality of the decision regarding the entry in the register of cultural landscape monuments and the absence of consideration of appeals against the issued building permit, construction work began at the end of March 2021. In the second week of May of the same year, the final decision on the entry into the register was signed, while all appeals were dismissed. \n\nOn April 5, 2024, the general contractor handed over the building of the Science Center. At the same time, the dates for the opening ceremony were announced for June 21 and 22, 2024.\npostal_code : nan\ntoilets : nan\nnatural : no information\ndescription : nan\nvisiting_time : nan\nleisure : no information\ntourism : museum\npublic_transport : nan\nbrand : nan\nalt_name : MCN Cogiteon\namenity : no information\nreservation : nan\nattraction : nan\nhighchair : nan\nparking : nan\nswimming_pool : nan\ncontact_phone : nan\ncommunity_centre : nan\naddr_street : Izydora Stella-Sawickiego\ncontact_twitter : https://x.com/cogiteon\nsocial_facility : nan\ncontact_facebook : https://www.facebook.com/cogiteon\nzoo : nan\nemail : biuro@cogiteon.pl\nwheelchair : nan\ncuisine : nan\ncontact_website : nan\ninternet_access : nan\nopening_hours_reception : nan\nguest_house : nan\naddr_city : Kraków\ncontact_instagram : https://www.instagram.com/cogiteon.pl\nimage : nan\nlocation : nan\noutdoor_seating : nan\nmuseum : science\ntakeaway : nan\nsmoking : nan\nname : Małopolskie Centrum Nauki Cogiteon;Małopolska Science Center Cogiteon;MCN Cogiteon;Cogiteon\nid : 3420\n\nphone : nan\ncemetery : nan\nemergency : nan\nopening_hours : nan\nwebsite : nan\npets_allowed : nan\ngeometry : POLYGON ((19.9384844 50.0559648, 19.9384812 50.0559763, 19.9384864 50.0559954, 19.9384559 50.0559998, 19.9384545 50.0559954, 19.9384495 50.0559963, 19.9384092 50.0558695, 19.9384081 50.055866, 19.9384112 50.0558656, 19.9384074 50.0558514, 19.9384032 50.0558354, 19.9384309 50.0558322, 19.9384358 50.0558476, 19.9384404 50.0558618, 19.9386281 50.0558382, 19.9386455 50.055836, 19.9388005 50.0558139, 19.9388014 50.0558162, 19.9388214 50.0558787, 19.9388338 50.055918, 19.9388153 50.0559205, 19.9384844 50.0559648))\nhistoric : church\nwiki_summary_en : St. Martin's Church – a historic Lutheran church located in Krakow, in the I Stare Miasto district at Grodzka Street 56, in the Old Town. It is the seat of the Krakow Evangelical-Augsburg parish and the Evangelical-Reformed diaspora. Additionally, services of the Old Catholic Mariavite Church are held there. The faithful of the Evangelical-Reformed Church (Calvinists) do not recognize the placement of sculptures and images in places of worship; however, as it is an ecumenical church, they made a concession regarding the placement of a painting of Jesus calming the storm and two figures in the chancel.\npostal_code : nan\ntoilets : nan\nnatural : no information\ndescription : nan\nvisiting_time : nan\nleisure : no information\ntourism : no information\npublic_transport : nan\nbrand : nan\nalt_name : nan\namenity : place_of_worship\nreservation : nan\nattraction : nan\nhighchair : nan\nparking : nan\nswimming_pool : nan\ncontact_phone : nan\ncommunity_centre : nan\naddr_street : Grodzka\ncontact_twitter : nan\nsocial_facility : nan\ncontact_facebook : nan\nzoo : nan\nemail : nan\nwheelchair : nan\ncuisine : nan\ncontact_website : nan\ninternet_access : nan\nopening_hours_reception : nan\nguest_house : nan\naddr_city : Kraków\ncontact_instagram : nan\nimage : http://commons.wikimedia.org/wiki/File:Church_of_St._Martin_in_Krak%C3%B3w.JPG\nlocation : nan\noutdoor_seating : nan\nmuseum : nan\ntakeaway : nan\nsmoking : nan\nname : Kościół Świętego Marcina;Kirche Heiliger Marcin;Szent Márton templom;Касцёл Святога Марціна\nid : 3518\n\nphone : nan\ncemetery : nan\nemergency : nan\nopening_hours : nan\nwebsite : nan\npets_allowed : nan\ngeometry : POINT (19.8584723 50.0817947)\nhistoric : no information\nwiki_summary_en : Kraków Młynówka – a train station in Kraków on line number 118, serving passenger trains that transport travelers from the Main Station in Kraków to John Paul II International Airport Kraków-Balice.\npostal_code : nan\ntoilets : nan\nnatural : no information\ndescription : nan\nvisiting_time : nan\nleisure : no information\ntourism : no information\npublic_transport : station\nbrand : nan\nalt_name : nan\namenity : no information\nreservation : nan\nattraction : nan\nhighchair : nan\nparking : nan\nswimming_pool : nan\ncontact_phone : nan\ncommunity_centre : nan\naddr_street : nan\ncontact_twitter : nan\nsocial_facility : nan\ncontact_facebook : nan\nzoo : nan\nemail : nan\nwheelchair : nan\ncuisine : nan\ncontact_website : nan\ninternet_access : nan\nopening_hours_reception : nan\nguest_house : nan\naddr_city : nan\ncontact_instagram : nan\nimage : nan\nlocation : nan\noutdoor_seating : nan\nmuseum : nan\ntakeaway : nan\nsmoking : nan\nname : Kraków Młynówka\nid : 7616\n\nphone : nan\ncemetery : nan\nemergency : nan\nopening_hours : 24/7\nwebsite : nan\npets_allowed : nan\ngeometry : POLYGON ((19.9364941 50.0618899, 19.9365179 50.0618818, 19.936504 50.061865, 19.9364802 50.0618731, 19.9364941 50.0618899))\nhistoric : memorial\nwiki_summary_en : no information\npostal_code : nan\ntoilets : nan\nnatural : no information\ndescription : nan\nvisiting_time : nan\nleisure : no information\ntourism : attraction\npublic_transport : nan\nbrand : nan\nalt_name : nan\namenity : no information\nreservation : nan\nattraction : nan\nhighchair : nan\nparking : nan\nswimming_pool : nan\ncontact_phone : nan\ncommunity_centre : nan\naddr_street : nan\ncontact_twitter : nan\nsocial_facility : nan\ncontact_facebook : nan\nzoo : nan\nemail : nan\nwheelchair : yes\ncuisine : nan\ncontact_website : nan\ninternet_access : nan\nopening_hours_reception : nan\nguest_house : nan\naddr_city : nan\ncontact_instagram : nan\nimage : nan\nlocation : nan\noutdoor_seating : nan\nmuseum : nan\ntakeaway : nan\nsmoking : nan\nname : Płyta upamiętniająca Insurekcję Kościuszkowską;Kościuszko-felkelés emléktáblája\nid : 3629\n\nphone : nan\ncemetery : nan\nemergency : nan\nopening_hours : nan\nwebsite : nan\npets_allowed : nan\ngeometry : POINT (20.0103363 50.065379)\nhistoric : no information\nwiki_summary_en : no information\npostal_code : nan\ntoilets : nan\nnatural : no information\ndescription : nan\nvisiting_time : nan\nleisure : no information\ntourism : no information\npublic_transport : stop_position\nbrand : nan\nalt_name : nan\namenity : no information\nreservation : nan\nattraction : nan\nhighchair : nan\nparking : nan\nswimming_pool : nan\ncontact_phone : nan\ncommunity_centre : nan\naddr_street : nan\ncontact_twitter : nan\nsocial_facility : nan\ncontact_facebook : nan\nzoo : nan\nemail : nan\nwheelchair : nan\ncuisine : nan\ncontact_website : nan\ninternet_access : nan\nopening_hours_reception : nan\nguest_house : nan\naddr_city : nan\ncontact_instagram : nan\nimage : nan\nlocation : nan\noutdoor_seating : nan\nmuseum : nan\ntakeaway : nan\nsmoking : nan\nname : Sołtysowska 04\nid : 9135\n\nphone : nan\ncemetery : nan\nemergency : nan\nopening_hours : nan\nwebsite : nan\npets_allowed : nan\ngeometry : POINT (19.9913106 50.0455816)\nhistoric : no information\nwiki_summary_en : no information\npostal_code : nan\ntoilets : nan\nnatural : no information\ndescription : nan\nvisiting_time : nan\nleisure : no information\ntourism : no information\npublic_transport : stop_position\nbrand : nan\nalt_name : nan\namenity : no information\nreservation : nan\nattraction : nan\nhighchair : nan\nparking : nan\nswimming_pool : nan\ncontact_phone : nan\ncommunity_centre : nan\naddr_street : nan\ncontact_twitter : nan\nsocial_facility : nan\ncontact_facebook : nan\nzoo : nan\nemail : nan\nwheelchair : nan\ncuisine : nan\ncontact_website : nan\ninternet_access : nan\nopening_hours_reception : nan\nguest_house : nan\naddr_city : nan\ncontact_instagram : nan\nimage : nan\nlocation : nan\noutdoor_seating : nan\nmuseum : nan\ntakeaway : nan\nsmoking : nan\nname : Myśliwska Szkoła 02\nid : 9101\n\nphone : nan\ncemetery : nan\nemergency : nan\nopening_hours : nan\nwebsite : http://www.ksos.pl\npets_allowed : nan\ngeometry : POLYGON ((19.9600111 50.0597902, 19.9610033 50.0596512, 19.9611409 50.0596261, 19.9611606 50.0596186, 19.9617137 50.05962, 19.9617093 50.0596425, 19.9616448 50.0598781, 19.9614905 50.0602479, 19.9623821 50.0604402, 19.9620928 50.0609521, 19.9620232 50.0609762, 19.962017 50.0610166, 19.962001 50.0611212, 19.9605653 50.061111, 19.9604856 50.0608913, 19.9604424 50.060894, 19.9602422 50.0603339, 19.9602166 50.0603075, 19.9600111 50.0597902))\nhistoric : no information\nwiki_summary_en : no information\npostal_code : nan\ntoilets : nan\nnatural : no information\ndescription : nan\nvisiting_time : nan\nleisure : sports_centre\ntourism : no information\npublic_transport : nan\nbrand : nan\nalt_name : nan\namenity : no information\nreservation : nan\nattraction : nan\nhighchair : nan\nparking : nan\nswimming_pool : nan\ncontact_phone : nan\ncommunity_centre : nan\naddr_street : Aleja Powstania Warszawskiego\ncontact_twitter : nan\nsocial_facility : nan\ncontact_facebook : nan\nzoo : nan\nemail : nan\nwheelchair : nan\ncuisine : nan\ncontact_website : nan\ninternet_access : nan\nopening_hours_reception : nan\nguest_house : nan\naddr_city : Kraków\ncontact_instagram : nan\nimage : nan\nlocation : nan\noutdoor_seating : nan\nmuseum : nan\ntakeaway : nan\nsmoking : nan\nname : Krakowski Szkolny Ośrodek Sportowy imienia Szarych Szeregów\nid : 11504\n\nphone : nan\ncemetery : nan\nemergency : nan\nopening_hours : nan\nwebsite : nan\npets_allowed : nan\ngeometry : POINT (20.0930343 50.0951434)\nhistoric : no information\nwiki_summary_en : no information\npostal_code : nan\ntoilets : nan\nnatural : no information\ndescription : nan\nvisiting_time : nan\nleisure : no information\ntourism : no information\npublic_transport : stop_position\nbrand : nan\nalt_name : nan\namenity : no information\nreservation : nan\nattraction : nan\nhighchair : nan\nparking : nan\nswimming_pool : nan\ncontact_phone : nan\ncommunity_centre : nan\naddr_street : nan\ncontact_twitter : nan\nsocial_facility : nan\ncontact_facebook : nan\nzoo : nan\nemail : nan\nwheelchair : nan\ncuisine : nan\ncontact_website : nan\ninternet_access : nan\nopening_hours_reception : nan\nguest_house : nan\naddr_city : nan\ncontact_instagram : nan\nimage : nan\nlocation : nan\noutdoor_seating : nan\nmuseum : nan\ntakeaway : nan\nsmoking : nan\nname : Lubocza Szkoła 01\nid : 8527\n\n",
  "answer": "The contact number for inquiries regarding Myśliwska Szkoła 02 is +48 12 3957065.",
  "labels": {
    "faithfulness": "FAITHFUL",
    "groundedness": "GROUNDED",
    "relevance": "RELEVANT",
    "completeness": "COMPLETE",
    "coherence": "COHERENT",
    "conciseness": "CONCISE"
  },
  "quality_score": 6
}