{
  "model": "openai_llm",
  "prompt": "prompt_B",
  "id": 3465,
  "question": "Can you tell me more about the historical significance of this church in the Old Town?",
  "context": "phone : nan\ncemetery : nan\nemergency : nan\nopening_hours : Mo-Sa 09:00-17:00; Su 13:30-18:00\nwebsite : http://www.kosciolwojciecha.pl/\npets_allowed : nan\ngeometry : POLYGON ((19.9376467 50.0609416, 19.9377635 50.0609446, 19.937768 50.0609525, 19.9377746 50.0609573, 19.9377835 50.0609603, 19.937795 50.0609631, 19.9378085 50.0609625, 19.9378202 50.0609603, 19.9378321 50.0609536, 19.9378363 50.0609489, 19.9378391 50.0609421, 19.9378389 50.0609212, 19.9378382 50.0608655, 19.9378376 50.0608168, 19.9378351 50.0608149, 19.9378306 50.0608128, 19.9377281 50.0608138, 19.9377226 50.0608158, 19.9377211 50.0608184, 19.9377221 50.0608429, 19.9377229 50.0608675, 19.9377046 50.0608672, 19.9376958 50.060867, 19.9376499 50.0608664, 19.9376481 50.0609093, 19.9376467 50.0609416))\nhistoric : church\nwiki_summary_en : The Church of St. Adalbert or the Church of St. Wojciech (Polish: Kościół św. Wojciecha), located on the intersection of the Main Market Square and Grodzka Street in Old Town, Kraków, is one of the oldest stone churches in Poland. Its almost 1000-year-old history goes back to the beginning of the Polish Romanesque architecture of the early Middle Ages. Throughout the early history of Kraków the Church of St. Wojciech was a place of worship first visited by merchants travelling from across Europe. It was a place where citizens and nobility would meet.\npostal_code : nan\ntoilets : nan\nnatural : no information\ndescription : nan\nvisiting_time : nan\nleisure : no information\ntourism : attraction\npublic_transport : nan\nbrand : nan\nalt_name : nan\namenity : place_of_worship\nreservation : nan\nattraction : nan\nhighchair : nan\nparking : nan\nswimming_pool : nan\ncontact_phone : nan\ncommunity_centre : nan\naddr_street : nan\ncontact_twitter : nan\nsocial_facility : nan\ncontact_facebook : nan\nzoo : nan\nemail : nan\nwheelchair : nan\ncuisine : nan\ncontact_website : nan\ninternet_access : nan\nopening_hours_reception : nan\nguest_house : nan\naddr_city : nan\ncontact_instagram : nan\nimage : http://commons.wikimedia.org/wiki/File:Church_of_St_Adalbert,_2_Main_Market_square,Old_Town,Krakow,Poland.jpg\nlocation : nan\noutdoor_seating : nan\nmuseum : nan\ntakeaway : nan\nsmoking : nan\nname : Kościół pw. Świętego Wojciecha Biskupa i Męczennika;St. Adalbert's church;Iglesia de San Adalberto;Prágai Szent Adalbert templom;Касцёл Святога Войцеха;성 보치에하 성당\nid : 3453\n\nphone : nan\ncemetery : nan\nemergency : nan\nopening_hours : nan\nwebsite : https://www.swietymarek.pl/\npets_allowed : nan\ngeometry : POLYGON ((19.9379294 50.0643896, 19.9377797 50.0644179, 19.9377046 50.0644338, 19.9376977 50.0644503, 19.9376355 50.0644695, 19.9376276 50.0644586, 19.9376135 50.064463, 19.9376222 50.0644748, 19.9375596 50.0644954, 19.9375495 50.0644838, 19.937536 50.0644882, 19.9375461 50.0645008, 19.937471 50.0645248, 19.9374427 50.0645208, 19.9374409 50.0645247, 19.9374613 50.0645278, 19.9374989 50.0645807, 19.9374749 50.0645866, 19.9374812 50.0645933, 19.937504 50.0645879, 19.9375324 50.0646289, 19.937512 50.0646345, 19.937517 50.064642, 19.9375374 50.0646369, 19.9375679 50.0646717, 19.937556 50.0646881, 19.9375651 50.0646912, 19.9375742 50.0646788, 19.9378025 50.0646061, 19.9377957 50.0645966, 19.9379836 50.0645368, 19.9380299 50.0644977, 19.9380248 50.0644858, 19.938024 50.0644775, 19.9380133 50.0644631, 19.9379959 50.0644397, 19.9380095 50.0644338, 19.9379998 50.0644082, 19.9379294 50.0643896))\nhistoric : church\nwiki_summary_en : St. Mark's Church - a historic Gothic Roman Catholic church located in Krakow, in the I Old Town district at 10 St. Mark's Street, at the corner with Sławkowska Street, in the Old Town.\npostal_code : nan\ntoilets : nan\nnatural : no information\ndescription : nan\nvisiting_time : nan\nleisure : no information\ntourism : no information\npublic_transport : nan\nbrand : nan\nalt_name : nan\namenity : place_of_worship\nreservation : nan\nattraction : nan\nhighchair : nan\nparking : nan\nswimming_pool : nan\ncontact_phone : nan\ncommunity_centre : nan\naddr_street : Świętego Marka\ncontact_twitter : nan\nsocial_facility : nan\ncontact_facebook : nan\nzoo : nan\nemail : nan\nwheelchair : nan\ncuisine : nan\ncontact_website : nan\ninternet_access : nan\nopening_hours_reception : nan\nguest_house : nan\naddr_city : Kraków\ncontact_instagram : nan\nimage : http://commons.wikimedia.org/wiki/File:Kosciol_Marka_Krakow.jpg\nlocation : nan\noutdoor_seating : nan\nmuseum : nan\ntakeaway : nan\nsmoking : nan\nname : Kościół pw. Świętego Marka;Church of Saint Mark;Szent Márk templom;Касцёл Святога Марка\nid : 3465\n\nphone : nan\ncemetery : nan\nemergency : nan\nopening_hours : nan\nwebsite : nan\npets_allowed : nan\ngeometry : POLYGON ((19.9396488 50.0582665, 19.9396515 50.058252, 19.9396699 50.0582528, 19.9396704 50.0582557, 19.9396942 50.0582577, 19.9396971 50.0582249, 19.9396747 50.0582268, 19.9396743 50.0582245, 19.9396682 50.0582247, 19.9396557 50.058225, 19.9396796 50.0580657, 19.9396879 50.0580111, 19.9396946 50.0579669, 19.9396914 50.0579668, 19.9396916 50.057962, 19.9396895 50.0579614, 19.9396936 50.057951, 19.9397109 50.0579522, 19.9397104 50.0579542, 19.9398487 50.0579615, 19.9398499 50.0579506, 19.9398738 50.0579511, 19.9398738 50.0579536, 19.9399171 50.0579552, 19.939875 50.0582811, 19.9396488 50.0582665))\nhistoric : church\nwiki_summary_en : St. Joseph's Church - a historic Roman Catholic conventual church of the Bernardines, located in Kraków, in the Old Town district at ul. Poselska 21, in the Old Town.\npostal_code : nan\ntoilets : nan\nnatural : no information\ndescription : nan\nvisiting_time : nan\nleisure : no information\ntourism : no information\npublic_transport : nan\nbrand : nan\nalt_name : nan\namenity : place_of_worship\nreservation : nan\nattraction : nan\nhighchair : nan\nparking : nan\nswimming_pool : nan\ncontact_phone : nan\ncommunity_centre : nan\naddr_street : Poselska\ncontact_twitter : nan\nsocial_facility : nan\ncontact_facebook : nan\nzoo : nan\nemail : nan\nwheelchair : nan\ncuisine : nan\ncontact_website : nan\ninternet_access : nan\nopening_hours_reception : nan\nguest_house : nan\naddr_city : Kraków\ncontact_instagram : nan\nimage : nan\nlocation : nan\noutdoor_seating : nan\nmuseum : nan\ntakeaway : nan\nsmoking : nan\nname : Kościół pw. Świętego Józefa;Szent József templom\nid : 3468\n\nphone : nan\ncemetery : nan\nemergency : nan\nopening_hours : nan\nwebsite : nan\npets_allowed : nan\ngeometry : POLYGON ((19.9275262 50.0605272, 19.9275366 50.0604942, 19.9275125 50.0604903, 19.9275261 50.0604577, 19.9275031 50.0604537, 19.9275172 50.0604225, 19.9275407 50.0604269, 19.9275547 50.0603937, 19.9275734 50.0603969, 19.9275935 50.0603658, 19.9277809 50.0604318, 19.9278005 50.0604541, 19.9278586 50.0604643, 19.9278624 50.0604551, 19.9278662 50.0604558, 19.92787 50.0604453, 19.9280045 50.0604683, 19.9279927 50.0604965, 19.9280105 50.0604997, 19.9279896 50.0605493, 19.9279104 50.0605354, 19.9279085 50.0605397, 19.9279163 50.0605483, 19.9279066 50.060552, 19.9278956 50.0605409, 19.9278417 50.0605314, 19.9278373 50.0605408, 19.9278266 50.0605388, 19.9278307 50.0605298, 19.9277728 50.0605192, 19.9277393 50.0605315, 19.9275262 50.0605272))\nhistoric : church\nwiki_summary_en : The Church of the Most Sacred Heart of Jesus – a historic Roman Catholic parish church and conventual church of the Sisters of the Sacred Heart located in Krakow, in the Old Town district at 24 Garncarska Street, in Nowy Świat.  \nIt was built at the end of the 19th century in an eclectic style with a predominance of Neo-Romanesque elements according to the plans of Władysław Kaczmarski, on land donated to the nuns by Duchess Wanda Jabłonowska, and funded by Zofia Wołodkowicz. It was consecrated in 1900.  \nOn the front facade of the church and monastery, there are sculptures by Jan Tombiński. In the convent house by the church, there is a museum dedicated to Bishop Józef Sebastian Pelczar, the founder of the congregation of the Sisters of the Sacred Heart. In the church, in a side chapel, there is an altar with a portrait and relics of Bishop Pelczar, and another altar where the mortal remains of the founder of the congregation, Klara Ludwika Szczęsna, were laid to rest in 1995, having been transferred from Rakowicki Cemetery. A small altar of John Paul II with relics was placed at the altar of St. Joseph in 2011. The main altar was made in 1899 by Kazimierz Wakulski, while the author of the side altars was Wit Wisz.\npostal_code : nan\ntoilets : nan\nnatural : no information\ndescription : nan\nvisiting_time : nan\nleisure : no information\ntourism : no information\npublic_transport : nan\nbrand : nan\nalt_name : nan\namenity : place_of_worship\nreservation : nan\nattraction : nan\nhighchair : nan\nparking : nan\nswimming_pool : nan\ncontact_phone : nan\ncommunity_centre : nan\naddr_street : Garncarska\ncontact_twitter : nan\nsocial_facility : nan\ncontact_facebook : nan\nzoo : nan\nemail : nan\nwheelchair : nan\ncuisine : nan\ncontact_website : nan\ninternet_access : nan\nopening_hours_reception : nan\nguest_house : nan\naddr_city : Kraków\ncontact_instagram : nan\nimage : http://commons.wikimedia.org/wiki/File:Ko%C5%9Bci%C3%B3%C5%82_Naj%C5%9Bwi%C4%99tszego_Serca_Pana_Jezusa,_Krak%C3%B3w.JPG\nlocation : nan\noutdoor_seating : nan\nmuseum : nan\ntakeaway : nan\nsmoking : nan\nname : Kościół pw. Najświętszego Serca Pana Jezusa;Jézus Szent Szíve templom\nid : 3470\n\nphone : nan\ncemetery : nan\nemergency : nan\nopening_hours : nan\nwebsite : nan\npets_allowed : nan\ngeometry : POLYGON ((19.9384844 50.0559648, 19.9384812 50.0559763, 19.9384864 50.0559954, 19.9384559 50.0559998, 19.9384545 50.0559954, 19.9384495 50.0559963, 19.9384092 50.0558695, 19.9384081 50.055866, 19.9384112 50.0558656, 19.9384074 50.0558514, 19.9384032 50.0558354, 19.9384309 50.0558322, 19.9384358 50.0558476, 19.9384404 50.0558618, 19.9386281 50.0558382, 19.9386455 50.055836, 19.9388005 50.0558139, 19.9388014 50.0558162, 19.9388214 50.0558787, 19.9388338 50.055918, 19.9388153 50.0559205, 19.9384844 50.0559648))\nhistoric : church\nwiki_summary_en : St. Martin's Church – a historic Lutheran church located in Krakow, in the I Stare Miasto district at Grodzka Street 56, in the Old Town. It is the seat of the Krakow Evangelical-Augsburg parish and the Evangelical-Reformed diaspora. Additionally, services of the Old Catholic Mariavite Church are held there. The faithful of the Evangelical-Reformed Church (Calvinists) do not recognize the placement of sculptures and images in places of worship; however, as it is an ecumenical church, they made a concession regarding the placement of a painting of Jesus calming the storm and two figures in the chancel.\npostal_code : nan\ntoilets : nan\nnatural : no information\ndescription : nan\nvisiting_time : nan\nleisure : no information\ntourism : no information\npublic_transport : nan\nbrand : nan\nalt_name : nan\namenity : place_of_worship\nreservation : nan\nattraction : nan\nhighchair : nan\nparking : nan\nswimming_pool : nan\ncontact_phone : nan\ncommunity_centre : nan\naddr_street : Grodzka\ncontact_twitter : nan\nsocial_facility : nan\ncontact_facebook : nan\nzoo : nan\nemail : nan\nwheelchair : nan\ncuisine : nan\ncontact_website : nan\ninternet_access : nan\nopening_hours_reception : nan\nguest_house : nan\naddr_city : Kraków\ncontact_instagram : nan\nimage : http://commons.wikimedia.org/wiki/File:Church_of_St._Martin_in_Krak%C3%B3w.JPG\nlocation : nan\noutdoor_seating : nan\nmuseum : nan\ntakeaway : nan\nsmoking : nan\nname : Kościół Świętego Marcina;Kirche Heiliger Marcin;Szent Márton templom;Касцёл Святога Марціна\nid : 3518\n\nphone : nan\ncemetery : nan\nemergency : nan\nopening_hours : nan\nwebsite : https://www.krzyzkrakow.pl/\npets_allowed : nan\ngeometry : POLYGON ((19.9434942 50.0634785, 19.9433745 50.0634676, 19.9433703 50.0634649, 19.9433673 50.0634667, 19.9433645 50.0634642, 19.9433182 50.0634605, 19.9433216 50.0634505, 19.9432953 50.0634482, 19.94329 50.0634603, 19.9432701 50.0634578, 19.9432727 50.0634467, 19.9432279 50.0634423, 19.943224 50.0634544, 19.9432138 50.0634532, 19.9432021 50.0634628, 19.9431704 50.0634592, 19.9431758 50.0634378, 19.9431472 50.0634354, 19.9431268 50.0634434, 19.9431175 50.0634345, 19.943053 50.0634274, 19.9430593 50.0633989, 19.9430499 50.0633915, 19.9430638 50.0633841, 19.9430659 50.0633737, 19.943076 50.0633746, 19.943082 50.0633452, 19.9430709 50.0633441, 19.9430729 50.0633342, 19.9430622 50.0633249, 19.9430743 50.0633195, 19.9430733 50.0633013, 19.9431035 50.0632997, 19.9431476 50.0632975, 19.9431408 50.0632913, 19.9431564 50.063283, 19.9431708 50.0632955, 19.9432316 50.0633, 19.9432336 50.0632875, 19.9432543 50.0632888, 19.9432515 50.063301, 19.943297 50.0633046, 19.9433037 50.0632667, 19.9433047 50.0632613, 19.9433048 50.0632603, 19.9433964 50.0632638, 19.9433965 50.0632668, 19.9433966 50.063271, 19.9433969 50.0633001, 19.9434081 50.0633097, 19.9433864 50.0633214, 19.9433858 50.063337, 19.9434443 50.0633397, 19.9434453 50.0633283, 19.9434612 50.0633289, 19.9434603 50.0633402, 19.943511 50.0633421, 19.9435121 50.0633311, 19.9435291 50.0633313, 19.9435291 50.0633429, 19.9435894 50.0633453, 19.943606 50.0633329, 19.9436187 50.0633396, 19.9436058 50.0633502, 19.9435967 50.0634315, 19.9436065 50.0634441, 19.943594 50.0634488, 19.9435912 50.0634465, 19.9435884 50.0634706, 19.9435684 50.0634819, 19.9434942 50.0634785))\nhistoric : church\nwiki_summary_en : The Church of the Holy Cross – a historic Roman Catholic parish church located in Krakow, in the I Old Town district at Plac św. Ducha 2, next to the Juliusz Słowacki Theatre, in the Old Town.\npostal_code : nan\ntoilets : nan\nnatural : no information\ndescription : nan\nvisiting_time : nan\nleisure : no information\ntourism : no information\npublic_transport : nan\nbrand : nan\nalt_name : nan\namenity : place_of_worship\nreservation : nan\nattraction : nan\nhighchair : nan\nparking : nan\nswimming_pool : nan\ncontact_phone : nan\ncommunity_centre : nan\naddr_street : Plac Świętego Ducha\ncontact_twitter : nan\nsocial_facility : nan\ncontact_facebook : nan\nzoo : nan\nemail : nan\nwheelchair : yes\ncuisine : nan\ncontact_website : nan\ninternet_access : nan\nopening_hours_reception : nan\nguest_house : nan\naddr_city : Kraków\ncontact_instagram : nan\nimage : nan\nlocation : nan\noutdoor_seating : nan\nmuseum : nan\ntakeaway : nan\nsmoking : nan\nname : Kościół pw. Świętego Krzyża;Sankt-Kreuz-Kirche;Szent Kereszt templom;Касцёл Святога Крыжа\nid : 3534\n\nphone : nan\ncemetery : nan\nemergency : nan\nopening_hours : nan\nwebsite : nan\npets_allowed : nan\ngeometry : POLYGON ((19.9408291 50.0624999, 19.9408266 50.0624975, 19.9407536 50.0625207, 19.9407557 50.0625233, 19.9407406 50.062528, 19.9407384 50.0625253, 19.9406512 50.0625529, 19.9406532 50.0625555, 19.9406382 50.0625602, 19.9406364 50.0625593, 19.9405742 50.0624814, 19.9408684 50.0623876, 19.9408705 50.0623874, 19.940877 50.0623952, 19.9408739 50.0623965, 19.9408802 50.0624053, 19.9408825 50.0624044, 19.9408929 50.0624144, 19.9408897 50.0624158, 19.940891 50.0624178, 19.9408904 50.0624193, 19.9409068 50.0624402, 19.9409109 50.0624396, 19.9409169 50.0624474, 19.9409154 50.0624484, 19.9409171 50.0624511, 19.940915 50.062452, 19.9409212 50.0624609, 19.9409246 50.0624596, 19.9409307 50.0624676, 19.940918 50.0624718, 19.940916 50.0624692, 19.9409115 50.062471, 19.9409134 50.0624735, 19.9408999 50.0624778, 19.9408971 50.0624751, 19.9408419 50.0624926, 19.9408439 50.0624952, 19.9408291 50.0624999))\nhistoric : church\nwiki_summary_en : St. Thomas the Apostle Church – a historic Roman Catholic conventual church of the Spiritans, located in Krakow, in the Old Town district at Szpitalna Street 14, on the corner with St. Thomas Street 23, in the Old Town. The temple is administratively subordinated to the parish of St. Mary's Basilica.\npostal_code : nan\ntoilets : nan\nnatural : no information\ndescription : nan\nvisiting_time : nan\nleisure : no information\ntourism : no information\npublic_transport : nan\nbrand : nan\nalt_name : nan\namenity : place_of_worship\nreservation : nan\nattraction : nan\nhighchair : nan\nparking : nan\nswimming_pool : nan\ncontact_phone : nan\ncommunity_centre : nan\naddr_street : Szpitalna\ncontact_twitter : nan\nsocial_facility : nan\ncontact_facebook : nan\nzoo : nan\nemail : nan\nwheelchair : nan\ncuisine : nan\ncontact_website : nan\ninternet_access : nan\nopening_hours_reception : nan\nguest_house : nan\naddr_city : nan\ncontact_instagram : nan\nimage : nan\nlocation : nan\noutdoor_seating : nan\nmuseum : nan\ntakeaway : nan\nsmoking : nan\nname : Kościół pw. Świętego Tomasza Apostoła;Szent Tamás apostol templom\nid : 3537\n\nphone : +48 126 621 000\ncemetery : nan\nemergency : nan\nopening_hours : nan\nwebsite : https://www.sheratongrandkrakow.com.pl/\npets_allowed : nan\ngeometry : POLYGON ((19.9314139 50.0558272, 19.9314033 50.0558226, 19.9309983 50.0562018, 19.9309815 50.0562175, 19.9310562 50.0562479, 19.9309982 50.0562964, 19.9309289 50.0562668, 19.9308878 50.0563053, 19.9309318 50.0563647, 19.9307186 50.0564302, 19.9303157 50.0558861, 19.9308248 50.0557297, 19.9308308 50.0557379, 19.9308621 50.0557298, 19.9308659 50.0557233, 19.9308762 50.0557201, 19.9308854 50.0557172, 19.930896 50.0557193, 19.9309253 50.0557088, 19.9309192 50.0557008, 19.9311836 50.0556238, 19.9311912 50.0556328, 19.9312045 50.055635, 19.931228 50.0556404, 19.9312509 50.0556474, 19.9312728 50.0556562, 19.9312927 50.0556663, 19.9313113 50.0556776, 19.9313276 50.0556898, 19.9313419 50.0557038, 19.9313589 50.0556987, 19.9313846 50.0557329, 19.9314216 50.0557226, 19.9314714 50.0557896, 19.9314275 50.055803, 19.9314394 50.0558191, 19.9314139 50.0558272))\nhistoric : no information\nwiki_summary_en : Sheraton Grand Kraków is a five-star hotel in Kraków, Poland at 7 Powiśle Street. The hotel is located on the Wisla River bank, near the famous Wawel Castle, close to the Market Square at the Old Town.\nIt was built on the site of the demolished, historically significant Royal Brewery, which was surrounded by scandal. The hotel building was the winner of the 2004 Archi-Szopa poll for the worst new architectural structure in Krakow, and was designed by a Belgian design firm.\npostal_code : nan\ntoilets : nan\nnatural : no information\ndescription : nan\nvisiting_time : nan\nleisure : no information\ntourism : hotel\npublic_transport : nan\nbrand : Sheraton\nalt_name : Sheraton Grand Krakow\namenity : no information\nreservation : nan\nattraction : nan\nhighchair : nan\nparking : nan\nswimming_pool : nan\ncontact_phone : nan\ncommunity_centre : nan\naddr_street : Powiśle\ncontact_twitter : nan\nsocial_facility : nan\ncontact_facebook : nan\nzoo : nan\nemail : nan\nwheelchair : nan\ncuisine : nan\ncontact_website : nan\ninternet_access : nan\nopening_hours_reception : nan\nguest_house : nan\naddr_city : Kraków\ncontact_instagram : nan\nimage : nan\nlocation : nan\noutdoor_seating : nan\nmuseum : nan\ntakeaway : nan\nsmoking : nan\nname : Sheraton;Sheraton Grand Krakow\nid : 6652\n\n",
  "answer": "The Church of St. Adalbert, also known as the Church of St. Wojciech, is a significant historical landmark located at the intersection of the Main Market Square and Grodzka Street in Kraków's Old Town. This church is one of the oldest stone churches in Poland, with a history that dates back nearly 1000 years, making it a remarkable example of early Polish Romanesque architecture from the early Middle Ages.\n\nHistorically, the Church of St. Wojciech served as a vital place of worship for merchants traveling from across Europe, making it a central meeting point for both citizens and nobility in Kraków. Its location and long-standing presence in the city highlight its importance in the social and religious life of the community throughout the centuries.\n\nVisitors can explore the church and appreciate its architectural features, as well as its role in Kraków's rich history. The church is open for visits from Monday to Saturday, 09:00 to 17:00, and on Sundays from 13:30 to 18:00. For more information, you can visit their official website: [Church of St. Adalbert](http://www.kosciolwojciecha.pl/).\n\n![Church of St. Adalbert](http://commons.wikimedia.org/wiki/File:Church_of_St_Adalbert,_2_Main_Market_square,Old_Town,Krakow,Poland.jpg)",
  "labels": {
    "faithfulness": "FAITHFUL",
    "groundedness": "GROUNDED",
    "relevance": "RELEVANT",
    "completeness": "COMPLETE",
    "coherence": "COHERENT",
    "conciseness": "PARTLY_CONCISE"
  },
  "quality_score": 5
}