{
  "model": "openai_llm",
  "prompt": "prompt_A",
  "id": 2759,
  "question": "Where can I find additional resources or details about the Historical Museum on the internet?",
  "context": "phone : nan\ncemetery : nan\nemergency : nan\nopening_hours : Tu-Fr 09:00-15:00; Sa, Su 10:00-18:00\nwebsite : http://www.isez.pan.krakow.pl/muzeum.html\npets_allowed : nan\ngeometry : POINT (19.9415137 50.0554747)\nhistoric : no information\nwiki_summary_en : The Natural History Museum in Krakow (full official name: Muzeum Przyrodnicze Instytutu Systematyki i Ewolucji Zwierząt PAN) – a museum located in Krakow at 9 St. Sebastian Street. Here you can find a preserved, perfectly preserved, prehistoric woolly rhinoceros, the only fully preserved specimen of this animal that went extinct over 12,000 years ago. Since October 2012, it has resumed its activities.\npostal_code : nan\ntoilets : nan\nnatural : no information\ndescription : nan\nvisiting_time : nan\nleisure : no information\ntourism : museum\npublic_transport : nan\nbrand : nan\nalt_name : nan\namenity : no information\nreservation : nan\nattraction : nan\nhighchair : nan\nparking : nan\nswimming_pool : nan\ncontact_phone : nan\ncommunity_centre : nan\naddr_street : Świętego Sebastiana\ncontact_twitter : nan\nsocial_facility : nan\ncontact_facebook : nan\nzoo : nan\nemail : nan\nwheelchair : nan\ncuisine : nan\ncontact_website : nan\ninternet_access : nan\nopening_hours_reception : nan\nguest_house : nan\naddr_city : Kraków\ncontact_instagram : nan\nimage : nan\nlocation : nan\noutdoor_seating : nan\nmuseum : nature\ntakeaway : nan\nsmoking : nan\nname : Muzeum Przyrodnicze PAN;Lengyel Tudományos Akadémia Természettudományi Múzeuma\nid : 2413\n\nphone : nan\ncemetery : nan\nemergency : nan\nopening_hours : Apr-Oct: Mo-Su 10:00-17:30; Nov-Mar: Mo-Tu off; We-Su 10:00-17:00\nwebsite : https://muzeumkrakowa.pl/oddzialy/ulica-pomorska\npets_allowed : nan\ngeometry : POINT (19.9249265 50.0706881)\nhistoric : no information\nwiki_summary_en : The Historical Museum of the City of Kraków (Polish: Muzeum Historyczne Miasta Krakowa) in Kraków, Lesser Poland, was granted the status of an independent institution in 1945. Originally, it was a branch of the Old Records Office of Kraków, in operation from 1899.\nThe museum's main location is the baroque Krzysztofory Palace.\npostal_code : nan\ntoilets : nan\nnatural : no information\ndescription : nan\nvisiting_time : nan\nleisure : no information\ntourism : museum\npublic_transport : nan\nbrand : nan\nalt_name : nan\namenity : no information\nreservation : nan\nattraction : nan\nhighchair : nan\nparking : nan\nswimming_pool : nan\ncontact_phone : nan\ncommunity_centre : nan\naddr_street : nan\ncontact_twitter : nan\nsocial_facility : nan\ncontact_facebook : nan\nzoo : nan\nemail : nan\nwheelchair : nan\ncuisine : nan\ncontact_website : nan\ninternet_access : nan\nopening_hours_reception : nan\nguest_house : nan\naddr_city : nan\ncontact_instagram : nan\nimage : nan\nlocation : nan\noutdoor_seating : nan\nmuseum : history\ntakeaway : nan\nsmoking : nan\nname : Ulica Pomorska;Pomorska Street;Pomorska utca\nid : 2759\n\nphone : nan\ncemetery : nan\nemergency : nan\nopening_hours : nan\nwebsite : https://historia.agh.edu.pl/wiki/Muzeum_AGH\npets_allowed : nan\ngeometry : POINT (19.9222029 50.0660335)\nhistoric : no information\nwiki_summary_en : The Museum of the History of AGH and Technology – a university museum operating since 1960 as part of the unit \"Center for the History of Technology with the AGH Museum,\" established three years earlier. The museum exhibits are grouped into four sections:\n\nDepartment of the History of Crafts and Industry  \nModeling of Mining and Metallurgical Equipment  \nHall of the History of AGH  \nExhibition about the University's relations with Pope John Paul II  \nThe museum is open daily from 10:00 AM to 2:00 PM - free admission. Visits are by telephone reservation.\npostal_code : nan\ntoilets : nan\nnatural : no information\ndescription : nan\nvisiting_time : nan\nleisure : no information\ntourism : museum\npublic_transport : nan\nbrand : nan\nalt_name : nan\namenity : no information\nreservation : nan\nattraction : nan\nhighchair : nan\nparking : nan\nswimming_pool : nan\ncontact_phone : nan\ncommunity_centre : nan\naddr_street : Aleja Adama Mickiewicza\ncontact_twitter : nan\nsocial_facility : nan\ncontact_facebook : nan\nzoo : nan\nemail : nan\nwheelchair : nan\ncuisine : nan\ncontact_website : nan\ninternet_access : nan\nopening_hours_reception : nan\nguest_house : nan\naddr_city : Kraków\ncontact_instagram : nan\nimage : nan\nlocation : nan\noutdoor_seating : nan\nmuseum : nan\ntakeaway : nan\nsmoking : nan\nname : Muzeum AGH\nid : 2894\n\nphone : nan\ncemetery : nan\nemergency : nan\nopening_hours : nan\nwebsite : https://wawel.krakow.pl/wystawa-stala/wawel-zaginiony-1\npets_allowed : nan\ngeometry : POINT (19.9363047 50.0540886)\nhistoric : no information\nwiki_summary_en : Wawel Zaginiony – an archaeological-architectural reserve and permanent exhibition, located in a former German building from the 1940s, built on the site of the former royal kitchens at Wawel. It showcases the architecture and history of the medieval Wawel Hill. In addition to the remains of former structures, numerous artifacts found during excavation work can also be seen here.\npostal_code : nan\ntoilets : nan\nnatural : no information\ndescription : nan\nvisiting_time : nan\nleisure : no information\ntourism : museum\npublic_transport : nan\nbrand : nan\nalt_name : nan\namenity : no information\nreservation : nan\nattraction : nan\nhighchair : nan\nparking : nan\nswimming_pool : nan\ncontact_phone : nan\ncommunity_centre : nan\naddr_street : nan\ncontact_twitter : nan\nsocial_facility : nan\ncontact_facebook : nan\nzoo : nan\nemail : nan\nwheelchair : nan\ncuisine : nan\ncontact_website : nan\ninternet_access : nan\nopening_hours_reception : nan\nguest_house : nan\naddr_city : nan\ncontact_instagram : nan\nimage : nan\nlocation : nan\noutdoor_seating : nan\nmuseum : history\ntakeaway : nan\nsmoking : nan\nname : Wawel Zaginiony\nid : 2967\n\nphone : nan\ncemetery : nan\nemergency : nan\nopening_hours : nan\nwebsite : https://wawel.krakow.pl/wystawa-stala/skarbiec-koronny\npets_allowed : nan\ngeometry : POINT (19.9369335 50.0548154)\nhistoric : no information\nwiki_summary_en : The Crown Treasury – an exhibition at the Wawel Royal Castle, containing a collection of memorabilia left by the reigning dynasties of the kings of Poland.\npostal_code : nan\ntoilets : nan\nnatural : no information\ndescription : nan\nvisiting_time : nan\nleisure : no information\ntourism : museum\npublic_transport : nan\nbrand : nan\nalt_name : nan\namenity : no information\nreservation : nan\nattraction : nan\nhighchair : nan\nparking : nan\nswimming_pool : nan\ncontact_phone : nan\ncommunity_centre : nan\naddr_street : nan\ncontact_twitter : nan\nsocial_facility : nan\ncontact_facebook : nan\nzoo : nan\nemail : nan\nwheelchair : nan\ncuisine : nan\ncontact_website : nan\ninternet_access : nan\nopening_hours_reception : nan\nguest_house : nan\naddr_city : nan\ncontact_instagram : nan\nimage : nan\nlocation : nan\noutdoor_seating : nan\nmuseum : nan\ntakeaway : nan\nsmoking : nan\nname : Skarbiec Koronny\nid : 3014\n\nphone : +48 12 4100770\ncemetery : nan\nemergency : nan\nopening_hours : Tu-Su 11:00-17:00\nwebsite : https://www.muzeum-ak.pl/\npets_allowed : nan\ngeometry : POLYGON ((19.9491122 50.0724855, 19.9487021 50.0721103, 19.9485364 50.0721859, 19.9485161 50.0721681, 19.9484828 50.0721826, 19.948452 50.0721976, 19.9484705 50.0722157, 19.948302 50.0722917, 19.9487129 50.072667, 19.9491122 50.0724855), (19.9487021 50.0722809, 19.9488988 50.0724612, 19.9487439 50.0725302, 19.9485498 50.0723497, 19.9487021 50.0722809))\nhistoric : yes\nwiki_summary_en : The Home Army Museum (Polish: Muzeum Armii Krajowej) was created in Kraków, Poland in 2000, to commemorate the struggle for independence by the underground Polish Secret State and its military arm, the Hope Army, the largest resistance movement in occupied Europe during World War II. The museum is named after general Emil August Fieldorf \"Nil\". It is the only such institution in Poland promoting knowledge about the Polish Underground State and its armed forces during World War II. The idea behind the Home Army Museum is to provide a holistic picture of the Polish underground, its spiritual origins and the shape of patriotic heritage to the present day.\nThe museum was established in 2000 as a local self-government unit but the formal establishment was preceded by a ten-year effort of collecting the historical items of the Home Army Veterans. So far, the museum has collected more than 8,000 exhibits and more than 12,000 archives – mostly gifts of Army Soldiers and their families around the world – historical memorabilia, often with the tenor of relics. The library resources reach about 11,500 volumes.\n\nThe permanent exhibition presents the history of Polish Underground State and Home Army in their complexity. The main section of the exhibition begins with the so-called September Campaign (Invasion of Poland, 1939). The division of Poland into two occupied zones, German and Soviet, consists of several sections (pe. Society, Terror, concentration camps, Holocaust and attitude of the Underground State towards persecuted Jews, etc.) and are well documented with photographic displays. Day-by-day life, both civilian and military, and the policy of both occupants is shown in the rich narrative scenography of the exhibition, based on documents and artefacts such as uniforms, munitions, many documents and decorations.\nThe main part of the exhibition is situated in the basement. Visitors are confronted with hundreds of photos and memorabilia telling stories of selected Home Army members. One of the most precious exhibits is the diary of a famous major \"Hubal\" – Henryk Dobrzański, the first guerilla commander of the World War II in Europe. Among other artefacts there is a replica of a fuselage section of Halifax (British heavy bomber) and a reconstructed inner structure of a V-2 rocket. The reconstruction of a detention cell in which after 1944 Polish Urząd Bezpieczeństwa (Department of Security) held members of the Home Army and postwar Freedom and Independence organisation gives the opportunity to experience the communist terror. The museum has an extensive weapon collection, including homemade projectiles.\nThe museum is located at Ulica Wita Stwosza 12, in the Grzegórzki District of Kraków.\npostal_code : nan\ntoilets : nan\nnatural : no information\ndescription : nan\nvisiting_time : nan\nleisure : no information\ntourism : museum\npublic_transport : nan\nbrand : nan\nalt_name : nan\namenity : no information\nreservation : nan\nattraction : nan\nhighchair : nan\nparking : nan\nswimming_pool : nan\ncontact_phone : nan\ncommunity_centre : nan\naddr_street : Wita Stwosza\ncontact_twitter : nan\nsocial_facility : nan\ncontact_facebook : nan\nzoo : nan\nemail : nan\nwheelchair : nan\ncuisine : nan\ncontact_website : nan\ninternet_access : nan\nopening_hours_reception : nan\nguest_house : nan\naddr_city : Kraków\ncontact_instagram : nan\nimage : nan\nlocation : nan\noutdoor_seating : nan\nmuseum : history\ntakeaway : nan\nsmoking : nan\nname : Muzeum Armii Krajowej;Muzeum Armii Krajowej im. Gen. Emila Fieldorfa \"Nila\";Lengyel Honi Hadsereg Múzeuma;Muzeum AK\nid : 3361\n\nphone : nan\ncemetery : nan\nemergency : nan\nopening_hours : Mo-Su 10:00-16:00\nwebsite : https://ma.krakow.pl/\npets_allowed : nan\ngeometry : POLYGON ((19.936714 50.0575332, 19.9366394 50.0575249, 19.9365636 50.0575196, 19.936554 50.0575694, 19.9365492 50.0575906, 19.9363244 50.0575761, 19.9363016 50.0576838, 19.9360661 50.0576654, 19.9360642 50.0576766, 19.9360607 50.0576763, 19.9360601 50.0576801, 19.9360636 50.0576803, 19.9360623 50.0576883, 19.936021 50.0576856, 19.9360223 50.0576778, 19.9360245 50.0576779, 19.9360252 50.0576742, 19.9360227 50.057674, 19.936035 50.0575998, 19.9360521 50.0574898, 19.9363837 50.0575159, 19.9363832 50.0575188, 19.9364042 50.0575204, 19.9364059 50.0575091, 19.9364045 50.0575089, 19.9364105 50.0574804, 19.9364123 50.0574804, 19.9364148 50.0574685, 19.936413 50.0574683, 19.9364385 50.0573377, 19.9364514 50.0572828, 19.9364726 50.0572789, 19.9364941 50.057275, 19.9366959 50.0573, 19.9367042 50.0573009, 19.9367199 50.0572428, 19.936722 50.0572342, 19.9365168 50.0572136, 19.9365198 50.0572003, 19.936515 50.0572, 19.9365003 50.0571992, 19.9364713 50.0571976, 19.9364404 50.0571959, 19.9364408 50.0571942, 19.9363239 50.0571808, 19.9363247 50.0571777, 19.9362906 50.0571738, 19.9362864 50.0571733, 19.936282 50.0571919, 19.9362885 50.0571924, 19.9362441 50.057403, 19.9359047 50.0573719, 19.935904 50.0573693, 19.9358552 50.0573652, 19.9358503 50.0573955, 19.935855 50.0573966, 19.9358087 50.0576744, 19.9358079 50.0576792, 19.9357999 50.0577271, 19.9357953 50.0577274, 19.9357875 50.0577584, 19.9358363 50.0577626, 19.9358369 50.0577593, 19.9359146 50.0577662, 19.9359007 50.0578487, 19.9358993 50.0578568, 19.9358965 50.0578562, 19.9358919 50.0578847, 19.9359181 50.0578867, 19.9359185 50.0578837, 19.9360065 50.0578896, 19.9360062 50.0578925, 19.9360326 50.0578943, 19.936033 50.0578914, 19.9366307 50.0579334, 19.9366298 50.0579369, 19.936645 50.0579382, 19.9366464 50.0579287, 19.9366434 50.0579284, 19.9366481 50.0578997, 19.9366509 50.0578999, 19.9366757 50.0577661, 19.9366729 50.0577658, 19.9366783 50.0577375, 19.9366806 50.0577377, 19.9366822 50.0577292, 19.9366797 50.057729, 19.9366999 50.05761, 19.9367022 50.05761, 19.9367073 50.0575836, 19.9367112 50.057564, 19.936714 50.0575332), (19.9364197 50.057714, 19.9364248 50.0576825, 19.9365346 50.05769, 19.9365293 50.0577217, 19.9364197 50.057714), (19.9360689 50.0577682, 19.9362086 50.0577781, 19.9361952 50.057856, 19.9360558 50.0578463, 19.9360689 50.0577682))\nhistoric : no information\nwiki_summary_en : The Archaeological Museum of Kraków (Polish: Muzeum Archeologiczne w Krakowie) is a historic museum in Kraków, Lesser Poland Voivodeship, Poland. It was established in 1850.\npostal_code : nan\ntoilets : nan\nnatural : no information\ndescription : nan\nvisiting_time : 1h\nleisure : no information\ntourism : museum\npublic_transport : nan\nbrand : nan\nalt_name : nan\namenity : no information\nreservation : nan\nattraction : nan\nhighchair : nan\nparking : nan\nswimming_pool : nan\ncontact_phone : nan\ncommunity_centre : nan\naddr_street : nan\ncontact_twitter : nan\nsocial_facility : nan\ncontact_facebook : nan\nzoo : nan\nemail : nan\nwheelchair : no\ncuisine : nan\ncontact_website : nan\ninternet_access : nan\nopening_hours_reception : nan\nguest_house : nan\naddr_city : nan\ncontact_instagram : nan\nimage : nan\nlocation : nan\noutdoor_seating : nan\nmuseum : archaeological\ntakeaway : nan\nsmoking : nan\nname : Muzeum Archeologiczne;Archeological Museum;Museo Arqueológico;Archäologisches Museum;Régészeti Múzeum\nid : 3362\n\nphone : nan\ncemetery : nan\nemergency : nan\nopening_hours : nan\nwebsite : nan\npets_allowed : nan\ngeometry : POLYGON ((19.9841827 50.0635276, 19.9842071 50.0636355, 19.9842549 50.0637194, 19.984371 50.0638856, 19.9844986 50.0640032, 19.9846225 50.0642185, 19.984718 50.0643028, 19.9849215 50.0644114, 19.9850376 50.0645065, 19.9851029 50.0646058, 19.9851371 50.0646479, 19.9851974 50.0646964, 19.9855984 50.0649782, 19.9857205 50.0651503, 19.9858426 50.0652188, 19.9859602 50.0652557, 19.9860832 50.0653072, 19.9862396 50.0654518, 19.9863485 50.0654862, 19.9864803 50.0655015, 19.9865631 50.0655045, 19.9867032 50.0654766, 19.9869381 50.0654232, 19.986977 50.0653842, 19.9870453 50.0652367, 19.9870843 50.0651173, 19.9871092 50.065041, 19.9872014 50.0649246, 19.9873264 50.0648733, 19.9874168 50.0648093, 19.9875492 50.0647052, 19.9876875 50.0644158, 19.9877065 50.0643779, 19.9877085 50.0643444, 19.9877068 50.0643129, 19.9876288 50.0643011, 19.9875172 50.0643021, 19.9872535 50.0642487, 19.9863298 50.0640652, 19.9855214 50.0639192, 19.9848232 50.063759, 19.9845349 50.0636928, 19.9841827 50.0635276))\nhistoric : no information\nwiki_summary_en : Staw Dąbski – an ecological site located in Kraków in the Grzegórzki district at al. Pokoju 44, in Dąbie. It was established by resolution no. XC/1202/10 on January 13, 2010, by the City Council of Kraków. According to the resolution, the purpose of protecting the site is to preserve the ecosystem that serves as a habitat and refuge for protected and endangered species of plants and animals. The site includes a small anthropogenic water reservoir. It is a clay pit that was created as a result of the extraction of resources by a brick factory operating in Dąbie in the first half of the 20th century. After the clay extraction ceased, the excavation was filled with shallow surface waters. The Białucha River flows nearby, with its mouth to the Vistula River located 400 meters away. Nine species of fish live in the pond, including the protected golden loach. Other species present include the great pond turtle (also protected), the sharp-shelled mussel, the mud crayfish, and aquatic snails. The plant world is represented by the yellow water lily (protected species), found in Kraków in only two locations, floating water knotweed, round-leafed water-milfoil, and stiff hornwort. Along the shores, you can find: common duckweed and triangular duckweed, and narrow-leaved bulrush. In the vicinity of the reservoir, we can encounter toxic buttercup, water atlantis, single hedgehog, American clematis, blueberry vine, as well as bushes and trees. The site covers an area of 2.53 hectares.\npostal_code : nan\ntoilets : nan\nnatural : water\ndescription : Użytek ekologiczny\nvisiting_time : nan\nleisure : nature_reserve\ntourism : no information\npublic_transport : nan\nbrand : nan\nalt_name : nan\namenity : no information\nreservation : nan\nattraction : nan\nhighchair : nan\nparking : nan\nswimming_pool : nan\ncontact_phone : nan\ncommunity_centre : nan\naddr_street : nan\ncontact_twitter : nan\nsocial_facility : nan\ncontact_facebook : nan\nzoo : nan\nemail : nan\nwheelchair : nan\ncuisine : nan\ncontact_website : nan\ninternet_access : nan\nopening_hours_reception : nan\nguest_house : nan\naddr_city : nan\ncontact_instagram : nan\nimage : nan\nlocation : nan\noutdoor_seating : nan\nmuseum : nan\ntakeaway : nan\nsmoking : nan\nname : Staw Dąbski\nid : 3836\n\nphone : nan\ncemetery : nan\nemergency : nan\nopening_hours : nan\nwebsite : nan\npets_allowed : nan\ngeometry : POLYGON ((19.9365296 50.0553099, 19.9365231 50.0553156, 19.9365125 50.055318, 19.9365023 50.0553162, 19.9365 50.0553145, 19.9364856 50.0553218, 19.9364158 50.0553061, 19.9364178 50.0553033, 19.9364848 50.0553187, 19.9364977 50.0553127, 19.9364953 50.0553038, 19.9364834 50.055301, 19.9364819 50.0553032, 19.9363156 50.0552649, 19.9363169 50.0552628, 19.9360956 50.0552119, 19.9358714 50.0551608, 19.9352984 50.0550296, 19.935294 50.0550372, 19.9352891 50.0550456, 19.935294 50.0550468, 19.9352905 50.0550529, 19.9352838 50.055051, 19.9352821 50.055052, 19.9352807 50.0550518, 19.935227 50.0550393, 19.9352246 50.0550419, 19.9352196 50.0550408, 19.9352202 50.0550401, 19.9351855 50.0550329, 19.9351852 50.0550334, 19.9351751 50.0550324, 19.9351622 50.055048, 19.9351492 50.0550636, 19.9351571 50.0550656, 19.9351934 50.0550756, 19.9351941 50.0550748, 19.9351987 50.0550758, 19.935197 50.0550785, 19.9352578 50.0550925, 19.9352593 50.0550935, 19.9352592 50.055095, 19.9352642 50.0550964, 19.9352638 50.0550987, 19.9352623 50.0551007, 19.9352613 50.055102, 19.9352515 50.0550998, 19.9352528 50.0550976, 19.9351982 50.0550851, 19.9351934 50.055084, 19.9351947 50.0550819, 19.9351534 50.0550705, 19.9351432 50.0550837, 19.9351395 50.0550825, 19.9351288 50.0550979, 19.9351025 50.0551365, 19.9350761 50.0551704, 19.9350646 50.0551804, 19.9350538 50.055188, 19.9350406 50.0551952, 19.9350161 50.0552043, 19.9349919 50.0552096, 19.9349676 50.0552118, 19.9349407 50.0552107, 19.9349232 50.0552083, 19.9348989 50.0552017, 19.9348805 50.0551941, 19.9348629 50.0551838, 19.9348446 50.055168, 19.9348315 50.0551476, 19.9348266 50.0551273, 19.9348276 50.0551135, 19.9348324 50.0550979, 19.9348589 50.0550511, 19.9346001 50.0548222, 19.9342832 50.0547151, 19.9339743 50.054437, 19.9337403 50.0543168, 19.9334743 50.0543403, 19.9334954 50.053956, 19.9332865 50.0538656, 19.933443 50.0537279, 19.9333654 50.05362, 19.9333523 50.0536219, 19.9333505 50.0536257, 19.9333346 50.0536301, 19.9333171 50.0536266, 19.9333091 50.0536158, 19.9333158 50.0536047, 19.9333323 50.0536, 19.9333371 50.053601, 19.9333481 50.053598, 19.9332619 50.0534765, 19.9335383 50.0534122, 19.9335625 50.0531546, 19.9336215 50.0531631, 19.9338295 50.053193, 19.9339574 50.0529715, 19.9339896 50.052903, 19.9342701 50.0528572, 19.9343549 50.0528439, 19.934688 50.0527068, 19.9346855 50.0525625, 19.935195 50.0526262, 19.9352779 50.0526016, 19.9355615 50.0529385, 19.9356339 50.0529533, 19.9356284 50.052964, 19.9355563 50.0529495, 19.9354913 50.0528812, 19.9354824 50.0528852, 19.9354774 50.0528964, 19.9354474 50.0529073, 19.9354311 50.0529005, 19.9354053 50.0529108, 19.935379 50.0529213, 19.935379 50.052933, 19.9353372 50.0529485, 19.9353303 50.0529408, 19.9353164 50.0529462, 19.935351 50.0529731, 19.9354428 50.0530516, 19.9358283 50.0533807, 19.9358035 50.0534288, 19.9359376 50.053558, 19.9361384 50.0536489, 19.9362242 50.0536346, 19.9366649 50.0538526, 19.9366788 50.053879, 19.936687 50.053894, 19.9367498 50.0539106, 19.9367646 50.0538903, 19.9367935 50.0538991, 19.9367795 50.0539198, 19.9368559 50.0539484, 19.9368638 50.0539442, 19.9368714 50.0539401, 19.9368768 50.0539373, 19.936891 50.0539299, 19.9369063 50.0539215, 19.9369112 50.0539189, 19.936922 50.0539131, 19.9369482 50.0538991, 19.9370599 50.0539449, 19.9370529 50.0539663, 19.9375071 50.0541295, 19.9375225 50.0543461, 19.9377731 50.0543654, 19.9379422 50.054389, 19.9379071 50.0544592, 19.9378722 50.0544523, 19.9378442 50.0545283, 19.9378779 50.0547181, 19.9376746 50.0548318, 19.9375665 50.0549666, 19.9374821 50.0550717, 19.9375151 50.0550953, 19.9375258 50.055104, 19.9375346 50.0551142, 19.9375419 50.0551272, 19.9375467 50.0551395, 19.9375478 50.0551546, 19.9375467 50.0551626, 19.9375423 50.0551764, 19.9375366 50.0551876, 19.9375233 50.0552015, 19.9375086 50.0552131, 19.937494 50.0552213, 19.9374638 50.0552325, 19.9374455 50.0552365, 19.9374184 50.0552385, 19.9374023 50.0552385, 19.9373848 50.055237, 19.9373618 50.0552328, 19.9373461 50.0552279, 19.937329 50.0552205, 19.9372654 50.05518, 19.9372216 50.0551974, 19.9371818 50.0551513, 19.9372228 50.0551345, 19.9372151 50.0551257, 19.937218 50.0551249, 19.9372035 50.0551081, 19.93716 50.0551236, 19.9370269 50.0551713, 19.9368944 50.0552042, 19.9367681 50.0552375, 19.936639 50.0552727, 19.936529 50.0553026, 19.9365296 50.0553099))\nhistoric : castle\nwiki_summary_en : The Wawel Royal Castle (Polish pronunciation: [ˈvavɛl] ; Zamek Królewski na Wawelu) and the Wawel Hill on which it sits constitute the most historically and culturally significant site in Poland. A fortified residency on the Vistula River in Kraków, it was established on the orders of King Casimir III the Great and enlarged over the centuries into a number of structures around a Polish Renaissance courtyard. It represents nearly all European architectural styles of the Medieval, Renaissance and Baroque periods. \nThe castle is part of a fortified architectural complex erected atop a limestone outcrop on the left bank of the Vistula River, at an altitude of 228 metres (748 ft) above sea level. The complex consists of numerous buildings of great historical and national importance, including the Wawel Cathedral where Polish monarchs were crowned and buried. Some of Wawel's oldest stone buildings can be traced back to 970 CE, in addition to the earliest examples of Romanesque and Gothic architecture in Poland. The current castle was built in the 14th century, and expanded over the next hundreds of years. In 1978, Wawel was declared the first World Heritage Site as part of the Historic Centre of Kraków.\nFor centuries the residence of the kings of Poland and the symbol of Polish statehood, Wawel Castle is now one of the country's premier art museums. Established in 1930, the museum encompasses ten curatorial departments responsible for collections of paintings, including an important collection of Italian Renaissance paintings, prints, sculpture, textiles, among them the Sigismund II Augustus tapestry collection, goldsmith's work, arms and armor, ceramics, Meissen porcelain, and period furniture. The museum's holdings in oriental art include the largest collection of Ottoman tents in Europe. With seven specialized conservation studios, the museum is also an important center for the conservation of works of art. With over 3.1 million visitors in 2024, Wawel Castle is the most visited art museum in Poland and the 17th most visited art museum in the world.\npostal_code : nan\ntoilets : nan\nnatural : no information\ndescription : nan\nvisiting_time : nan\nleisure : no information\ntourism : no information\npublic_transport : nan\nbrand : nan\nalt_name : nan\namenity : no information\nreservation : nan\nattraction : nan\nhighchair : nan\nparking : nan\nswimming_pool : nan\ncontact_phone : nan\ncommunity_centre : nan\naddr_street : nan\ncontact_twitter : nan\nsocial_facility : nan\ncontact_facebook : nan\nzoo : nan\nemail : nan\nwheelchair : nan\ncuisine : nan\ncontact_website : nan\ninternet_access : nan\nopening_hours_reception : nan\nguest_house : nan\naddr_city : nan\ncontact_instagram : nan\nimage : nan\nlocation : nan\noutdoor_seating : nan\nmuseum : nan\ntakeaway : nan\nsmoking : nan\nname : Zamek Wawel;Wawel;Wawelburg;Kasteel van Wawel\nid : 4019\n\nphone : nan\ncemetery : nan\nemergency : nan\nopening_hours : nan\nwebsite : nan\npets_allowed : nan\ngeometry : POINT (19.9361073 50.0547467)\nhistoric : no information\nwiki_summary_en : The Wawel Royal Castle (Polish pronunciation: [ˈvavɛl] ; Zamek Królewski na Wawelu) and the Wawel Hill on which it sits constitute the most historically and culturally significant site in Poland. A fortified residency on the Vistula River in Kraków, it was established on the orders of King Casimir III the Great and enlarged over the centuries into a number of structures around a Polish Renaissance courtyard. It represents nearly all European architectural styles of the Medieval, Renaissance and Baroque periods. \nThe castle is part of a fortified architectural complex erected atop a limestone outcrop on the left bank of the Vistula River, at an altitude of 228 metres (748 ft) above sea level. The complex consists of numerous buildings of great historical and national importance, including the Wawel Cathedral where Polish monarchs were crowned and buried. Some of Wawel's oldest stone buildings can be traced back to 970 CE, in addition to the earliest examples of Romanesque and Gothic architecture in Poland. The current castle was built in the 14th century, and expanded over the next hundreds of years. In 1978, Wawel was declared the first World Heritage Site as part of the Historic Centre of Kraków.\nFor centuries the residence of the kings of Poland and the symbol of Polish statehood, Wawel Castle is now one of the country's premier art museums. Established in 1930, the museum encompasses ten curatorial departments responsible for collections of paintings, including an important collection of Italian Renaissance paintings, prints, sculpture, textiles, among them the Sigismund II Augustus tapestry collection, goldsmith's work, arms and armor, ceramics, Meissen porcelain, and period furniture. The museum's holdings in oriental art include the largest collection of Ottoman tents in Europe. With seven specialized conservation studios, the museum is also an important center for the conservation of works of art. With over 3.1 million visitors in 2024, Wawel Castle is the most visited art museum in Poland and the 17th most visited art museum in the world.\npostal_code : nan\ntoilets : nan\nnatural : peak\ndescription : nan\nvisiting_time : nan\nleisure : no information\ntourism : no information\npublic_transport : nan\nbrand : nan\nalt_name : nan\namenity : no information\nreservation : nan\nattraction : nan\nhighchair : nan\nparking : nan\nswimming_pool : nan\ncontact_phone : nan\ncommunity_centre : nan\naddr_street : nan\ncontact_twitter : nan\nsocial_facility : nan\ncontact_facebook : nan\nzoo : nan\nemail : nan\nwheelchair : nan\ncuisine : nan\ncontact_website : nan\ninternet_access : nan\nopening_hours_reception : nan\nguest_house : nan\naddr_city : nan\ncontact_instagram : nan\nimage : nan\nlocation : nan\noutdoor_seating : nan\nmuseum : nan\ntakeaway : nan\nsmoking : nan\nname : Wawel;Vavel\nid : 11464\n\n",
  "answer": "You can find additional resources and details about the Historical Museum of the City of Kraków by visiting their official website: [Historical Museum of the City of Kraków](https://muzeumkrakowa.pl/oddzialy/ulica-pomorska). This site provides information on exhibitions, visiting hours, and other relevant details about the museum. \n\nIf you're looking for more general information, you can also check out their Wikipedia page, which offers a summary of the museum's history and significance.",
  "labels": {
    "faithfulness": "FAITHFUL",
    "groundedness": "GROUNDED",
    "relevance": "RELEVANT",
    "completeness": "COMPLETE",
    "coherence": "COHERENT",
    "conciseness": "CONCISE"
  },
  "quality_score": 6
}