{
  "model": "openai_llm",
  "prompt": "prompt_A",
  "id": 9552,
  "question": "What areas can I explore within Solvay Park, including any distinct sections?",
  "context": "phone : nan\ncemetery : nan\nemergency : nan\nopening_hours : nan\nwebsite : nan\npets_allowed : nan\ngeometry : POLYGON ((20.0127215 50.0159219, 20.0138004 50.0160865, 20.0140518 50.015517, 20.0148328 50.0155354, 20.0148826 50.0153404, 20.0142021 50.0152225, 20.0144005 50.0147544, 20.0143917 50.014743, 20.0145137 50.0144829, 20.0148073 50.0145349, 20.0149524 50.0141009, 20.0147418 50.0140501, 20.0149763 50.0135053, 20.0151148 50.0134772, 20.0151372 50.0130825, 20.0152754 50.0128699, 20.0154483 50.0125104, 20.0155586 50.0124376, 20.015623 50.0123629, 20.0156545 50.0123496, 20.0157016 50.0123407, 20.0156433 50.01233, 20.0158962 50.011777, 20.0159611 50.0117868, 20.0159509 50.0117433, 20.0161924 50.0117167, 20.0162591 50.0116211, 20.016561 50.0109164, 20.016917 50.0101132, 20.0161933 50.0100106, 20.016153 50.0101057, 20.01526 50.0100067, 20.0149128 50.0100489, 20.0139079 50.0098219, 20.0137758 50.0098731, 20.0134403 50.0100031, 20.0130907 50.0096348, 20.012924 50.0094592, 20.0124733 50.0089844, 20.0129222 50.0087926, 20.0127053 50.0085778, 20.0126997 50.0085732, 20.0122939 50.0087619, 20.0107692 50.0094605, 20.0108553 50.0095433, 20.0109425 50.0096191, 20.0112534 50.0099248, 20.011292 50.0099617, 20.0114018 50.0100667, 20.0115341 50.0101933, 20.0118207 50.0104705, 20.0119428 50.0104184, 20.0122132 50.010662, 20.0124929 50.0109232, 20.0125798 50.010888, 20.0128949 50.0111538, 20.0128143 50.0112457, 20.0132076 50.0115947, 20.0127953 50.0117868, 20.0131609 50.0125257, 20.0129671 50.0125698, 20.0129902 50.0127069, 20.0128151 50.0127442, 20.0128078 50.0128956, 20.012604 50.0128912, 20.0124953 50.0137048, 20.0124138 50.0143313, 20.0123782 50.0146228, 20.012337 50.0149456, 20.0123296 50.015078, 20.0123385 50.0151805, 20.0124077 50.0153435, 20.0124736 50.0154764, 20.0125138 50.0154357, 20.012682 50.0157474, 20.0127215 50.0159219))\nhistoric : no information\nwiki_summary_en : Park Aleksandry – a park in Krakow, in the Bieżanów-Prokocim district, located in the valley of the Bieżanowski stream. It serves as a recreational area for residents of large housing estates with a high intensity of development – Nowy Prokocim and Nowy Bieżanów. Once developed, it will be part of the planned Drwinki and Serafa River Park with Malinówka.\n\nIt consists of two parts:\n\nPark Aleksandry – South limited by the streets: Wielicka, Jerzmanowskiego, Aleksandry, and Ćwiklińska,\nPark Aleksandry – North limited by the streets: Ćwiklińska, Jerzmanowskiego, Bieżanowska, Młodzieży, and Telimeny.\n\nThe City Greenery Management in Krakow and the Cracow University of Technology announced an architectural and urban planning competition on August 2, 2017, for the development of the concept for the northern part of the Aleksandry River Park in Krakow.\npostal_code : nan\ntoilets : nan\nnatural : no information\ndescription : nan\nvisiting_time : nan\nleisure : park\ntourism : no information\npublic_transport : nan\nbrand : nan\nalt_name : nan\namenity : no information\nreservation : nan\nattraction : nan\nhighchair : nan\nparking : nan\nswimming_pool : nan\ncontact_phone : nan\ncommunity_centre : nan\naddr_street : nan\ncontact_twitter : nan\nsocial_facility : nan\ncontact_facebook : nan\nzoo : nan\nemail : nan\nwheelchair : nan\ncuisine : nan\ncontact_website : nan\ninternet_access : nan\nopening_hours_reception : nan\nguest_house : nan\naddr_city : nan\ncontact_instagram : nan\nimage : nan\nlocation : nan\noutdoor_seating : nan\nmuseum : nan\ntakeaway : nan\nsmoking : nan\nname : Park Aleksandry\nid : 3444\n\nphone : nan\ncemetery : nan\nemergency : nan\nopening_hours : nan\nwebsite : nan\npets_allowed : nan\ngeometry : POLYGON ((19.8655028 50.049014, 19.865788 50.0493523, 19.8658926 50.0488307, 19.8661553 50.0485963, 19.8660209 50.048515, 19.8659393 50.0485257, 19.8657982 50.0485074, 19.865725 50.0484923, 19.8656922 50.0484536, 19.8657008 50.0484135, 19.8657511 50.0483863, 19.8658334 50.0483847, 19.8659693 50.0484052, 19.8660652 50.0483391, 19.8659591 50.0482579, 19.8660805 50.0482054, 19.866202 50.0481648, 19.8662547 50.048149, 19.8663003 50.0481421, 19.8663409 50.0481385, 19.8664391 50.0481351, 19.8665318 50.0481364, 19.8665266 50.0480615, 19.8665266 50.0480497, 19.866532 50.048037, 19.8665428 50.048026, 19.8665578 50.0480157, 19.8665757 50.0480087, 19.8665949 50.0480036, 19.8666174 50.0480019, 19.86664 50.0480038, 19.8666586 50.0480087, 19.8666755 50.0480168, 19.8666908 50.0480259, 19.866702 50.0480367, 19.8667083 50.0480461, 19.8667122 50.048057, 19.8667146 50.0480851, 19.8667886 50.0480953, 19.8675213 50.048186, 19.8675335 50.0481358, 19.8675916 50.0479723, 19.8676186 50.047934, 19.8675292 50.0478954, 19.8674412 50.0478306, 19.8673948 50.047719, 19.8672102 50.0476312, 19.8672571 50.0475642, 19.867032 50.0474908, 19.8667871 50.0474355, 19.8664405 50.0474857, 19.8663663 50.0474673, 19.8662981 50.0474773, 19.8661684 50.0476639, 19.8659654 50.0476821, 19.8658074 50.0478428, 19.8656529 50.0479844, 19.8656297 50.0480286, 19.8653527 50.0481497, 19.8651378 50.0482227, 19.8650165 50.0482473, 19.8649294 50.0483269, 19.8650737 50.0484852, 19.8655028 50.049014))\nhistoric : no information\nwiki_summary_en : Skałki Przegorzalskie Nature Reserve – a strict floristic nature reserve covering an area of 1.38 ha, established in 1959 in Kraków on the site of a distinct ridge with cliffs, on the edge of Wolski Forest towards Przegorze. It serves to protect rare rocky and xerothermic grasslands as well as thermophilic shrubbery. A mixed forest grows here, predominantly featuring the thermophilic form of subcontinental beech forest and thermophilic shrubs. The plants protected in this area include: common rush, bay laurel, common houseleek, lofty primrose, May lily of the valley, broad-leaved orchid, common buckthorn, common ivy, coral viburnum, and sweet woodruff. The reserve area is owned by Jagiellonian University. \nJust above the reserve stands a large structure from World War II, known as the Belvedere, as well as the villa of Adolf Szyszko-Bohusz, called the Rotunda, due to its similarity to the Wawel Rotunda. \nThe reserve lies within the boundaries of the Bielańsko-Tyniecki Landscape Park.\npostal_code : nan\ntoilets : nan\nnatural : no information\ndescription : nan\nvisiting_time : nan\nleisure : nature_reserve\ntourism : no information\npublic_transport : nan\nbrand : nan\nalt_name : nan\namenity : no information\nreservation : nan\nattraction : nan\nhighchair : nan\nparking : nan\nswimming_pool : nan\ncontact_phone : nan\ncommunity_centre : nan\naddr_street : nan\ncontact_twitter : nan\nsocial_facility : nan\ncontact_facebook : nan\nzoo : nan\nemail : nan\nwheelchair : nan\ncuisine : nan\ncontact_website : nan\ninternet_access : nan\nopening_hours_reception : nan\nguest_house : nan\naddr_city : nan\ncontact_instagram : nan\nimage : nan\nlocation : nan\noutdoor_seating : nan\nmuseum : nan\ntakeaway : nan\nsmoking : nan\nname : Rezerwat Skałki Przegorzalskie\nid : 3552\n\nphone : 0122573910\ncemetery : nan\nemergency : nan\nopening_hours : Mo-Sa 08:00-23:00; Su 09:00-22:00\nwebsite : https://www.solvaypark.pl/\npets_allowed : nan\ngeometry : POLYGON ((19.9272504 50.0145271, 19.9272006 50.0145263, 19.9271321 50.0145201, 19.92708 50.0145109, 19.927019 50.0144949, 19.9269527 50.0144702, 19.9269105 50.014449, 19.9268837 50.0144341, 19.926877 50.0144293, 19.9268407 50.0144023, 19.9268089 50.0143729, 19.9268038 50.0143667, 19.9267893 50.014349, 19.9267663 50.0143147, 19.926713 50.0142094, 19.9266655 50.0141122, 19.9266681 50.0141117, 19.9266724 50.0141108, 19.9266741 50.0141105, 19.926678 50.0141182, 19.9266748 50.0141189, 19.9266982 50.0141666, 19.9267008 50.0141659, 19.9267028 50.0141699, 19.9267006 50.0141704, 19.926713 50.0141959, 19.9268855 50.0141608, 19.9268914 50.0141728, 19.9269457 50.0141617, 19.9269313 50.0141324, 19.92697 50.0141243, 19.9269358 50.0140548, 19.9270045 50.0140407, 19.927011 50.0140394, 19.9271492 50.014011, 19.9271556 50.0140097, 19.9271791 50.0140049, 19.9273058 50.0139789, 19.927312 50.0139776, 19.9278055 50.0138764, 19.9278137 50.0138747, 19.928139 50.013808, 19.9282603 50.0140538, 19.9283954 50.0143276, 19.928157 50.0143766, 19.9280953 50.0143892, 19.9275325 50.0145042, 19.9274555 50.0145188, 19.9274475 50.0145209, 19.9274138 50.0145269, 19.9273543 50.0145385, 19.9273028 50.0145441, 19.9272933 50.0145251, 19.9272504 50.0145271))\nhistoric : no information\nwiki_summary_en : Solvay Park – a city park in Krakow, located in District IX Łagiewniki-Borek Fałęcki, in Borek Fałęcki. It stretches on both sides of Kościuszkowców Street. To the east, the natural boundary of the park is defined by the Rzewny stream, while to the south and west it is bordered by Juliana Ursyna Niemcewicza, Żywiecka, and Jagodowa streets. Traditionally, the park is divided into three parts called respectively: Sosny, Podmokła, and Leśna. Its terrain is slightly undulating and descends from the south toward the north.\npostal_code : nan\ntoilets : yes\nnatural : no information\ndescription : nan\nvisiting_time : nan\nleisure : no information\ntourism : no information\npublic_transport : nan\nbrand : nan\nalt_name : nan\namenity : no information\nreservation : nan\nattraction : nan\nhighchair : nan\nparking : nan\nswimming_pool : nan\ncontact_phone : nan\ncommunity_centre : nan\naddr_street : Zakopiańska\ncontact_twitter : nan\nsocial_facility : nan\ncontact_facebook : nan\nzoo : nan\nemail : nan\nwheelchair : nan\ncuisine : nan\ncontact_website : nan\ninternet_access : wlan\nopening_hours_reception : nan\nguest_house : nan\naddr_city : Kraków\ncontact_instagram : nan\nimage : nan\nlocation : nan\noutdoor_seating : nan\nmuseum : nan\ntakeaway : nan\nsmoking : nan\nname : Solvay Park\nid : 9552\n\nphone : nan\ncemetery : nan\nemergency : nan\nopening_hours : nan\nwebsite : nan\npets_allowed : nan\ngeometry : POINT (19.8273289 50.0091801)\nhistoric : no information\nwiki_summary_en : Ostra Góra (284 m) – a hill in Tyniec, Kraków. Administratively, it belongs to District VIII Dębniki. Geographically, it is part of the Tyniec Hills on the Kraków Bridge within the macroregion of the Kraków Gate. These hills are included in the area of the Bielańsko-Tyniecki Landscape Park.  \nOstra Góra has 4 peaks. It is completely covered with forest. Its western slopes descend to the built-up settlement of Tyniec – Zagórze, while the northern slopes lead to the street Obrońcy Tyńca, which passes through the forest. This street, leading through the passes, separates Ostra Góra from the next elevation to the north in the Tyniec Hills – Duża Kowodrza. At the southeastern foot, there is a clearing called Bagno with a single house.  \nOstra Góra, like the entire Tyniec Hills, is a place for recreation, walking, and sports. There is a marked tourist trail running through it. Part of its northern slopes is included in an ecological area called Uroczysko Tyniec.\npostal_code : nan\ntoilets : nan\nnatural : peak\ndescription : nan\nvisiting_time : nan\nleisure : no information\ntourism : no information\npublic_transport : nan\nbrand : nan\nalt_name : nan\namenity : no information\nreservation : nan\nattraction : nan\nhighchair : nan\nparking : nan\nswimming_pool : nan\ncontact_phone : nan\ncommunity_centre : nan\naddr_street : nan\ncontact_twitter : nan\nsocial_facility : nan\ncontact_facebook : nan\nzoo : nan\nemail : nan\nwheelchair : nan\ncuisine : nan\ncontact_website : nan\ninternet_access : nan\nopening_hours_reception : nan\nguest_house : nan\naddr_city : nan\ncontact_instagram : nan\nimage : nan\nlocation : nan\noutdoor_seating : nan\nmuseum : nan\ntakeaway : nan\nsmoking : nan\nname : Ostra Góra\nid : 11444\n\nphone : nan\ncemetery : nan\nemergency : nan\nopening_hours : nan\nwebsite : nan\npets_allowed : nan\ngeometry : LINESTRING (19.8041749 50.0210971, 19.8041796 50.0210276, 19.8041535 50.0209688, 19.8041016 50.0209289)\nhistoric : no information\nwiki_summary_en : Skurwysyn – a rock on the hill of Winnica in Tyniec. Administratively, it belongs to District VIII Dębniki in Kraków. Geographically, it is part of the Tyniec Hills on the Kraków Bridge within the macroregion of the Kraków Gate. These hills have been included in the area of the Bielańsko-Tyniecki Landscape Park.  \nThe rock is located at the northwestern foot of the Winnica hill and rises by the terrace of the Vistula River above Promowa Street. Right next to the rock, there is a parking lot and a restaurant, and a ferry dock is located a few dozen meters away. The rock is on private land. By agreement between the landowner and the Polish Mountaineering Association (PZA), it has been made available for rock climbing under certain conditions.  \nLike all the rocks of the Tyniec Hills, it is a limestone rock from the late Jurassic period. It is the southernmost part of a rock wall approximately 180 m long. Climbers distinguish between Winnica, the Wall by Skurwysyn, and the actual Skurwysyn, which features 18 climbing routes of varying difficulty (II–VI.6). All routes have protection: 4–7 rings (r) and belay stations (st). The rock has a height of 12–14 m, with vertical or overhanging walls featuring a pillar, chimney, and crack.  \nSkurwysyn has a large, distinctive, and dark roof. Below it is the Shelter in Winnica Drugie. In the vertical wall above the roof, about 10 m above the ground, there are three cave openings that are difficult to see from the ground: Tunnel above the First Roof, Tunnel above the Second Roof, Tunnel above the Third Roof.\npostal_code : nan\ntoilets : nan\nnatural : cliff\ndescription : nan\nvisiting_time : nan\nleisure : climbing\ntourism : no information\npublic_transport : nan\nbrand : nan\nalt_name : nan\namenity : no information\nreservation : nan\nattraction : nan\nhighchair : nan\nparking : nan\nswimming_pool : nan\ncontact_phone : nan\ncommunity_centre : nan\naddr_street : nan\ncontact_twitter : nan\nsocial_facility : nan\ncontact_facebook : nan\nzoo : nan\nemail : nan\nwheelchair : nan\ncuisine : nan\ncontact_website : nan\ninternet_access : nan\nopening_hours_reception : nan\nguest_house : nan\naddr_city : nan\ncontact_instagram : nan\nimage : nan\nlocation : nan\noutdoor_seating : nan\nmuseum : nan\ntakeaway : nan\nsmoking : nan\nname : Skurwysyn\nid : 11604\n\nphone : nan\ncemetery : nan\nemergency : nan\nopening_hours : nan\nwebsite : nan\npets_allowed : nan\ngeometry : POLYGON ((19.8041749 50.0210971, 19.8041796 50.0210276, 19.8041535 50.0209688, 19.8041016 50.0209289, 19.8040382 50.0208802, 19.8039122 50.0208176, 19.8039027 50.0207924, 19.8039538 50.0207825, 19.8040394 50.020855, 19.8041648 50.0209488, 19.8042723 50.0210528, 19.8043626 50.0212032, 19.8043674 50.0212963, 19.8041749 50.0210971))\nhistoric : no information\nwiki_summary_en : Skurwysyn – a rock on the hill of Winnica in Tyńcu. Administratively, it belongs to District VIII Dębniki in Kraków. Geographically, it is part of the Tynieckie Hills on the Krakow Bridge within the macroregion of the Krakow Gate. These hills are included in the area of the Bielańsko-Tyniecki Landscape Park.  \nThe rock is located at the northwestern foothill of the Winnica hill and rises along the Vistula terrace above Promowa Street. Right next to the rock, there is a parking lot and a restaurant, and a ferry terminal is located just a few dozen meters away. The rock is situated on private property. By virtue of an agreement between the landowner and the PZA, it has been made available for climbing under certain conditions.  \nLike all the rocks of the Tynieckie Hills, it is a limestone rock from the Late Jurassic period. It is the southernmost part of a rock wall approximately 180 meters long. Climbers distinguish between Winnica, Wall at Skurwysyn, and the actual Skurwysyn, which has 18 climbing routes of varying difficulty (II–VI.6). All routes have protection: 4–7 rings (r) and rappel stations (st). The rock has a height of 12–14 meters, with vertical or overhanging walls, featuring a pillar, chimney, and crack.  \nSkurwysyn features a large, distinctive, and dark overhang. Beneath it is the Shelter in Winnica Drugie. In the vertical wall above the overhang, at a height of about 10 meters above the ground, there are three cave openings that are hard to spot from the ground: Tunnel above the First Overhang, Tunnel above the Second Overhang, Tunnel above the Third Overhang.\npostal_code : nan\ntoilets : nan\nnatural : bare_rock\ndescription : nan\nvisiting_time : nan\nleisure : no information\ntourism : no information\npublic_transport : nan\nbrand : nan\nalt_name : nan\namenity : no information\nreservation : nan\nattraction : nan\nhighchair : nan\nparking : nan\nswimming_pool : nan\ncontact_phone : nan\ncommunity_centre : nan\naddr_street : nan\ncontact_twitter : nan\nsocial_facility : nan\ncontact_facebook : nan\nzoo : nan\nemail : nan\nwheelchair : nan\ncuisine : nan\ncontact_website : nan\ninternet_access : nan\nopening_hours_reception : nan\nguest_house : nan\naddr_city : nan\ncontact_instagram : nan\nimage : nan\nlocation : nan\noutdoor_seating : nan\nmuseum : nan\ntakeaway : nan\nsmoking : nan\nname : Skurwysyn\nid : 11605\n\nphone : nan\ncemetery : nan\nemergency : nan\nopening_hours : nan\nwebsite : nan\npets_allowed : nan\ngeometry : POLYGON ((19.9439313 50.0440988, 19.9443094 50.0438018, 19.9446844 50.0440257, 19.9450683 50.0442621, 19.9451217 50.0442977, 19.9451788 50.0443409, 19.9451976 50.0443593, 19.9452083 50.0443777, 19.9452227 50.0444102, 19.9452271 50.0444379, 19.9452268 50.0444557, 19.9452194 50.0444784, 19.9452099 50.0444992, 19.9451983 50.0445122, 19.945184 50.0445236, 19.9451711 50.0445307, 19.9453798 50.0446444, 19.9455589 50.0445368, 19.9456304 50.0445875, 19.9455504 50.0446351, 19.9455097 50.0446592, 19.9454861 50.0446745, 19.9454693 50.0446826, 19.9454534 50.0446885, 19.9454388 50.0446912, 19.9454304 50.0446922, 19.9454151 50.0446933, 19.9454039 50.0446925, 19.9453829 50.0446871, 19.9452645 50.044648, 19.9450489 50.0445776, 19.9450442 50.0445835, 19.9450381 50.0445809, 19.9447043 50.0444697, 19.944505 50.0444086, 19.9442867 50.044347, 19.9439576 50.0442651, 19.9439666 50.0442496, 19.943937 50.0442418, 19.9439026 50.0442271, 19.9438849 50.0442084, 19.9438771 50.0441909, 19.9438779 50.0441676, 19.9438848 50.0441463, 19.9438946 50.0441318, 19.9439313 50.0440988))\nhistoric : no information\nwiki_summary_en : no information\npostal_code : nan\ntoilets : nan\nnatural : no information\ndescription : nan\nvisiting_time : nan\nleisure : park\ntourism : no information\npublic_transport : nan\nbrand : nan\nalt_name : nan\namenity : no information\nreservation : nan\nattraction : nan\nhighchair : nan\nparking : nan\nswimming_pool : nan\ncontact_phone : nan\ncommunity_centre : nan\naddr_street : nan\ncontact_twitter : nan\nsocial_facility : nan\ncontact_facebook : nan\nzoo : nan\nemail : nan\nwheelchair : nan\ncuisine : nan\ncontact_website : nan\ninternet_access : nan\nopening_hours_reception : nan\nguest_house : nan\naddr_city : nan\ncontact_instagram : nan\nimage : nan\nlocation : nan\noutdoor_seating : nan\nmuseum : nan\ntakeaway : nan\nsmoking : nan\nname : no information\nid : 3531\n\nphone : nan\ncemetery : nan\nemergency : nan\nopening_hours : nan\nwebsite : nan\npets_allowed : nan\ngeometry : POLYGON ((19.9923315 50.0349799, 19.9924583 50.0349568, 19.9926764 50.0349324, 19.9929902 50.0349009, 19.9931589 50.034895, 19.9932282 50.0348992, 19.9933318 50.0348744, 19.9933354 50.03488, 19.9943096 50.0345484, 19.9950214 50.0345298, 19.995021 50.0344955, 19.9950038 50.0344957, 19.995004 50.0344585, 19.9949604 50.0344586, 19.9949551 50.0341934, 19.9949526 50.0340491, 19.994952 50.0340156, 19.9949934 50.0339738, 19.9951157 50.033978, 19.9953579 50.0340178, 19.9954256 50.0339882, 19.9955461 50.0336659, 19.9952596 50.0336201, 19.9950245 50.0335822, 19.9944968 50.0334977, 19.9945501 50.0333483, 19.994635 50.0331093, 19.994889 50.0331458, 19.9949196 50.0330621, 19.994619 50.033018, 19.9941773 50.032957, 19.9941883 50.0328711, 19.9942092 50.0327629, 19.9940853 50.0328229, 19.9939955 50.0328677, 19.9939496 50.0328663, 19.9937861 50.0328152, 19.9937811 50.0327771, 19.993946 50.0326345, 19.9939508 50.0326001, 19.9939574 50.0325524, 19.993895 50.0324814, 19.9937719 50.0324701, 19.9937042 50.0324819, 19.9936369 50.0325219, 19.9935319 50.0326064, 19.9933747 50.0327628, 19.9933466 50.0328116, 19.9933332 50.0328714, 19.9933569 50.0329031, 19.9934086 50.0329266, 19.993433 50.0329316, 19.9934992 50.0328064, 19.9939267 50.0329063, 19.9939621 50.0329142, 19.9939796 50.0329159, 19.9939255 50.0330162, 19.9939131 50.0330613, 19.9939141 50.0331287, 19.9938838 50.0331167, 19.9938365 50.0332689, 19.9938557 50.0333431, 19.993859 50.0333557, 19.9938948 50.0334942, 19.9939004 50.033516, 19.9938778 50.0336, 19.9938759 50.0336072, 19.9938709 50.0336273, 19.9937869 50.0337785, 19.9933957 50.033718, 19.9933923 50.0337395, 19.9934174 50.0337719, 19.9934451 50.0337947, 19.9935017 50.0338324, 19.9935247 50.0338442, 19.9935906 50.0338939, 19.9936009 50.0338884, 19.9936095 50.0338839, 19.9935959 50.0338708, 19.9935735 50.0338536, 19.9935072 50.0338029, 19.9937916 50.0338481, 19.9938116 50.0338577, 19.9938212 50.0338654, 19.9938231 50.0338743, 19.9938037 50.0339182, 19.9937677 50.0339994, 19.9937324 50.0340603, 19.9936872 50.0341149, 19.9936297 50.0341709, 19.993569 50.034218, 19.9935491 50.0342335, 19.993472 50.0342834, 19.9934025 50.0343177, 19.9933209 50.0343517, 19.9932381 50.0343796, 19.9931001 50.034415, 19.9930714 50.0343876, 19.9930453 50.0343742, 19.9930448 50.0343597, 19.9928754 50.0343612, 19.9928705 50.0343451, 19.9927812 50.0343611, 19.9925497 50.034387, 19.9921791 50.0344665, 19.9919683 50.0344724, 19.9918593 50.0344754, 19.9915377 50.0344947, 19.9911749 50.0345115, 19.9910292 50.0345108, 19.9909604 50.0345105, 19.9905942 50.0345089, 19.9904787 50.0344906, 19.990406 50.0344791, 19.9903129 50.0344643, 19.990287 50.0344602, 19.9899611 50.0344463, 19.9899419 50.0344455, 19.9896922 50.0344349, 19.9893396 50.0343657, 19.9891633 50.0343145, 19.9891032 50.0342858, 19.9890693 50.0342697, 19.9888507 50.0341319, 19.9888312 50.0341196, 19.9886541 50.0339967, 19.9886347 50.0339832, 19.9884287 50.0338495, 19.9882796 50.0337737, 19.9882463 50.033766, 19.9882035 50.033756, 19.9881701 50.0337482, 19.9880889 50.0337488, 19.9879745 50.0337875, 19.9879698 50.0338116, 19.9879548 50.0338885, 19.9879491 50.0339178, 19.9880199 50.0339811, 19.9883729 50.0340686, 19.9886326 50.0341204, 19.9887875 50.0341748, 19.9889248 50.034243, 19.9889603 50.0343181, 19.9889037 50.0343745, 19.9889402 50.0343929, 19.9890178 50.0343437, 19.98928 50.0344114, 19.9893474 50.0344774, 19.9894507 50.0345805, 19.9896254 50.0347065, 19.9898283 50.0348528, 19.9906713 50.0355193, 19.9907256 50.0355647, 19.9908175 50.0355349, 19.990836 50.0355252, 19.991433 50.0351901, 19.9915498 50.0351515, 19.9920984 50.0350258, 19.9923315 50.0349799))\nhistoric : no information\nwiki_summary_en : no information\npostal_code : nan\ntoilets : nan\nnatural : no information\ndescription : nan\nvisiting_time : nan\nleisure : park\ntourism : no information\npublic_transport : nan\nbrand : nan\nalt_name : nan\namenity : no information\nreservation : nan\nattraction : nan\nhighchair : nan\nparking : nan\nswimming_pool : nan\ncontact_phone : nan\ncommunity_centre : nan\naddr_street : nan\ncontact_twitter : nan\nsocial_facility : nan\ncontact_facebook : nan\nzoo : nan\nemail : nan\nwheelchair : nan\ncuisine : nan\ncontact_website : nan\ninternet_access : nan\nopening_hours_reception : nan\nguest_house : nan\naddr_city : nan\ncontact_instagram : nan\nimage : nan\nlocation : nan\noutdoor_seating : nan\nmuseum : nan\ntakeaway : nan\nsmoking : nan\nname : no information\nid : 3393\n\nphone : nan\ncemetery : nan\nemergency : nan\nopening_hours : nan\nwebsite : nan\npets_allowed : nan\ngeometry : POLYGON ((19.9504059 50.0583383, 19.9504002 50.0583627, 19.9504031 50.0583857, 19.9504112 50.0584064, 19.9504241 50.0584256, 19.9504464 50.0584487, 19.9504661 50.0584617, 19.9504814 50.0584692, 19.9504983 50.0584742, 19.9505183 50.0584765, 19.9505507 50.0584789, 19.9505797 50.0584755, 19.9506324 50.0584642, 19.9507204 50.0584369, 19.9508146 50.0584012, 19.9509986 50.0583105, 19.9511702 50.058207, 19.9514121 50.0580389, 19.9516326 50.0578819, 19.9519075 50.0576721, 19.9519988 50.0575949, 19.9521438 50.0574602, 19.9524201 50.0572068, 19.9524313 50.0571916, 19.9524348 50.0571769, 19.9524338 50.0571639, 19.9524267 50.0571542, 19.9521928 50.0570525, 19.9521721 50.0570477, 19.9521526 50.0570482, 19.9521328 50.0570534, 19.9521211 50.0570581, 19.9521084 50.0570656, 19.9516509 50.0574863, 19.9513358 50.0577227, 19.9509259 50.0580091, 19.9506661 50.0581695, 19.9504534 50.058278, 19.9504146 50.0583182, 19.9504059 50.0583383))\nhistoric : no information\nwiki_summary_en : no information\npostal_code : nan\ntoilets : nan\nnatural : no information\ndescription : nan\nvisiting_time : nan\nleisure : park\ntourism : no information\npublic_transport : nan\nbrand : nan\nalt_name : nan\namenity : no information\nreservation : nan\nattraction : nan\nhighchair : nan\nparking : nan\nswimming_pool : nan\ncontact_phone : nan\ncommunity_centre : nan\naddr_street : nan\ncontact_twitter : nan\nsocial_facility : nan\ncontact_facebook : nan\nzoo : nan\nemail : nan\nwheelchair : nan\ncuisine : nan\ncontact_website : nan\ninternet_access : nan\nopening_hours_reception : nan\nguest_house : nan\naddr_city : nan\ncontact_instagram : nan\nimage : nan\nlocation : nan\noutdoor_seating : nan\nmuseum : nan\ntakeaway : nan\nsmoking : nan\nname : no information\nid : 3491\n\n",
  "answer": "Solvay Park, located in the Łagiewniki-Borek Fałęcki district of Kraków, is a lovely city park that offers a variety of areas to explore. The park is traditionally divided into three distinct sections:\n\n1. **Sosny**: This area is characterized by its pine trees and provides a serene environment for walking and relaxation. It's a great spot for nature lovers who enjoy the tranquility of wooded areas.\n\n2. **Podmokła**: This section features more damp and marshy terrain, which can be interesting for those who appreciate diverse ecosystems. It's a unique area within the park that may attract different wildlife.\n\n3. **Leśna**: As the name suggests, this part is more forested and offers a denser tree cover, making it ideal for shaded walks and enjoying the natural surroundings.\n\nThe park is slightly undulating, descending from the south toward the north, which adds to its scenic beauty. You can enjoy leisurely walks, picnics, and the natural beauty of the area. Additionally, the park is equipped with amenities such as toilets and Wi-Fi, making it a comfortable place to spend time outdoors. \n\nWhether you're looking for a peaceful stroll, a place to unwind, or a spot to enjoy nature, Solvay Park has something to offer in each of its sections.",
  "labels": {
    "faithfulness": "FAITHFUL",
    "groundedness": "GROUNDED",
    "relevance": "RELEVANT",
    "completeness": "COMPLETE",
    "coherence": "COHERENT",
    "conciseness": "PARTLY_CONCISE"
  },
  "quality_score": 5
}