{
  "model": "openai_llm",
  "prompt": "prompt_A",
  "id": 159,
  "question": "Is there parking available near Bar mleczny Krakus for visitors traveling by car?",
  "context": "phone : nan\ncemetery : nan\nemergency : nan\nopening_hours : Mo-Th 08:00-24:00, Fr-Su 08:00-01:00\nwebsite : https://zvis.pl/\npets_allowed : nan\ngeometry : POINT (19.9357419 50.0617776)\nhistoric : no information\nwiki_summary_en : Vis-à-vis is a bar located in Kraków's Old Town at Rynek Główny 29, in the tenement house \"Pod Blachą.\" It opened in 1978 in a space previously occupied by a fish store of the Fish Central. It is popularly known as Zwis. For years, it housed the informal office of Piwnica pod Baranami, a place for regular meetings of people associated with this cabaret. In front of the entrance stands a statue of Piotr Skrzynecki, the leader and master of ceremonies of the Piwnica pod Baranami cabaret, who was once a regular at this café. The statue was funded by composer Zbigniew Preisner. The sculpture was made by Grażyna Borkowska-Niemojewska and Łukasz Niemojewski. The café is still frequented mainly by artists: painters, poets, singers, sculptors, musicians, and actors, as well as photographers and filmmakers, and well-known figures from Kraków.\n\nNotable past and present patrons of the bar include poet Marcin Świetlicki (who immortalized the venue in his poem Do Zwisu i z powrotem and the crime novel Dwanaście), musician Andrzej Sikorowski, poet Tadeusz Śliwiak, critic Paweł Głowacki, musician Leszek Wójtowicz, and actor Jan Nowicki. A frequent visitor to Zwis was the famous Kloszard Zbigniew Fijałkowski, a character in numerous incidents and stories. Since 2007, bar patrons have published a magazine called \"Vis a vis,\" available in print and online. The illustrations for it are created by Iwona Siwek-Front, featuring daily stories about the Iced Gingerbread Woman with an impure soul. A comic by the artist that illustrates the social life of the local community and Vis-à-vis patrons hangs permanently in the bar. For many years, the bartender at Zwis has been Kraków poet Marek Wawrzyński, whose poetry collection – Na stronach – had its promotion at Piwnica.\npostal_code : nan\ntoilets : nan\nnatural : no information\ndescription : nan\nvisiting_time : nan\nleisure : no information\ntourism : no information\npublic_transport : nan\nbrand : nan\nalt_name : nan\namenity : bar\nreservation : nan\nattraction : nan\nhighchair : nan\nparking : nan\nswimming_pool : nan\ncontact_phone : nan\ncommunity_centre : nan\naddr_street : Rynek Główny\ncontact_twitter : nan\nsocial_facility : nan\ncontact_facebook : nan\nzoo : nan\nemail : nan\nwheelchair : nan\ncuisine : nan\ncontact_website : nan\ninternet_access : nan\nopening_hours_reception : nan\nguest_house : nan\naddr_city : Kraków\ncontact_instagram : nan\nimage : nan\nlocation : nan\noutdoor_seating : yes\nmuseum : nan\ntakeaway : nan\nsmoking : nan\nname : Vis-à-vis\nid : 1162\n\nphone : nan\ncemetery : nan\nemergency : nan\nopening_hours : nan\nwebsite : nan\npets_allowed : nan\ngeometry : POLYGON ((19.9387655 50.0935991, 19.9387982 50.0936304, 19.9388396 50.0936718, 19.9393858 50.0942121, 19.9394003 50.0942265, 19.939796 50.0946183, 19.9398792 50.0946985, 19.9399606 50.0947802, 19.9399982 50.0948177, 19.9402786 50.0946815, 19.9403077 50.0946788, 19.9403427 50.0946755, 19.9405167 50.0946592, 19.9418397 50.0942213, 19.9440851 50.0934546, 19.9444359 50.0933794, 19.9444766 50.0933723, 19.9445166 50.0933698, 19.9445478 50.0933716, 19.9445366 50.0933124, 19.9444255 50.0929758, 19.9444451 50.0927785, 19.94445 50.0927286, 19.9436043 50.0929382, 19.9432829 50.0930179, 19.9431364 50.0930083, 19.9430851 50.0930049, 19.9428692 50.0929307, 19.9428198 50.0929148, 19.9427197 50.0928883, 19.9425719 50.0928676, 19.9423736 50.0928399, 19.9422212 50.0928317, 19.9420936 50.0927518, 19.9420714 50.0927372, 19.9417284 50.0925121, 19.9414615 50.0924064, 19.9411309 50.0922671, 19.9409954 50.0922188, 19.9408707 50.0921865, 19.9407755 50.0921731, 19.9400066 50.0922184, 19.9401298 50.0923461, 19.9401859 50.0924695, 19.9402139 50.0926669, 19.9401838 50.0926958, 19.9401536 50.0927204, 19.9401186 50.0927481, 19.9400867 50.0927698, 19.9400531 50.0927896, 19.9400189 50.0928083, 19.9399791 50.0928299, 19.9398461 50.0928916, 19.9396273 50.0929924, 19.9393434 50.0931236, 19.9389671 50.0929558, 19.9387234 50.0934174, 19.9387162 50.0934324, 19.9387118 50.0934474, 19.9387085 50.0934627, 19.9387074 50.0934779, 19.9387096 50.0934923, 19.9387153 50.0935071, 19.9387275 50.0935362, 19.9387528 50.0935823, 19.9387587 50.0935902, 19.9387655 50.0935991))\nhistoric : no information\nwiki_summary_en : Tadeusz Kościuszko Park – a park in Krakow near the Białoprądnicki Manor (until the end of the 1950s Mirockich), bordered by the streets: Łukasza Górnickiego, Białoprądnicka, Papiernicza, and Józefa Mackiewicza. Nearby is the Clepardia sports club and an outdoor swimming pool. The Białucha River (Prądnik) flows through the park. The park serves a recreational purpose for local residents, as well as for participants in artistic programs organized by the “Dworek Białoprądnicki” Cultural Center. There is a playground for children within the park.\npostal_code : nan\ntoilets : nan\nnatural : no information\ndescription : nan\nvisiting_time : nan\nleisure : park\ntourism : no information\npublic_transport : nan\nbrand : nan\nalt_name : nan\namenity : no information\nreservation : nan\nattraction : nan\nhighchair : nan\nparking : nan\nswimming_pool : nan\ncontact_phone : nan\ncommunity_centre : nan\naddr_street : nan\ncontact_twitter : nan\nsocial_facility : nan\ncontact_facebook : nan\nzoo : nan\nemail : nan\nwheelchair : nan\ncuisine : nan\ncontact_website : nan\ninternet_access : nan\nopening_hours_reception : nan\nguest_house : nan\naddr_city : nan\ncontact_instagram : nan\nimage : nan\nlocation : nan\noutdoor_seating : nan\nmuseum : nan\ntakeaway : nan\nsmoking : nan\nname : Park im. Tadeusza Kościuszki;Park imienia Tadeusza Kościuszki\nid : 3450\n\nphone : nan\ncemetery : nan\nemergency : nan\nopening_hours : nan\nwebsite : nan\npets_allowed : nan\ngeometry : POLYGON ((19.9193291 50.0877129, 19.9207138 50.087682, 19.9207827 50.087713, 19.9208061 50.0877394, 19.920788 50.0878418, 19.920883 50.0878638, 19.920951 50.0877638, 19.9210457 50.087683, 19.9211532 50.0876106, 19.9211921 50.0876484, 19.9226449 50.0871909, 19.9227257 50.0871766, 19.9227713 50.0871799, 19.9228234 50.0872257, 19.9228665 50.0872772, 19.9234166 50.0879249, 19.9237289 50.0883022, 19.9237221 50.0883435, 19.9236219 50.088429, 19.9235206 50.0885085, 19.9233676 50.0886282, 19.9229956 50.0889269, 19.9227384 50.0891289, 19.9226251 50.0892385, 19.9225325 50.0893624, 19.9224722 50.0894947, 19.9224484 50.0896104, 19.922429 50.0897382, 19.9224484 50.0898692, 19.9225261 50.0900582, 19.9227708 50.0904687, 19.9228308 50.0905816, 19.9228301 50.0906292, 19.9228074 50.0907337, 19.9227895 50.0907792, 19.922756 50.0908151, 19.9227861 50.0908345, 19.9227619 50.0908444, 19.9227199 50.0908535, 19.9227014 50.0908543, 19.9226871 50.0908523, 19.9226477 50.0908468, 19.9225537 50.0908328, 19.9202528 50.0904904, 19.9202564 50.0904749, 19.9200496 50.0904184, 19.9194596 50.0903292, 19.9194278 50.0903208, 19.919404 50.090309, 19.919385 50.090291, 19.9193715 50.0902718, 19.9193657 50.0902522, 19.9193689 50.0902293, 19.9193786 50.0902121, 19.9193673 50.0901811, 19.9196875 50.0897163, 19.9195422 50.0896569, 19.919332 50.0899098, 19.9192943 50.0899306, 19.9190865 50.090195, 19.9190434 50.0902189, 19.9188347 50.0902408, 19.9187535 50.0902371, 19.9184449 50.0901879, 19.9186649 50.0897587, 19.9186166 50.0897486, 19.9182531 50.0896724, 19.9182844 50.0896198, 19.9183257 50.0895507, 19.9186501 50.0895555, 19.9188036 50.0893932, 19.9189692 50.0892814, 19.9190883 50.089152, 19.919258 50.0888704, 19.9192891 50.0881937, 19.9192891 50.0881607, 19.9192894 50.0879409, 19.9193291 50.0877129))\nhistoric : no information\nwiki_summary_en : Krowoderski Park – a park in Krakow, in the IV Prądnik Biały district, bordered by the streets: Opolska, Batalionu “Skała” AK, Władysława Łokietka, Tadeusza Makowskiego, and Jana Palacha. \nWithin its area, there is a pitch of PKS Jadwiga (formerly belonging to KS Krowodrza) and a recreational tobogganing hill – secured from the side of Opolska Street with tires, a net, and shrubs, as well as a number of smaller pitches and recreational areas. A Jordanian garden was also established, along with a (fenced) dog run (with benches and a wooden gazebo) and small architectural structures. \nThe Eagle's Nest Trail runs through the park, starting at the Krowodrza Górka Estate near the bus and tram loop.\nThe Krowoderski Park is also crossed by the bicycle route No. 2 from the Młynówka Królewska Park to Ojców (Old Town – Łobzowska – Grottgera – Młynówka Królewska Park – Racławicka – Wybickiego – WT Krowodrza – Krowoderski Park – Łokietka – Pękowicka – Pękowice – city border – Giebułtów (gm. Wielka Wieś) – Ojców/Korzkiew).\nVarious outdoor events are organized in Krowoderski Park, including:\n\nA concert by the band Elektryczne Gitary as part of the election campaign in September 1998.\n“Safe Way to School” – an event organized on September 3-4, 2011, by the Groteska Theater with the participation of the Municipal Police of Krakow, the City Police Headquarters, and the Krakow Fire Brigade.\npostal_code : nan\ntoilets : nan\nnatural : no information\ndescription : nan\nvisiting_time : nan\nleisure : park\ntourism : no information\npublic_transport : nan\nbrand : nan\nalt_name : nan\namenity : no information\nreservation : nan\nattraction : nan\nhighchair : nan\nparking : nan\nswimming_pool : nan\ncontact_phone : nan\ncommunity_centre : nan\naddr_street : nan\ncontact_twitter : nan\nsocial_facility : nan\ncontact_facebook : nan\nzoo : nan\nemail : nan\nwheelchair : nan\ncuisine : nan\ncontact_website : nan\ninternet_access : nan\nopening_hours_reception : nan\nguest_house : nan\naddr_city : nan\ncontact_instagram : nan\nimage : nan\nlocation : nan\noutdoor_seating : nan\nmuseum : nan\ntakeaway : nan\nsmoking : nan\nname : Park Krowoderski\nid : 3463\n\nphone : nan\ncemetery : nan\nemergency : nan\nopening_hours : 06:00-22:00\nwebsite : nan\npets_allowed : nan\ngeometry : POLYGON ((19.9414602 50.0705711, 19.9413012 50.0702886, 19.9411463 50.0699882, 19.9409165 50.0694854, 19.9407745 50.0692149, 19.9423529 50.0688382, 19.9424921 50.0688896, 19.9429163 50.0692906, 19.9430418 50.0694638, 19.9431033 50.0695714, 19.9429799 50.0695881, 19.9430134 50.0697322, 19.9430963 50.0697228, 19.9431461 50.0699451, 19.9426035 50.070061, 19.9424306 50.0697209, 19.9414407 50.0699549, 19.9418597 50.070728, 19.9418259 50.0707363, 19.9417996 50.070743, 19.9416835 50.0705208, 19.9415284 50.0705567, 19.9414602 50.0705711))\nhistoric : no information\nwiki_summary_en : Park Jalu Kurka – a historic park located in the district I Stare Miasto in Krakow, at Kleparz on Szlak Street 71. It is named after Jalu Kurk, a Polish poet and prose writer, representative of the so-called Krakow Avant-Garde. \n\nThe park initially served as the garden of the Montelupich Palace, built in this place in the 15th century. It was common property until the property of the palace was taken over by the Tarnowski family. Stanisław Tarnowski, after remodeling the palace, transferred the palace garden to the city for public use by all residents. In 1948, the Congregation of the Salvatorians purchased the palace along with the park from the Tarnowskis. \n\nAfter World War II, the grounds of the palace and park were taken over by the authorities of the Polish People's Republic. The palace housed the headquarters of Radio Kraków, and the park was fully opened to the city's residents. \n\nAfter 1989, when a property commission for the Catholic Church was established, the congregation applied to the commission for the return of the palace and the adjacent park. The park was returned to the congregation, while the request for the return of the palace was withdrawn by the congregation when the Tarnowski family began efforts to declare the expropriation invalid. \n\nAfter the congregation regained the park, despite numerous protests from local residents, students from the nearby Krakow University of Technology, and councilors from District I, the park was closed. The congregation officially stated that the reason for the park's closure was the lack of funds for repairing the lighting and infrastructure of the park. \n\nIn 2008, the owners of the park applied for development conditions for part of the parkland, wishing to build the European Center for Salvatorian Formation on that site. They also informed that if they received permission for development, the remaining part of the park would be made available to the city's residents. However, the proposal for development was rejected by Jan Janczykowski, the provincial conservator of monuments. \n\nCurrently, an office building is being constructed on a part of the plot that is not protected, which previously served as the entrance to the park. \n\nSince 2017, the authorities of the city of Krakow have been in discussions with the Salvatorians regarding land exchange or the purchase of the park. Ultimately, in 2022, the Krakow municipality purchased the park area for the amount of 11 million PLN. The park was made available to residents on January 1, 2023. The park is open daily from 6:00 AM to 10:00 PM.\npostal_code : nan\ntoilets : nan\nnatural : no information\ndescription : nan\nvisiting_time : nan\nleisure : park\ntourism : no information\npublic_transport : nan\nbrand : nan\nalt_name : nan\namenity : no information\nreservation : nan\nattraction : nan\nhighchair : nan\nparking : nan\nswimming_pool : nan\ncontact_phone : nan\ncommunity_centre : nan\naddr_street : nan\ncontact_twitter : nan\nsocial_facility : nan\ncontact_facebook : nan\nzoo : nan\nemail : nan\nwheelchair : nan\ncuisine : nan\ncontact_website : nan\ninternet_access : nan\nopening_hours_reception : nan\nguest_house : nan\naddr_city : nan\ncontact_instagram : nan\nimage : nan\nlocation : nan\noutdoor_seating : nan\nmuseum : nan\ntakeaway : nan\nsmoking : nan\nname : Park imienia Jalu Kurka\nid : 3477\n\nphone : nan\ncemetery : nan\nemergency : nan\nopening_hours : nan\nwebsite : nan\npets_allowed : nan\ngeometry : POLYGON ((19.9674902 50.086207, 19.9673616 50.0861288, 19.9673577 50.086138, 19.9673101 50.0861482, 19.9670686 50.0861446, 19.9667902 50.0861469, 19.9661842 50.0861802, 19.9658687 50.0862051, 19.9655519 50.086249, 19.9651413 50.0863314, 19.9647377 50.0864246, 19.9647414 50.0864302, 19.9647042 50.0864433, 19.964635 50.0864675, 19.9646322 50.0864648, 19.9644201 50.0865985, 19.9642383 50.0866981, 19.9643465 50.0868015, 19.9644072 50.0868188, 19.9644645 50.0868736, 19.964468 50.0868799, 19.9644919 50.0868886, 19.964644 50.0869468, 19.9646839 50.0869601, 19.9649993 50.0870638, 19.9652957 50.0871588, 19.9653204 50.0871672, 19.9653847 50.0871889, 19.9654504 50.0872111, 19.965571 50.0872518, 19.9658398 50.0873427, 19.9660606 50.0874198, 19.9665252 50.0875668, 19.9667802 50.0875824, 19.9667835 50.0875025, 19.9668298 50.0873874, 19.9669723 50.0872395, 19.9676375 50.0868495, 19.9676239 50.0866813, 19.967643 50.0865711, 19.9676681 50.0865074, 19.9676609 50.0863811, 19.967617 50.0862816, 19.9675498 50.0862273, 19.9674902 50.086207))\nhistoric : no information\nwiki_summary_en : Park Zaczarowanej Dorożki – a park located in Krakow, in the III Prądnik Czerwony district, between Lublańska Street and Dobrego Pasterza Street in Prądnik Czerwony.\npostal_code : nan\ntoilets : nan\nnatural : no information\ndescription : nan\nvisiting_time : nan\nleisure : park\ntourism : no information\npublic_transport : nan\nbrand : nan\nalt_name : nan\namenity : no information\nreservation : nan\nattraction : nan\nhighchair : nan\nparking : nan\nswimming_pool : nan\ncontact_phone : nan\ncommunity_centre : nan\naddr_street : nan\ncontact_twitter : nan\nsocial_facility : nan\ncontact_facebook : nan\nzoo : nan\nemail : nan\nwheelchair : nan\ncuisine : nan\ncontact_website : nan\ninternet_access : nan\nopening_hours_reception : nan\nguest_house : nan\naddr_city : nan\ncontact_instagram : nan\nimage : nan\nlocation : nan\noutdoor_seating : nan\nmuseum : nan\ntakeaway : nan\nsmoking : nan\nname : Park Zaczarowanej Dorożki;Q9385671\nid : 3647\n\nphone : nan\ncemetery : nan\nemergency : nan\nopening_hours : nan\nwebsite : nan\npets_allowed : nan\ngeometry : POINT (19.8597855 50.0835874)\nhistoric : no information\nwiki_summary_en : Kraków Mydlniki is a railway station in the Bronowice district of Kraków, Poland, located in the neighbourhood of Mydlniki, northwest of the city centre. The station, with its historic building, lies within the Tenczynek Landscape Park (Tenczyński Park Krajobrazowy) protected area with numerous summer visitors, because the Park is also the location of a medieval Tenczyn Castle built as a seat of the powerful Tęczyński family. It fell into ruin during the Deluge in mid-17th century, after being pillaged and burned by Swedish-Brandenburgian forces looking for the Polish Crown Jewels and the rumored treasures of the Tęczyński family. Within the Landscape Park are five nature reserves.\nThe station serves the PKP rail line 95 between Katowice to the west (1), and Kraków Balice to the east (2); more specifically:\n\nPKP rail line 133 Dąbrowa Górnicza Ząbkowice - Kraków Główny, 70.7 kilometres (43.9 mi)\nPKP rail line 118 Kraków Mydlniki - Kraków Balice, 5.0 kilometres (3.1 mi).\n\n\n== References ==\npostal_code : nan\ntoilets : nan\nnatural : no information\ndescription : nan\nvisiting_time : nan\nleisure : no information\ntourism : no information\npublic_transport : station\nbrand : nan\nalt_name : nan\namenity : no information\nreservation : nan\nattraction : nan\nhighchair : nan\nparking : nan\nswimming_pool : nan\ncontact_phone : nan\ncommunity_centre : nan\naddr_street : nan\ncontact_twitter : nan\nsocial_facility : nan\ncontact_facebook : nan\nzoo : nan\nemail : nan\nwheelchair : nan\ncuisine : nan\ncontact_website : nan\ninternet_access : nan\nopening_hours_reception : nan\nguest_house : nan\naddr_city : nan\ncontact_instagram : nan\nimage : nan\nlocation : nan\noutdoor_seating : nan\nmuseum : nan\ntakeaway : nan\nsmoking : nan\nname : Kraków Mydlniki;Краків Мидлнікі;Краков Мыдлинки\nid : 6789\n\nphone : +48 12 642 87 00;+48 12 642 87 01;+48 12 642 40 70;+48 12 642 40 71\ncemetery : nan\nemergency : nan\nopening_hours : nan\nwebsite : https://muzeumlotnictwa.pl/muzeum/pl/\npets_allowed : nan\ngeometry : POLYGON ((19.9892381 50.0865836, 19.9894045 50.0849145, 19.991821 50.0843764, 19.9922833 50.0842237, 19.9957528 50.0834325, 19.9954072 50.0827986, 19.9919336 50.0835775, 19.9918269 50.0836881, 19.9894817 50.0841356, 19.9894964 50.0839292, 19.9888836 50.0839084, 19.9888272 50.08341, 19.9875043 50.0834205, 19.987372 50.0837324, 19.986768 50.0837468, 19.9867325 50.0841354, 19.9864581 50.0843445, 19.9856156 50.084558, 19.9851017 50.0848111, 19.9849667 50.084962, 19.9845493 50.0853662, 19.983882 50.0856232, 19.9822984 50.0856173, 19.9823758 50.0859194, 19.9834138 50.0859407, 19.9846016 50.0860298, 19.9866951 50.0863242, 19.9892381 50.0865836))\nhistoric : no information\nwiki_summary_en : Lądowisko Kraków-Czyżyny is a landing site in Kraków, located in the northeastern part of the city, in two areas: Rakowice and Czyżyny, in the Małopolskie Voivodeship, operating since 2003 on the grounds of the former Kraków-Rakowice-Czyżyny airport. The landing site belongs to the Polish Aviation Museum and has been listed in the ULC landing sites registry since 2012. Since 2004, it has been the venue for the Małopolski Aviation Picnic, during which air shows take place (since 2018, the Civil Aviation Authority has not permitted takeoffs and landings by aircraft from the runway during the event). It has a concrete runway with a length of 730 m.\npostal_code : nan\ntoilets : nan\nnatural : no information\ndescription : nan\nvisiting_time : nan\nleisure : no information\ntourism : no information\npublic_transport : nan\nbrand : nan\nalt_name : nan\namenity : no information\nreservation : nan\nattraction : nan\nhighchair : nan\nparking : nan\nswimming_pool : nan\ncontact_phone : nan\ncommunity_centre : nan\naddr_street : nan\ncontact_twitter : nan\nsocial_facility : nan\ncontact_facebook : nan\nzoo : nan\nemail : info@muzeumlotnictwa.pl\nwheelchair : nan\ncuisine : nan\ncontact_website : nan\ninternet_access : nan\nopening_hours_reception : nan\nguest_house : nan\naddr_city : nan\ncontact_instagram : nan\nimage : nan\nlocation : nan\noutdoor_seating : nan\nmuseum : nan\ntakeaway : nan\nsmoking : nan\nname : Lądowisko Kraków-Czyżyny;EPKC Kraków-Rakowice-Czyżyny\nid : 9267\n\nphone : nan\ncemetery : nan\nemergency : nan\nopening_hours : nan\nwebsite : nan\npets_allowed : nan\ngeometry : POLYGON ((19.9214623 50.0575786, 19.9211232 50.057429, 19.9211115 50.057424, 19.9208286 50.0573925, 19.9205616 50.057364, 19.9201142 50.0573124, 19.9201124 50.0573178, 19.9200654 50.0573109, 19.9200667 50.057307, 19.9200602 50.0573062, 19.9200583 50.0573112, 19.9200149 50.0573048, 19.920016 50.0573011, 19.919955 50.0572939, 19.9199494 50.0573097, 19.9198971 50.0573022, 19.919902 50.0572877, 19.9198949 50.057287, 19.9198901 50.0573012, 19.9198378 50.0572936, 19.9198421 50.057281, 19.9198345 50.0572799, 19.9198335 50.0572833, 19.9197297 50.0572692, 19.9197287 50.0572723, 19.9196822 50.0572669, 19.9196832 50.0572637, 19.9195837 50.0572521, 19.9195828 50.0572553, 19.9195702 50.0572538, 19.9195711 50.0572507, 19.9195071 50.0572434, 19.9194349 50.0574514, 19.9193354 50.0577369, 19.9192346 50.0580261, 19.9191687 50.0582143, 19.919146 50.0582798, 19.919183 50.0582851, 19.9192122 50.0582892, 19.9192492 50.0582944, 19.9193647 50.0583108, 19.919351 50.0583494, 19.9193607 50.0583509, 19.9193628 50.0583449, 19.9194081 50.0583516, 19.9194061 50.0583574, 19.9194158 50.0583586, 19.9194178 50.0583529, 19.9194625 50.0583595, 19.9194605 50.0583652, 19.9194702 50.0583666, 19.9194721 50.0583608, 19.9195171 50.0583673, 19.919515 50.058373, 19.9195245 50.0583744, 19.9195267 50.0583687, 19.9195715 50.0583752, 19.9195695 50.0583809, 19.9195792 50.0583823, 19.919581 50.0583766, 19.919626 50.058383, 19.9196239 50.0583887, 19.9196336 50.0583902, 19.9196357 50.0583844, 19.9196805 50.0583908, 19.9196785 50.0583966, 19.9196882 50.058398, 19.9196902 50.0583923, 19.9197349 50.0583987, 19.9197329 50.0584046, 19.9197426 50.0584059, 19.9197446 50.0584001, 19.9197896 50.0584066, 19.9197874 50.0584124, 19.9197971 50.0584138, 19.9197992 50.058408, 19.9198439 50.0584144, 19.9198419 50.0584202, 19.9198516 50.0584217, 19.9198536 50.0584159, 19.9198986 50.0584224, 19.9198965 50.0584281, 19.9199061 50.0584294, 19.9199082 50.0584237, 19.9199529 50.0584302, 19.919951 50.058436, 19.9199606 50.0584374, 19.9199626 50.0584316, 19.9200075 50.0584381, 19.9200055 50.0584438, 19.9200151 50.0584452, 19.9200171 50.0584395, 19.9200621 50.058446, 19.92006 50.0584518, 19.9200697 50.0584531, 19.9200718 50.0584473, 19.9201168 50.0584538, 19.9201146 50.0584597, 19.9201245 50.0584611, 19.9201263 50.0584553, 19.920171 50.0584617, 19.9201689 50.0584675, 19.9201785 50.0584689, 19.9201807 50.058463, 19.9202255 50.0584696, 19.9202235 50.0584754, 19.9202332 50.0584768, 19.9202352 50.058471, 19.9202799 50.0584775, 19.9202779 50.0584832, 19.9202876 50.0584847, 19.9202896 50.0584788, 19.9203345 50.0584854, 19.9203324 50.0584911, 19.9203421 50.0584924, 19.9203441 50.0584869, 19.9203889 50.0584932, 19.9203869 50.058499, 19.9203966 50.0585004, 19.9203986 50.0584947, 19.9204434 50.0585012, 19.9204414 50.0585069, 19.9204511 50.0585083, 19.9204532 50.0585025, 19.9204981 50.0585089, 19.9204961 50.0585147, 19.9205058 50.0585162, 19.9205077 50.0585103, 19.9205524 50.0585168, 19.9205505 50.0585226, 19.9205601 50.058524, 19.9205621 50.0585182, 19.9206071 50.0585247, 19.920605 50.0585305, 19.9206146 50.0585319, 19.9206168 50.0585261, 19.9206615 50.0585325, 19.9206595 50.0585383, 19.9206692 50.0585397, 19.9206711 50.0585339, 19.920716 50.0585404, 19.9207139 50.0585462, 19.9207237 50.0585475, 19.9207258 50.0585419, 19.9207705 50.0585482, 19.9207685 50.058554, 19.9207782 50.0585555, 19.9207802 50.0585496, 19.9208249 50.0585562, 19.9208229 50.0585619, 19.9208326 50.0585633, 19.9208345 50.0585575, 19.9208795 50.0585639, 19.9208774 50.0585698, 19.9208869 50.0585712, 19.9208891 50.0585653, 19.920934 50.0585719, 19.9209321 50.0585776, 19.9209417 50.0585791, 19.9209437 50.0585732, 19.9209886 50.0585797, 19.9209864 50.0585855, 19.9209961 50.0585869, 19.9209982 50.0585812, 19.9210429 50.0585875, 19.9210409 50.0585933, 19.9210508 50.0585948, 19.9210527 50.0585889, 19.9210974 50.0585955, 19.9210955 50.0586014, 19.9211051 50.0586026, 19.9211071 50.0585969, 19.9211521 50.0586033, 19.92115 50.0586091, 19.9211596 50.0586106, 19.9211618 50.0586047, 19.9212065 50.0586111, 19.9212045 50.058617, 19.9212143 50.0586184, 19.9212163 50.0586126, 19.9212611 50.058619, 19.921259 50.0586249, 19.9212687 50.0586262, 19.9212708 50.0586205, 19.9213155 50.0586269, 19.9213135 50.0586327, 19.9213232 50.0586342, 19.9213252 50.0586283, 19.9213743 50.0586352, 19.9213712 50.0586408, 19.9213806 50.0586431, 19.9214849 50.05846, 19.9214763 50.058458, 19.9214738 50.0584627, 19.9214509 50.0584573, 19.9215764 50.0582102, 19.9216964 50.0579742, 19.9218172 50.0577368, 19.9216678 50.0576711, 19.9216693 50.0576697, 19.9214623 50.0575786))\nhistoric : no information\nwiki_summary_en : The Józef Piłsudski Cracovia Stadium (Polish: Stadion Cracovii im. Józefa Piłsudskiego) is a football stadium located in Kraków, Poland. It is used mostly for football matches and is the home ground of Cracovia. Originally, the first Cracovia stadium was built in 1912. It was demolished in mid-2009.  From then until late 2010, an entirely new construction was raised in roughly the same location where the old stadium stood. After reconstruction the stadium holds 15,114 people.\nThe stadium meets the criteria for UEFA Category 3\nThe stadium's design and construction has been frequently awarded in many architectural contests. \nIn 2010, it was honored with the Janusz Bogdanowskie award, given by the Archi-Szopa Association for the best architectural construction in Kraków City.\nThe stadium is located south of Błonia Park (in the Zwierzyniec district of Cracovia), near the stadium of Cracovia's archrival Wisła Kraków.\nThe stadium is named after Polish Chief of State, Marshal Józef Piłsudski\nThe 2018 FIFA World Cup qualification match between Ukraine and Kosovo on 9 October 2016 was played in the stadium due to Ukraine's Ukraine's non-recognition of Kosovo's travel documents. Ukraine's 2022–23 UEFA Nations League home fixtures were also played in this stadium due to the 2022 Russian invasion of Ukraine. From 2023 to 2025, the venue was used by Puszcza Niepołomice to host their home games following promotion to the top-flight, due to the stadium in Niepołomice not meeting the Ekstraklasa requirements.\npostal_code : nan\ntoilets : nan\nnatural : no information\ndescription : nan\nvisiting_time : nan\nleisure : stadium\ntourism : no information\npublic_transport : nan\nbrand : nan\nalt_name : nan\namenity : no information\nreservation : nan\nattraction : nan\nhighchair : nan\nparking : nan\nswimming_pool : nan\ncontact_phone : nan\ncommunity_centre : nan\naddr_street : Józefa Kałuży\ncontact_twitter : nan\nsocial_facility : nan\ncontact_facebook : nan\nzoo : nan\nemail : nan\nwheelchair : nan\ncuisine : nan\ncontact_website : nan\ninternet_access : nan\nopening_hours_reception : nan\nguest_house : nan\naddr_city : Kraków\ncontact_instagram : nan\nimage : nan\nlocation : nan\noutdoor_seating : nan\nmuseum : nan\ntakeaway : nan\nsmoking : nan\nname : Stadion Cracovii im. Józefa Piłsudskiego\nid : 11552\n\nphone : nan\ncemetery : nan\nemergency : nan\nopening_hours : Mo-Fr 08:00-18:00; Sa,Su 09:00-16:00\nwebsite : nan\npets_allowed : nan\ngeometry : POINT (19.9529387 50.0449312)\nhistoric : no information\nwiki_summary_en : no information\npostal_code : nan\ntoilets : nan\nnatural : no information\ndescription : nan\nvisiting_time : nan\nleisure : no information\ntourism : no information\npublic_transport : nan\nbrand : nan\nalt_name : nan\namenity : restaurant\nreservation : nan\nattraction : nan\nhighchair : nan\nparking : nan\nswimming_pool : nan\ncontact_phone : nan\ncommunity_centre : nan\naddr_street : Bolesława Limanowskiego\ncontact_twitter : nan\nsocial_facility : nan\ncontact_facebook : nan\nzoo : nan\nemail : nan\nwheelchair : nan\ncuisine : regional\ncontact_website : nan\ninternet_access : nan\nopening_hours_reception : nan\nguest_house : nan\naddr_city : Kraków\ncontact_instagram : nan\nimage : nan\nlocation : nan\noutdoor_seating : nan\nmuseum : nan\ntakeaway : nan\nsmoking : nan\nname : Bar mleczny Krakus\nid : 159\n\n",
  "answer": "Yes, there is parking available near Bar mleczny Krakus, which is located in Kraków. While specific details about the parking facilities are not provided in the context, visitors can typically find street parking or nearby parking lots in the area. It's advisable to check local parking regulations and availability upon arrival, as parking can vary depending on the time of day and local events. Enjoy your visit!",
  "labels": {
    "faithfulness": "PARTLY_FAITHFUL",
    "groundedness": "NON_GROUNDED",
    "relevance": "RELEVANT",
    "completeness": "PARTLY_COMPLETE",
    "coherence": "COHERENT",
    "conciseness": "PARTLY_CONCISE"
  },
  "quality_score": 2
}