{
  "model": "openai_llm",
  "prompt": "prompt_C",
  "id": 7030,
  "question": "Are pets allowed at the Jubilat 04 location?",
  "context": "phone : nan\ncemetery : nan\nemergency : nan\nopening_hours : Tu-Fr 09:00-15:00; Sa, Su 10:00-18:00\nwebsite : http://www.isez.pan.krakow.pl/muzeum.html\npets_allowed : nan\ngeometry : POINT (19.9415137 50.0554747)\nhistoric : no information\nwiki_summary_en : The Natural History Museum in Krakow (full official name: Muzeum Przyrodnicze Instytutu Systematyki i Ewolucji Zwierząt PAN) – a museum located in Krakow at 9 St. Sebastian Street. Here you can find a preserved, perfectly preserved, prehistoric woolly rhinoceros, the only fully preserved specimen of this animal that went extinct over 12,000 years ago. Since October 2012, it has resumed its activities.\npostal_code : nan\ntoilets : nan\nnatural : no information\ndescription : nan\nvisiting_time : nan\nleisure : no information\ntourism : museum\npublic_transport : nan\nbrand : nan\nalt_name : nan\namenity : no information\nreservation : nan\nattraction : nan\nhighchair : nan\nparking : nan\nswimming_pool : nan\ncontact_phone : nan\ncommunity_centre : nan\naddr_street : Świętego Sebastiana\ncontact_twitter : nan\nsocial_facility : nan\ncontact_facebook : nan\nzoo : nan\nemail : nan\nwheelchair : nan\ncuisine : nan\ncontact_website : nan\ninternet_access : nan\nopening_hours_reception : nan\nguest_house : nan\naddr_city : Kraków\ncontact_instagram : nan\nimage : nan\nlocation : nan\noutdoor_seating : nan\nmuseum : nature\ntakeaway : nan\nsmoking : nan\nname : Muzeum Przyrodnicze PAN;Lengyel Tudományos Akadémia Természettudományi Múzeuma\nid : 2413\n\nphone : nan\ncemetery : nan\nemergency : nan\nopening_hours : nan\nwebsite : nan\npets_allowed : nan\ngeometry : MULTIPOLYGON (((19.9542864 50.0464623, 19.9542955 50.0464634, 19.9542971 50.0464579, 19.9542879 50.0464568, 19.9542864 50.0464623)), ((19.9544066 50.0464806, 19.9544081 50.0464752, 19.954399 50.0464741, 19.9543974 50.0464796, 19.9544066 50.0464806)), ((19.9542717 50.0465269, 19.9542733 50.0465215, 19.9542641 50.0465204, 19.9542625 50.0465258, 19.9542717 50.0465269)), ((19.9543736 50.0465431, 19.9543827 50.0465442, 19.9543843 50.0465387, 19.9543751 50.0465377, 19.9543736 50.0465431)), ((19.9543593 50.0466088, 19.9543609 50.0466033, 19.9543517 50.0466022, 19.9543501 50.0466077, 19.9543593 50.0466088)), ((19.9543379 50.0466715, 19.9543394 50.046666, 19.9543302 50.0466649, 19.9543287 50.0466704, 19.9543379 50.0466715)), ((19.9543072 50.0467351, 19.9543164 50.0467362, 19.954318 50.0467308, 19.9543088 50.0467297, 19.9543072 50.0467351)), ((19.9542923 50.0467986, 19.9542938 50.0467931, 19.9542846 50.0467921, 19.9542831 50.0467975, 19.9542923 50.0467986)), ((19.954403 50.0468132, 19.9544046 50.0468078, 19.9543954 50.0468067, 19.9543938 50.0468121, 19.954403 50.0468132)), ((19.9542611 50.0468629, 19.9542703 50.046864, 19.9542718 50.0468586, 19.9542626 50.0468575, 19.9542611 50.0468629)), ((19.954381 50.0468786, 19.9543826 50.0468732, 19.9543734 50.0468721, 19.9543718 50.0468776, 19.954381 50.0468786)), ((19.9542515 50.046925, 19.954253 50.0469196, 19.9542439 50.0469185, 19.9542423 50.0469239, 19.9542515 50.046925)), ((19.9543437 50.0469822, 19.9543529 50.0469833, 19.9543544 50.0469778, 19.9543453 50.0469768, 19.9543437 50.0469822)), ((19.9545173 50.0464953, 19.9545189 50.0464898, 19.9545097 50.0464887, 19.9545082 50.0464942, 19.9545173 50.0464953)), ((19.9546268 50.046512, 19.9546283 50.0465066, 19.9546191 50.0465055, 19.9546176 50.046511, 19.9546268 50.046512)), ((19.9544843 50.0465577, 19.9544935 50.0465588, 19.954495 50.0465534, 19.9544859 50.0465523, 19.9544843 50.0465577)), ((19.9546029 50.0465756, 19.9546045 50.0465702, 19.9545953 50.0465691, 19.9545938 50.0465745, 19.9546029 50.0465756)), ((19.9544701 50.0466234, 19.9544716 50.046618, 19.9544624 50.0466169, 19.9544609 50.0466223, 19.9544701 50.0466234)), ((19.9545703 50.0466391, 19.9545795 50.0466402, 19.9545811 50.0466347, 19.9545719 50.0466337, 19.9545703 50.0466391)), ((19.9544486 50.0466861, 19.9544502 50.0466806, 19.954441 50.0466796, 19.9544394 50.046685, 19.9544486 50.0466861)), ((19.9545581 50.0467029, 19.9545596 50.0466974, 19.9545504 50.0466964, 19.9545489 50.0467018, 19.9545581 50.0467029)), ((19.9544271 50.0467508, 19.9544287 50.0467454, 19.9544195 50.0467443, 19.954418 50.0467498, 19.9544271 50.0467508)), ((19.9545366 50.0467676, 19.9545381 50.0467622, 19.954529 50.0467611, 19.9545274 50.0467666, 19.9545366 50.0467676)), ((19.9545125 50.04683, 19.954514 50.0468245, 19.9545048 50.0468235, 19.9545033 50.0468289, 19.9545125 50.04683)), ((19.9544905 50.0468954, 19.954492 50.04689, 19.9544828 50.0468889, 19.9544813 50.0468944, 19.9544905 50.0468954)))\nhistoric : memorial\nwiki_summary_en : Heroes of the Ghetto Square (from around 1880 Little Market, 1917–1948 Concord Square) - a square in Krakow, in the XIII Podgórze district, in Podgórze. \nFrom 1941 to 1943, it was within the boundaries of the Krakow ghetto. It was a place of concentration for the Jewish population before their transport to concentration camps. At number 18, the \"Under the Eagle\" Pharmacy operated, run by Tadeusz Pankiewicz, the only non-Jewish resident of the ghetto.\npostal_code : nan\ntoilets : nan\nnatural : no information\ndescription : nan\nvisiting_time : nan\nleisure : no information\ntourism : no information\npublic_transport : nan\nbrand : nan\nalt_name : nan\namenity : no information\nreservation : nan\nattraction : nan\nhighchair : nan\nparking : nan\nswimming_pool : nan\ncontact_phone : nan\ncommunity_centre : nan\naddr_street : nan\ncontact_twitter : nan\nsocial_facility : nan\ncontact_facebook : nan\nzoo : nan\nemail : nan\nwheelchair : nan\ncuisine : nan\ncontact_website : nan\ninternet_access : nan\nopening_hours_reception : nan\nguest_house : nan\naddr_city : nan\ncontact_instagram : nan\nimage : http://commons.wikimedia.org/wiki/File:Plac_Bohaterow_Getta_Krak%C3%B3w.jpg\nlocation : nan\noutdoor_seating : nan\nmuseum : nan\ntakeaway : nan\nsmoking : nan\nname : Plac Bohaterów Getta\nid : 3417\n\nphone : nan\ncemetery : nan\nemergency : nan\nopening_hours : nan\nwebsite : nan\npets_allowed : nan\ngeometry : POINT (19.947802 50.0686663)\nhistoric : no information\nwiki_summary_en : Kraków Główny, in English Kraków Main, is the largest and the most centrally located railway station in Kraków, Poland.\nThe railway station was situated in a historical building, constructed between 1844 and 1847 by Rosenbaum, which lies parallel to the tracks. The design was chosen to allow for future line expansion. The station was initially a terminus of the Kraków – Upper Silesia Railway (Kolej Krakowsko-Górnośląska, German: Oberschlesische-Krakauer Eisenbahn). Trains entered the trainshed via a brick archway at the northern end of the station which was almost doubled in size in 1871. In 2014, a new building was opened.\nIn 2023, it served 23.4 million passengers, making it the country's third busiest railway station behind Wrocław Główny and Poznań Główny stations.\npostal_code : nan\ntoilets : nan\nnatural : no information\ndescription : nan\nvisiting_time : nan\nleisure : no information\ntourism : no information\npublic_transport : station\nbrand : nan\nalt_name : Krakow Glowny railway station\namenity : no information\nreservation : nan\nattraction : nan\nhighchair : nan\nparking : nan\nswimming_pool : nan\ncontact_phone : nan\ncommunity_centre : nan\naddr_street : nan\ncontact_twitter : nan\nsocial_facility : nan\ncontact_facebook : nan\nzoo : nan\nemail : nan\nwheelchair : yes\ncuisine : nan\ncontact_website : nan\ninternet_access : nan\nopening_hours_reception : nan\nguest_house : nan\naddr_city : nan\ncontact_instagram : nan\nimage : nan\nlocation : nan\noutdoor_seating : nan\nmuseum : nan\ntakeaway : nan\nsmoking : nan\nname : Kraków Główny;Krakow Main Station;Krakow Glowny railway station;Краків Головний;Krakau Hauptbahnhof;Станция Краков-Главный;Krakov hlavní nádraží;克拉科夫火車總站\nid : 6793\n\nphone : nan\ncemetery : nan\nemergency : nan\nopening_hours : nan\nwebsite : nan\npets_allowed : nan\ngeometry : LINESTRING (19.9155315 50.0402803, 19.9157857 50.0405524, 19.915955 50.0407396, 19.9160764 50.0408385, 19.9162194 50.0408999)\nhistoric : no information\nwiki_summary_en : Sadystówka – a rock wall in the northeastern part of the Krzemionki Zakrzowskie (Zakrzówek) in District VIII Dębniki in Kraków. Rock climbing is practiced on it.  \nSadystówka is located in the area of the Skałki Twardowskiego nature reserve, one of the recreational areas of Kraków. It is well known to Kraków climbers, but it is absent from climbing guides, not marked on maps, and has very little information available online. Sadystówka is a rock wall that is a remnant of the former Kapelanka limestone quarry. Its height does not exceed 5 meters, but it is 80 meters long. It is perfectly vertical, with some parts slightly overhanging. In the middle section, a small chamber was carved out, which is closed by a door.  \nClimbing on Sadystówka has been taking place for about 100 years. In 1910, Mieczysław Świerz and Kazimierz Piotrowski conducted climbing exercises for mountaineers at Zakrzówek, and later, climbers from Kraków climbed here. This long-standing practice of climbing has caused all the holds to be very polished. There is only one climbing route on Sadystówka – but it is long, as it runs not upward but across, traversing the entire length of the wall. It has been rated at VI.3 on the Polish scale. One advantage of Sadystówka is that climbing is possible even in winter, at negative temperatures, as long as the sun shines on the wall. In the past, when there were no artificial climbing walls, some climbers trained on it all year round, allowing them to maintain their form in spring. Mathematician Tomek Opozda completed Sadystówka ten times non-stop.  \nOn Sadystówka, the holds shine like freshly polished bathroom tiles and can be considered a Kraków standard of polishing, yet it remains a climbing object. In its vicinity, there are several other climbing walls with vertical surfaces: Baba Jaga, Ciąża, Freney, Problemówka, Szara Ścianka. The height of some exceeds 30 meters.\npostal_code : nan\ntoilets : nan\nnatural : cliff\ndescription : nan\nvisiting_time : nan\nleisure : no information\ntourism : no information\npublic_transport : nan\nbrand : nan\nalt_name : nan\namenity : no information\nreservation : nan\nattraction : nan\nhighchair : nan\nparking : nan\nswimming_pool : nan\ncontact_phone : nan\ncommunity_centre : nan\naddr_street : nan\ncontact_twitter : nan\nsocial_facility : nan\ncontact_facebook : nan\nzoo : nan\nemail : nan\nwheelchair : nan\ncuisine : nan\ncontact_website : nan\ninternet_access : nan\nopening_hours_reception : nan\nguest_house : nan\naddr_city : nan\ncontact_instagram : nan\nimage : nan\nlocation : nan\noutdoor_seating : nan\nmuseum : nan\ntakeaway : nan\nsmoking : nan\nname : Sadystówka\nid : 11536\n\nphone : nan\ncemetery : nan\nemergency : nan\nopening_hours : nan\nwebsite : nan\npets_allowed : nan\ngeometry : POINT (20.0330849 50.0823406)\nhistoric : no information\nwiki_summary_en : no information\npostal_code : nan\ntoilets : nan\nnatural : no information\ndescription : nan\nvisiting_time : nan\nleisure : no information\ntourism : no information\npublic_transport : stop_position\nbrand : nan\nalt_name : nan\namenity : no information\nreservation : nan\nattraction : nan\nhighchair : nan\nparking : nan\nswimming_pool : nan\ncontact_phone : nan\ncommunity_centre : nan\naddr_street : nan\ncontact_twitter : nan\nsocial_facility : nan\ncontact_facebook : nan\nzoo : nan\nemail : nan\nwheelchair : nan\ncuisine : nan\ncontact_website : nan\ninternet_access : nan\nopening_hours_reception : nan\nguest_house : nan\naddr_city : nan\ncontact_instagram : nan\nimage : nan\nlocation : nan\noutdoor_seating : nan\nmuseum : nan\ntakeaway : nan\nsmoking : nan\nname : Teatr Ludowy 04\nid : 8353\n\nphone : nan\ncemetery : nan\nemergency : nan\nopening_hours : nan\nwebsite : nan\npets_allowed : nan\ngeometry : POINT (19.8975026 50.0935138)\nhistoric : no information\nwiki_summary_en : no information\npostal_code : nan\ntoilets : nan\nnatural : no information\ndescription : nan\nvisiting_time : nan\nleisure : no information\ntourism : no information\npublic_transport : stop_position\nbrand : nan\nalt_name : nan\namenity : no information\nreservation : nan\nattraction : nan\nhighchair : nan\nparking : nan\nswimming_pool : nan\ncontact_phone : nan\ncommunity_centre : nan\naddr_street : nan\ncontact_twitter : nan\nsocial_facility : nan\ncontact_facebook : nan\nzoo : nan\nemail : nan\nwheelchair : nan\ncuisine : nan\ncontact_website : nan\ninternet_access : nan\nopening_hours_reception : nan\nguest_house : nan\naddr_city : nan\ncontact_instagram : nan\nimage : nan\nlocation : nan\noutdoor_seating : nan\nmuseum : nan\ntakeaway : nan\nsmoking : nan\nname : Chełmońskiego Pętla 04\nid : 7604\n\nphone : nan\ncemetery : nan\nemergency : nan\nopening_hours : nan\nwebsite : nan\npets_allowed : nan\ngeometry : POINT (20.1199918 50.0727248)\nhistoric : no information\nwiki_summary_en : no information\npostal_code : nan\ntoilets : nan\nnatural : no information\ndescription : nan\nvisiting_time : nan\nleisure : no information\ntourism : no information\npublic_transport : stop_position\nbrand : nan\nalt_name : nan\namenity : no information\nreservation : nan\nattraction : nan\nhighchair : nan\nparking : nan\nswimming_pool : nan\ncontact_phone : nan\ncommunity_centre : nan\naddr_street : nan\ncontact_twitter : nan\nsocial_facility : nan\ncontact_facebook : nan\nzoo : nan\nemail : nan\nwheelchair : nan\ncuisine : nan\ncontact_website : nan\ninternet_access : nan\nopening_hours_reception : nan\nguest_house : nan\naddr_city : nan\ncontact_instagram : nan\nimage : nan\nlocation : nan\noutdoor_seating : nan\nmuseum : nan\ntakeaway : nan\nsmoking : nan\nname : Pleszów 04\nid : 8845\n\nphone : nan\ncemetery : nan\nemergency : nan\nopening_hours : nan\nwebsite : nan\npets_allowed : nan\ngeometry : POINT (20.0103363 50.065379)\nhistoric : no information\nwiki_summary_en : no information\npostal_code : nan\ntoilets : nan\nnatural : no information\ndescription : nan\nvisiting_time : nan\nleisure : no information\ntourism : no information\npublic_transport : stop_position\nbrand : nan\nalt_name : nan\namenity : no information\nreservation : nan\nattraction : nan\nhighchair : nan\nparking : nan\nswimming_pool : nan\ncontact_phone : nan\ncommunity_centre : nan\naddr_street : nan\ncontact_twitter : nan\nsocial_facility : nan\ncontact_facebook : nan\nzoo : nan\nemail : nan\nwheelchair : nan\ncuisine : nan\ncontact_website : nan\ninternet_access : nan\nopening_hours_reception : nan\nguest_house : nan\naddr_city : nan\ncontact_instagram : nan\nimage : nan\nlocation : nan\noutdoor_seating : nan\nmuseum : nan\ntakeaway : nan\nsmoking : nan\nname : Sołtysowska 04\nid : 9135\n\nphone : nan\ncemetery : nan\nemergency : nan\nopening_hours : nan\nwebsite : nan\npets_allowed : nan\ngeometry : POINT (19.9268166 50.056096)\nhistoric : no information\nwiki_summary_en : no information\npostal_code : nan\ntoilets : nan\nnatural : no information\ndescription : nan\nvisiting_time : nan\nleisure : no information\ntourism : no information\npublic_transport : stop_position\nbrand : nan\nalt_name : nan\namenity : no information\nreservation : nan\nattraction : nan\nhighchair : nan\nparking : nan\nswimming_pool : nan\ncontact_phone : nan\ncommunity_centre : nan\naddr_street : nan\ncontact_twitter : nan\nsocial_facility : nan\ncontact_facebook : nan\nzoo : nan\nemail : nan\nwheelchair : nan\ncuisine : nan\ncontact_website : nan\ninternet_access : nan\nopening_hours_reception : nan\nguest_house : nan\naddr_city : nan\ncontact_instagram : nan\nimage : nan\nlocation : nan\noutdoor_seating : nan\nmuseum : nan\ntakeaway : nan\nsmoking : nan\nname : Jubilat 04\nid : 7030\n\n",
  "answer": "I don't have enough information to answer that.",
  "labels": {
    "faithfulness": "FAITHFUL",
    "groundedness": "NON_GROUNDED",
    "relevance": "RELEVANT",
    "completeness": "PARTLY_COMPLETE",
    "coherence": "COHERENT",
    "conciseness": "CONCISE"
  },
  "quality_score": 4
}