{
  "model": "openai_llm",
  "prompt": "prompt_C",
  "id": 2184,
  "question": "What are Amici's hours of operation, and are they open on weekends?",
  "context": "phone : +48 12 656 56 25\ncemetery : nan\nemergency : nan\nopening_hours : We-Su 10:00-17:00\nwebsite : https://muzeumkrakowa.pl/oddzialy/apteka-pod-orlem\npets_allowed : nan\ngeometry : POINT (19.9541481 50.0462364)\nhistoric : no information\nwiki_summary_en : The Eagle Pharmacy Museum (Polish: Apteka Pod Orłem) is a branch of the Historical Museum of Kraków located in the Podgórze district of Kraków, Poland. Originally established as a private pharmacy in 1910, during World War II it operated within the Kraków Ghetto. Its owner, Tadeusz Pankiewicz, was the only non-Jewish Pole permitted to remain and operate a business inside the ghetto. The pharmacy served as a vital hub for clandestine aid, communication, and resistance, providing shelter, medical supplies, and moral support to the persecuted Jewish community. \nAfter the war, the site was gradually transformed into a commemorative museum. The permanent exhibition opened in 2003 following contributions from Holocaust survivor and filmmaker Roman Polanski.\npostal_code : nan\ntoilets : nan\nnatural : no information\ndescription : nan\nvisiting_time : nan\nleisure : no information\ntourism : museum\npublic_transport : nan\nbrand : nan\nalt_name : nan\namenity : no information\nreservation : nan\nattraction : nan\nhighchair : nan\nparking : nan\nswimming_pool : nan\ncontact_phone : nan\ncommunity_centre : nan\naddr_street : Plac Bohaterów Getta\ncontact_twitter : nan\nsocial_facility : nan\ncontact_facebook : nan\nzoo : nan\nemail : nan\nwheelchair : limited\ncuisine : nan\ncontact_website : nan\ninternet_access : nan\nopening_hours_reception : nan\nguest_house : nan\naddr_city : Kraków\ncontact_instagram : nan\nimage : nan\nlocation : nan\noutdoor_seating : nan\nmuseum : history\ntakeaway : nan\nsmoking : nan\nname : Apteka Pod Orłem;Eagle Pharmacy;Patika a Sas Alatt\nid : 2424\n\nphone : nan\ncemetery : nan\nemergency : nan\nopening_hours : nan\nwebsite : https://historia.agh.edu.pl/wiki/Muzeum_AGH\npets_allowed : nan\ngeometry : POINT (19.9222029 50.0660335)\nhistoric : no information\nwiki_summary_en : The Museum of the History of AGH and Technology – a university museum operating since 1960 as part of the unit \"Center for the History of Technology with the AGH Museum,\" established three years earlier. The museum exhibits are grouped into four sections:\n\nDepartment of the History of Crafts and Industry  \nModeling of Mining and Metallurgical Equipment  \nHall of the History of AGH  \nExhibition about the University's relations with Pope John Paul II  \nThe museum is open daily from 10:00 AM to 2:00 PM - free admission. Visits are by telephone reservation.\npostal_code : nan\ntoilets : nan\nnatural : no information\ndescription : nan\nvisiting_time : nan\nleisure : no information\ntourism : museum\npublic_transport : nan\nbrand : nan\nalt_name : nan\namenity : no information\nreservation : nan\nattraction : nan\nhighchair : nan\nparking : nan\nswimming_pool : nan\ncontact_phone : nan\ncommunity_centre : nan\naddr_street : Aleja Adama Mickiewicza\ncontact_twitter : nan\nsocial_facility : nan\ncontact_facebook : nan\nzoo : nan\nemail : nan\nwheelchair : nan\ncuisine : nan\ncontact_website : nan\ninternet_access : nan\nopening_hours_reception : nan\nguest_house : nan\naddr_city : Kraków\ncontact_instagram : nan\nimage : nan\nlocation : nan\noutdoor_seating : nan\nmuseum : nan\ntakeaway : nan\nsmoking : nan\nname : Muzeum AGH\nid : 2894\n\nphone : +48 12 3957065\ncemetery : nan\nemergency : nan\nopening_hours : Tu-Th 09:00-17:00; Fr-Su 09:00-19:00; PH off\nwebsite : https://www.cogiteon.pl/\npets_allowed : nan\ngeometry : MULTIPOLYGON (((19.9898496 50.0852354, 19.9903389 50.0851391, 19.9904527 50.0851167, 19.9904573 50.0851263, 19.990487 50.0851888, 19.9898762 50.0853096, 19.9898587 50.0853131, 19.9899393 50.0853806, 19.9901311 50.0855413, 19.9903675 50.0857393, 19.990383 50.0857363, 19.990389 50.0857351, 19.9911684 50.0855815, 19.9911743 50.0855803, 19.9911902 50.0855772, 19.9912277 50.0851656, 19.9912391 50.0850402, 19.991223 50.0850434, 19.990689 50.0851489, 19.9906594 50.0850866, 19.9906548 50.0850769, 19.9907686 50.0850545, 19.9908231 50.0850437, 19.9911631 50.0849767, 19.9911792 50.0849736, 19.9912005 50.0849694, 19.9912303 50.0849635, 19.9912472 50.0849602, 19.9912491 50.0849235, 19.991256 50.0847964, 19.9912452 50.0847985, 19.9912221 50.0848031, 19.9905694 50.0849319, 19.9904761 50.0849507, 19.990402 50.0849657, 19.989673 50.0851088, 19.9896443 50.0851145, 19.989632 50.0851169, 19.9897839 50.0852483, 19.9897996 50.0852452, 19.9898496 50.0852354)), ((19.9907781 50.0859263, 19.990934 50.0858956, 19.9911429 50.0858543, 19.9911496 50.085853, 19.9911649 50.08585, 19.9911744 50.0857455, 19.9911824 50.0856577, 19.991167 50.0856607, 19.9908515 50.0857231, 19.9906191 50.085769, 19.9904595 50.0858006, 19.9904444 50.0858036, 19.9905288 50.0858746, 19.9906258 50.0859563, 19.9906409 50.0859534, 19.9906469 50.0859522, 19.9907781 50.0859263)), ((19.9911563 50.0859308, 19.9911422 50.0859336, 19.990969 50.0859679, 19.9908122 50.0859989, 19.9907296 50.0860153, 19.9907174 50.0860177, 19.9907028 50.0860206, 19.9910015 50.0862716, 19.9911174 50.086369, 19.9911277 50.0862533, 19.9911465 50.0860414, 19.9911563 50.0859308)))\nhistoric : no information\nwiki_summary_en : Małopolskie Centrum Nauki Cogiteon – a science center, a cultural institution of the Małopolskie Voivodeship. Its aim is to educate through play and to engage in independent or team scientific experiments, research projects, and social initiatives. \n\nFormally, the institution was established in December 2017. By mid-2022, a headquarters is to be built in the Krakow district of Czyżyny, according to a design prepared by the Wrocław office of Heinle, Wischer und Partner Architekci. The project was selected through an architectural competition, with the results announced on February 17, 2018. The estimated value of the project is approximately 120 million PLN. \n\nThe building will include, among other things, a permanent exhibition, the main theme of which will be humanity. Until the construction investment is realized, the Center intends to carry out its mission, among others, through the activities of the Mobile Exhibition \"Naukowiej.\" The exhibition has been operating since February 2019 and is housed in a retractable trailer. It features several exhibits dedicated to the theme of air. The exhibition aims to visit all municipalities in the Małopolskie Voivodeship. \n\nDespite the lack of finality of the decision regarding the entry in the register of cultural landscape monuments and the absence of consideration of appeals against the issued building permit, construction work began at the end of March 2021. In the second week of May of the same year, the final decision on the entry into the register was signed, while all appeals were dismissed. \n\nOn April 5, 2024, the general contractor handed over the building of the Science Center. At the same time, the dates for the opening ceremony were announced for June 21 and 22, 2024.\npostal_code : nan\ntoilets : nan\nnatural : no information\ndescription : nan\nvisiting_time : nan\nleisure : no information\ntourism : museum\npublic_transport : nan\nbrand : nan\nalt_name : MCN Cogiteon\namenity : no information\nreservation : nan\nattraction : nan\nhighchair : nan\nparking : nan\nswimming_pool : nan\ncontact_phone : nan\ncommunity_centre : nan\naddr_street : Izydora Stella-Sawickiego\ncontact_twitter : https://x.com/cogiteon\nsocial_facility : nan\ncontact_facebook : https://www.facebook.com/cogiteon\nzoo : nan\nemail : biuro@cogiteon.pl\nwheelchair : nan\ncuisine : nan\ncontact_website : nan\ninternet_access : nan\nopening_hours_reception : nan\nguest_house : nan\naddr_city : Kraków\ncontact_instagram : https://www.instagram.com/cogiteon.pl\nimage : nan\nlocation : nan\noutdoor_seating : nan\nmuseum : science\ntakeaway : nan\nsmoking : nan\nname : Małopolskie Centrum Nauki Cogiteon;Małopolska Science Center Cogiteon;MCN Cogiteon;Cogiteon\nid : 3420\n\nphone : +48 12 422 05 21\ncemetery : nan\nemergency : nan\nopening_hours : Mo-Sa 11:30-18:00; Su 14:00-18:00\nwebsite : https://mariacki.com\npets_allowed : nan\ngeometry : POLYGON ((19.9389202 50.0616958, 19.9389203 50.061699, 19.9389308 50.0616987, 19.9389329 50.0617701, 19.9390219 50.061769, 19.9390222 50.0617899, 19.939069 50.0617897, 19.9390689 50.0617933, 19.9390767 50.061793, 19.9390802 50.0618409, 19.939344 50.0618351, 19.939351 50.0618316, 19.9393529 50.0618287, 19.9393987 50.0618276, 19.9394004 50.0618305, 19.9394044 50.0618316, 19.9394074 50.0618335, 19.9395723 50.0618301, 19.9395709 50.0618076, 19.9396872 50.0618003, 19.9398112 50.0617858, 19.9398073 50.0617685, 19.9399081 50.0617606, 19.9399015 50.0617225, 19.9399401 50.0617198, 19.93994 50.0617183, 19.9399602 50.061717, 19.9399606 50.0617186, 19.9399692 50.061718, 19.9399702 50.0617194, 19.9399813 50.0617187, 19.9399899 50.0617279, 19.9399952 50.0617288, 19.9400217 50.0617113, 19.9400209 50.0617098, 19.9400369 50.0616991, 19.9400395 50.0616999, 19.9400659 50.0616821, 19.9400651 50.0616789, 19.9400511 50.0616717, 19.940056 50.061665, 19.9400547 50.0616639, 19.9400564 50.0616076, 19.940059 50.0616066, 19.9400525 50.0615991, 19.940068 50.0615934, 19.9400674 50.0615901, 19.9399952 50.0615393, 19.9399396 50.0615406, 19.9399397 50.0615398, 19.9399158 50.0615402, 19.9399161 50.0615412, 19.939878 50.0615421, 19.9398787 50.0615519, 19.9398721 50.0615521, 19.9398723 50.0615544, 19.9397785 50.0615573, 19.9397782 50.0615557, 19.9397579 50.0615566, 19.9397579 50.0615578, 19.9397104 50.0615598, 19.9397104 50.0615587, 19.9396443 50.0615601, 19.9396455 50.0615812, 19.9396154 50.0615819, 19.9396132 50.0615889, 19.9396 50.0615893, 19.9395861 50.0615896, 19.9395829 50.0615827, 19.9395486 50.0615837, 19.9395448 50.0615299, 19.9395668 50.0615144, 19.939553 50.0614859, 19.939531 50.0614753, 19.9395071 50.0614763, 19.9393837 50.0614812, 19.9393762 50.0614839, 19.9393761 50.0614869, 19.9393269 50.0614876, 19.9393264 50.0614846, 19.9393189 50.0614835, 19.939314 50.0614832, 19.9393132 50.0614736, 19.9392723 50.0614752, 19.9392747 50.0614847, 19.9390605 50.0614909, 19.9390002 50.0614946, 19.9390017 50.0615307, 19.9390053 50.0615305, 19.9390062 50.0615472, 19.9389247 50.0615485, 19.9389213 50.0616186, 19.9389157 50.0616188, 19.9389159 50.0616254, 19.9388923 50.0616254, 19.9388892 50.0616186, 19.938877 50.0616213, 19.9388797 50.0616277, 19.9388474 50.0616408, 19.9388378 50.0616376, 19.9388319 50.0616448, 19.9388419 50.0616479, 19.938842 50.0616615, 19.9388421 50.0616746, 19.938833 50.0616782, 19.9388394 50.0616852, 19.9388485 50.0616816, 19.9388831 50.061693, 19.93888 50.0616998, 19.9388918 50.0617023, 19.9388965 50.061696, 19.9389202 50.0616958))\nhistoric : church\nwiki_summary_en : The Church of the Assumption of the Blessed Virgin Mary (Polish: Kościół Wniebowzięcia Najświętszej Marii Panny), known colloquially as the St. Mary's Church (Polish: Kościół Mariacki), is a historic Roman Catholic parish church located at Mariacki Square at the north-eastern corner of the Main Market Square in the Old Town of Kraków, Poland.\nIt is a Brick Gothic church. Built in the 14th century, its foundations date back to the early 13th century and serve as one of the best examples of Polish Gothic architecture. Standing 80 m (262 ft) tall, it is particularly famous for its wooden altarpiece carved by Veit Stoss (Wit Stwosz). Some of its monumental polychrome murals were designed by Poland's leading history painter, Jan Matejko (1838–1893). In 1978, it became a UNESCO World Heritage Site alongside the Historic Centre of Kraków.\nOn every hour, 24 hours a day, 365 days a year, a trumpet signal—called the Hejnał mariacki—is played from the top of the taller of Saint Mary's two towers. The plaintive tune breaks off in mid-stream, to commemorate a famous 13th-century trumpeter who was shot in the throat while sounding the alarm before a Mongol attack on the city. The noon-time hejnał is heard across Poland and abroad broadcast live by Polish Radio Jedynka.\nSaint Mary's Basilica also served as an architectural model for many of the churches that were built by the Polish diaspora abroad, particularly those like Saint Michael's and Saint John Cantius in Chicago, designed in the Polish Cathedral style.\nThe church is familiar to many English-speaking readers from the 1928 book The Trumpeter of Krakow by Eric P. Kelly.\npostal_code : nan\ntoilets : nan\nnatural : no information\ndescription : nan\nvisiting_time : nan\nleisure : no information\ntourism : attraction\npublic_transport : nan\nbrand : nan\nalt_name : Kościół pw. Wniebowzięcia Najświętszej Maryi Panny\namenity : place_of_worship\nreservation : nan\nattraction : nan\nhighchair : nan\nparking : nan\nswimming_pool : nan\ncontact_phone : nan\ncommunity_centre : nan\naddr_street : Plac Mariacki\ncontact_twitter : nan\nsocial_facility : nan\ncontact_facebook : nan\nzoo : nan\nemail : biuro@mariacki.com\nwheelchair : yes\ncuisine : nan\ncontact_website : nan\ninternet_access : nan\nopening_hours_reception : nan\nguest_house : nan\naddr_city : Kraków\ncontact_instagram : nan\nimage : nan\nlocation : nan\noutdoor_seating : nan\nmuseum : nan\ntakeaway : nan\nsmoking : nan\nname : Bazylika Wniebowzięcia Najświętszej Maryi Panny;St. Mary's Basilica;Kościół pw. Wniebowzięcia Najświętszej Maryi Panny;Iglesia de Santa María;Bazylika Mariacka;Церква Успіння Пресвятої Богородиці;Marienbasilika;Мариацкий костёл;Mária Mennybevétele templom;Касцёл Унебаўзняцця Найсвяцейшай Панны Марыі;Basilica di Santa Maria;Kościół Mariacki;Basilique Sainte-Marie;Krokuvos Šv. Marijos bazilika;聖母聖殿;성모 승천 대성당;Krakówi Maria kirik;Sanktuarium Matki Bożej Częstochowskiej\nid : 3443\n\nphone : +48 664 633 955\ncemetery : nan\nemergency : nan\nopening_hours : Mo-Sa 09:00-21:00; Su 10:00-21:00\nwebsite : https://galeriabronowice.pl/\npets_allowed : nan\ngeometry : POLYGON ((19.8953594 50.0926198, 19.8954699 50.092863, 19.895659 50.0932817, 19.8959762 50.0932245, 19.896005 50.0932838, 19.8964531 50.0932006, 19.896426 50.0931389, 19.8966396 50.0930989, 19.8967832 50.093072, 19.8969047 50.0932353, 19.897622 50.0930084, 19.8975727 50.0929445, 19.8976591 50.0929164, 19.8977066 50.0929803, 19.898422 50.0927546, 19.8983481 50.0926576, 19.8984428 50.0926277, 19.8985375 50.0925978, 19.8986115 50.0926936, 19.8989947 50.0925726, 19.8995264 50.0924048, 19.8994771 50.0923397, 19.8995654 50.0923129, 19.8996128 50.0923768, 19.8998621 50.0922979, 19.9000692 50.0922324, 19.9003301 50.0921498, 19.9002315 50.0920209, 19.9002908 50.0920038, 19.9007299 50.0918623, 19.9004801 50.0915354, 19.9006621 50.0914769, 19.900686 50.0914648, 19.900695 50.091454, 19.9007004 50.0914445, 19.9007039 50.0914349, 19.9007037 50.0914242, 19.900696 50.0914064, 19.9005708 50.0912431, 19.9005539 50.091229, 19.9005315 50.0912208, 19.9005185 50.0912185, 19.9004945 50.0912164, 19.9004575 50.0912214, 19.9002865 50.0912751, 19.9002623 50.0912431, 19.9002391 50.0912124, 19.9003843 50.0911637, 19.9004248 50.0911502, 19.9004485 50.0911322, 19.9004592 50.0911107, 19.9004552 50.0910941, 19.9004475 50.0910798, 19.9003299 50.090926, 19.9003074 50.0909084, 19.9002757 50.0908967, 19.9002479 50.0908922, 19.9002165 50.0908983, 19.9001321 50.0909249, 19.9000418 50.0909533, 19.9000344 50.0909509, 19.8998174 50.0910205, 19.8997567 50.0909412, 19.8997052 50.0909571, 19.899764 50.0910363, 19.8995768 50.0910971, 19.8995673 50.0910829, 19.8994643 50.0911146, 19.8994738 50.0911277, 19.8993303 50.0911728, 19.8992201 50.0911189, 19.8990564 50.091169, 19.8990337 50.0911394, 19.8989399 50.0911711, 19.8990195 50.0912728, 19.8987749 50.0913509, 19.8987654 50.0913379, 19.8986661 50.0913684, 19.8986756 50.0913838, 19.8986278 50.0913984, 19.8985194 50.0913409, 19.8983208 50.0914041, 19.8981627 50.0914544, 19.8981779 50.0914769, 19.8981668 50.0914805, 19.898182 50.0915019, 19.8981949 50.0914958, 19.8982158 50.0915266, 19.8980778 50.0915693, 19.8980533 50.0915409, 19.8978951 50.0915921, 19.897916 50.0916217, 19.8974655 50.0917646, 19.8970737 50.0918889, 19.8970585 50.0918688, 19.8970015 50.0918871, 19.8970167 50.0919084, 19.8968273 50.0919682, 19.896276 50.0920712, 19.8962965 50.0921029, 19.8963069 50.09214, 19.8953427 50.0923212, 19.8954662 50.0925964, 19.8953594 50.0926198))\nhistoric : no information\nwiki_summary_en : Galeria Bronowice – one of the largest shopping malls in Krakow, located on Stawowa Street, near the Roundabout of Katyń Victims. Built and managed by the French investor Immochan (now Ceetrus), who manages stores under the Auchan brand.\npostal_code : nan\ntoilets : yes\nnatural : no information\ndescription : nan\nvisiting_time : nan\nleisure : no information\ntourism : no information\npublic_transport : nan\nbrand : nan\nalt_name : nan\namenity : no information\nreservation : nan\nattraction : nan\nhighchair : nan\nparking : nan\nswimming_pool : nan\ncontact_phone : nan\ncommunity_centre : nan\naddr_street : Stawowa\ncontact_twitter : nan\nsocial_facility : nan\ncontact_facebook : nan\nzoo : nan\nemail : nan\nwheelchair : yes\ncuisine : nan\ncontact_website : nan\ninternet_access : wlan\nopening_hours_reception : nan\nguest_house : nan\naddr_city : Kraków\ncontact_instagram : nan\nimage : nan\nlocation : nan\noutdoor_seating : nan\nmuseum : nan\ntakeaway : nan\nsmoking : nan\nname : Galeria Bronowice\nid : 9581\n\nphone : nan\ncemetery : nan\nemergency : nan\nopening_hours : nan\nwebsite : https://www.centrumserenada.pl\npets_allowed : nan\ngeometry : POLYGON ((19.9844823 50.0883036, 19.9845887 50.0879426, 19.9845967 50.0879135, 19.9846258 50.0878126, 19.984631 50.0877968, 19.9846399 50.0877671, 19.9846572 50.0877095, 19.9846958 50.0875811, 19.9848446 50.0875435, 19.9849449 50.0875181, 19.9851271 50.087472, 19.9851972 50.0874546, 19.9861524 50.0872127, 19.986187 50.0872065, 19.9862121 50.0872052, 19.9862439 50.0872051, 19.9862686 50.0872082, 19.986302 50.0872153, 19.9863412 50.0872307, 19.9863628 50.0872424, 19.9863813 50.0872571, 19.9863929 50.0872689, 19.986404 50.0872843, 19.9865529 50.0876391, 19.9865867 50.0876885, 19.9866377 50.087763, 19.9866653 50.0878034, 19.9866942 50.0878455, 19.9868607 50.0880889, 19.9868675 50.0880989, 19.9870412 50.0883526, 19.9870419 50.0883743, 19.987054 50.088818, 19.9869871 50.0888789, 19.9862305 50.0887952, 19.9847365 50.0886299, 19.9846411 50.0886194, 19.9845086 50.0886047, 19.9845187 50.088571, 19.9845301 50.0885326, 19.9845314 50.0885283, 19.9845692 50.0884016, 19.9844823 50.0883036))\nhistoric : no information\nwiki_summary_en : Centrum Serenada – a shopping center with an area of 42,000 m², located at al. Gen. T. Bora–Komorowskiego 41 in northern Krakow, opened in October 2017.\npostal_code : nan\ntoilets : nan\nnatural : no information\ndescription : nan\nvisiting_time : nan\nleisure : no information\ntourism : no information\npublic_transport : nan\nbrand : nan\nalt_name : nan\namenity : no information\nreservation : nan\nattraction : nan\nhighchair : nan\nparking : nan\nswimming_pool : nan\ncontact_phone : nan\ncommunity_centre : nan\naddr_street : Aleja Generała Tadeusza Bora-Komorowskiego\ncontact_twitter : nan\nsocial_facility : nan\ncontact_facebook : nan\nzoo : nan\nemail : nan\nwheelchair : yes\ncuisine : nan\ncontact_website : nan\ninternet_access : nan\nopening_hours_reception : nan\nguest_house : nan\naddr_city : Kraków\ncontact_instagram : nan\nimage : nan\nlocation : nan\noutdoor_seating : nan\nmuseum : nan\ntakeaway : nan\nsmoking : nan\nname : Centrum Serenada\nid : 9607\n\nphone : nan\ncemetery : nan\nemergency : nan\nopening_hours : nan\nwebsite : nan\npets_allowed : nan\ngeometry : POLYGON ((19.8090941 50.0154597, 19.8091083 50.0155249, 19.8091742 50.015519, 19.8091785 50.0155369, 19.8091849 50.0155399, 19.8092174 50.0155375, 19.8091965 50.0154503, 19.8090941 50.0154597))\nhistoric : no information\nwiki_summary_en : no information\npostal_code : nan\ntoilets : nan\nnatural : no information\ndescription : nan\nvisiting_time : nan\nleisure : no information\ntourism : no information\npublic_transport : nan\nbrand : nan\nalt_name : nan\namenity : fast_food\nreservation : nan\nattraction : nan\nhighchair : nan\nparking : nan\nswimming_pool : nan\ncontact_phone : nan\ncommunity_centre : nan\naddr_street : nan\ncontact_twitter : nan\nsocial_facility : nan\ncontact_facebook : nan\nzoo : nan\nemail : nan\nwheelchair : nan\ncuisine : kebab\ncontact_website : nan\ninternet_access : nan\nopening_hours_reception : nan\nguest_house : nan\naddr_city : nan\ncontact_instagram : nan\nimage : nan\nlocation : nan\noutdoor_seating : nan\nmuseum : nan\ntakeaway : nan\nsmoking : nan\nname : Amici\nid : 2184\n\nphone : nan\ncemetery : nan\nemergency : nan\nopening_hours : Mo-Su 09:00-21:00\nwebsite : nan\npets_allowed : nan\ngeometry : POINT (19.9473247 50.0682829)\nhistoric : no information\nwiki_summary_en : no information\npostal_code : nan\ntoilets : nan\nnatural : no information\ndescription : nan\nvisiting_time : nan\nleisure : no information\ntourism : no information\npublic_transport : nan\nbrand : nan\nalt_name : nan\namenity : cafe\nreservation : nan\nattraction : nan\nhighchair : nan\nparking : nan\nswimming_pool : nan\ncontact_phone : nan\ncommunity_centre : nan\naddr_street : nan\ncontact_twitter : nan\nsocial_facility : nan\ncontact_facebook : nan\nzoo : nan\nemail : nan\nwheelchair : nan\ncuisine : nan\ncontact_website : nan\ninternet_access : nan\nopening_hours_reception : nan\nguest_house : nan\naddr_city : nan\ncontact_instagram : nan\nimage : nan\nlocation : nan\noutdoor_seating : nan\nmuseum : nan\ntakeaway : nan\nsmoking : nan\nname : Deli Sandwich\nid : 1657\n\n",
  "answer": "Amici's hours of operation are from Monday to Sunday, 09:00 to 21:00. Yes, they are open on weekends.",
  "labels": {
    "faithfulness": "FAITHFUL",
    "groundedness": "GROUNDED",
    "relevance": "RELEVANT",
    "completeness": "COMPLETE",
    "coherence": "COHERENT",
    "conciseness": "CONCISE"
  },
  "quality_score": 6
}