{
  "model": "openai_llm",
  "prompt": "prompt_C",
  "id": 2424,
  "question": "What are the opening hours for visiting the Eagle Pharmacy Museum in Kraków?",
  "context": "phone : +48 12 421 92 79\ncemetery : nan\nemergency : nan\nopening_hours : We-Sa 09:30-15:00; Tu 12:00-18:30\nwebsite : http://muzeum.farmacja.uj.edu.pl\npets_allowed : nan\ngeometry : POINT (19.9403302 50.0632264)\nhistoric : no information\nwiki_summary_en : Muzeum Farmacji Collegium Medicum Uniwersytetu Jagiellońskiego (Pharmacy Museum, Jagiellonian University Medical College) is a museum on Floriańska Street, Kraków, Poland, specializing in the history of pharmacy and pharmaceutical technology. It was established in 1946.\nThe museum was founded by Stanisław Proń, legal counsel and administrative director of the Regional Chamber of Pharmacists in Kraków. Until the late 1980s, the museum was housed in the building at 3 ul. Basztowa. It was then transferred to the newly renovated building at ul. St. Florian's, where it remains today. \nIt is the largest and oldest Museum of Pharmacy in Poland, and one of the largest museums of its kind in the world.\nThe museum occupies all five floors of the building, including the basement and the attic, in a manner appropriate to the historical use of such premises in as an apothecary. On the first floor is a room dedicated to Ignacy Łukasiewicz, a pharmacist, pioneer in the field of crude oil, and the inventor of the modern kerosene lamp. The room on the second floor of the exhibition is devoted to Tadeusz Pankiewicz, a Roman Catholic who ran the \"Under the Eagle\" pharmacy in the Kraków Ghetto during the Nazi occupation of Poland. Among the various exhibits of pharmaceutical technology are weights of less than one gram as patented by Marian Zahradnik, the shape of which indicates their importance. Such weights were adopted in the countries of the Austro-Hungarian Empire and later across Europe, and are still used with minor modifications. Another interesting invention is an electrical device to sterilize prescriptions. It was to protect the pharmacist from infection by germs transferred on the prescription.\n\n\n== References ==\npostal_code : nan\ntoilets : nan\nnatural : no information\ndescription : nan\nvisiting_time : nan\nleisure : no information\ntourism : museum\npublic_transport : nan\nbrand : nan\nalt_name : nan\namenity : no information\nreservation : nan\nattraction : nan\nhighchair : nan\nparking : nan\nswimming_pool : nan\ncontact_phone : nan\ncommunity_centre : nan\naddr_street : Floriańska\ncontact_twitter : nan\nsocial_facility : nan\ncontact_facebook : nan\nzoo : nan\nemail : mf1@mp.pl\nwheelchair : nan\ncuisine : nan\ncontact_website : nan\ninternet_access : nan\nopening_hours_reception : nan\nguest_house : nan\naddr_city : Kraków\ncontact_instagram : nan\nimage : nan\nlocation : nan\noutdoor_seating : nan\nmuseum : nan\ntakeaway : nan\nsmoking : nan\nname : Muzeum Farmacji UJ;Museum of Pharmacy;Музей фармацевтики;Patikamúzeum\nid : 2408\n\nphone : +48 12 656 56 25\ncemetery : nan\nemergency : nan\nopening_hours : We-Su 10:00-17:00\nwebsite : https://muzeumkrakowa.pl/oddzialy/apteka-pod-orlem\npets_allowed : nan\ngeometry : POINT (19.9541481 50.0462364)\nhistoric : no information\nwiki_summary_en : The Eagle Pharmacy Museum (Polish: Apteka Pod Orłem) is a branch of the Historical Museum of Kraków located in the Podgórze district of Kraków, Poland. Originally established as a private pharmacy in 1910, during World War II it operated within the Kraków Ghetto. Its owner, Tadeusz Pankiewicz, was the only non-Jewish Pole permitted to remain and operate a business inside the ghetto. The pharmacy served as a vital hub for clandestine aid, communication, and resistance, providing shelter, medical supplies, and moral support to the persecuted Jewish community. \nAfter the war, the site was gradually transformed into a commemorative museum. The permanent exhibition opened in 2003 following contributions from Holocaust survivor and filmmaker Roman Polanski.\npostal_code : nan\ntoilets : nan\nnatural : no information\ndescription : nan\nvisiting_time : nan\nleisure : no information\ntourism : museum\npublic_transport : nan\nbrand : nan\nalt_name : nan\namenity : no information\nreservation : nan\nattraction : nan\nhighchair : nan\nparking : nan\nswimming_pool : nan\ncontact_phone : nan\ncommunity_centre : nan\naddr_street : Plac Bohaterów Getta\ncontact_twitter : nan\nsocial_facility : nan\ncontact_facebook : nan\nzoo : nan\nemail : nan\nwheelchair : limited\ncuisine : nan\ncontact_website : nan\ninternet_access : nan\nopening_hours_reception : nan\nguest_house : nan\naddr_city : Kraków\ncontact_instagram : nan\nimage : nan\nlocation : nan\noutdoor_seating : nan\nmuseum : history\ntakeaway : nan\nsmoking : nan\nname : Apteka Pod Orłem;Eagle Pharmacy;Patika a Sas Alatt\nid : 2424\n\nphone : nan\ncemetery : nan\nemergency : nan\nopening_hours : Mo-Su 10:00-20:00; Tu 10:00-16:00; Nov-Mar: Mo,We,Th 10:00-19:00; Nov-Mar: Tu 10:00-14:00; Nov-Mar: Fr-Su 10:00-20:00\nwebsite : https://muzeumkrakowa.pl/oddzialy/rynek-podziemny\npets_allowed : nan\ngeometry : POINT (19.9377745 50.061996)\nhistoric : no information\nwiki_summary_en : The Rynek Underground museum of Kraków is situated below the market square of the city. The museum is approximately 4000 square meters in size.\nWork on the museum first began in 2009 with a budget of 38 million złotys, equal to approximately 9.3 million United States dollars (2023). The museum was opened on September 24, 2010. The main exhibit \"In the Footsteps of Krakow's European Identity\" was launched three days after the museum's opening, on September 27, 2010.\npostal_code : nan\ntoilets : nan\nnatural : no information\ndescription : nan\nvisiting_time : nan\nleisure : no information\ntourism : museum\npublic_transport : nan\nbrand : nan\nalt_name : nan\namenity : no information\nreservation : nan\nattraction : nan\nhighchair : nan\nparking : nan\nswimming_pool : nan\ncontact_phone : nan\ncommunity_centre : nan\naddr_street : Rynek Główny\ncontact_twitter : nan\nsocial_facility : nan\ncontact_facebook : nan\nzoo : nan\nemail : nan\nwheelchair : limited\ncuisine : nan\ncontact_website : nan\ninternet_access : nan\nopening_hours_reception : nan\nguest_house : nan\naddr_city : Kraków\ncontact_instagram : nan\nimage : nan\nlocation : nan\noutdoor_seating : nan\nmuseum : history\ntakeaway : nan\nsmoking : nan\nname : Rynek Podziemny;Rynek Underground;Подземелье рынка;Föld alatti Piac tér\nid : 2430\n\nphone : nan\ncemetery : nan\nemergency : nan\nopening_hours : Apr-Oct: Mo-Su 10:00-17:30; Nov-Mar: Mo-Tu off; We-Su 10:00-17:00\nwebsite : https://muzeumkrakowa.pl/oddzialy/ulica-pomorska\npets_allowed : nan\ngeometry : POINT (19.9249265 50.0706881)\nhistoric : no information\nwiki_summary_en : The Historical Museum of the City of Kraków (Polish: Muzeum Historyczne Miasta Krakowa) in Kraków, Lesser Poland, was granted the status of an independent institution in 1945. Originally, it was a branch of the Old Records Office of Kraków, in operation from 1899.\nThe museum's main location is the baroque Krzysztofory Palace.\npostal_code : nan\ntoilets : nan\nnatural : no information\ndescription : nan\nvisiting_time : nan\nleisure : no information\ntourism : museum\npublic_transport : nan\nbrand : nan\nalt_name : nan\namenity : no information\nreservation : nan\nattraction : nan\nhighchair : nan\nparking : nan\nswimming_pool : nan\ncontact_phone : nan\ncommunity_centre : nan\naddr_street : nan\ncontact_twitter : nan\nsocial_facility : nan\ncontact_facebook : nan\nzoo : nan\nemail : nan\nwheelchair : nan\ncuisine : nan\ncontact_website : nan\ninternet_access : nan\nopening_hours_reception : nan\nguest_house : nan\naddr_city : nan\ncontact_instagram : nan\nimage : nan\nlocation : nan\noutdoor_seating : nan\nmuseum : history\ntakeaway : nan\nsmoking : nan\nname : Ulica Pomorska;Pomorska Street;Pomorska utca\nid : 2759\n\nphone : nan\ncemetery : nan\nemergency : nan\nopening_hours : nan\nwebsite : https://historia.agh.edu.pl/wiki/Muzeum_AGH\npets_allowed : nan\ngeometry : POINT (19.9222029 50.0660335)\nhistoric : no information\nwiki_summary_en : The Museum of the History of AGH and Technology – a university museum operating since 1960 as part of the unit \"Center for the History of Technology with the AGH Museum,\" established three years earlier. The museum exhibits are grouped into four sections:\n\nDepartment of the History of Crafts and Industry  \nModeling of Mining and Metallurgical Equipment  \nHall of the History of AGH  \nExhibition about the University's relations with Pope John Paul II  \nThe museum is open daily from 10:00 AM to 2:00 PM - free admission. Visits are by telephone reservation.\npostal_code : nan\ntoilets : nan\nnatural : no information\ndescription : nan\nvisiting_time : nan\nleisure : no information\ntourism : museum\npublic_transport : nan\nbrand : nan\nalt_name : nan\namenity : no information\nreservation : nan\nattraction : nan\nhighchair : nan\nparking : nan\nswimming_pool : nan\ncontact_phone : nan\ncommunity_centre : nan\naddr_street : Aleja Adama Mickiewicza\ncontact_twitter : nan\nsocial_facility : nan\ncontact_facebook : nan\nzoo : nan\nemail : nan\nwheelchair : nan\ncuisine : nan\ncontact_website : nan\ninternet_access : nan\nopening_hours_reception : nan\nguest_house : nan\naddr_city : Kraków\ncontact_instagram : nan\nimage : nan\nlocation : nan\noutdoor_seating : nan\nmuseum : nan\ntakeaway : nan\nsmoking : nan\nname : Muzeum AGH\nid : 2894\n\nphone : nan\ncemetery : nan\nemergency : nan\nopening_hours : nan\nwebsite : nan\npets_allowed : nan\ngeometry : MULTIPOLYGON (((19.9542864 50.0464623, 19.9542955 50.0464634, 19.9542971 50.0464579, 19.9542879 50.0464568, 19.9542864 50.0464623)), ((19.9544066 50.0464806, 19.9544081 50.0464752, 19.954399 50.0464741, 19.9543974 50.0464796, 19.9544066 50.0464806)), ((19.9542717 50.0465269, 19.9542733 50.0465215, 19.9542641 50.0465204, 19.9542625 50.0465258, 19.9542717 50.0465269)), ((19.9543736 50.0465431, 19.9543827 50.0465442, 19.9543843 50.0465387, 19.9543751 50.0465377, 19.9543736 50.0465431)), ((19.9543593 50.0466088, 19.9543609 50.0466033, 19.9543517 50.0466022, 19.9543501 50.0466077, 19.9543593 50.0466088)), ((19.9543379 50.0466715, 19.9543394 50.046666, 19.9543302 50.0466649, 19.9543287 50.0466704, 19.9543379 50.0466715)), ((19.9543072 50.0467351, 19.9543164 50.0467362, 19.954318 50.0467308, 19.9543088 50.0467297, 19.9543072 50.0467351)), ((19.9542923 50.0467986, 19.9542938 50.0467931, 19.9542846 50.0467921, 19.9542831 50.0467975, 19.9542923 50.0467986)), ((19.954403 50.0468132, 19.9544046 50.0468078, 19.9543954 50.0468067, 19.9543938 50.0468121, 19.954403 50.0468132)), ((19.9542611 50.0468629, 19.9542703 50.046864, 19.9542718 50.0468586, 19.9542626 50.0468575, 19.9542611 50.0468629)), ((19.954381 50.0468786, 19.9543826 50.0468732, 19.9543734 50.0468721, 19.9543718 50.0468776, 19.954381 50.0468786)), ((19.9542515 50.046925, 19.954253 50.0469196, 19.9542439 50.0469185, 19.9542423 50.0469239, 19.9542515 50.046925)), ((19.9543437 50.0469822, 19.9543529 50.0469833, 19.9543544 50.0469778, 19.9543453 50.0469768, 19.9543437 50.0469822)), ((19.9545173 50.0464953, 19.9545189 50.0464898, 19.9545097 50.0464887, 19.9545082 50.0464942, 19.9545173 50.0464953)), ((19.9546268 50.046512, 19.9546283 50.0465066, 19.9546191 50.0465055, 19.9546176 50.046511, 19.9546268 50.046512)), ((19.9544843 50.0465577, 19.9544935 50.0465588, 19.954495 50.0465534, 19.9544859 50.0465523, 19.9544843 50.0465577)), ((19.9546029 50.0465756, 19.9546045 50.0465702, 19.9545953 50.0465691, 19.9545938 50.0465745, 19.9546029 50.0465756)), ((19.9544701 50.0466234, 19.9544716 50.046618, 19.9544624 50.0466169, 19.9544609 50.0466223, 19.9544701 50.0466234)), ((19.9545703 50.0466391, 19.9545795 50.0466402, 19.9545811 50.0466347, 19.9545719 50.0466337, 19.9545703 50.0466391)), ((19.9544486 50.0466861, 19.9544502 50.0466806, 19.954441 50.0466796, 19.9544394 50.046685, 19.9544486 50.0466861)), ((19.9545581 50.0467029, 19.9545596 50.0466974, 19.9545504 50.0466964, 19.9545489 50.0467018, 19.9545581 50.0467029)), ((19.9544271 50.0467508, 19.9544287 50.0467454, 19.9544195 50.0467443, 19.954418 50.0467498, 19.9544271 50.0467508)), ((19.9545366 50.0467676, 19.9545381 50.0467622, 19.954529 50.0467611, 19.9545274 50.0467666, 19.9545366 50.0467676)), ((19.9545125 50.04683, 19.954514 50.0468245, 19.9545048 50.0468235, 19.9545033 50.0468289, 19.9545125 50.04683)), ((19.9544905 50.0468954, 19.954492 50.04689, 19.9544828 50.0468889, 19.9544813 50.0468944, 19.9544905 50.0468954)))\nhistoric : memorial\nwiki_summary_en : Heroes of the Ghetto Square (from around 1880 Little Market, 1917–1948 Concord Square) - a square in Krakow, in the XIII Podgórze district, in Podgórze. \nFrom 1941 to 1943, it was within the boundaries of the Krakow ghetto. It was a place of concentration for the Jewish population before their transport to concentration camps. At number 18, the \"Under the Eagle\" Pharmacy operated, run by Tadeusz Pankiewicz, the only non-Jewish resident of the ghetto.\npostal_code : nan\ntoilets : nan\nnatural : no information\ndescription : nan\nvisiting_time : nan\nleisure : no information\ntourism : no information\npublic_transport : nan\nbrand : nan\nalt_name : nan\namenity : no information\nreservation : nan\nattraction : nan\nhighchair : nan\nparking : nan\nswimming_pool : nan\ncontact_phone : nan\ncommunity_centre : nan\naddr_street : nan\ncontact_twitter : nan\nsocial_facility : nan\ncontact_facebook : nan\nzoo : nan\nemail : nan\nwheelchair : nan\ncuisine : nan\ncontact_website : nan\ninternet_access : nan\nopening_hours_reception : nan\nguest_house : nan\naddr_city : nan\ncontact_instagram : nan\nimage : http://commons.wikimedia.org/wiki/File:Plac_Bohaterow_Getta_Krak%C3%B3w.jpg\nlocation : nan\noutdoor_seating : nan\nmuseum : nan\ntakeaway : nan\nsmoking : nan\nname : Plac Bohaterów Getta\nid : 3417\n\nphone : nan\ncemetery : nan\nemergency : nan\nopening_hours : Tu,Fr,Sa 10:00-19:00; Mo off; We,Th,Su 10:00-18:00\nwebsite : nan\npets_allowed : nan\ngeometry : POLYGON ((19.9233662 50.0599863, 19.9234073 50.0599949, 19.9234287 50.0599532, 19.9235376 50.0599761, 19.9235474 50.0599569, 19.9235681 50.0599613, 19.9235686 50.0599604, 19.9235816 50.059935, 19.9238447 50.0599902, 19.9241092 50.0600452, 19.9240942 50.0600728, 19.9241144 50.0600771, 19.9241043 50.0600955, 19.9242026 50.0601161, 19.9241806 50.0601594, 19.9242216 50.060168, 19.9238367 50.060926, 19.9237807 50.0609143, 19.9237778 50.0609199, 19.9230323 50.0607631, 19.9230359 50.0607559, 19.9229786 50.0607438, 19.9233662 50.0599863))\nhistoric : no information\nwiki_summary_en : The National Museum in Kraków (Polish: Muzeum Narodowe w Krakowie), popularly abbreviated as MNK, is the largest museum in Poland. Established in 1879, the museum consists of 21 departments which are divided by art period: 11 galleries, 2 libraries, and 12 conservation workshops. It holds some 780,000 art objects, from classical archeology to modern art, with special focus on Polish painting. In 2023, the museum was visited by over 1.85 million people, making it the third most-visited art museum in Poland and the 38th most-visited art museum in the world.\npostal_code : nan\ntoilets : nan\nnatural : no information\ndescription : nan\nvisiting_time : nan\nleisure : no information\ntourism : museum\npublic_transport : nan\nbrand : nan\nalt_name : nan\namenity : no information\nreservation : nan\nattraction : nan\nhighchair : nan\nparking : nan\nswimming_pool : nan\ncontact_phone : nan\ncommunity_centre : nan\naddr_street : Aleja 3 Maja\ncontact_twitter : nan\nsocial_facility : nan\ncontact_facebook : nan\nzoo : nan\nemail : nan\nwheelchair : yes\ncuisine : nan\ncontact_website : nan\ninternet_access : nan\nopening_hours_reception : nan\nguest_house : nan\naddr_city : Kraków\ncontact_instagram : nan\nimage : nan\nlocation : nan\noutdoor_seating : nan\nmuseum : nan\ntakeaway : nan\nsmoking : nan\nname : Muzeum Narodowe w Krakowie;National Museum in Kraków;Nationalmuseum in Krakau;Krakkói Nemzeti Múzeum\nid : 5965\n\nphone : +48 12 4289900\ncemetery : nan\nemergency : nan\nopening_hours : Mo-Sa 09:00-22:00; Su 10:00-21:00\nwebsite : https://www.galeriakrakowska.pl/\npets_allowed : nan\ngeometry : POLYGON ((19.9467508 50.0679, 19.9466806 50.0678981, 19.9466996 50.0674108, 19.9467281 50.0666779, 19.9468965 50.0666799, 19.9469107 50.0662715, 19.9468916 50.0662712, 19.9468952 50.0660874, 19.9461932 50.0660788, 19.9461923 50.0661179, 19.9460876 50.0661169, 19.9459808 50.0661158, 19.9459823 50.0660762, 19.9453968 50.0660691, 19.9454078 50.0662579, 19.9453912 50.0662577, 19.9454574 50.0672177, 19.9456162 50.0672195, 19.9456134 50.0672891, 19.945573 50.0682716, 19.9455703 50.0683424, 19.9455688 50.0683721, 19.9455658 50.0684467, 19.9455346 50.0684461, 19.9454907 50.0687015, 19.9454719 50.0688196, 19.9454249 50.0691136, 19.9460172 50.069123, 19.9460179 50.0691079, 19.9461191 50.0691088, 19.9461466 50.0690881, 19.9461949 50.0690601, 19.9462439 50.0690365, 19.9463223 50.0690029, 19.9463967 50.0689736, 19.9464753 50.0689505, 19.9465474 50.068929, 19.9466159 50.0689126, 19.9466687 50.0689012, 19.9466969 50.068901, 19.9466984 50.0688549, 19.9466996 50.0688358, 19.946715 50.0688358, 19.9467163 50.0688021, 19.946729 50.0684407, 19.9467334 50.0683145, 19.9467335 50.068311, 19.9467408 50.0681038, 19.9467478 50.0679367, 19.9467508 50.0679))\nhistoric : no information\nwiki_summary_en : Galeria Krakowska is a shopping mall in Kraków, Poland, located adjacent to the city's main railway station.\npostal_code : nan\ntoilets : yes\nnatural : no information\ndescription : nan\nvisiting_time : nan\nleisure : no information\ntourism : no information\npublic_transport : nan\nbrand : nan\nalt_name : nan\namenity : no information\nreservation : nan\nattraction : nan\nhighchair : nan\nparking : nan\nswimming_pool : nan\ncontact_phone : nan\ncommunity_centre : nan\naddr_street : Pawia\ncontact_twitter : nan\nsocial_facility : nan\ncontact_facebook : nan\nzoo : nan\nemail : galeria@galeria-krakowska.pl\nwheelchair : yes\ncuisine : nan\ncontact_website : nan\ninternet_access : wlan\nopening_hours_reception : nan\nguest_house : nan\naddr_city : Kraków\ncontact_instagram : nan\nimage : nan\nlocation : nan\noutdoor_seating : nan\nmuseum : nan\ntakeaway : nan\nsmoking : nan\nname : Galeria Krakowska;Krakauer Kaufgalerie;克拉科夫之廊\nid : 9540\n\n",
  "answer": "The opening hours for visiting the Eagle Pharmacy Museum in Kraków are as follows: \n\n- Tuesday, Friday, Saturday: 10:00 AM - 7:00 PM\n- Wednesday, Thursday, Sunday: 10:00 AM - 6:00 PM\n- Monday: Closed.",
  "labels": {
    "faithfulness": "FAITHFUL",
    "groundedness": "GROUNDED",
    "relevance": "RELEVANT",
    "completeness": "COMPLETE",
    "coherence": "COHERENT",
    "conciseness": "CONCISE"
  },
  "quality_score": 6
}