{
  "model": "openai_llm",
  "prompt": "prompt_A",
  "id": 3571,
  "question": "Is the Pasamonik Tower considered a popular tourist destination in Kraków?",
  "context": "phone : nan\ncemetery : nan\nemergency : nan\nopening_hours : Tu-Su 11:00-19:00\nwebsite : https://bunkier.art.pl/\npets_allowed : nan\ngeometry : POINT (19.9344469 50.0635805)\nhistoric : no information\nwiki_summary_en : Gallery of Contemporary Art \"Bunkier Sztuki\" – an art gallery in Kraków located at plac Szczepański 3a, in the Old Town by the Planty park. Established in 1965, it is considered one of the most important Polish institutions presenting contemporary art. It is an artistically independent cultural institution, funded by the City of Kraków.\npostal_code : nan\ntoilets : nan\nnatural : no information\ndescription : nan\nvisiting_time : nan\nleisure : no information\ntourism : museum\npublic_transport : nan\nbrand : nan\nalt_name : nan\namenity : no information\nreservation : nan\nattraction : nan\nhighchair : nan\nparking : nan\nswimming_pool : nan\ncontact_phone : nan\ncommunity_centre : nan\naddr_street : Plac Szczepański\ncontact_twitter : nan\nsocial_facility : nan\ncontact_facebook : nan\nzoo : nan\nemail : nan\nwheelchair : nan\ncuisine : nan\ncontact_website : nan\ninternet_access : nan\nopening_hours_reception : nan\nguest_house : nan\naddr_city : Kraków\ncontact_instagram : nan\nimage : nan\nlocation : nan\noutdoor_seating : nan\nmuseum : nan\ntakeaway : nan\nsmoking : nan\nname : Bunkier Sztuki;Művészetek Bunkere\nid : 2417\n\nphone : nan\ncemetery : nan\nemergency : nan\nopening_hours : Mo-Su 10:30-18:00; Nov-Mar off\nwebsite : https://muzeumkrakowa.pl/oddzialy/barbakan\npets_allowed : nan\ngeometry : POLYGON ((19.9416052 50.0652889, 19.9415687 50.0652963, 19.9415432 50.0653015, 19.9415145 50.0653074, 19.9414795 50.0653145, 19.9414673 50.065317, 19.9414873 50.0653633, 19.9414918 50.0653738, 19.9415155 50.0654285, 19.9414128 50.0654595, 19.9414189 50.0654702, 19.9414353 50.0654649, 19.9414325 50.0654753, 19.941433 50.0655099, 19.9414376 50.0655273, 19.9414464 50.0655453, 19.9414567 50.065559, 19.9414394 50.0655698, 19.9414502 50.0655784, 19.9414648 50.0655692, 19.9414735 50.0655743, 19.9414922 50.0655877, 19.9415109 50.0656011, 19.9415206 50.0656068, 19.9415058 50.0656162, 19.9415185 50.0656237, 19.9415355 50.0656127, 19.9415672 50.0656226, 19.9415951 50.0656278, 19.9416261 50.0656308, 19.9416564 50.0656308, 19.9416875 50.0656282, 19.9417175 50.0656229, 19.9417484 50.0656135, 19.9417624 50.065608, 19.9417756 50.0656018, 19.94179 50.0655932, 19.9418026 50.0655838, 19.9418398 50.0655466, 19.9418523 50.0655183, 19.941855 50.0654814, 19.9418504 50.0654637, 19.941838 50.0654406, 19.9418225 50.0654223, 19.9418176 50.065418, 19.9418018 50.0654039, 19.9416661 50.0653898, 19.9416447 50.0653438, 19.94164 50.0653335, 19.9416183 50.0652862, 19.9416052 50.0652889), (19.9416349 50.0654157, 19.9416693 50.0654084, 19.9417628 50.0654147, 19.9417858 50.065432, 19.9417918 50.0654404, 19.9418142 50.0654351, 19.9418282 50.0654539, 19.9418052 50.0654591, 19.9418134 50.0654809, 19.941837 50.0654806, 19.9418376 50.0655017, 19.9418148 50.0655007, 19.9418055 50.0655292, 19.9418279 50.0655358, 19.9418128 50.0655552, 19.9417919 50.0655482, 19.9417661 50.0655692, 19.9417804 50.065581, 19.9417553 50.0655951, 19.9417404 50.065584, 19.9417023 50.0655964, 19.9417093 50.0656107, 19.9416776 50.0656157, 19.941671 50.0656014, 19.9416286 50.0656019, 19.9416253 50.0656152, 19.9415929 50.0656113, 19.9415923 50.0655979, 19.9415425 50.0655825, 19.9415248 50.0655688, 19.9415061 50.0655554, 19.9414844 50.065535, 19.9414822 50.0655269, 19.9414593 50.065528, 19.9414539 50.0655092, 19.9414762 50.0655054, 19.9414738 50.0654951, 19.9414509 50.0654887, 19.9414538 50.0654731, 19.9414783 50.0654711, 19.9414851 50.0654571, 19.9415344 50.0654393, 19.9415691 50.0654305, 19.9415155 50.0653237, 19.9415225 50.0653215, 19.9415504 50.0653157, 19.9415756 50.0653105, 19.9415833 50.0653099, 19.9416349 50.0654157))\nhistoric : city_gate\nwiki_summary_en : The Kraków Barbican (Polish: Barbakan Krakowski) is a barbican – a fortified outpost once connected to the city walls. It is a historic gateway leading into the Old Town of Kraków, Poland. The barbican is one of the few remaining relics of the complex network of fortifications and defensive barriers that once encircled the royal city of Kraków in the south of Poland. It currently serves as a tourist attraction and venue for a variety of exhibitions.\nToday the Barbican is under the jurisdiction of The Historical Museum of the City of Kraków. Tourists may tour its interior with its displays outlining the historical development of fortifications in Kraków.\npostal_code : nan\ntoilets : nan\nnatural : no information\ndescription : nan\nvisiting_time : nan\nleisure : no information\ntourism : museum\npublic_transport : nan\nbrand : nan\nalt_name : nan\namenity : no information\nreservation : nan\nattraction : nan\nhighchair : nan\nparking : nan\nswimming_pool : nan\ncontact_phone : nan\ncommunity_centre : nan\naddr_street : nan\ncontact_twitter : nan\nsocial_facility : nan\ncontact_facebook : nan\nzoo : nan\nemail : nan\nwheelchair : limited\ncuisine : nan\ncontact_website : nan\ninternet_access : nan\nopening_hours_reception : nan\nguest_house : nan\naddr_city : nan\ncontact_instagram : nan\nimage : nan\nlocation : nan\noutdoor_seating : nan\nmuseum : history\ntakeaway : nan\nsmoking : nan\nname : Barbakan;Barbican;Barbakán\nid : 3414\n\nphone : nan\ncemetery : nan\nemergency : nan\nopening_hours : Mo 11:00-15:00; Tu-Su 11:00-18:00\nwebsite : https://muzeumkrakowa.pl/oddzialy/wieza-ratuszowa\npets_allowed : nan\ngeometry : POLYGON ((19.9363154 50.0614476, 19.9363278 50.0614668, 19.936315 50.0614699, 19.9363001 50.0614734, 19.9363554 50.0615472, 19.9364414 50.0615226, 19.9364477 50.0615208, 19.9364717 50.0615139, 19.9364999 50.0615063, 19.9365062 50.0615045, 19.9365292 50.0614983, 19.9364606 50.0614016, 19.9363154 50.0614476))\nhistoric : tower\nwiki_summary_en : Town Hall Tower in Kraków, Poland (Polish: Wieża ratuszowa w Krakowie) is one of the main focal points of the Main Market Square in the Old Town district of Kraków.\nThe Tower is the only remaining part of the old Kraków Town Hall (Ratusz, see painting, below) demolished in 1820 as part of the city plan to open up the Main Square. Its cellars once housed a city prison with a Medieval torture chamber.\nIn 1967, after a complex conservation which underlined its gothic ancestry, the tower was put under the management of the Historical Museum of Kraków.\npostal_code : nan\ntoilets : nan\nnatural : no information\ndescription : nan\nvisiting_time : nan\nleisure : no information\ntourism : museum\npublic_transport : nan\nbrand : nan\nalt_name : nan\namenity : no information\nreservation : nan\nattraction : nan\nhighchair : nan\nparking : nan\nswimming_pool : nan\ncontact_phone : nan\ncommunity_centre : nan\naddr_street : Rynek Główny\ncontact_twitter : nan\nsocial_facility : nan\ncontact_facebook : nan\nzoo : nan\nemail : nan\nwheelchair : no\ncuisine : nan\ncontact_website : nan\ninternet_access : wlan\nopening_hours_reception : nan\nguest_house : nan\naddr_city : Kraków\ncontact_instagram : nan\nimage : nan\nlocation : nan\noutdoor_seating : nan\nmuseum : history\ntakeaway : nan\nsmoking : nan\nname : Wieża Ratuszowa;Town Hall Tower;Torre del Ayuntamiento;Krakauer Rathausturm;Ратушная башня;Városháza tornya;Ратушная вежа;Torre del Municipio;Radniční věž;市政廳鐘樓;라투슈초바 탑\nid : 3433\n\nphone : nan\ncemetery : nan\nemergency : nan\nopening_hours : 24/7\nwebsite : nan\npets_allowed : nan\ngeometry : POLYGON ((19.9412736 50.0648228, 19.9412786 50.0648359, 19.9412853 50.0648533, 19.9412872 50.0648582, 19.9412894 50.0648638, 19.9412975 50.0648848, 19.9413072 50.0649102, 19.9413385 50.0649051, 19.9413698 50.0649001, 19.941397 50.0648957, 19.9414324 50.06489, 19.9414223 50.0648638, 19.9414145 50.0648438, 19.9414105 50.0648333, 19.9414083 50.0648276, 19.9414038 50.0648159, 19.9413987 50.0648028, 19.9413633 50.0648085, 19.9413361 50.0648128, 19.9413048 50.0648178, 19.9412736 50.0648228))\nhistoric : city_gate\nwiki_summary_en : St. Florian's Gate (Polish: Brama Floriańska) in Kraków, Poland, is one of the best-known Polish Gothic towers, and a focal point of Kraków's Old Town. It was built about the 14th century as a rectangular Gothic tower of \"wild stone\", part of the city fortifications against Mongol attack.\npostal_code : nan\ntoilets : nan\nnatural : no information\ndescription : nan\nvisiting_time : nan\nleisure : no information\ntourism : attraction\npublic_transport : nan\nbrand : nan\nalt_name : nan\namenity : no information\nreservation : nan\nattraction : nan\nhighchair : nan\nparking : nan\nswimming_pool : nan\ncontact_phone : nan\ncommunity_centre : nan\naddr_street : nan\ncontact_twitter : nan\nsocial_facility : nan\ncontact_facebook : nan\nzoo : nan\nemail : nan\nwheelchair : yes\ncuisine : nan\ncontact_website : nan\ninternet_access : nan\nopening_hours_reception : nan\nguest_house : nan\naddr_city : nan\ncontact_instagram : nan\nimage : nan\nlocation : nan\noutdoor_seating : nan\nmuseum : nan\ntakeaway : nan\nsmoking : nan\nname : Brama Floriańska;Saint Florian's Gate;Florianstor;Флорианские ворота в Кракове;Flórián-kapu;Floriánská brána;圣福里安门;성 플로리안의 문;Florianuspoort;Poarta Florian;Floriánska brána;Florianertor\nid : 3467\n\nphone : nan\ncemetery : nan\nemergency : nan\nopening_hours : nan\nwebsite : nan\npets_allowed : nan\ngeometry : POLYGON ((19.9399572 50.0651468, 19.9400441 50.0651311, 19.9400569 50.0651603, 19.9400858 50.0652261, 19.9399989 50.0652418, 19.939969 50.0651736, 19.9399572 50.0651468))\nhistoric : fortification\nwiki_summary_en : The Carpenter's Tower (also known as the Carpenter's Bastion) – one of three fully preserved towers within the city walls of Krakow (alongside the Pasamonik Tower and the Joiners Tower).\npostal_code : nan\ntoilets : nan\nnatural : no information\ndescription : nan\nvisiting_time : nan\nleisure : no information\ntourism : attraction\npublic_transport : nan\nbrand : nan\nalt_name : nan\namenity : no information\nreservation : nan\nattraction : nan\nhighchair : nan\nparking : nan\nswimming_pool : nan\ncontact_phone : nan\ncommunity_centre : nan\naddr_street : nan\ncontact_twitter : nan\nsocial_facility : nan\ncontact_facebook : nan\nzoo : nan\nemail : nan\nwheelchair : nan\ncuisine : nan\ncontact_website : nan\ninternet_access : nan\nopening_hours_reception : nan\nguest_house : nan\naddr_city : nan\ncontact_instagram : nan\nimage : nan\nlocation : nan\noutdoor_seating : nan\nmuseum : nan\ntakeaway : nan\nsmoking : nan\nname : Baszta Ciesielska;Zimmereiturm;Ácsok bástyája\nid : 3568\n\nphone : nan\ncemetery : nan\nemergency : nan\nopening_hours : nan\nwebsite : nan\npets_allowed : nan\ngeometry : POLYGON ((19.9421795 50.0647424, 19.9421897 50.0647676, 19.9421985 50.0647747, 19.942213 50.0647812, 19.9422326 50.0647845, 19.9422494 50.0647835, 19.9422654 50.0647792, 19.9422791 50.0647713, 19.9422871 50.0647622, 19.9422907 50.0647516, 19.9422803 50.064726, 19.9423172 50.06472, 19.9423091 50.0646996, 19.9422728 50.0647055, 19.9422215 50.0647135, 19.9421714 50.064722, 19.9421795 50.0647424))\nhistoric : fort\nwiki_summary_en : The Pasamonik Tower (also known as the Szmuklerzy Tower) – one of the three fully preserved towers within the city walls of Krakow (alongside the Cieśli and Stolarzy).\npostal_code : nan\ntoilets : nan\nnatural : no information\ndescription : nan\nvisiting_time : nan\nleisure : no information\ntourism : attraction\npublic_transport : nan\nbrand : nan\nalt_name : nan\namenity : no information\nreservation : nan\nattraction : nan\nhighchair : nan\nparking : nan\nswimming_pool : nan\ncontact_phone : nan\ncommunity_centre : nan\naddr_street : nan\ncontact_twitter : nan\nsocial_facility : nan\ncontact_facebook : nan\nzoo : nan\nemail : nan\nwheelchair : nan\ncuisine : nan\ncontact_website : nan\ninternet_access : nan\nopening_hours_reception : nan\nguest_house : nan\naddr_city : nan\ncontact_instagram : nan\nimage : nan\nlocation : nan\noutdoor_seating : nan\nmuseum : nan\ntakeaway : nan\nsmoking : nan\nname : Baszta Pasamoników;Posamenterturm;Paszományosok bástyája\nid : 3571\n\nphone : nan\ncemetery : nan\nemergency : nan\nopening_hours : nan\nwebsite : nan\npets_allowed : nan\ngeometry : POLYGON ((19.9381298 50.062444, 19.938121 50.0624487, 19.938082 50.062467, 19.938026 50.0624944, 19.9377567 50.0625732, 19.9377548 50.0625708, 19.9376993 50.0625873, 19.9377002 50.0625887, 19.9376153 50.0626124, 19.9376164 50.0626139, 19.9375596 50.0626322, 19.9375001 50.0626513, 19.9374974 50.0626473, 19.9374908 50.062649, 19.9374852 50.0626507, 19.9374867 50.0626532, 19.9374552 50.0626647, 19.9374535 50.0626625, 19.9374449 50.0626653, 19.9374459 50.0626667, 19.9374268 50.0626737, 19.9374254 50.0626721, 19.937349 50.0626989, 19.9373538 50.0627037, 19.9373301 50.0627119, 19.9372118 50.0627527, 19.9372097 50.0627502, 19.9371599 50.0627675, 19.9371278 50.0627787, 19.9371266 50.0627774, 19.9369878 50.0628263, 19.9369077 50.062856, 19.936845 50.0628788, 19.9367994 50.0628314, 19.9367512 50.0627851, 19.9367448 50.0627783, 19.936746 50.0627775, 19.9366896 50.0627203, 19.9366805 50.0627103, 19.9366864 50.062708, 19.9366828 50.0627037, 19.936677 50.0627057, 19.9366563 50.0626846, 19.9366611 50.0626822, 19.9366569 50.0626775, 19.9366512 50.0626802, 19.936589 50.0626134, 19.9364936 50.0625161, 19.9364969 50.0625147, 19.9364795 50.0624964, 19.9364768 50.0624974, 19.9364633 50.0624837, 19.9364656 50.0624823, 19.936459 50.0624758, 19.9364561 50.0624765, 19.9364423 50.0624625, 19.9364448 50.0624609, 19.9364362 50.0624523, 19.936434 50.0624533, 19.9363965 50.0624147, 19.9363981 50.0624135, 19.9363808 50.0623952, 19.9363781 50.062396, 19.9363427 50.0623607, 19.9363453 50.0623591, 19.9363396 50.0623527, 19.9363367 50.0623536, 19.9363344 50.0623513, 19.9363351 50.0623502, 19.9363309 50.0623467, 19.9363321 50.062346, 19.9362843 50.0622949, 19.9362867 50.0622933, 19.9362808 50.0622877, 19.9362796 50.0622876, 19.9362533 50.0622603, 19.9362453 50.0622525, 19.9362458 50.0622518, 19.9362422 50.0622482, 19.9362381 50.0622442, 19.9362373 50.062245, 19.936197 50.062203, 19.9361939 50.0622037, 19.936184 50.0621919, 19.9361822 50.0621923, 19.9361701 50.0621789, 19.936172 50.0621775, 19.936152 50.0621529, 19.9361405 50.0621391, 19.9360916 50.0620961, 19.9360371 50.0620486, 19.9360298 50.0620407, 19.9360275 50.0620405, 19.9360036 50.0620135, 19.935965 50.0619704, 19.9358682 50.061863, 19.9358701 50.0618622, 19.9358631 50.0618542, 19.9358667 50.0618528, 19.9358624 50.0618477, 19.9358598 50.0618482, 19.9358308 50.061817, 19.9358318 50.0618158, 19.9358261 50.0618096, 19.9358353 50.0618057, 19.9358303 50.0618006, 19.9358181 50.061805, 19.9358114 50.0617981, 19.9357988 50.0617852, 19.9358113 50.0617798, 19.935806 50.0617747, 19.935797 50.0617781, 19.9357924 50.0617737, 19.9357903 50.0617739, 19.9357878 50.0617714, 19.9357859 50.061772, 19.9357635 50.0617484, 19.935765 50.0617472, 19.9357627 50.0617446, 19.9357641 50.0617438, 19.9357594 50.0617386, 19.9357616 50.0617372, 19.9357568 50.0617326, 19.9357529 50.0617328, 19.9357333 50.0617119, 19.9357366 50.0617096, 19.935725 50.0616963, 19.9356905 50.0616566, 19.9356913 50.0616561, 19.9356881 50.0616528, 19.9356085 50.0615612, 19.9356111 50.0615596, 19.9356064 50.0615544, 19.9356037 50.061554, 19.9355981 50.0615557, 19.9355788 50.0615344, 19.9355842 50.0615324, 19.9355849 50.0615302, 19.935579 50.0615232, 19.9355758 50.0615227, 19.9355711 50.0615244, 19.9355592 50.0615121, 19.9355518 50.0615031, 19.935558 50.0615005, 19.9355535 50.0614942, 19.9355504 50.0614946, 19.9354612 50.0613934, 19.9354112 50.061358, 19.9353677 50.0613281, 19.935426 50.0613098, 19.9355003 50.0612874, 19.9356554 50.0612348, 19.9356604 50.0612359, 19.9356674 50.061234, 19.9356686 50.0612295, 19.9356702 50.061229, 19.935668 50.0612255, 19.9356972 50.0612167, 19.9356987 50.0612186, 19.9357006 50.0612191, 19.9357017 50.0612206, 19.9357082 50.0612222, 19.9357148 50.0612201, 19.935716 50.0612163, 19.9357154 50.0612152, 19.9357181 50.0612144, 19.9357193 50.0612106, 19.9357182 50.0612075, 19.9357442 50.0612003, 19.9357465 50.0612033, 19.9357522 50.0612048, 19.9357587 50.0612027, 19.9357601 50.0611989, 19.9357581 50.0611959, 19.9357843 50.0611885, 19.9357868 50.0611917, 19.9357924 50.0611929, 19.9357999 50.0611906, 19.9358025 50.0611872, 19.9358002 50.0611841, 19.935826 50.0611761, 19.9358282 50.0611793, 19.9358339 50.0611807, 19.935842 50.0611781, 19.9358435 50.0611741, 19.9358417 50.0611717, 19.9358677 50.0611643, 19.9358693 50.0611668, 19.9358751 50.0611684, 19.9358827 50.0611661, 19.9358838 50.0611621, 19.9358819 50.0611593, 19.9359081 50.0611522, 19.9359102 50.061155, 19.9359161 50.0611564, 19.9359225 50.0611545, 19.9359206 50.0611514, 19.9359177 50.0611478, 19.9359597 50.0611354, 19.935962 50.0611392, 19.9360043 50.0611261, 19.9360304 50.0611183, 19.936047 50.0611132, 19.9360454 50.0611112, 19.9360754 50.0611016, 19.9360772 50.0611031, 19.9361379 50.061083, 19.9361351 50.0610796, 19.936163 50.0610705, 19.936166 50.0610741, 19.9361814 50.0610692, 19.9361774 50.0610648, 19.9361855 50.0610622, 19.9361873 50.0610644, 19.9361968 50.0610611, 19.9361934 50.0610569, 19.9362381 50.0610419, 19.9362415 50.0610462, 19.936251 50.0610432, 19.9362495 50.0610413, 19.9362909 50.0610277, 19.9362923 50.0610296, 19.9363027 50.0610261, 19.9363012 50.0610241, 19.9363293 50.0610151, 19.9363308 50.0610171, 19.9363453 50.0610134, 19.9363464 50.0610147, 19.9363884 50.0609997, 19.9363893 50.0610007, 19.936421 50.0609903, 19.9364202 50.0609891, 19.9364295 50.060986, 19.9364286 50.0609845, 19.93644 50.0609807, 19.9364514 50.060977, 19.9364526 50.0609785, 19.9364639 50.0609748, 19.9364628 50.0609733, 19.936474 50.0609695, 19.9364854 50.0609656, 19.9364865 50.060967, 19.9364935 50.0609649, 19.9364972 50.0609697, 19.9365257 50.0609607, 19.9365806 50.0609405, 19.9366426 50.0609176, 19.9366708 50.0609083, 19.936669 50.0609063, 19.9366973 50.0608967, 19.9366991 50.060899, 19.9367169 50.0608932, 19.9367154 50.0608915, 19.9367401 50.0608832, 19.9367418 50.0608853, 19.9367671 50.0608774, 19.9367655 50.0608753, 19.9367688 50.0608744, 19.9367665 50.0608711, 19.9367925 50.0608628, 19.9367948 50.060866, 19.9367987 50.0608648, 19.9368002 50.0608668, 19.9368251 50.0608585, 19.9368231 50.0608563, 19.9368477 50.0608483, 19.936849 50.0608503, 19.9368673 50.0608444, 19.9368657 50.0608426, 19.9368951 50.060833, 19.9368963 50.0608349, 19.9369141 50.060829, 19.9369132 50.0608279, 19.9369356 50.0608174, 19.9369327 50.0608148, 19.9369508 50.0608061, 19.9369538 50.0608084, 19.9369612 50.0608048, 19.9369585 50.0608025, 19.9369618 50.0608008, 19.9369629 50.0608011, 19.9369687 50.0607994, 19.9369703 50.0607984, 19.9369718 50.0607966, 19.9369689 50.0607944, 19.9369912 50.0607826, 19.936994 50.0607849, 19.936997 50.0607844, 19.9369991 50.0607834, 19.9370034 50.0607802, 19.9370028 50.0607798, 19.9370939 50.0607344, 19.9371511 50.0607067, 19.9372056 50.0606645, 19.9371986 50.0606611, 19.9372781 50.0605568, 19.9372891 50.0605607, 19.937295 50.0605529, 19.9373029 50.0605423, 19.9373092 50.0605347, 19.9373098 50.0605339, 19.9373158 50.0605304, 19.9373599 50.0604769, 19.9373641 50.0604734, 19.9373692 50.060475, 19.9373789 50.0604609, 19.9373715 50.0604584, 19.9373776 50.0604496, 19.9373837 50.0604415, 19.9373916 50.060444, 19.9374823 50.0603123, 19.9375206 50.0602583, 19.9375123 50.0602559, 19.9375196 50.0602431, 19.9375641 50.0601667, 19.9376852 50.0601622, 19.9377792 50.0601589, 19.937825 50.0603269, 19.9378308 50.0603531, 19.9378411 50.0603793, 19.9378391 50.0603796, 19.9378861 50.0605069, 19.9378965 50.0605251, 19.9379432 50.060607, 19.9379468 50.060612, 19.9379449 50.0606125, 19.9380011 50.0606941, 19.9380029 50.0606936, 19.9380052 50.0606967, 19.9380183 50.0607126, 19.9380245 50.0607202, 19.9380296 50.0607254, 19.9380551 50.0607562, 19.9380723 50.0607775, 19.938068 50.0607788, 19.9381481 50.0608721, 19.9381498 50.0608716, 19.9381516 50.0608738, 19.938158 50.0608717, 19.9381729 50.0608904, 19.9381678 50.0608924, 19.9381695 50.0608947, 19.9381677 50.0608953, 19.9381738 50.0609024, 19.9381749 50.0609036, 19.9381733 50.0609043, 19.9381752 50.0609065, 19.9381799 50.0609049, 19.9381994 50.0609272, 19.9381949 50.0609285, 19.938201 50.0609359, 19.9382022 50.0609356, 19.9382072 50.0609416, 19.9382113 50.0609402, 19.9382117 50.0609407, 19.9382165 50.0609391, 19.9382244 50.0609487, 19.9382322 50.0609576, 19.9382275 50.0609592, 19.9382279 50.0609597, 19.9382234 50.0609614, 19.9382289 50.060967, 19.9382283 50.0609674, 19.9382354 50.060975, 19.938238 50.060974, 19.9382778 50.0610211, 19.938275 50.0610222, 19.9382807 50.0610288, 19.9382842 50.061028, 19.9382861 50.0610303, 19.9382833 50.0610313, 19.9382875 50.0610361, 19.9382945 50.0610339, 19.938295 50.0610345, 19.9382997 50.0610329, 19.938307 50.0610417, 19.9383145 50.0610506, 19.9383094 50.0610522, 19.9383098 50.0610527, 19.9383036 50.0610552, 19.938308 50.06106, 19.9383101 50.0610593, 19.9383304 50.0610808, 19.9383295 50.0610814, 19.9383325 50.0610848, 19.9383337 50.0610842, 19.9383492 50.0611015, 19.9383474 50.0611023, 19.9384091 50.0611734, 19.9384114 50.0611722, 19.938429 50.0611924, 19.9384264 50.0611937, 19.9384274 50.0611949, 19.9384136 50.0611995, 19.9384356 50.0612261, 19.9384804 50.0612106, 19.9385017 50.0612331, 19.938577 50.0612535, 19.938589 50.0612681, 19.9386852 50.061383, 19.9387518 50.0614562, 19.9386701 50.0614966, 19.9386365 50.0615305, 19.9386214 50.0615693, 19.938621 50.061593, 19.9386382 50.0616445, 19.9387967 50.0618353, 19.9388528 50.0618802, 19.9389253 50.0619216, 19.939009 50.061951, 19.9390984 50.0619685, 19.9391747 50.061974, 19.9392112 50.0619749, 19.9392587 50.0620203, 19.9392905 50.0620509, 19.9393302 50.0620894, 19.9391757 50.0620188, 19.9391878 50.0621216, 19.9391734 50.0621247, 19.9391426 50.0621328, 19.9391432 50.0621341, 19.9390293 50.0621704, 19.939027 50.0621685, 19.9390176 50.0621718, 19.9389747 50.0621859, 19.938964 50.0621877, 19.938962 50.0621887, 19.9389485 50.0621931, 19.9389514 50.0621964, 19.9389196 50.0622067, 19.9389176 50.0622034, 19.938888 50.0622112, 19.9388826 50.0622131, 19.9388842 50.062215, 19.9388552 50.0622241, 19.9388536 50.0622218, 19.9388413 50.0622255, 19.9388429 50.0622279, 19.9388217 50.0622352, 19.9388194 50.062232, 19.9388082 50.0622354, 19.938811 50.0622388, 19.9387812 50.0622472, 19.9387781 50.0622439, 19.9387674 50.0622472, 19.9387696 50.0622499, 19.9387266 50.0622637, 19.9387162 50.0622669, 19.9386599 50.0622848, 19.9384475 50.0623524, 19.9384506 50.0623567, 19.9384219 50.0623641, 19.9384196 50.0623611, 19.9384097 50.0623643, 19.9384086 50.0623631, 19.9382963 50.0623997, 19.9382938 50.0623957, 19.9382905 50.0623965, 19.9382883 50.0623934, 19.9382334 50.0624118, 19.9382352 50.0624145, 19.9381571 50.0624385, 19.9381551 50.0624358, 19.9381298 50.062444))\nhistoric : square\nwiki_summary_en : The Main Market Square (Polish: Rynek Główny [ˈrɨnɛɡ ˈɡwuvnɨ] lit. ) of the Old Town of Kraków, Lesser Poland, is the principal urban space located at the center of the city. It dates back to the 13th century, and at 3.79 ha (9.4 acres) is sometimes called the largest medieval town square in Europe, but Charles Square in Prague is two times larger.\nThe Main Square is a square space surrounded by historic townhouses (kamienice) and churches. The center of the square is dominated by the Cloth Hall (Sukiennice), rebuilt in 1555 in the Renaissance style, topped by a attic or Polish parapet decorated with carved masks. On one side of the cloth hall is the Town Hall Tower (Wieża ratuszowa), on the other the 11th century Church of St. Adalbert and 1898 Adam Mickiewicz Monument. Rising above the square are the Gothic towers of St. Mary's Basilica (Kościół Mariacki). Kraków Main Square does not have a town hall, because it has not survived to the present day.\npostal_code : nan\ntoilets : nan\nnatural : no information\ndescription : nan\nvisiting_time : nan\nleisure : no information\ntourism : attraction\npublic_transport : nan\nbrand : nan\nalt_name : nan\namenity : no information\nreservation : nan\nattraction : nan\nhighchair : nan\nparking : nan\nswimming_pool : nan\ncontact_phone : nan\ncommunity_centre : nan\naddr_street : nan\ncontact_twitter : nan\nsocial_facility : nan\ncontact_facebook : nan\nzoo : nan\nemail : nan\nwheelchair : yes\ncuisine : nan\ncontact_website : nan\ninternet_access : nan\nopening_hours_reception : nan\nguest_house : nan\naddr_city : nan\ncontact_instagram : nan\nimage : nan\nlocation : nan\noutdoor_seating : nan\nmuseum : nan\ntakeaway : nan\nsmoking : nan\nname : Rynek Główny;Main Square;Plaza del Mercado;Площа Ринок;Hauptmarkt;Főpiac tér (Rynek Główny);Галоўны рынак;Rynek;中央集市廣場;리네크 글루프니;ana meydan\nid : 3572\n\nphone : nan\ncemetery : nan\nemergency : nan\nopening_hours : nan\nwebsite : nan\npets_allowed : nan\ngeometry : POINT (19.9040589 50.041352)\nhistoric : no information\nwiki_summary_en : Krzemionki Zakrzowskie – a ridge in the southwestern part of Krakow, south of the Vistula River. In various publications, it is also known by other names: Zakrzówek, Zrąb Zakrzówka, Twardowski's Rocks, Southern Ridge. In the past, the hill was part of the village of Zakrzówek, which was incorporated into Krakow; it is currently located in Krakow, in District VIII Dębniki, in the Krakow Bridge macroregion. \n\nFor several hundred years, limestone has been extracted from Krzemionki Zakrzowskie for construction purposes, with the most intensive mining taking place since the early 20th century. At that time, there were four quarries on the hill: Berger's Quarry, Twardowski's Rocks, Kapelanka, and Zakrzówek. The largest was the Zakrzówek quarry. It left behind a vast depression in the terrain, which quickly filled with water after mining ceased. Today, it is a popular recreation area for Krakow residents, known as Zakrzówek Reservoir. Most of the hill has become a recreational area of Krakow called Uroczysko Skałki Twardowskiego. In its northeastern part, there is a dry Kapelanka quarry, whose rocky walls, resembling rock walls, are a very popular climbing spot not only for Krakow climbers. Climbers distinguish among them the rocks: Baba Jaga, Ciąża, Freney, Niski Mur, Problemówka, Rdzawe Zacięcie, Szara Ścianka, Sadystówka. The remaining part of Krzemionki is covered by forest. A dense network of walking paths with benches for tourists and trash bins runs through the hill. \n\nAmong the rocks of Krzemionki Zakrzowskie, there are several caves, the largest being Twardowski's Cave, located in the western part of Krzemionki. The remaining caves and shelters include: Jasna Cave, Kogut Cave, Musza Cave, Niska Cave, the cave under Nyża, the cave before Problemówka, Pychowicka Cave, the cave in the Anastomoses, Wywiew Cave, the cave with Balls, Magazyn Cave, Zbójnickie Window, Rurka, Shelter above Sadystówka, Shelter next to the Anastomoses, Tunnel in Pychowice.\npostal_code : nan\ntoilets : nan\nnatural : peak\ndescription : nan\nvisiting_time : nan\nleisure : no information\ntourism : no information\npublic_transport : nan\nbrand : nan\nalt_name : Zakrzówek\namenity : no information\nreservation : nan\nattraction : nan\nhighchair : nan\nparking : nan\nswimming_pool : nan\ncontact_phone : nan\ncommunity_centre : nan\naddr_street : nan\ncontact_twitter : nan\nsocial_facility : nan\ncontact_facebook : nan\nzoo : nan\nemail : nan\nwheelchair : nan\ncuisine : nan\ncontact_website : nan\ninternet_access : nan\nopening_hours_reception : nan\nguest_house : nan\naddr_city : nan\ncontact_instagram : nan\nimage : nan\nlocation : nan\noutdoor_seating : nan\nmuseum : nan\ntakeaway : nan\nsmoking : nan\nname : Krzemionki Zakrzowskie;Zakrzówek\nid : 11452\n\n",
  "answer": "The Pasamonik Tower, also known as the Szmuklerzy Tower, is one of the three fully preserved towers within the city walls of Kraków. While it is a historical attraction, it is not as widely recognized or visited as some of the more prominent landmarks in the city, such as the Main Market Square or Wawel Castle. However, it does hold significance as part of Kraków's fortifications and can be of interest to those exploring the city's medieval history.\n\nIf you're interested in visiting, it may not be a top tourist destination, but it can be a worthwhile stop for history enthusiasts or those looking to explore lesser-known sites in Kraków.",
  "labels": {
    "faithfulness": "PARTLY_FAITHFUL",
    "groundedness": "GROUNDED",
    "relevance": "RELEVANT",
    "completeness": "PARTLY_COMPLETE",
    "coherence": "COHERENT",
    "conciseness": "PARTLY_CONCISE"
  },
  "quality_score": 3
}