{
  "model": "openai_llm",
  "prompt": "prompt_B",
  "id": 3362,
  "question": "Does the Archaeological Museum of Kraków have wheelchair accessibility for visitors?",
  "context": "phone : nan\ncemetery : nan\nemergency : nan\nopening_hours : Mo-Fr 10:00-17:00\nwebsite : https://maius.uj.edu.pl/\npets_allowed : nan\ngeometry : POINT (19.9337367 50.0615617)\nhistoric : no information\nwiki_summary_en : The Jagiellonian University Museum – a museum located in the Collegium Maius building of the Jagiellonian University, at the corner of St. Anna and Jagiellońska streets in Kraków. It originates from the Archaeological Cabinet of the University, established in 1867 by Professor Józef Łepkowski, and its current form is primarily due to Karol Estreicher.\npostal_code : nan\ntoilets : nan\nnatural : no information\ndescription : nan\nvisiting_time : nan\nleisure : no information\ntourism : museum\npublic_transport : nan\nbrand : nan\nalt_name : nan\namenity : no information\nreservation : nan\nattraction : nan\nhighchair : nan\nparking : nan\nswimming_pool : nan\ncontact_phone : nan\ncommunity_centre : nan\naddr_street : nan\ncontact_twitter : nan\nsocial_facility : nan\ncontact_facebook : nan\nzoo : nan\nemail : nan\nwheelchair : nan\ncuisine : nan\ncontact_website : nan\ninternet_access : nan\nopening_hours_reception : nan\nguest_house : nan\naddr_city : nan\ncontact_instagram : nan\nimage : nan\nlocation : nan\noutdoor_seating : nan\nmuseum : nan\ntakeaway : nan\nsmoking : nan\nname : Muzeum Uniwersytetu Jagiellońskiego;University Museum;Museum des Jagiellonen-Universitäts;Jagelló Egyetem Múzeuma\nid : 2409\n\nphone : nan\ncemetery : nan\nemergency : nan\nopening_hours : Apr-Oct: Mo-Su 10:00-17:30; Nov-Mar: Mo-Tu off; We-Su 10:00-17:00\nwebsite : https://muzeumkrakowa.pl/oddzialy/ulica-pomorska\npets_allowed : nan\ngeometry : POINT (19.9249265 50.0706881)\nhistoric : no information\nwiki_summary_en : The Historical Museum of the City of Kraków (Polish: Muzeum Historyczne Miasta Krakowa) in Kraków, Lesser Poland, was granted the status of an independent institution in 1945. Originally, it was a branch of the Old Records Office of Kraków, in operation from 1899.\nThe museum's main location is the baroque Krzysztofory Palace.\npostal_code : nan\ntoilets : nan\nnatural : no information\ndescription : nan\nvisiting_time : nan\nleisure : no information\ntourism : museum\npublic_transport : nan\nbrand : nan\nalt_name : nan\namenity : no information\nreservation : nan\nattraction : nan\nhighchair : nan\nparking : nan\nswimming_pool : nan\ncontact_phone : nan\ncommunity_centre : nan\naddr_street : nan\ncontact_twitter : nan\nsocial_facility : nan\ncontact_facebook : nan\nzoo : nan\nemail : nan\nwheelchair : nan\ncuisine : nan\ncontact_website : nan\ninternet_access : nan\nopening_hours_reception : nan\nguest_house : nan\naddr_city : nan\ncontact_instagram : nan\nimage : nan\nlocation : nan\noutdoor_seating : nan\nmuseum : history\ntakeaway : nan\nsmoking : nan\nname : Ulica Pomorska;Pomorska Street;Pomorska utca\nid : 2759\n\nphone : nan\ncemetery : nan\nemergency : nan\nopening_hours : Mo-Su 10:00-16:00\nwebsite : https://ma.krakow.pl/\npets_allowed : nan\ngeometry : POLYGON ((19.936714 50.0575332, 19.9366394 50.0575249, 19.9365636 50.0575196, 19.936554 50.0575694, 19.9365492 50.0575906, 19.9363244 50.0575761, 19.9363016 50.0576838, 19.9360661 50.0576654, 19.9360642 50.0576766, 19.9360607 50.0576763, 19.9360601 50.0576801, 19.9360636 50.0576803, 19.9360623 50.0576883, 19.936021 50.0576856, 19.9360223 50.0576778, 19.9360245 50.0576779, 19.9360252 50.0576742, 19.9360227 50.057674, 19.936035 50.0575998, 19.9360521 50.0574898, 19.9363837 50.0575159, 19.9363832 50.0575188, 19.9364042 50.0575204, 19.9364059 50.0575091, 19.9364045 50.0575089, 19.9364105 50.0574804, 19.9364123 50.0574804, 19.9364148 50.0574685, 19.936413 50.0574683, 19.9364385 50.0573377, 19.9364514 50.0572828, 19.9364726 50.0572789, 19.9364941 50.057275, 19.9366959 50.0573, 19.9367042 50.0573009, 19.9367199 50.0572428, 19.936722 50.0572342, 19.9365168 50.0572136, 19.9365198 50.0572003, 19.936515 50.0572, 19.9365003 50.0571992, 19.9364713 50.0571976, 19.9364404 50.0571959, 19.9364408 50.0571942, 19.9363239 50.0571808, 19.9363247 50.0571777, 19.9362906 50.0571738, 19.9362864 50.0571733, 19.936282 50.0571919, 19.9362885 50.0571924, 19.9362441 50.057403, 19.9359047 50.0573719, 19.935904 50.0573693, 19.9358552 50.0573652, 19.9358503 50.0573955, 19.935855 50.0573966, 19.9358087 50.0576744, 19.9358079 50.0576792, 19.9357999 50.0577271, 19.9357953 50.0577274, 19.9357875 50.0577584, 19.9358363 50.0577626, 19.9358369 50.0577593, 19.9359146 50.0577662, 19.9359007 50.0578487, 19.9358993 50.0578568, 19.9358965 50.0578562, 19.9358919 50.0578847, 19.9359181 50.0578867, 19.9359185 50.0578837, 19.9360065 50.0578896, 19.9360062 50.0578925, 19.9360326 50.0578943, 19.936033 50.0578914, 19.9366307 50.0579334, 19.9366298 50.0579369, 19.936645 50.0579382, 19.9366464 50.0579287, 19.9366434 50.0579284, 19.9366481 50.0578997, 19.9366509 50.0578999, 19.9366757 50.0577661, 19.9366729 50.0577658, 19.9366783 50.0577375, 19.9366806 50.0577377, 19.9366822 50.0577292, 19.9366797 50.057729, 19.9366999 50.05761, 19.9367022 50.05761, 19.9367073 50.0575836, 19.9367112 50.057564, 19.936714 50.0575332), (19.9364197 50.057714, 19.9364248 50.0576825, 19.9365346 50.05769, 19.9365293 50.0577217, 19.9364197 50.057714), (19.9360689 50.0577682, 19.9362086 50.0577781, 19.9361952 50.057856, 19.9360558 50.0578463, 19.9360689 50.0577682))\nhistoric : no information\nwiki_summary_en : The Archaeological Museum of Kraków (Polish: Muzeum Archeologiczne w Krakowie) is a historic museum in Kraków, Lesser Poland Voivodeship, Poland. It was established in 1850.\npostal_code : nan\ntoilets : nan\nnatural : no information\ndescription : nan\nvisiting_time : 1h\nleisure : no information\ntourism : museum\npublic_transport : nan\nbrand : nan\nalt_name : nan\namenity : no information\nreservation : nan\nattraction : nan\nhighchair : nan\nparking : nan\nswimming_pool : nan\ncontact_phone : nan\ncommunity_centre : nan\naddr_street : nan\ncontact_twitter : nan\nsocial_facility : nan\ncontact_facebook : nan\nzoo : nan\nemail : nan\nwheelchair : no\ncuisine : nan\ncontact_website : nan\ninternet_access : nan\nopening_hours_reception : nan\nguest_house : nan\naddr_city : nan\ncontact_instagram : nan\nimage : nan\nlocation : nan\noutdoor_seating : nan\nmuseum : archaeological\ntakeaway : nan\nsmoking : nan\nname : Muzeum Archeologiczne;Archeological Museum;Museo Arqueológico;Archäologisches Museum;Régészeti Múzeum\nid : 3362\n\nphone : nan\ncemetery : nan\nemergency : nan\nopening_hours : nan\nwebsite : nan\npets_allowed : nan\ngeometry : POLYGON ((19.9374939 50.0622093, 19.9374996 50.0622021, 19.9376562 50.0621462, 19.9376787 50.0621382, 19.9377005 50.0621305, 19.9377127 50.0621261, 19.9377341 50.0621185, 19.9377554 50.0621109, 19.9378739 50.0620688, 19.9378785 50.0620743, 19.9379268 50.062058, 19.9379014 50.062027, 19.9378889 50.0620118, 19.9378758 50.0619959, 19.9375935 50.0616517, 19.9376012 50.0616491, 19.9375868 50.0616311, 19.9375734 50.0616152, 19.9375604 50.0615996, 19.9375459 50.0615819, 19.9375368 50.0615849, 19.9373777 50.061392, 19.9372658 50.0612564, 19.9372523 50.0612401, 19.937239 50.061224, 19.9372223 50.0612038, 19.93721 50.061189, 19.9371967 50.0611731, 19.9371492 50.0611894, 19.9371543 50.0611955, 19.9371231 50.0612086, 19.9370422 50.0612436, 19.9370215 50.0612524, 19.9370013 50.061261, 19.9369897 50.0612659, 19.9369692 50.0612746, 19.9369487 50.0612833, 19.9368425 50.0613286, 19.9368473 50.061334, 19.9367977 50.0613511, 19.9367916 50.0613532, 19.9368087 50.061374, 19.9368217 50.0613898, 19.9368349 50.0614059, 19.9371043 50.0617327, 19.9371208 50.0617527, 19.937134 50.0617687, 19.9371471 50.0617847, 19.9371615 50.0618021, 19.9373751 50.0620613, 19.9374452 50.0621463, 19.9374583 50.0621622, 19.9374713 50.062178, 19.9374878 50.062198, 19.9374821 50.0622054, 19.9374939 50.0622093))\nhistoric : no information\nwiki_summary_en : The Kraków Cloth Hall (Polish: Sukiennice, pronounced [sukʲɛˈɲːit͡sɛ]), in Lesser Poland, dates to the Renaissance and is one of the city's most recognizable monuments. It is the central feature of the main market square in the Kraków Old Town (the historic center of Kraków), which since 1978 has been listed as a UNESCO World Heritage Site.\npostal_code : nan\ntoilets : nan\nnatural : no information\ndescription : nan\nvisiting_time : nan\nleisure : no information\ntourism : attraction\npublic_transport : nan\nbrand : nan\nalt_name : nan\namenity : no information\nreservation : nan\nattraction : nan\nhighchair : nan\nparking : nan\nswimming_pool : nan\ncontact_phone : nan\ncommunity_centre : nan\naddr_street : Rynek Główny\ncontact_twitter : nan\nsocial_facility : nan\ncontact_facebook : nan\nzoo : nan\nemail : nan\nwheelchair : yes\ncuisine : nan\ncontact_website : nan\ninternet_access : nan\nopening_hours_reception : nan\nguest_house : nan\naddr_city : Kraków\ncontact_instagram : nan\nimage : nan\nlocation : nan\noutdoor_seating : nan\nmuseum : nan\ntakeaway : nan\nsmoking : nan\nname : Sukiennice;Cloth Hall;Tuchhallen;Суконные ряды;Posztócsarnok;Palazzo del tessuto;紡織會館;수키엔니체\nid : 3429\n\nphone : nan\ncemetery : nan\nemergency : nan\nopening_hours : Tu-Sa 10:00-17:00\nwebsite : https://muzeumkrakowa.pl/oddzialy/rydlowka\npets_allowed : nan\ngeometry : POLYGON ((19.8779752 50.0879672, 19.8779752 50.0879683, 19.877961 50.0879701, 19.8779579 50.0879604, 19.8779619 50.0879598, 19.8779573 50.087945, 19.8779545 50.0879452, 19.8779354 50.0878838, 19.8779714 50.0878792, 19.8779669 50.0878628, 19.8779948 50.0878597, 19.8779841 50.0878205, 19.8779663 50.0877549, 19.877983 50.0877528, 19.87798 50.0877429, 19.8780134 50.0877387, 19.8780161 50.0877489, 19.8780397 50.0877459, 19.8780368 50.0877357, 19.8780698 50.0877316, 19.8780727 50.0877409, 19.878093 50.0877386, 19.878126 50.0878604, 19.8781342 50.0878596, 19.8781364 50.0878686, 19.8781339 50.087869, 19.8781508 50.0879357, 19.8781531 50.0879354, 19.8781555 50.0879448, 19.8781421 50.0879471, 19.8781413 50.0879449, 19.8779752 50.0879672))\nhistoric : no information\nwiki_summary_en : Regionalne Muzeum Młodej Polski \"Rydlówka\" is a museum in Kraków, Poland. It was constructed in 1894.\npostal_code : nan\ntoilets : yes\nnatural : no information\ndescription : nan\nvisiting_time : nan\nleisure : no information\ntourism : museum\npublic_transport : nan\nbrand : nan\nalt_name : nan\namenity : no information\nreservation : nan\nattraction : nan\nhighchair : nan\nparking : nan\nswimming_pool : nan\ncontact_phone : nan\ncommunity_centre : nan\naddr_street : Włodzimierza Tetmajera\ncontact_twitter : nan\nsocial_facility : nan\ncontact_facebook : nan\nzoo : nan\nemail : nan\nwheelchair : no\ncuisine : nan\ncontact_website : nan\ninternet_access : nan\nopening_hours_reception : nan\nguest_house : nan\naddr_city : Kraków\ncontact_instagram : nan\nimage : nan\nlocation : nan\noutdoor_seating : nan\nmuseum : history\ntakeaway : nan\nsmoking : nan\nname : Rydlówka\nid : 3611\n\nphone : nan\ncemetery : nan\nemergency : nan\nopening_hours : nan\nwebsite : nan\npets_allowed : nan\ngeometry : POLYGON ((19.9920443 49.9948323, 19.9920239 49.9948523, 19.9919712 49.9948286, 19.9919906 49.9948095, 19.9918014 49.9947269, 19.9917981 49.9947298, 19.9916796 49.994678, 19.9917668 49.9945711, 19.9924046 49.9948483, 19.9924023 49.9948789, 19.9924268 49.9949105, 19.9924463 49.9949224, 19.992454 49.9949327, 19.9924059 49.9949856, 19.9923786 49.994983, 19.9922277 49.9949168, 19.9922307 49.9949136, 19.9920443 49.9948323))\nhistoric : fort\nwiki_summary_en : Fort 50 ½ O Kosocice – one of the forts of the Kraków Fortress. It was built between 1897 and 1899. In 1945, it was stripped of its towers – both armored and observation. It belonged to the VII fortified area. The object was designed by Emil Gołogórski. \n\nIt defended the railway line to Przemyśl and the Lwów Route. In December 1914, the fort, along with the neighboring forts 50 \"Prokocim\" and 51 \"Rajsko,\" held back the main force of the Russian assault on Kraków. The fort is in good condition and is occasionally open to visitors. It is part of the Kraków Fortress Museum. The object is located at J. Hallera Street in Kraków.\npostal_code : nan\ntoilets : nan\nnatural : no information\ndescription : nan\nvisiting_time : nan\nleisure : no information\ntourism : attraction\npublic_transport : nan\nbrand : nan\nalt_name : Fort 50½ O \"Barycz\"\namenity : no information\nreservation : nan\nattraction : nan\nhighchair : nan\nparking : nan\nswimming_pool : nan\ncontact_phone : nan\ncommunity_centre : nan\naddr_street : nan\ncontact_twitter : nan\nsocial_facility : nan\ncontact_facebook : nan\nzoo : nan\nemail : nan\nwheelchair : nan\ncuisine : nan\ncontact_website : nan\ninternet_access : nan\nopening_hours_reception : nan\nguest_house : nan\naddr_city : nan\ncontact_instagram : nan\nimage : nan\nlocation : nan\noutdoor_seating : nan\nmuseum : nan\ntakeaway : nan\nsmoking : nan\nname : Fort 50½ O \"Kosocice\";Fort 50½ O \"Barycz\"\nid : 3631\n\nphone : nan\ncemetery : nan\nemergency : nan\nopening_hours : nan\nwebsite : nan\npets_allowed : nan\ngeometry : POLYGON ((19.9365296 50.0553099, 19.9365231 50.0553156, 19.9365125 50.055318, 19.9365023 50.0553162, 19.9365 50.0553145, 19.9364856 50.0553218, 19.9364158 50.0553061, 19.9364178 50.0553033, 19.9364848 50.0553187, 19.9364977 50.0553127, 19.9364953 50.0553038, 19.9364834 50.055301, 19.9364819 50.0553032, 19.9363156 50.0552649, 19.9363169 50.0552628, 19.9360956 50.0552119, 19.9358714 50.0551608, 19.9352984 50.0550296, 19.935294 50.0550372, 19.9352891 50.0550456, 19.935294 50.0550468, 19.9352905 50.0550529, 19.9352838 50.055051, 19.9352821 50.055052, 19.9352807 50.0550518, 19.935227 50.0550393, 19.9352246 50.0550419, 19.9352196 50.0550408, 19.9352202 50.0550401, 19.9351855 50.0550329, 19.9351852 50.0550334, 19.9351751 50.0550324, 19.9351622 50.055048, 19.9351492 50.0550636, 19.9351571 50.0550656, 19.9351934 50.0550756, 19.9351941 50.0550748, 19.9351987 50.0550758, 19.935197 50.0550785, 19.9352578 50.0550925, 19.9352593 50.0550935, 19.9352592 50.055095, 19.9352642 50.0550964, 19.9352638 50.0550987, 19.9352623 50.0551007, 19.9352613 50.055102, 19.9352515 50.0550998, 19.9352528 50.0550976, 19.9351982 50.0550851, 19.9351934 50.055084, 19.9351947 50.0550819, 19.9351534 50.0550705, 19.9351432 50.0550837, 19.9351395 50.0550825, 19.9351288 50.0550979, 19.9351025 50.0551365, 19.9350761 50.0551704, 19.9350646 50.0551804, 19.9350538 50.055188, 19.9350406 50.0551952, 19.9350161 50.0552043, 19.9349919 50.0552096, 19.9349676 50.0552118, 19.9349407 50.0552107, 19.9349232 50.0552083, 19.9348989 50.0552017, 19.9348805 50.0551941, 19.9348629 50.0551838, 19.9348446 50.055168, 19.9348315 50.0551476, 19.9348266 50.0551273, 19.9348276 50.0551135, 19.9348324 50.0550979, 19.9348589 50.0550511, 19.9346001 50.0548222, 19.9342832 50.0547151, 19.9339743 50.054437, 19.9337403 50.0543168, 19.9334743 50.0543403, 19.9334954 50.053956, 19.9332865 50.0538656, 19.933443 50.0537279, 19.9333654 50.05362, 19.9333523 50.0536219, 19.9333505 50.0536257, 19.9333346 50.0536301, 19.9333171 50.0536266, 19.9333091 50.0536158, 19.9333158 50.0536047, 19.9333323 50.0536, 19.9333371 50.053601, 19.9333481 50.053598, 19.9332619 50.0534765, 19.9335383 50.0534122, 19.9335625 50.0531546, 19.9336215 50.0531631, 19.9338295 50.053193, 19.9339574 50.0529715, 19.9339896 50.052903, 19.9342701 50.0528572, 19.9343549 50.0528439, 19.934688 50.0527068, 19.9346855 50.0525625, 19.935195 50.0526262, 19.9352779 50.0526016, 19.9355615 50.0529385, 19.9356339 50.0529533, 19.9356284 50.052964, 19.9355563 50.0529495, 19.9354913 50.0528812, 19.9354824 50.0528852, 19.9354774 50.0528964, 19.9354474 50.0529073, 19.9354311 50.0529005, 19.9354053 50.0529108, 19.935379 50.0529213, 19.935379 50.052933, 19.9353372 50.0529485, 19.9353303 50.0529408, 19.9353164 50.0529462, 19.935351 50.0529731, 19.9354428 50.0530516, 19.9358283 50.0533807, 19.9358035 50.0534288, 19.9359376 50.053558, 19.9361384 50.0536489, 19.9362242 50.0536346, 19.9366649 50.0538526, 19.9366788 50.053879, 19.936687 50.053894, 19.9367498 50.0539106, 19.9367646 50.0538903, 19.9367935 50.0538991, 19.9367795 50.0539198, 19.9368559 50.0539484, 19.9368638 50.0539442, 19.9368714 50.0539401, 19.9368768 50.0539373, 19.936891 50.0539299, 19.9369063 50.0539215, 19.9369112 50.0539189, 19.936922 50.0539131, 19.9369482 50.0538991, 19.9370599 50.0539449, 19.9370529 50.0539663, 19.9375071 50.0541295, 19.9375225 50.0543461, 19.9377731 50.0543654, 19.9379422 50.054389, 19.9379071 50.0544592, 19.9378722 50.0544523, 19.9378442 50.0545283, 19.9378779 50.0547181, 19.9376746 50.0548318, 19.9375665 50.0549666, 19.9374821 50.0550717, 19.9375151 50.0550953, 19.9375258 50.055104, 19.9375346 50.0551142, 19.9375419 50.0551272, 19.9375467 50.0551395, 19.9375478 50.0551546, 19.9375467 50.0551626, 19.9375423 50.0551764, 19.9375366 50.0551876, 19.9375233 50.0552015, 19.9375086 50.0552131, 19.937494 50.0552213, 19.9374638 50.0552325, 19.9374455 50.0552365, 19.9374184 50.0552385, 19.9374023 50.0552385, 19.9373848 50.055237, 19.9373618 50.0552328, 19.9373461 50.0552279, 19.937329 50.0552205, 19.9372654 50.05518, 19.9372216 50.0551974, 19.9371818 50.0551513, 19.9372228 50.0551345, 19.9372151 50.0551257, 19.937218 50.0551249, 19.9372035 50.0551081, 19.93716 50.0551236, 19.9370269 50.0551713, 19.9368944 50.0552042, 19.9367681 50.0552375, 19.936639 50.0552727, 19.936529 50.0553026, 19.9365296 50.0553099))\nhistoric : castle\nwiki_summary_en : The Wawel Royal Castle (Polish pronunciation: [ˈvavɛl] ; Zamek Królewski na Wawelu) and the Wawel Hill on which it sits constitute the most historically and culturally significant site in Poland. A fortified residency on the Vistula River in Kraków, it was established on the orders of King Casimir III the Great and enlarged over the centuries into a number of structures around a Polish Renaissance courtyard. It represents nearly all European architectural styles of the Medieval, Renaissance and Baroque periods. \nThe castle is part of a fortified architectural complex erected atop a limestone outcrop on the left bank of the Vistula River, at an altitude of 228 metres (748 ft) above sea level. The complex consists of numerous buildings of great historical and national importance, including the Wawel Cathedral where Polish monarchs were crowned and buried. Some of Wawel's oldest stone buildings can be traced back to 970 CE, in addition to the earliest examples of Romanesque and Gothic architecture in Poland. The current castle was built in the 14th century, and expanded over the next hundreds of years. In 1978, Wawel was declared the first World Heritage Site as part of the Historic Centre of Kraków.\nFor centuries the residence of the kings of Poland and the symbol of Polish statehood, Wawel Castle is now one of the country's premier art museums. Established in 1930, the museum encompasses ten curatorial departments responsible for collections of paintings, including an important collection of Italian Renaissance paintings, prints, sculpture, textiles, among them the Sigismund II Augustus tapestry collection, goldsmith's work, arms and armor, ceramics, Meissen porcelain, and period furniture. The museum's holdings in oriental art include the largest collection of Ottoman tents in Europe. With seven specialized conservation studios, the museum is also an important center for the conservation of works of art. With over 3.1 million visitors in 2024, Wawel Castle is the most visited art museum in Poland and the 17th most visited art museum in the world.\npostal_code : nan\ntoilets : nan\nnatural : no information\ndescription : nan\nvisiting_time : nan\nleisure : no information\ntourism : no information\npublic_transport : nan\nbrand : nan\nalt_name : nan\namenity : no information\nreservation : nan\nattraction : nan\nhighchair : nan\nparking : nan\nswimming_pool : nan\ncontact_phone : nan\ncommunity_centre : nan\naddr_street : nan\ncontact_twitter : nan\nsocial_facility : nan\ncontact_facebook : nan\nzoo : nan\nemail : nan\nwheelchair : nan\ncuisine : nan\ncontact_website : nan\ninternet_access : nan\nopening_hours_reception : nan\nguest_house : nan\naddr_city : nan\ncontact_instagram : nan\nimage : nan\nlocation : nan\noutdoor_seating : nan\nmuseum : nan\ntakeaway : nan\nsmoking : nan\nname : Zamek Wawel;Wawel;Wawelburg;Kasteel van Wawel\nid : 4019\n\nphone : nan\ncemetery : nan\nemergency : nan\nopening_hours : nan\nwebsite : nan\npets_allowed : nan\ngeometry : POINT (19.9343201 50.0139215)\nhistoric : no information\nwiki_summary_en : Kraków Sanktuarium – a passenger stop in the Kraków Łagiewniki area, in the Małopolskie Voivodeship, built to serve the Kraków sanctuaries: the Sanctuary of Divine Mercy and the John Paul II Center, a shopping center on Zakopiańska Street, and nearby residential buildings during the World Youth Days 2016 and for the needs of the Fast Urban Railway.\npostal_code : nan\ntoilets : nan\nnatural : no information\ndescription : nan\nvisiting_time : nan\nleisure : no information\ntourism : no information\npublic_transport : station\nbrand : nan\nalt_name : nan\namenity : no information\nreservation : nan\nattraction : nan\nhighchair : nan\nparking : nan\nswimming_pool : nan\ncontact_phone : nan\ncommunity_centre : nan\naddr_street : nan\ncontact_twitter : nan\nsocial_facility : nan\ncontact_facebook : nan\nzoo : nan\nemail : nan\nwheelchair : nan\ncuisine : nan\ncontact_website : nan\ninternet_access : nan\nopening_hours_reception : nan\nguest_house : nan\naddr_city : nan\ncontact_instagram : nan\nimage : nan\nlocation : nan\noutdoor_seating : nan\nmuseum : nan\ntakeaway : nan\nsmoking : nan\nname : Kraków Sanktuarium\nid : 7685\n\nphone : nan\ncemetery : nan\nemergency : no\nopening_hours : nan\nwebsite : https://babinski.pl/\npets_allowed : nan\ngeometry : POLYGON ((19.8824348 50.0069202, 19.8843417 50.0069935, 19.8849402 50.0070189, 19.8875083 50.0066649, 19.8880141 50.0065848, 19.8881842 50.0065535, 19.888112 50.00642, 19.8882092 50.0063876, 19.8880943 50.0061774, 19.8879824 50.0059916, 19.8879509 50.0059117, 19.8878967 50.0056645, 19.8878965 50.0054078, 19.8878045 50.0047803, 19.8876821 50.0041801, 19.8878225 50.0041695, 19.8892816 50.0040478, 19.8888912 50.002901, 19.88869 50.0024074, 19.888503 50.0022779, 19.8882204 50.0021777, 19.8875366 50.0019449, 19.8873654 50.0016748, 19.8869679 50.0005448, 19.8850666 50.0007807, 19.8849145 50.0003367, 19.8837538 50.0004836, 19.8835958 50.000323, 19.8826593 50.0004063, 19.8823982 50.0006701, 19.8804605 50.000921, 19.8800799 50.0017329, 19.8799691 50.0020356, 19.8799566 50.0021636, 19.8799464 50.0021859, 19.8799302 50.0022587, 19.8799131 50.0023427, 19.8798174 50.0025338, 19.8795507 50.0027998, 19.8793604 50.0029278, 19.8784102 50.0034635, 19.8779455 50.0038621, 19.877504 50.0044353, 19.8772183 50.004991, 19.8775537 50.0049451, 19.8776463 50.004924, 19.877824 50.0048961, 19.8781083 50.0048535, 19.8785713 50.0047858, 19.8804922 50.0044551, 19.8809256 50.0043778, 19.8813457 50.0050631, 19.881528 50.0053604, 19.881704 50.0056391, 19.8821694 50.0064276, 19.8824348 50.0069202))\nhistoric : no information\nwiki_summary_en : The Józef Babiński Clinical Hospital Independent Public Healthcare Institution in Kraków – a hospital in Kraków (in the Kobierzyn district) that specializes in the treatment and rehabilitation of patients in the fields of psychiatry, addiction, and neurology. In 1999, the hospital-park complex was entered on the list of historic monuments.\npostal_code : nan\ntoilets : nan\nnatural : no information\ndescription : nan\nvisiting_time : nan\nleisure : no information\ntourism : no information\npublic_transport : nan\nbrand : nan\nalt_name : nan\namenity : hospital\nreservation : nan\nattraction : nan\nhighchair : nan\nparking : nan\nswimming_pool : nan\ncontact_phone : nan\ncommunity_centre : nan\naddr_street : nan\ncontact_twitter : nan\nsocial_facility : nan\ncontact_facebook : nan\nzoo : nan\nemail : nan\nwheelchair : nan\ncuisine : nan\ncontact_website : nan\ninternet_access : nan\nopening_hours_reception : nan\nguest_house : nan\naddr_city : nan\ncontact_instagram : nan\nimage : nan\nlocation : nan\noutdoor_seating : nan\nmuseum : nan\ntakeaway : nan\nsmoking : nan\nname : Szpital Kliniczny im. doktora Józefa Babińskiego SP ZOZ\nid : 11288\n\nphone : nan\ncemetery : nan\nemergency : nan\nopening_hours : nan\nwebsite : nan\npets_allowed : nan\ngeometry : POINT (19.9361073 50.0547467)\nhistoric : no information\nwiki_summary_en : The Wawel Royal Castle (Polish pronunciation: [ˈvavɛl] ; Zamek Królewski na Wawelu) and the Wawel Hill on which it sits constitute the most historically and culturally significant site in Poland. A fortified residency on the Vistula River in Kraków, it was established on the orders of King Casimir III the Great and enlarged over the centuries into a number of structures around a Polish Renaissance courtyard. It represents nearly all European architectural styles of the Medieval, Renaissance and Baroque periods. \nThe castle is part of a fortified architectural complex erected atop a limestone outcrop on the left bank of the Vistula River, at an altitude of 228 metres (748 ft) above sea level. The complex consists of numerous buildings of great historical and national importance, including the Wawel Cathedral where Polish monarchs were crowned and buried. Some of Wawel's oldest stone buildings can be traced back to 970 CE, in addition to the earliest examples of Romanesque and Gothic architecture in Poland. The current castle was built in the 14th century, and expanded over the next hundreds of years. In 1978, Wawel was declared the first World Heritage Site as part of the Historic Centre of Kraków.\nFor centuries the residence of the kings of Poland and the symbol of Polish statehood, Wawel Castle is now one of the country's premier art museums. Established in 1930, the museum encompasses ten curatorial departments responsible for collections of paintings, including an important collection of Italian Renaissance paintings, prints, sculpture, textiles, among them the Sigismund II Augustus tapestry collection, goldsmith's work, arms and armor, ceramics, Meissen porcelain, and period furniture. The museum's holdings in oriental art include the largest collection of Ottoman tents in Europe. With seven specialized conservation studios, the museum is also an important center for the conservation of works of art. With over 3.1 million visitors in 2024, Wawel Castle is the most visited art museum in Poland and the 17th most visited art museum in the world.\npostal_code : nan\ntoilets : nan\nnatural : peak\ndescription : nan\nvisiting_time : nan\nleisure : no information\ntourism : no information\npublic_transport : nan\nbrand : nan\nalt_name : nan\namenity : no information\nreservation : nan\nattraction : nan\nhighchair : nan\nparking : nan\nswimming_pool : nan\ncontact_phone : nan\ncommunity_centre : nan\naddr_street : nan\ncontact_twitter : nan\nsocial_facility : nan\ncontact_facebook : nan\nzoo : nan\nemail : nan\nwheelchair : nan\ncuisine : nan\ncontact_website : nan\ninternet_access : nan\nopening_hours_reception : nan\nguest_house : nan\naddr_city : nan\ncontact_instagram : nan\nimage : nan\nlocation : nan\noutdoor_seating : nan\nmuseum : nan\ntakeaway : nan\nsmoking : nan\nname : Wawel;Vavel\nid : 11464\n\n",
  "answer": "The Archaeological Museum of Kraków does not have wheelchair accessibility for visitors. If you need further assistance or alternative options, feel free to ask!",
  "labels": {
    "faithfulness": "FAITHFUL",
    "groundedness": "GROUNDED",
    "relevance": "RELEVANT",
    "completeness": "COMPLETE",
    "coherence": "COHERENT",
    "conciseness": "CONCISE"
  },
  "quality_score": 6
}