{
  "model": "openai_llm",
  "prompt": "prompt_C",
  "id": 1255,
  "question": "What are the opening hours for Good Lood on Saturdays?",
  "context": "phone : nan\ncemetery : nan\nemergency : nan\nopening_hours : nan\nwebsite : nan\npets_allowed : nan\ngeometry : POLYGON ((19.9920443 49.9948323, 19.9920239 49.9948523, 19.9919712 49.9948286, 19.9919906 49.9948095, 19.9918014 49.9947269, 19.9917981 49.9947298, 19.9916796 49.994678, 19.9917668 49.9945711, 19.9924046 49.9948483, 19.9924023 49.9948789, 19.9924268 49.9949105, 19.9924463 49.9949224, 19.992454 49.9949327, 19.9924059 49.9949856, 19.9923786 49.994983, 19.9922277 49.9949168, 19.9922307 49.9949136, 19.9920443 49.9948323))\nhistoric : fort\nwiki_summary_en : Fort 50 ½ O Kosocice – one of the forts of the Kraków Fortress. It was built between 1897 and 1899. In 1945, it was stripped of its towers – both armored and observation. It belonged to the VII fortified area. The object was designed by Emil Gołogórski. \n\nIt defended the railway line to Przemyśl and the Lwów Route. In December 1914, the fort, along with the neighboring forts 50 \"Prokocim\" and 51 \"Rajsko,\" held back the main force of the Russian assault on Kraków. The fort is in good condition and is occasionally open to visitors. It is part of the Kraków Fortress Museum. The object is located at J. Hallera Street in Kraków.\npostal_code : nan\ntoilets : nan\nnatural : no information\ndescription : nan\nvisiting_time : nan\nleisure : no information\ntourism : attraction\npublic_transport : nan\nbrand : nan\nalt_name : Fort 50½ O \"Barycz\"\namenity : no information\nreservation : nan\nattraction : nan\nhighchair : nan\nparking : nan\nswimming_pool : nan\ncontact_phone : nan\ncommunity_centre : nan\naddr_street : nan\ncontact_twitter : nan\nsocial_facility : nan\ncontact_facebook : nan\nzoo : nan\nemail : nan\nwheelchair : nan\ncuisine : nan\ncontact_website : nan\ninternet_access : nan\nopening_hours_reception : nan\nguest_house : nan\naddr_city : nan\ncontact_instagram : nan\nimage : nan\nlocation : nan\noutdoor_seating : nan\nmuseum : nan\ntakeaway : nan\nsmoking : nan\nname : Fort 50½ O \"Kosocice\";Fort 50½ O \"Barycz\"\nid : 3631\n\nphone : nan\ncemetery : nan\nemergency : nan\nopening_hours : nan\nwebsite : nan\npets_allowed : nan\ngeometry : POINT (19.9569831 50.0484407)\nhistoric : no information\nwiki_summary_en : Kraków Zabłocie – a train station in Kraków, in the Podgórze district, in its formerly industrial part, Zabłocie. It was opened in 1979. Only passenger trains stop at the station. The station can be accessed via Kącik Street (from the Old Podgórze side) and Lipowa Street (from the Zabłocie side).\npostal_code : nan\ntoilets : nan\nnatural : no information\ndescription : nan\nvisiting_time : nan\nleisure : no information\ntourism : no information\npublic_transport : station\nbrand : nan\nalt_name : nan\namenity : no information\nreservation : nan\nattraction : nan\nhighchair : nan\nparking : nan\nswimming_pool : nan\ncontact_phone : nan\ncommunity_centre : nan\naddr_street : nan\ncontact_twitter : nan\nsocial_facility : nan\ncontact_facebook : nan\nzoo : nan\nemail : nan\nwheelchair : yes\ncuisine : nan\ncontact_website : nan\ninternet_access : nan\nopening_hours_reception : nan\nguest_house : nan\naddr_city : nan\ncontact_instagram : nan\nimage : http://commons.wikimedia.org/wiki/File:Krak%C3%B3w_Zab%C5%82ocie.jpg\nlocation : nan\noutdoor_seating : nan\nmuseum : nan\ntakeaway : nan\nsmoking : nan\nname : Kraków Zabłocie\nid : 7162\n\nphone : nan\ncemetery : nan\nemergency : nan\nopening_hours : nan\nwebsite : nan\npets_allowed : nan\ngeometry : POINT (19.9343201 50.0139215)\nhistoric : no information\nwiki_summary_en : Kraków Sanktuarium – a passenger stop in the Kraków Łagiewniki area, in the Małopolskie Voivodeship, built to serve the Kraków sanctuaries: the Sanctuary of Divine Mercy and the John Paul II Center, a shopping center on Zakopiańska Street, and nearby residential buildings during the World Youth Days 2016 and for the needs of the Fast Urban Railway.\npostal_code : nan\ntoilets : nan\nnatural : no information\ndescription : nan\nvisiting_time : nan\nleisure : no information\ntourism : no information\npublic_transport : station\nbrand : nan\nalt_name : nan\namenity : no information\nreservation : nan\nattraction : nan\nhighchair : nan\nparking : nan\nswimming_pool : nan\ncontact_phone : nan\ncommunity_centre : nan\naddr_street : nan\ncontact_twitter : nan\nsocial_facility : nan\ncontact_facebook : nan\nzoo : nan\nemail : nan\nwheelchair : nan\ncuisine : nan\ncontact_website : nan\ninternet_access : nan\nopening_hours_reception : nan\nguest_house : nan\naddr_city : nan\ncontact_instagram : nan\nimage : nan\nlocation : nan\noutdoor_seating : nan\nmuseum : nan\ntakeaway : nan\nsmoking : nan\nname : Kraków Sanktuarium\nid : 7685\n\nphone : nan\ncemetery : nan\nemergency : nan\nopening_hours : nan\nwebsite : nan\npets_allowed : nan\ngeometry : POINT (19.8228282 50.0165366)\nhistoric : no information\nwiki_summary_en : Kowadza (261 m) – a hill in Tyniec in Kraków. Administratively, it belongs to District VIII Dębniki. Geographically, it is part of the Tyniec Hills on the Kraków Bridge within the macroregion of the Kraków Gate. These hills have been included in the area of the Bielańsko-Tyniecki Landscape Park.  \nKowadza rises on the eastern side of Świętojańska Street in Tyniec. Formed from limestone, the hill is mostly covered by a beech-hornbeam forest, but the summit and southern slopes are open fields of former pastures and meadows. It is covered by a thin layer of soil with xerothermic grassland. Thanks to the open areas, the summit of Kowadza is a good viewpoint. In the valley lies Uroczysko Tyniec, to the southwest the horizon is obscured by the hills of Wielkanoc and Bogucianka, to the south Guminek, and just to the east is the hill Duża Kowodrza.  \nAn ecological site named Uroczysko Kowadza, covering an area of 10 ha, has been established on Kowadza. Benches, trash bins, tourist information boards, and a shelter have been prepared for tourists. A marked hiking trail runs over the summit of Kowadza, with educational paths along its slopes.\npostal_code : nan\ntoilets : nan\nnatural : peak\ndescription : nan\nvisiting_time : nan\nleisure : no information\ntourism : no information\npublic_transport : nan\nbrand : nan\nalt_name : nan\namenity : no information\nreservation : nan\nattraction : nan\nhighchair : nan\nparking : nan\nswimming_pool : nan\ncontact_phone : nan\ncommunity_centre : nan\naddr_street : nan\ncontact_twitter : nan\nsocial_facility : nan\ncontact_facebook : nan\nzoo : nan\nemail : nan\nwheelchair : nan\ncuisine : nan\ncontact_website : nan\ninternet_access : nan\nopening_hours_reception : nan\nguest_house : nan\naddr_city : nan\ncontact_instagram : nan\nimage : nan\nlocation : nan\noutdoor_seating : nan\nmuseum : nan\ntakeaway : nan\nsmoking : nan\nname : Kowodrza\nid : 11439\n\nphone : 12 619 09 53\ncemetery : nan\nemergency : nan\nopening_hours : Mo-Su 11:00-21:00\nwebsite : https://goodlood.com\npets_allowed : nan\ngeometry : POINT (19.9640347 50.0475033)\nhistoric : no information\nwiki_summary_en : no information\npostal_code : nan\ntoilets : nan\nnatural : no information\ndescription : nan\nvisiting_time : nan\nleisure : no information\ntourism : no information\npublic_transport : nan\nbrand : nan\nalt_name : nan\namenity : ice_cream\nreservation : nan\nattraction : nan\nhighchair : nan\nparking : nan\nswimming_pool : nan\ncontact_phone : nan\ncommunity_centre : nan\naddr_street : Tadeusza Romanowicza\ncontact_twitter : nan\nsocial_facility : nan\ncontact_facebook : nan\nzoo : nan\nemail : goodlood@goodlood.com\nwheelchair : yes\ncuisine : nan\ncontact_website : nan\ninternet_access : nan\nopening_hours_reception : nan\nguest_house : nan\naddr_city : Kraków\ncontact_instagram : nan\nimage : nan\nlocation : nan\noutdoor_seating : yes\nmuseum : nan\ntakeaway : yes\nsmoking : nan\nname : Good Lood\nid : 1135\n\nphone : nan\ncemetery : nan\nemergency : nan\nopening_hours : Mo-Fr 11:00-21:00 Sa-Su 10:00-21:00\nwebsite : https://goodlood.com\npets_allowed : nan\ngeometry : POINT (19.9996506 50.0817384)\nhistoric : no information\nwiki_summary_en : no information\npostal_code : nan\ntoilets : nan\nnatural : no information\ndescription : nan\nvisiting_time : nan\nleisure : no information\ntourism : no information\npublic_transport : nan\nbrand : Good Lood\nalt_name : nan\namenity : ice_cream\nreservation : nan\nattraction : nan\nhighchair : nan\nparking : nan\nswimming_pool : nan\ncontact_phone : nan\ncommunity_centre : nan\naddr_street : Bolesława Orlińskiego\ncontact_twitter : nan\nsocial_facility : nan\ncontact_facebook : nan\nzoo : nan\nemail : support@goodlood.com\nwheelchair : yes\ncuisine : nan\ncontact_website : nan\ninternet_access : nan\nopening_hours_reception : nan\nguest_house : nan\naddr_city : Kraków\ncontact_instagram : nan\nimage : nan\nlocation : nan\noutdoor_seating : yes\nmuseum : nan\ntakeaway : nan\nsmoking : nan\nname : Good Lood\nid : 2045\n\nphone : nan\ncemetery : nan\nemergency : nan\nopening_hours : Mo-Fr 11:00-20:30 Sa 11:00-21:00 Su 10:00-21:00\nwebsite : https://goodlood.com\npets_allowed : nan\ngeometry : POINT (19.9597106 50.0686213)\nhistoric : no information\nwiki_summary_en : no information\npostal_code : nan\ntoilets : nan\nnatural : no information\ndescription : nan\nvisiting_time : nan\nleisure : no information\ntourism : no information\npublic_transport : nan\nbrand : nan\nalt_name : nan\namenity : ice_cream\nreservation : nan\nattraction : nan\nhighchair : nan\nparking : nan\nswimming_pool : nan\ncontact_phone : 12 619 09 61\ncommunity_centre : nan\naddr_street : Aleja Pułkownika Władysława Beliny-Prażmowskiego\ncontact_twitter : nan\nsocial_facility : nan\ncontact_facebook : nan\nzoo : nan\nemail : goodlood@goodlood.com\nwheelchair : no\ncuisine : nan\ncontact_website : nan\ninternet_access : nan\nopening_hours_reception : nan\nguest_house : nan\naddr_city : Kraków\ncontact_instagram : nan\nimage : nan\nlocation : nan\noutdoor_seating : yes\nmuseum : nan\ntakeaway : yes\nsmoking : nan\nname : Good Lood\nid : 1255\n\n",
  "answer": "The opening hours for Good Lood on Saturdays are from 10:00 to 21:00.",
  "labels": {
    "faithfulness": "FAITHFUL",
    "groundedness": "GROUNDED",
    "relevance": "RELEVANT",
    "completeness": "COMPLETE",
    "coherence": "COHERENT",
    "conciseness": "CONCISE"
  },
  "quality_score": 6
}